star_point,comment,photo
5,"DX V1이 너무 만족스러웠어서 하나 더 장만하려했지만 단종되어 못구했었어요. 중고로 구매할까하다 V2나온다는 소문이있어 존버했는데 드디어 나왔네요 ㅠㅠ
V1에서 가장 개선되었으면 했던게 5핀인점과 케이블 유격이었는데 C타입에 유격도없고 나사까지 숨겨놔서 너무좋네요 ㅋㅋ
스페이스바는 손좀 봐야할것같고
키캡은 음..저는 다른걸로 갈아낄래요 ㅋ.ㅋ
인생키보드 V2 잘쓰겠습니다 많이파세요!","['https://phinf.pstatic.net/checkout/20200822_213/1598088530333W3XNb_JPEG/review-attachment-e92dd886-7ac2-4a70-b758-84c19ad3b876.jpeg?type=f287', 'https://phinf.pstatic.net/checkout/20200822_8/1598090494469xTYmd_JPEG/review-attachment-5fe19a6e-b38f-4c75-8859-aa29d1bdf282.jpeg?type=f287', 'https://phinf.pstatic.net/checkout/20200822_155/1598089704117dDp5i_JPEG/review-attachment-687cab64-ca99-4cba-ad70-94284a88bf39.jpeg?type=f287', 'https://phinf.pstatic.net/checkout/20200822_265/1598087921377YyByL_JPEG/review-attachment-84e25807-af78-4c96-8e44-64ae7baf89b2.jpeg?type=f287', 'https://phinf.pstatic.net/checkout/20200822_226/1598088530361Jxba3_JPEG/review-attachment-063b05a1-0c39-4976-81ea-4c5f8774c464.jpeg?type=f287']"
4,"통알루미늄 키보드에 팰토리 윤활이라 그런지 통통거리는 소리는 역시 나네요. 스테빌 및 스프링 소음 거슬리시는 분들은 공방 맡기시거나 작업하시거나, 타 제품 사셔야할거같아요.
무게가 묵직하니, 안정성은 좋고, 타이핑하기에도 적합한 설계같아요,
잘 쓸게요","['https://phinf.pstatic.net/checkout/20200929_206/1601363391423GULyQ_JPEG/review-attachment-4701036a-bbba-457a-885c-9e31a8b566e4.jpeg?type=f287', 'https://phinf.pstatic.net/checkout/20200929_236/1601363391643HweFD_JPEG/review-attachment-7c19a790-831a-4c61-b241-2054f4154120.jpeg?type=f287', 'https://phinf.pstatic.net/checkout/20200929_280/16013633920278qxWK_JPEG/review-attachment-27b04e2d-0704-4549-8d6c-544163a1d260.jpeg?type=f287', 'https://phinf.pstatic.net/checkout/20200929_238/1601363392104dFbzU_JPEG/review-attachment-08a6f053-816e-4a11-b6a4-5e5fd53987fb.jpeg?type=f287']"
4,"이전에 나온 dx에서도 디자인으로 호불호가 갈렸지 타건감에선 이견이 없던 제품으로 알고 있습니다.그리고 2에서는 1에서 지적되었던 부분들은 거의 다 수정해서 구입하게 되었습니다.그래서 대부분의 사항에 대해서 만족하지만, 2가지 정도 실망한 부분이 있습니다.첫번째는 QC입니다. 제품은 잘 만들었는데 왜 검수는...키보드 내부에 흡읍재가 누락되어 있었고, 보강판과 기판을 연결하는 나사가 마모되어 리벳인줄 알았습니다.두번째는 키맵핑입니다. 자체적인 소프트웨어를 지원해서 편하긴한데, FN키는 변경되지 않습니다.저는 FN키가 있는 위치에 Backspace를 지정해서 사용하는데, 이 부분은 지극히 개인적인 부분이라 일반 구매자분들에게는 QC문제가 없다면 이 가격대에 이만한 알루 키보드는 없을 것이라고 생각합니다.",[]
5,"전작에서 문제됬던 부분 다 개선됬구요.
검은색 진짜 이쁘게 잘뽑혔습니다.
기본 키캡도 퀄리티 좋구요.
스테빌은 윤활재가 살짝 부족한듯 하나 퀵스왑이니 별문제가 안됩니다.
DX v1 때 만족하고 후속작 나온다고 해서 기다렸는데요.
정말 잘산것 같습니다
그리고 사진은 실물 보다 더밝게 나왔습니다.","['https://phinf.pstatic.net/checkout/20200820_109/1597899101883BOVtC_JPEG/review-attachment-33228108-00d3-4e8f-8d11-255c47f331e2.jpeg?type=f287', 'https://phinf.pstatic.net/checkout/20200820_142/1597899101887PPtnH_JPEG/review-attachment-9fb85a6c-33c8-42c3-8e95-b23fbbce3dcf.jpeg?type=f287']"
5,"사진보다 실물이 더 낫네요
당분간은 키캡 안 갈아끼고 쓸 것 같습니다
동영상은 소리가 좀 세게 나는데 역시 저적이라 실제 소리는 훨씬 심심하고 나름의 느낌이 있어서 좋습니다 스테빌도 스페이스바 제외하고는 거슬리지 않고 괜찮은 것 같아요","['https://phinf.pstatic.net/image.nmv/shopnbuyer_2020_09_03_0/aa9cab8f-ed8c-11ea-9463-a0369ff94ec8_03.jpg?type=f287', 'https://phinf.pstatic.net/checkout/20200903_154/1599099870404CrIQH_JPEG/review-attachment-57378bb0-86a9-4b64-ab61-f39957e43e18.jpeg?type=f287']"
5,단단하고 좋은 키감입니다. 팩토리 윤활이라 스테빌도 생각보다는 쓸만하구요. RGB와 비키의 조합이 화려해서 마음에 듭니다. 아쉬운 점은모서리 쪽 키들에 대한 편차가 있네요. 한번 교환을 받았고 다른 커스텀 키보드들도 이러한 단점에서 완전히 자유롭지는 않지만 꽤 편차가 있는 편이네요. 스테빌도 결국 튜닝을 해줘야하긴 하구요.,['https://phinf.pstatic.net/checkout/20201105_183/16045519872196ksyl_JPEG/review-attachment-80427bf2-9bd3-496a-9475-aed2496e3a25.jpeg?type=f287']
5,"기기 와서 잘쓰고있습니당 무게도 묵직하구요
풀알루에 저적이라 소리 굉장히 조용합니다
비키타입에 실버라 따로 맞춘 푸딩키캡이랑 호환도 아주 좋구요 광량도 좋습니당
상자에 들어있던 청소붓이 쓰지도않았는데 손잡이랑 붓이랑 따로 빠진거빼면 기기자체는 매우 만족합니다",['https://phinf.pstatic.net/checkout/20201110_255/1604996995246TDv0c_JPEG/review-attachment-30223744-9455-47e3-8c4b-b2c6d7abefa4.jpeg?type=f287']
5,스프링 소리와 사각거림은 일반 키보드와 크게 다르지 않지만 단단함과 타건감에서의 차이감은 확실히 납니다 풀윤활만 하면 될거같네요 무게감은 확실히 있고 축 교환이 가능한 퀵스왑 방식이라 좋네요 키캡은 PBT재질 치고는 약간 미끌거리는 편이고 품질은 보통에서 상태 안좋은거는 보통 이하 정도까지 큰 기대 안하시는 편이 좋습니다 하지만 풀알루 모델이고 비키타입이라 통울림이 없고 이쁩니다 나중에 FX 다이킷도 구매해서 풀윤활 해보고싶네요,[]
5,"통울림도 없고 스테빌 윤활도 기본적으로 되어있고 진짜 너무 좋습니다.. 시중에 나온 키보드들이 다 별로라서 커스텀키보드 사서 튜닝하려고 했는데 안그래도 될거같아요.... 좋은 제품 감사합니다.
키보드 입문자에게는 이 제품만큼 좋은 건 없어보입니다. 다만 알루미늄이라 꽤 무거운데 그건 어쩔 수 없는 것 같아요.",['https://phinf.pstatic.net/checkout/20200823_169/1598145855389XkWyE_JPEG/review-attachment-723e22a7-508c-4741-911a-d494419c85f9.jpeg?type=f287']
5,"DXv1에서 달라진점
1. 상판결합나사를 키캡사이로 숨김
2. 매립형 smd led
3. 스페이스바 흡음
4. 하이브리드 스테빌에서 체리스테빌라이저로 바뀜
5. 마이크로5핀에서 C타입으로 변경됨
6. 건메탈에서 블랙으로 진화
7. DIY구성 기본키캡의 퀄리티 향상
8. 숫자키 위에 붙어있던 펑션열 분리",['https://phinf.pstatic.net/checkout/20200822_278/1598036777119vDj3M_JPEG/review-attachment-daa29bb3-f4a1-41ba-842b-962d472af666.jpeg?type=f287']
5,"적축+단단한 타건감 너무 좋네요.
스테빌 체리 순정 스테빌로 발톱 잘라서 교체하고
스페이스바 철심만 안찰찰 철심으로 교체해서
쓰는데요, 어디 흠잡을데 없습니다.
좌컨 우방향키 누르면 살짝 아래쪽 빈 느낌이 나는데
저는 사용하는데 전혀 문제로 느껴지지는 않네요
너무 만족합니다",['https://phinf.pstatic.net/checkout/20200824_137/1598272619777Oa3bu_JPEG/review-attachment-2db6a17a-fbdf-4d8d-9a31-89bfa723c4ad.jpeg?type=f287']
5,배송도 당일 출고로 빠르고 무엇 보다 DX1의 모든 단점을 개선하고 나와서 정말 마음에 들어요. 퀵스왑인데 반해 스테빌이 잘 잡혀 있고 스위치 체결력이 좋아서 스위치가 잘 고정되고 흔들림이 없어 키감과 타건음이 정말 좋은 것 같아요. 지금 할인가라면 여타 브랜드의 플라 제품들과는 비교가 안되게 월등하다고 생각해요.,[]
5,전 모델인 dx1 사고 싶었는데 품절돼서 fx를 구매해 만족하며 사용하고 있었습니다. Dx2 발매소식을 듣고 바로 구매해서 사용햇는데 정말 좋네여 ㅎㅎ 좀 아쉬운점은 택배박스가 너무 망가져 있어서 마음에 살짝 걸렸습니다. 회사 측인지 아니면 택배 측인지 모르겠지만 택배빅스도 신경 써주시면 감사하겠습니다. 잘쓸게요~~^^*,['https://phinf.pstatic.net/checkout/20200829_72/1598678252038WXfrO_JPEG/review-attachment-36164a8f-13ab-4d0b-add8-456f2bff2aa5.jpeg?type=f287']
5,"Dx2체리스위치, PBT이중사출키캡, 묵직한 타건감, LED효과 등기성 알루키보드중 최상급입니다스테빌은 윤활이 겉에만 되어서?아쉬운 부분이나 면봉으로 안쪽 속으로 보내니 좋아졌네요비키라 꺼렸는데 매력이 많은 키보드입니다 추천합니다",[]
5,"블랙색상이 맘에드네요.
스테빌은 윤활이 필요해보입니다
눈뽕 좋아요","['https://phinf.pstatic.net/checkout/20200821_214/1597979102910rAFUk_JPEG/review-attachment-ab67202b-241f-4f1e-9761-a9b64beaebe5.jpeg?type=f287', 'https://phinf.pstatic.net/checkout/20200821_296/15979791244688uGWc_JPEG/review-attachment-ae11a36c-8bbb-4e26-a1b5-aed70f0f1072.jpeg?type=f287', 'https://phinf.pstatic.net/checkout/20200821_288/1597979125140k03NY_JPEG/review-attachment-d54e9b4e-5727-47f2-ac5e-5fa4c475adfd.jpeg?type=f287', 'https://phinf.pstatic.net/checkout/20200821_169/15979791270222K2VA_JPEG/review-attachment-fca1adbf-9f6f-474a-bbe8-9be791cefc12.jpeg?type=f287']"
4,"풀알루에 적축은 처음 써보는데 키압 딱인거같아요
마음에 듭니다 , 배송이 너무 늦어서 그건하나뺐지만, 포장도 잘되어서오고 만족합니다.ㅎ","['https://phinf.pstatic.net/checkout/20201106_201/1604629959007N8UKa_JPEG/review-attachment-14776a10-bff9-4b49-bd87-db2ff02fce30.jpeg?type=f287', 'https://phinf.pstatic.net/checkout/20201106_68/1604629958995vJfmW_JPEG/review-attachment-11e2a377-ac53-4607-8357-5dc0a83ee6c1.jpeg?type=f287']"
5,"하우징 마감이나 led광량 모두 좋네요.
통울림도 거의 없고 기본 스테빌도 흔들림 없이 체결되어 만족스럽습니다. 타건감, 타건음 준수하고 5핀 정방향 매립인점도 좋습니다. 가격도 이정도면 가성비 좋은거 같네요.","['https://phinf.pstatic.net/checkout/20200903_135/1599094887587LVETV_JPEG/review-attachment-2b64dbab-8682-470d-989c-dbfb654977ea.jpeg?type=f287', 'https://phinf.pstatic.net/checkout/20200903_251/1599094900723ouJKM_JPEG/review-attachment-03148049-cae1-4bac-8859-3083122bbbeb.jpeg?type=f287']"
5,포장도 튼튼하고 키보드도 정말 예쁘네요,"['https://phinf.pstatic.net/checkout/20200915_287/1600175245872Uk77G_JPEG/review-attachment-56800960-3591-4f81-b3cd-b312255f8af9.jpeg?type=f287', 'https://phinf.pstatic.net/checkout/20200915_17/1600175253681kvDv6_JPEG/review-attachment-3e599b0d-9842-4105-a7e8-1d07ad4da3b1.jpeg?type=f287']"
5,비키시리즈 좋아해서 dx2 제품도 주문했습니다 확실히 1보다 마감도좋고 스테빌이나 그런거 잡으려고 한게 눈에보이게 좋네요 ㅋㅋㅋ... 개인적으로 ar87보다 만족하게사용중이랍니다,"['https://phinf.pstatic.net/checkout/20200828_60/1598569539448nTVfY_JPEG/review-attachment-bf90d979-546d-48cc-94f3-8f173d6daf78.jpeg?type=f287', 'https://phinf.pstatic.net/checkout/20200828_10/1598569544147RqoPW_JPEG/review-attachment-48f927f3-ee0c-4bcb-952a-6276c763e8b9.jpeg?type=f287']"
5,비키 알루키보드 드디어 만나 구매했는데 대만족입니다~,"['https://phinf.pstatic.net/checkout/20200821_194/1598004016449qfOLp_JPEG/review-attachment-ad489c13-c4fb-427b-bb87-62d9bd2ec7b1.jpeg?type=f287', 'https://phinf.pstatic.net/checkout/20200821_95/1598004016591BpRpd_JPEG/review-attachment-8730ad71-42f0-4c99-995b-f84e82f78a2b.jpeg?type=f287']"
5,빨른 배송과 안전한 포장상태 최고 입니다,"['https://phinf.pstatic.net/checkout/20200822_275/1598090918700H3J7p_JPEG/review-attachment-238b90c1-0fa3-4332-ac98-6ed10e2be5da.jpeg?type=f287', 'https://phinf.pstatic.net/checkout/20200822_58/1598090930175LT34t_JPEG/review-attachment-17528ba3-3d5f-45fd-bd2b-b6ebe66a8665.jpeg?type=f287']"
4,알루키보드가 확실히 소음 잡기 쉬워서 좋습니다! 키감도 단단하고 딱 원하던 느낌입니다. 다만 구조상의 특징인지 우상단 pause키와 좌하단 control키 (스크류 나사 옆 스위치)는 소리가 구분되게 달라 아쉽습니다.,['https://phinf.pstatic.net/checkout/20201117_159/1605616361305MalT6_JPEG/review-attachment-a1a88bdd-0af0-40e3-86c3-7a64ff9bc212.jpeg?type=f287']
5,키감이 단단하고 좋네요 만족합니다,['https://phinf.pstatic.net/checkout/20201129_68/1606631979340baaOb_JPEG/review-attachment-031eb224-32a0-4912-84cf-be1c10d0d9e0.jpeg?type=f287']
5,진짜 소문대로 이쁘고 확실하네요 풀알루 처음 써보는데 핫스왑인데도 키감이 이렇게 좋을 줄은 몰랐어요...다만 스테빌은 철심소리까진 아닌데 경박한 찰랑거리는 키감이라 윤활 한번 해주셔야해요,['https://phinf.pstatic.net/image.nmv/shopnbuyer_2020_11_19_0/bacc6e6b-2a1d-11eb-beee-48df379cc9e4_03.jpg?type=f287']
5,"배송도 빠르고 물건도 잘받았습니다
수고하세요",['https://phinf.pstatic.net/checkout/20201114_158/1605332723011vg8cn_JPEG/review-attachment-71e86136-c1c3-4e41-8634-c15631803aee.jpeg?type=f287']
5,키감이 단단해서 좋습니다,['https://phinf.pstatic.net/checkout/20201028_211/1603865803603lF7sv_JPEG/review-attachment-c043f84f-9e18-489e-986b-8df633e46f67.jpeg?type=f287']
5,H1 스위치 장착후 사용중인데 만족합니다 스태빌은 조금 아쉽지만,['https://phinf.pstatic.net/checkout/20201030_138/1604057090565SRFUJ_JPEG/review-attachment-1eb69d9c-2dbd-4860-8006-89a5015da3fd.jpeg?type=f287']
5,예쁘고 타건감 좋습니ㅏㅏ,['https://phinf.pstatic.net/checkout/20201029_141/1603960338668QyMi2_JPEG/review-attachment-3dea4a2f-0291-4c22-821b-92076f7ea8a0.jpeg?type=f287']
5,키감 최고 입니다.,['https://phinf.pstatic.net/checkout/20201026_43/16036853359598IUtA_JPEG/review-attachment-91bed11c-7206-4c17-8846-a2bf43252ad2.jpeg?type=f287']
4,"스테빌은 따로 잡아야할듯 하네요
묵직한 풀알루 하우징..처음이예요^^
빠른 배송 감사합니다",['https://phinf.pstatic.net/checkout/20201029_220/1603969639061M9Vb7_JPEG/review-attachment-1b80c754-047d-48a9-aeca-8dbd44d1501a.jpeg?type=f287']
5,"가성비 좋습니다.
앞으로 출시 예정인 FX2도 기대하고 있겠습니다.",['https://phinf.pstatic.net/checkout/20201021_82/16032906152563JNXr_JPEG/review-attachment-51ce8a1c-12e3-4de9-80de-c3ca427e5248.jpeg?type=f287']
5,배송 빠르게 잘받았습니다 타건감이 좋습니다,['https://phinf.pstatic.net/checkout/20201029_60/1603965282108tMBqk_JPEG/review-attachment-57214a7d-9652-4518-b5d3-4ebf74360a2d.jpeg?type=f287']
5,키감 단단하고 스테빌도 훌륭하네요!,['https://phinf.pstatic.net/checkout/20201012_121/1602493047187bdGd5_JPEG/review-attachment-3d7bd676-8074-4f50-a808-d1e5d389ac25.jpeg?type=f287']
4,키캡도 예쁘고 다좋지만 스테빌같은경우에는 철심소리가 점점커져서 자가윤활을 했습니다. 풀알루미늄+비키 키보드 찾는분들에게 강추드립니다.,['https://phinf.pstatic.net/checkout/20201009_130/1602195480512r93Uq_JPEG/review-attachment-ddf631a6-6bc7-483f-b7f6-91e12025e146.jpeg?type=f287']
5,풀알루에 갈축 안어율릴거같지만 타건감 쫀쫀하고 좋아요,['https://phinf.pstatic.net/checkout/20201008_51/1602127330661Mn0Mf_JPEG/review-attachment-d9c4ea1d-5137-4f33-be0a-643cd2dd5239.jpeg?type=f287']
5,만족합니다.좋아요.,['https://phinf.pstatic.net/checkout/20201013_204/1602591764951pYxGN_JPEG/review-attachment-3a1e7482-c7ea-4a73-9183-1c65d6a73369.jpeg?type=f287']
5,"키캡과 스위치 모두 제 마음대로 바꿔가면서 아주 잘 쓰고 있습니다.
조금 쓰다 보니 스테빌 쪽 소음이 조금씩 올라와서 철심 교정하고 재윤활해주니 딱 좋네요!",['https://phinf.pstatic.net/checkout/20200923_42/1600826718334imL7O_JPEG/review-attachment-7b0bb56f-403a-4111-aa47-25bd093bff78.jpeg?type=f287']
5,퀵스왑 비키 키보드라서 만족스럽고 윤활도 따로 안해줘도 될정도로 팩토리윤활이 훌륭합니다.,['https://phinf.pstatic.net/checkout/20200925_35/1601011285142lTSVq_JPEG/review-attachment-1c2c4886-9914-41d7-864c-40eecd47ec4b.jpeg?type=f287']
5,"빠른배송, 그리고 키감 좋습니다.",['https://phinf.pstatic.net/checkout/20200921_186/1600647709918VPfkE_JPEG/review-attachment-a73144d0-fb8b-4372-80fb-e462d2061bdb.jpeg?type=f287']
5,가격대비 풀알루키보드중 최고,['https://phinf.pstatic.net/checkout/20200928_21/1601251801514doS1L_JPEG/review-attachment-44517c17-d709-483a-9e0a-428d8000836d.jpeg?type=f287']
5,키감이 너무 맘에듭니다,['https://phinf.pstatic.net/checkout/20200922_127/1600738486181ILnOk_JPEG/review-attachment-55264afe-e03d-4c8b-8be8-f8397c1fcc62.jpeg?type=f287']
5,너무 이쁩니당 ㅎㅎ,['https://phinf.pstatic.net/checkout/20200930_102/1601450567162Jt8lT_JPEG/review-attachment-dd58a3f5-a2b7-4e0d-ae5e-c0330d50bf03.jpeg?type=f287']
5,꽤 좋은 제품입니다 ㅎㅎ 스테빌만 튜닝하면 기성품으로서는 거의 1티어가 아닐까 생각됩니다 ㅎㅎ,['https://phinf.pstatic.net/checkout/20200925_2/1600995351186oqTRd_JPEG/review-attachment-beda5ba8-8d92-4c4f-abef-8877b2dd2686.jpeg?type=f287']
5,풀알루타건감 좋아요,['https://phinf.pstatic.net/checkout/20200911_184/1599783685991dO7BT_JPEG/review-attachment-15502a4a-666c-4c5e-b56e-28ea65dfdbe5.jpeg?type=f287']
5,"알루의 단단한 느낌 안정성 너무 좋고요, 교체식 축도 너무 편합니다",['https://phinf.pstatic.net/image.nmv/shopnbuyer_2020_09_17_0/c9365a16-f8b6-11ea-9397-48df379ccacc_03.jpg?type=f287']
4,"첫 풀알루 사용인데 알루 하우징이 주는 특유의 키감이 너무 좋네요!
풀 알루, 핫스왑, 정방향, RGB까지 고려하면 킹성비 인정합니다!
근데 일주일 가까이 걸린 배송 때문에 별 하나 뺄거예요!",['https://phinf.pstatic.net/checkout/20200824_212/1598242074328bz09h_JPEG/review-attachment-19953645-2e49-4797-85f9-ab001f019301.jpeg?type=f287']
5,택배받는데 오래걸렸지만 잘 받았습니다 불량없고 풀알루라 단단한 키감 좋습니다^^,['https://phinf.pstatic.net/checkout/20200904_154/1599194398262GliQb_JPEG/review-attachment-3cd4c354-e51e-4a0d-b2ba-413692318c2d.jpeg?type=f287']
5,dx2 굿굿굿 좋아요,['https://phinf.pstatic.net/checkout/20200927_124/16011935869441JiB0_JPEG/review-attachment-4c47efa7-e9af-456e-911f-d71241b7c93b.jpeg?type=f287']
5,"전작의 단단한 타건감은 유지했는데
단점인 나사랑 붙여있는 f열은 고쳐가지고 아주 만족스러움
그리고 기본키캡의 품질도 좋은편이라고 생각함",['https://phinf.pstatic.net/checkout/20200821_282/1598021241205AJWp1_JPEG/review-attachment-9c18b6c8-9657-4c7f-9ab0-4eab561fc904.jpeg?type=f287']
5,단단한 느낌이 강한 하우징입니다. 스테빌쪽 소음이 있어서 따로 작업이 필요한것 빼고는 특이사항이 없으며 품질도 좋습니다. 추천합니다.,['https://phinf.pstatic.net/checkout/20200821_126/1597992076059AJEIi_JPEG/review-attachment-95ed948f-a350-4628-8963-1ef93a7d396a.jpeg?type=f287']
5,"키캡때문에 블랙색상 했는데 딱 맘에듭니다.
무게도 있어서 안밀리고 키감이 정말 단단하네요.
숫자패드까지 있는 풀배열로도 나오면 좋을거같지만 욕심이겠죠. 하자없이 배송빠르게 잘왓습니다.",['https://phinf.pstatic.net/checkout/20200824_96/1598237391576I3k2e_JPEG/review-attachment-a941b804-a4c3-43ba-8341-d9b5d5e51b09.jpeg?type=f287']
5,퀵스왑에 정방향 등 장점이 많습니다.,['https://phinf.pstatic.net/checkout/20200822_237/1598071412559pR8yl_JPEG/review-attachment-533fd516-ea9d-445c-a8ed-bffef68fcf06.jpeg?type=f287']
5,비키인데 못생기지 않음,['https://phinf.pstatic.net/checkout/20200902_161/1599008886258pIQWV_JPEG/review-attachment-b154bd63-61dc-4f7c-9d14-6a436f2d4d5e.jpeg?type=f287']
5,키캡 생각보다 실물이 괜찮습니다. 하우징 색도 잘 뽑힌 것 같습니다. 키감 단단하고요. 스페이스바가 좀 텅텅거리는 것만 손보면 될 것 같습니다.,['https://phinf.pstatic.net/checkout/20200820_195/1597927540268luLaj_JPEG/review-attachment-9ba1ded9-72e4-4161-a510-8542b2803844.jpeg?type=f287']
5,이뻐서 좋네용 ㅎㅎ,['https://phinf.pstatic.net/checkout/20200820_186/1597924048479wGnss_JPEG/review-attachment-a91faab7-3cc8-4b2e-ad32-0298e265a35e.jpeg?type=f287']
5,"처음으로 사본 기계식 키보드 특가가격 보고 바로 질렀습니다.
다른 기키를 써본적이 없어서 비교는 불가능 하지만 단단한 느낌이 굉장히 마음에 듭니다",['https://phinf.pstatic.net/checkout/20200823_136/1598148357204OMAH4_JPEG/review-attachment-b6277fc9-fef6-4c36-8999-104337669d73.jpeg?type=f287']
5,"사이즈도 컴팩트하고 디자인도 꽤 잘나온거 같아요.
기본키캡 퀄리틴 나쁘지 않은거 같은데 조금 얇은 느낌이네요.",['https://phinf.pstatic.net/checkout/20200821_257/1597976078635MEJsT_JPEG/review-attachment-d7658967-7c49-4f90-8529-6564a670bd71.jpeg?type=f287']
5,"풀 알루 키보드 처음써봅니다..
갈축인데 적축같은 느낌이네요
led도 빵빵해서 좋네용",['https://phinf.pstatic.net/checkout/20200824_75/1598221397852qurco_JPEG/review-attachment-82f7c942-1946-418b-b3bc-53f0013a7dac.jpeg?type=f287']
5,"빠른배송 감사합니다 ㅎㅎ
퀵스왑 키보드가 하나 필요했는데 키감도 괜찮고 좋네요!",['https://phinf.pstatic.net/checkout/20200829_124/1598634251544ThxDC_JPEG/review-attachment-17cf3f39-288d-422d-ba52-d6c479f0d89f.jpeg?type=f287']
5,아콘 알루 키보드 3개째 보유중인데 역시 마감을 시작으로 전체적으로 만족스럽습니다. 특히 기본 키캡도 마음에 들어 잘 사용할 것같습니다,['https://phinf.pstatic.net/checkout/20200824_210/1598231271640rQk3V_JPEG/review-attachment-925dc960-53ea-4f8a-96dd-bae47309486f.jpeg?type=f287']
5,"아콘dx2 블랙, 크리스탈키캡,
몬스타기어 팜레스트 조합 깔끔합니다.",['https://phinf.pstatic.net/checkout/20200826_181/1598421829482vXpG5_JPEG/review-attachment-9363a6e1-68e1-4034-b668-856371fb60fd.jpeg?type=f287']
5,안전하게 잘받았고 생각보다 무개감있네요 잘됩니다,['https://phinf.pstatic.net/checkout/20200822_83/1598072387967BaYIM_JPEG/review-attachment-f844a21f-4f65-428c-af96-9fdf066ae8c2.jpeg?type=f287']
5,"DX v1의 안좋은 점들이 거진 다 개선된거 같습니다.

키캡도 바꿔주고 사용하고 있는데 매우 만족스럽습니다.",['https://phinf.pstatic.net/checkout/20200821_299/15979771810584aPfx_JPEG/review-attachment-1f9dc525-64e5-444c-ba99-ec923ba21ecf.jpeg?type=f287']
5,타건감이 단단하고 아주 좋습니다,['https://phinf.pstatic.net/checkout/20200826_226/1598430089045NrSGQ_JPEG/review-attachment-d74efb8d-680d-4741-b284-65cb5362aabb.jpeg?type=f287']
4,비키인거빼면 만족스럽습니다,['https://phinf.pstatic.net/checkout/20200823_197/1598147880864tJp6v_JPEG/review-attachment-b095695e-4d04-4a04-a8ba-7055c18bc96b.jpeg?type=f287']
5,풀알루미늄 키보드를 좋은가격에 살 수 있게 되서 좋아요😀😀,['https://phinf.pstatic.net/checkout/20200821_147/1597991747202uTk4o_JPEG/review-attachment-c921ed55-f506-43ce-9fd6-bc46855dcc80.jpeg?type=f287']
5,"이쁘네요 스테빌도 만족스럽고, 제품 하자없이 잘왔습니다. 기존에 dx에서도 만족스러웠는데 이번제품도 좋습니다.",['https://phinf.pstatic.net/checkout/20200824_18/1598226796383vuWxQ_JPEG/review-attachment-659f9946-0d33-4a47-9031-bfac3e6b9209.jpeg?type=f287']
5,너무 생각보다 키감이 좋네요 감사합니다,[]
5,좋습니다. 만족합니다.,['https://phinf.pstatic.net/checkout/20200821_271/1598007982653bV4Gr_PNG/review-attachment-c51afa6c-5cb5-482a-9335-f277041c289e.png?type=f287']
5,키감 최고네요. 색깔도 좋고 LED 효과도 좋아요.,[]
5,풀알루미늄이라 키보드 치는맛이 좋네용 ㅎㅎ,[]
5,다 철덩어리라 통울림이 없어요,[]
5,좋아요.. 저적이라 조용하고,[]
5,단단하고 느낌 좋습니다,[]
5,가격도 싸고 잘 샀습니다 많이 파세요 ~,[]
5,물건 잘 도착했고. 키감 마음에 듭니다.,[]
5,조립품질이 좋고. 키감이 좋네요.,[]
4,스테빌소리가 별로네요,[]
5,너무 좋았습니다 비싼값 하는거같아요,[]
5,검은색 하우징 풀알루 키보드를 기성품에서 보다니 참 좋네요. 적축으로 축 바꾸고 타건하는데 스프링소리도 없고 참 좋습니다.,[]
5,제 인생키보드 입니다,[]
5,스마일 클럽 가입해서 싸게 잘 사갑니다 정말 좋은 키보드네요 누르는 맛이 쫀쫀해요ㅎㅎ다음에 적축 키 사서 끼워서 해봐야겠어요!,[]
5,스테빌도 순정상테로 써도될정도고단단한 키감 또한 좋아요포장은 아콘이면 말 다했죠,[]
5,"기존에 쓰던 키보드랑은 전혀 다른 세상 키보드네요풀배열만 쓰다보니 허전함은 좀 있지만, 엄청 묵직하고, 조용하고 키감이 너무 좋습니다.훌륭합니다.",[]
5,저소음적축이라 키감이 안좋은데 마감은 정말좋습니다,[]
4,"키보드가 이뻐요
색상 다양했으면 좋았을 듯",[]
5,스테빌 잘 잡혀있고 타건감 좋습니당,[]
