star_point,comment,photo
5,"데스크탑을 사로 맞추면서 구매하게 된 키보드입니다. 게임을 거의 안하고, 라이트한 게임도 할까말까하지만 사무용으로 나온 키보드들 중 마음에 드는 제품이 없어서 게이밍 제품군까지 알아보게 됐습니다.

이 제품의 경우 텐키도 있고, 디자인이 특히 깔끔하여 구매를 결정했습니다. 다른 게이밍 키보드의 경우 RGB가 너무 요란해서 걸러버렸는데, 이 제품은 화이트 LED 단일로 나오는 것을 보니 마음에 들었습니다.

기계식이 처음이라 타건감이 아직 어색합니다. 저소음 모델이 아니라서 소음도 좀 느껴지구요. (이건 제가 이전에 저소음 키보드를 사용해서 그렇게 느껴지는 것 같습니다.)

무튼 좋은 제품 구매한것 같아 좋습니다.","['https://phinf.pstatic.net/checkout/20201024_191/1603518874534mgU7x_JPEG/review-attachment-9ac64e84-90f1-4998-b7e6-6d6d3762a22d.jpeg?type=f287', 'https://phinf.pstatic.net/checkout/20201024_224/1603518874646RQhW9_JPEG/review-attachment-8c2c3902-c275-482a-8237-dfecbceee327.jpeg?type=f287', 'https://phinf.pstatic.net/checkout/20201024_225/1603518874509nf4PC_JPEG/review-attachment-2e3dcf15-b38c-4a1d-9740-c635a493fd11.jpeg?type=f287', 'https://phinf.pstatic.net/checkout/20201024_21/1603518874602rDRjN_JPEG/review-attachment-ebd336e7-120a-48e6-b296-9ad20973f828.jpeg?type=f287', 'https://phinf.pstatic.net/checkout/20201024_75/1603518874691tOpqz_JPEG/review-attachment-b1083816-f48f-450b-81da-06d76cfd8dd3.jpeg?type=f287']"
5,"기계식키보드는 피시방에서 청축, 광축, 적축만 사용해봤고 갈축은 처음 써봤습니다.
처음 딱 타건했을때는 뭐지? 밋밋한데? 라고 느꼈는데 이게 생각보다 치는 맛이 있고 청축 특유의 걸리는 느낌이 세게 들지는 않지만 약간 걸리는듯 밀리는 느낌이 들어서 이 특유의 갈축 손맛이 너무 좋습니다.

청축, 광축이 맵고 달달한 떡볶이라 자극적이고 확 땡기는 느낌이라면
갈축은 동네 시장떡볶이 느낌? 확 자극적이지는 않지만 적절히 감칠맛도 나고 안질리고 계속 생각나는 그런 타건감이네요. 딱 처음 손댓을때 뭐지? 싱거운데? 하는 느낌만 벗어나면 정말 중독되는 키감입니다.

소음도 딱 적당하게 밤에 사용해도 크게 시끄럽다고 안느껴지고, 그렇다고 아예 아 내가 기계식 쓰고있구나 하는 느낌이 잘 듭니다.

디자인은 블랙 베이스에 키캡은 약간 찐한 회색? 살짝 연한 검은색? 느낌으로 되게 괜찮습니다. 단일 LED는 호불호가 갈리겠지만 경험상 레인보우는 빨리 질리는 감도 있고 별로 예쁘다고 못느껴서 단일LED인게 더 좋네요.

통울림은 정말 조용할때 키 하나하나 눌러보고 쎄게 눌러보면 아예 없다고는 못하겠지만 평소 그냥 사용하듯 타다다닥 치고있으면 통울림 아예 못느끼고, 헤드셋 or 스피커 쓰고있으면 솔직히 통울림 못느꼈네요.

갈축을 처음써봐서 기대반 걱정반으로 산 제품인데 생각보다 너무 취향이라 마음에 드네요. 갈축이 왜 핫한지 잘 알게 되었습니다.

잘 쓰겠습니다~",['https://phinf.pstatic.net/checkout/20200831_233/1598870944314LHyx8_JPEG/review-attachment-5fda6e99-c4db-4a9b-9118-5b61f379575d.jpeg?type=f287']
5,"박스 안에도 스타이렌 폼으로 꼭짓점들이 보호되고 있어 키보드에는 상처가 없이 올 수밖에 없습니다
그런데 추가적으로 겉면에 포장해주시는 뽁뽁이가 되게 빵빵해서 배송 안정감은 그냥 최고라고 할 수 있겠네요

광축을 쓰다가 조용한 새벽에 클릭 소리가 스트레스로 다가와 가성비 갑이라는 ck87의 풀배열 모델인 ck108을 사기로 결정했습니다
제가 적축 청축 이런건 써본 경험이 전무하기 때문에 상대적 키감 이런거는 평가할 수 없을 것 같습니다
근데 영상들을 찾아보고 공부해본 결과
통울림 스프링소리 이런 저가형의 소리는 안나는 걸 알 수 있었습니다
제가 느끼기엔 확실히 소리가 아예 안나는 그런게 아닌 서걱서걱하고 부드러운 키감이 일품입니다
약한 소음이 있기에 키 구분은 잘 되구요
광축의 클릭소리에서 넘어왔지만 적응기간은 따로 필요하지 않았네요 ㅎㅎ
오랫동안 고장나지만 않아줬으면 좋겠습니다

제가 받은 제품은 처음에 스페이스바의 스테빌이 잘 안된 듯 했습니다
왼쪽 누를때는 서걱서걱한데 오른쪽 누를때는 탁탁 팅팅 거렸거든요
절망하려다가 광축 스페이스바를 갖다 껴보니
그래서 장착의 문제구나 하고서 다시 끼면서 꽉 눌러 껴주니 해결이 되었습니다

전체적으로 정말 군더더기 없이 깔끔한 좋은 키보드인 것 같습니다
아, 키보드 덮개는 따로없지만 광축꺼라던가 오래전 쓰던 멤브레인 키보드 덮개로 대충 덮어지니 저는 괜찮네요 ㅎㅎ","['https://phinf.pstatic.net/checkout/20200411_64/1586572430225m8ziY_JPEG/20200409_112746.jpg?type=f287', 'https://phinf.pstatic.net/checkout/20200411_22/1586572447581iX7Fj_JPEG/20200409_114958.jpg?type=f287']"
5,"일단 기계식 답게 무게감 있어서 좋구.
원래 저소음갈축 가려다가 황축 소리듣고 반해서 산건데, 저소음갈축 샀으면 큰일날뻔 했네요
왜냐면 이게 생각보다 많이 조용해요 유튭에서 황축 영상 다 찾아봤는데 듣기로는 청축 갈축 중간 같아서 뭔가 청축보다 무거운 경쾌함? 이런거 생각 했는데 생각보다 많이 조용한 편입니다. 게임할 때 키감이 느껴져야 하는 사람들은 안좋은 거 같기도해요
빠른 타이핑을 할 때 진가가 나온다고 해야대나 서걱서걱 소리가 정말 좋네요
조용히 짧은 문장 칠 때는 갠적으론 많이 조용한 거 같구요. 일단 겜할때도 저는만족입니다",['https://phinf.pstatic.net/checkout/20200929_294/1601357548079cemMh_JPEG/review-attachment-9297dd9a-e8c1-4ad4-aca8-cfc03696d043.jpeg?type=f287']
4,"기계식 키보드 처음 써보는데 좋은건지 나쁜건지는 잘모르겠어요
갈축으로 구매했는데 소리는 작다고헀지만 막상써보니 완적 작은느낌은 아니였습니다~ 키보드자체는 조금 무게감이 있었고 전반적인 디자인은 깔끔한 스타일인것 같습니다.
특이한점은 누를떙 스프링 튀기느 팅? 팅? 소리가 약하게 들리는데 원래그런거지 잘못된건지?? 바닥에 뭘안깔아서 그런건지는 모르겠습니다!!","['https://phinf.pstatic.net/checkout/20201023_147/1603422895786AWyaz_JPEG/review-attachment-b8265f08-1c9c-4566-8921-dcb670202809.jpeg?type=f287', 'https://phinf.pstatic.net/checkout/20201023_108/1603422895517OalSh_JPEG/review-attachment-576013ae-814a-4dc8-be9b-955e2fc93f48.jpeg?type=f287']"
5,"처음으로 기계식 키보드를 써봤습니다.
구매전에 유투브등으로 약간의 정보는 참고했지만
한번도 기계식 키보드를 사용해본적 없기에 어떤 축을
골라야 할지 고민이 많았습니다.
갈축을 선택 했지만 유투브에 유독 황축에 대한
영상이 많아서 아...나도 황축 했어야 했나 하는
결정 장애적 후회가 밀려 오기도 했습니다.
멤브레인 키보드만 20년 이상 사용했습니다.
하지만 오늘 오후 배송 받은 직후.....
콕스 108 갈축 첫 타건...느낌은....
지옥에서 천국을 영접한 느낌....
내가 이때까지...도데체 무슨 쓰레기를 두드린거야....
하는...신세계에 첫발을 내딛은 느낌이였습니다.
갈축의 타건도 무겁지 않고 저한테는 적당했구요...
고급진 느낌이였습니다.
..다음에는 서걱서걱하는 황축도 한번
사용해 보고 싶네요.
많이 파세요...
모나미 오각 볼펜만 사용하다
몽블랑 만년필을 처음 사용한 기분입니다.ㅎ",['https://phinf.pstatic.net/checkout/20200512_55/1589289436301674JI_JPEG/20200512_220221.jpg?type=f287']
5,"배송 엄청 빠르고요 포장도 되게 견고하게해서 옵니다.
기계식 키보드는 처음써보는데 키감이 무겁지않고 소음도 그렇게 크지않은게 적당한것 같네요 스페이스만 따로 조금 키감이 다르긴한데 이부분은 유튜브에서 많이 리뷰로 보아서 미리 알고있던 부분이라 크게 불편한점은 없네요
가성비가 상당히 좋다고 말하던데 듣던데로 좋네요 잘쓸게요","['https://phinf.pstatic.net/checkout/20200520_254/1589973693999pg97j_JPEG/KakaoTalk_20200520_201848513_02.jpg?type=f287', 'https://phinf.pstatic.net/checkout/20200520_85/1589973691404AXmwb_JPEG/KakaoTalk_20200520_201848513.jpg?type=f287']"
5,"이 키보드를 추천 받았을 때는 적축과 흑축의 사이? 라고 들어서 무슨 말인지 몰랐습니다만 써보니까 바로 알겠습니다. 이것은 아주 훌륭한 혼종입니다. 키감이 너무 가볍지도 그렇다고 무겁지도 않습니다 소리는 아주 적당한 거 같습니다. 소리는 대략 삼성컴퓨터 사면 주는 기본 키보드..정도? 매우 조용한 것은 아니지만 사무용으로 사용해도 문제 없을 정도입니다. 디자인,, 특히 마감이 매우 만족스럽습니다.",['https://phinf.pstatic.net/checkout/20201015_33/1602737910631obfbx_JPEG/review-attachment-a061b874-59dd-46da-a751-a22014ea29b3.jpeg?type=f287']
5,"기계식키보드를 처음으로 입문하는거라 6만원 이내 키보드를 찾았고, 이것저것 알아보면서 눈여겨보던 제품인데, 마침 할인을 해서 바로 사버렸습니다. 지방에 사는지라 타건은 못해봤고, 피방에서 보통 청축을 많이 쓰는데, 소리는 둘째치고 키보드를 눌렀을 때 걸릴듯말듯 탁하고 들어가는 느낌이 싫어서 리니어축으로 선택하였고, 결과는 매우 만족스럽습니다.
장점으로는 깔끔한 디자인, 스페이바 윤할로 매우 부드러운점, 숫자키패드 위에 가시적으로 보이는 소리조절과 계산기 사용, 10만원대에 키보드와 같은 하우징으로 튼실할거같은?
단점으로는 스페이스바 통울림과 키보드 보호캡이 없다는 점이겠네요.",['https://phinf.pstatic.net/checkout/20200407_133/1586250340347s2fJ9_JPEG/1.jpg?type=f287']
5,처음으로 기계식 키보드를 사봅니다.동생이 앱코 광축 키보드를 썼었는데 클릭 스위치라 소음이 생각보다 커서 소음 적을걸로 사려고 고민하다가 황축으로 구매를 했습니다.타건해본 결과 타건음도 상당히 좋고 타건감도 상당히 좋았습니다. 다른 키보드를 안써봐서 잘은 모르지만 입문용으로 좋은것 같습니다.소음은 사람들이 기계식은 뭘 어떻게 해도 소음이 난다고 해서 걱정했는데 카일 광축클릭이랑 비교도 않되게 정숙하고 원래 쓰던 오래된 멤브레인 키보드보다 소리가 작아서 깜짝 놀랐습니다. 개인차에 따라서 다르겠지만 소음은 신경쓰지 않으셔도 될 것 같습니다.색깔도 사이트에 나와있는것보다 연한 회색인데 무광이어서 은은하게 빛나는 흰색 led와 함께 고급스럽고 좋은것 같습니다.입문용으로 강추합니다.,[]
4,"사무실 키보드가 오래돼 사용에 불편함이 있어 주문했습니다. 판매자의 잘못인지 택배사의 잘못인지 모르겠으나 주말에 주문하고 목요일 오후에서야 받았습니다

상자 열어보니 스페이스바가 이탈되어있어 기분이 썩 좋진 않았으나, 결합하고 사용 해보니 기능상 문제는 없어 걱정은 덜었습니다.

일단 전체적으로
사무실에서 사용할 키보드라 유튜브 리뷰 영상을 통해 축별 소리를 들어봤습니다
처음엔 저소음 갈축을 생각했으나,
1인 사무실이라 소리에 따른 제약이 없어 경쾌한 소리나는 녹축으로 결정했습니다
사용해보니 타감도 좋고 경쾌한 소리에 일할 맛 납니다.
배송문제 빼면,
타감, 소리, 다양한 led모드 등. 전체적으로 아주 만족합니다",['https://phinf.pstatic.net/checkout/20200709_249/15942775053570AK66_JPEG/review-attachment-4cc48e01-c646-4483-b754-9a2ca3132662.jpeg?type=f287']
5,"황축이랑 갈축중에 갈축 골랐습니다.
키압은 5g 차이지만 갈축도 나름 키압이 적절하게 낮음을 느꼈습니다.
주로 게임과 코딩을 위주로 하다 보니 키압 낮은걸 원했는데
괜찮게 구한 것 같습니다.

볼륨조절키와 계산기바로가기 키가 매우 유용합니다. 계산기를 애용하다보니 ㅎㅎ
. 완전 검정색이 아니라 진한회색 느낌이기도 해서 뭔가 딱 제가 원한 색상이었습니다.",['https://phinf.pstatic.net/checkout/20200819_9/1597823107071gzBq0_JPEG/review-attachment-add51cbd-df08-4fd4-882e-77e91d9908a7.jpeg?type=f287']
4,"정숙한 타건음, 서걱이는 느낌, 과장되어 피로하지 않은 led 등 모든 장점을 갖췄다고 생각됩니다. 다만 가끔 키입력이 먹히는 경우가 있었고 이게 불량인지 아닌지 알 수가 없지만 광고에 따르면 무한 키입력이 가능하다면 키 씹힘은 별로 좋은 상태는 아니지 않나 싶습니다. 10만원 이상으로 통 크게 지른 제품에서 이런 부분에서 아쉬움을 느낄줄은 몰랐지만... 그것만 제외하면 최상의 제품이었다고 생각합니다.",[]
5,"색 키감 다 좋아요. 타건음도 원래 쓰던 갈축보다 조용하니 마음에 들구요.
다만 단점이라면...다른데서는 주는 스위치 리무버는 안들어있으니까 구매하실때 참고하세요.
물론 쓸일은 별로 없지만요.
그리고 FN키 등록에 소리만 있고 화면밝기가 없는건 좀 아쉽네요. 물론 서피스를 쓰는 특수한 상황이지만, FN+F1~12는 제가 맘대로 바꿀수 있게 되었다면 더더욱 완벽했을것같습니다.",['https://phinf.pstatic.net/checkout/20200407_91/1586270996942iMFsA_JPEG/1586270974326.jpg?type=f287']
5,"기존에 쓰던 키보드는 손에 자연스럽게 힘이 들어가서 작업을 많이 하고 나면 손가락 마디가 아팠는데요. cox ck108 키보드로 바꾸고 나서는 굳이 힘을 들이지 않아도 자판이 시원하게 잘 눌려서 손가락 마디가 아프지 않네요. 다만, 저소음은 아니여서 키보드 자판 누르는 소리가 나긴 하는데요. 청축이나 갈축 같은 다른 제품보다 덜 하지만 시끄러운 게 아예 싫으신 분들은 저소음 키보드로 사시길 바랍니다.",['https://phinf.pstatic.net/checkout/20200702_23/1593673830150fLvMv_JPEG/cox%C5%B0%BA%B8%B5%E5.jpg?type=f287']
5,"갈축쓰고있었는데 이건 조금더 부드러운 느낌
더 조용해진 느낌입니다 만족합니다.
다만 캡스룩키랑 눔키가 키에 들어오는 불로는 구별이 안되더라구요 따로 있긴한데 조금아숴웠어요.
선은 좀 튼튼해보여서 좋았어요
별문제없이 잘썼으면합니다~!",['https://phinf.pstatic.net/checkout/20200922_41/1600761195818TBy7o_JPEG/review-attachment-2b6dae74-3793-4ad2-a287-0e5c9b8985ee.jpeg?type=f287']
5,사무실에서 쓰려고 구입했어요. 워낙 손끝에 힘을 주고 팍팍 치는 스타일이라 소리를 걱정했는데 웬걸 직전에 쓰던 멤브레인 키보드보다도 훨씬 조용하네요 ㅋㅋㅋ LED가 요란하지 않고 심플한게 마음에 들어요. 다른 축도 써보고 싶네요.,['https://phinf.pstatic.net/checkout/20200820_14/1597910996420qk0Uc_JPEG/review-attachment-99a032e1-f45c-4f1a-9834-dc8eaa1ddd27.jpeg?type=f287']
5,ck450을 6월달에 구매했는데 led도 고장나고 키축도 고장이 나 바꿔야해서 그럴바엔 그냥 다시 괜찮은걸로 구매해야겠다 싶어 이번에 CK108로 구매했는데 진작 이걸로 구매할걸 싶더라구요! 타건감도 좋고 깔끔해서 너무 마음에 들었어요! ck108은 ck450처럼 고장생기지 않고 오래오래 쓸 수 있었으면 좋겠어요~,['https://phinf.pstatic.net/checkout/20201013_14/16025925796597TReu_JPEG/review-attachment-f1e344e4-d115-4ba6-b75d-b9e3b7f3298a.jpeg?type=f287']
3,제품 자체 퀄리티는 군데군데 아쉬운 점이 있지만 그래도 좋은 편입니다. 다만 제가 체리 청축만 오랫동안 사용해서 그런지 황축에 적응을 하기가 쉽지 않아서 별점을 낮게 내렸습니다. 리니어 타입 스위치 좋아하시는 분들은 저와 다르게 스위치 퀄리티도 좋게 느끼실 것 같아요.,[]
2,"제품 받아서 사용하고 있었는데 소음같은건 확실히 잡힌거 같아요.. 근데 가끔 키가 안먹혀요. 착각이겠거니 싶다가 X키, 페이지 다운키를 한번씩 톡톡 건드리는데 안먹히고 가만히 있는 때도 있고 그러네요.

저소음인건 좋지만 게이밍에도 충분할거라고 고려하고 산건데 키가 안먹히는건 좀 큰 문제 같아요..",[]
4,"2일 전에 주문을 해 오늘 도착해서 리뷰 남기고 갑니다. 일단 키보드 받고 나서 포장지를 뜯고 박스 열어보려 했는데 예상치도 못한 일이 있었습니다. 사진처럼 박스 왼쪽 부분이 찧였고, 그리고 안쪽에 선을 넣은 부분이 구겨져서 왔네요. 살짝 걱정이 되었으나 다행히도 안에 있는 내용물들은 이상이 없고요, 아마 택배회사쪽에서 이동중에 손상이 된 걸로 생각됩니다. 제가 주문할 때 파손위험이 있으니 소중히 다뤄주라고 얘기해도 이렇게 오는 걸 보고 많이 아쉬웠습니다. 앞으로도 배송에 많이 신경 써주면 좋겠습니다. 본 내용인 키보드 리뷰를 하자면, 제가 알고 있는 체리 갈축과 비교해 다르게 서걱임과 소음이 조금 강했고요, 그럼에도 불구하고 비교적 정숙한 느낌이 있습니다. 나중에 축 윤활까지 아니더라도 오링작업까지 하면 조금이나마 소음이 줄어들겠네요. 이 제품 특성상 흡음재가 기본으로 내장되었기 때문에 통울림은 심하지 않고, 스테빌라이저 윤활 덕분에 철소리가 안납니다. 이 점은 정말 좋은 것 같아요. 콕스가 앱코 자회사인지라 여러모로 커뮤니티나 유튜브 같은 매체에서 부정적인 이야기를 많이 들었습니다. 계속 써봐야 알겠지만, 지금까지 기계식 키보드를 많이 써봤던 제 입장에서 이 제품은 제가 지금까지 써보았던 보급형 제품들 중에서 가장 가성비가 좋다고 생각해요. 기계식 키보드를 처음 사시는 분들에게 추천해주고 싶네요. 다만 소리에 민감하신 분들에겐 갈축보단 황축같은 리니어 계열의 축이 들어간 키보드를 쓰시는 걸 추천합니다. 만족합니다 잘 쓸게요!",[]
5,"배송은 빨름 입금후 다음날 물건 받았어요

마지막으로 썻던 멤브레인 키보드가 스톰 X 타이탄 제품으로
타이탄의 키감이 좀 묵직했다면 CK108 제품은 많이 가볍습니다.
타건시 소리는 찰칵소리보단 서걱에 가까운소리가 납니다

키보드의 외관은 올 블랙에 LED가 흰색으로 나오고 밝기조절은2단
까지 가능합니다 심플하고 깔끔한 키보드 원하신다면 강추합니다.",['https://phinf.pstatic.net/checkout/20200509_47/158901881384524fLV_JPEG/KakaoTalk_20200509_185924556.jpg?type=f287']
4,"디자인 보고 샀는데 정말 깔끔해서 맘에 들어요
엔터나 캡스락같이 긴 문구에 빛이 균일하게 안들어오는데 그부분은 조금 아쉽습니다. 하지만 가격대비 정말 괜찮은 타건감을 가지고 있어서 입문용 기계식 키보드로 완벽한거같아요!",['https://phinf.pstatic.net/checkout/20200530_154/1590841514968DUHCT_JPEG/KakaoTalk_Photo_20200530_2125_09789.jpg?type=f287']
4,할인해서 명시된 가격보다 저렴하게 산거는 좋네요 유튜브 리뷰들을 보면 원래 가격이 할인된 가격이랑 동일하긴한데 시간이 지남에따라 물가가 올랐거나 수요가 많아져 비싸진거라 생각하지요 월요일 저녁에 상품을 주문했기때문에 수요일 도착이 무리라는 것은 예상했습니다만 목요일 오후에 도착할지는 몰랐네요아마 배송사의 잘못이겠죠그다음 상품을 개봉했는데 스페이스바가 반대로 끼워져있었습니다교환을 위해 판매자에게 전화 2통 문자 1통 보냈으나 답변을 주시지않았지만 qna? 문의사항?에 질문을 남기니 교환을 위해 상품을 보내달라는 답변을 남겨주신 점은 좋았네요하지만 상품을 보내고 다시 교환 제품을 받기까지 일주일 정도 걸릴거라 생각이 드니 그냥 제가 스페이스바를 제대로 끼워 쓰기로 결정은 했습니다 또한 내 잘못이 아닌데 교환 반품을 위해 제가 택배비를 추가로 지불해야한다는 점이 맘에 들지 않은 것도 어느 정도 있습니다그럼 이왕 쓰기로 한거 걍 쓸것이지 뭔 말이 많냐라고 생각하는 불편한 사람도 있을테지만 걍 리뷰 남기라길래 제가 겪은 걸 남기는거뿐입니다키보드 자체는 좋긴합니다 쓴 지 얼마되지 않아 손에 익숙하지 않을 뿐 타자감 키보드 타건 부디 소원은 올때 스페이스바가 반대로 끼워진 불량품이라 부디 as는 좋았으면 하네요키보드 자체는 좋은데 여러가지 문제점들이 있어 3점 드립니다,[]
5,가성비가 좋다는 소문을 듣고 이것저것 정보 찾아본 뒤에 구매했습니다 일단 들었을 때 첫 인상은 엄청 묵직합니다. 제대로 된 기계식 키보는 처음 써봤는데 무거워서 흔들림없이 잘 사용할 수 있을거같아요 키감은 갈축 처음 써보는데 생각보다 서걱서걱한 느낌은 아니고 뭉툭하게 도각도각 다각다각 거리는 느낌입니다 통울림 거의 없구요 (스페이스바 귀에 갖다대고 쳐야 들립니다) 키 누르는 압력도 적당히 힘주면 부드럽게 내려가고 올라오는것도 빠릿하게 올라옵니다. 한마디로 깔끔하고 손에 부담없이 가볍게 잘 사용할 수 있을 것 같습니다 키보드 많이 쓰는 직업인데 괜찮게 구매한것같습니다. 색상은 사진은 좀 진하게 나오는데 올블랙아니고 자판부분이 살짝 그레이컬러가 들어가서 디자인 괜찮습니다. 사실 검정 바디에 흰색 LED라서 디자인이 이쁘다 뭐 이런것보단 그냥 딱 깔끔하다 보시면 될 것 같아요 볼륨키 조절 우측 상단에 달려있어서 매우매우 엄청 만족하구요 높이 조절도 2단이여서 만족합니다 가성비 좋다는 놈인만큼 오래 쓰고 보내줘야겠습니다 ㅎㅎ,[]
5,"1. 디자인
클래식, 단일 LED

2. 키감
게이트론은 황축이 정답이라는걸 깨달았네요.
앞선 리뷰의 아쉬움을 모두 날려주었습니다. 황축으로 바꾸었을 뿐인데 이렇게 키보드가 조용하다니
그리고 쫀득한 키감이 타이핑 하는 재미를 살려줍니다.
사무실에서 사용하기 딱 좋을 제품이네요.

3. 총평
게이트론은 황축이 진리다.","['https://phinf.pstatic.net/checkout/20200115_216/1579072427083FHESU_JPEG/20200115_021126.jpg?type=f287', 'https://phinf.pstatic.net/checkout/20200115_232/1579072427042pXi4T_JPEG/20200115_015649.jpg?type=f287']"
4,디자인은 제가 생각한거랑 똑같아서 매우 만족스럽습니다 다만 키감이 제가 생각했던것보다는 조금 가벼웠습니다 갈축보다 좀 더 무거운 키감을 했어야 했는데 제 실수입니다. 아직까지 많이 써보지는 않았지만 만족인 상품입니다.,[]
4,"1. 디자인
호불호가 거의 없을 크래식한 디자인 깔끔
화이트 LED단색

2. 키감
게이트론 스위치를 처음 사용해 보는 거라 일단 녹축 / 갈축 / 황축
대표적인거를 구입해 보았습니다.
녹축
체르MX 청축에 비해 확실히 키압이 녹아요 소음은 비슷한거 같구요.
중저가 키보드 치고는 확실히 기본기가 탄탄함이 느껴집니다.
살짝 만져 주면 정말 괜찮은 키감이 나올 듯 합니다.

저에게는 녹축이 상당히 버겁네요.
몇 시간 타이핑 하면 손에서 지가 날듯

총평.

게이트론 입문자 중 높은 키압의 경쾌한 키보드가 필요하신 분들은 추천드립니다.",['https://phinf.pstatic.net/checkout/20200115_276/1579071892124rSIWp_JPEG/20200115_015031.jpg?type=f287']
5,첫 기계식키보드 입문을 콕스사 키보드로 하게 되었는데 굉장히 만족스럽습니다. 우선 사진보다 실물이 더 이뻐서 뜯어보자마자 너무 맘에 들었습니다. 타건감 역시 맘에 듭니다. 스프링 튕기는 소리가 약간 나기는 하지만 충분히 넘길 수 있을 정도입니다. 잘 쓰겠습니다~~,"['https://phinf.pstatic.net/checkout/20200218_275/1582028268239EG9qI_JPEG/KakaoTalk_20200218_211315359_02.jpg?type=f287', 'https://phinf.pstatic.net/checkout/20200218_169/1582028276634047ea_JPEG/KakaoTalk_20200218_211315359_01.jpg?type=f287']"
