star_point,comment,photo
4,"하얗고 깔끔한 디자인이 정말 눈물나게 마음에 듭니다. 들어오는 RGB 색도 너무너무 영롱하고, 키보드 자판의 글자마저 깔끔하고 예쁩니다 ... 단점이 하나 있다면 .. 통울림이 심하다는 것? 타자를 치면 웅웅 소리가 납니다 가벼워서 그런듯 하구 ... 별로 신경은 안쓰입니다.. 적축이라 저거저저걱저걱적겆겆적 소리가 나네요 키 누르는 소리도 괜찮구.. 조용하진 않습니다. 근데 모든 단점을 찍어누를 만큼 키보드가 예쁘네요ㅎㅎ 키도 엄청 가볍게 눌립니다. 진짜 가볍게 눌려서 종이 누르는 기분입니다 아무튼 예뻐서 추천 // 통울림 심한거 싫어하시는 분께는 비추","['https://phinf.pstatic.net/checkout/20201021_12/1603265082463nMMOB_JPEG/review-attachment-fa2029ff-65e7-48b8-a308-d1868390c027.jpeg?type=f287', 'https://phinf.pstatic.net/checkout/20201021_74/16032650827416189e_JPEG/review-attachment-b3a5c117-17fa-4381-83db-8f31ed11539e.jpeg?type=f287', 'https://phinf.pstatic.net/checkout/20201021_212/1603265082652v6Kv3_JPEG/review-attachment-c2e7aa47-24d6-4524-ac2d-73a112675068.jpeg?type=f287']"
3,"일단 타자칠때 부드럽지만 기계식에 소음은 어쩔수 없는거 같네요. 상품 사용감인지 불량인지 모르겠지만 긁힌 자국 비슷한게 있어서 맘에 안들어 점수 3점 줍니다.
이런 부분은 검수하면서 안거르는 건지요?? 교체 할 수도 있지만 왔다갔다 하기 귀찮아서 그냥써요. 다음에 재주문은 글쎄요....","['https://phinf.pstatic.net/checkout/20201030_255/1604058726006z6cCE_JPEG/review-attachment-c8f39c9d-f0aa-4df8-a06b-bae850c2c0ad.jpeg?type=f287', 'https://phinf.pstatic.net/checkout/20201030_151/1604058742236gu1Q8_JPEG/review-attachment-64d89fc7-44e1-42b7-9c8a-1c520b3161e2.jpeg?type=f287']"
5,"기계식키보드를 아주 저렴하게 구입했습니다.
모든키와 모든LED 잘 작동합니다.
편하게 쓰기엔 오타도 적어 커세어은축 low profile보다 낫네요.
가격대에 불구하고 마감상태까지 허술하지는 않네요.
키캡 감촉도 무난하고, 각인도 깔끔합니다.
LED광량이 그냥 켜졌구나라는 정도...화사하진 않습니다.
텅텅거리는 철심소리가 있네요. 이런 소리는 더 비싼 키보드들에서 자주 있는것이니, 윤활수고가 좀 필요해보입니다.
난 그냥 쓸테니까....뭐....스피커 켜면 묻히겠??
단점없으면 거짓말이고, 이 가격이면 커버할수 있는게 아닐까요? 내 생각인가...
화이트갈축인데....제대로 찰칵거리게 청축살껄 그랬나",[]
3,"타자 소음이 매우 크고, 탄력적이지 않고 뭔가 딱딱한 느낌? 아이들 게임용과 일반용을 겸해서 오랫동안 사용할 생각으로 구매했는데, 예전 사용한 자판보다는 별로인것 같음. 교환신청해봐야 똑같은 물건일까봐 교환신청하는것도 번거롭고..., 암튼 자판이 뭔가 부드럽지 못하고 딱딱한 느낌! 구매에 신중하시길....",[]
3,생각보다 시끄럽구요. 통울림 거슬립니다.그리고 키 높이가 너무 높아요. 키감은 나쁘지 않습니다. LED가 롤 용으로 기본셋팅 옵션에 있다는 있은 좋습니다. QWER-DF-B키만 불이 들어오는 옵션이 있습니다. 가격이 싸서 샀는데 딱 이정도네요. 키캡 도색이 별로 안이쁩니다. 잘 사용할거같진 않네요. 사무실같은 곳에서는 절대 못 씁니다.,[]
5,기계식 키보드 처음 사보는데 잘 모르겠어서 오프에서 대충 보니 청축보단 소리가 덜 나는 것 같아서 갈축으로 선택했습니당 노트북을 거치대에 올려두고 메이플하는데 어깨에 너무 부담가는 것 같아서요~ㅎㅎㅎ 너무 예쁘고 맘에 들어요~ 배송도 엄청 빨랐어요. 감사합니다^^,"['https://phinf.pstatic.net/checkout/20200619_295/1592554211936NS922_JPEG/20200619_165647.jpg?type=f287', 'https://phinf.pstatic.net/checkout/20200619_110/1592554211684nbo2L_JPEG/20200619_165911.jpg?type=f287']"
4,방금전에 배송이 왔네요 보내주는거는 정말 빠르게 보내주시는데 택배사에서 많은 물량으로 인하여 6일에 시킨 물건이 오늘인 12일에 배송을 받았습니다. 빠르게 필요로 하시는분들은 택배사를 잘 보시구 주문 하시는게 나으실것같네요. 그리고 배송포장상태에서 말씀 드립니다. 키보드도 pc상품이고 전자제품인데도 불구하고 뽁뽁이를 안해주시는거에 대해서 좀 실망스럽습니다. 박스가 살짝 구부져써네여ㅠ 일단 써봐야 알 것같습니다. 그래도 이 가격대에 이상품을 사시는것은 추천해드립니다. 가성비굿👍🏻,[]
5,기존에도 콕스 기계식 사용중인데 다른 세컨컴에 맞룰려고 신제품 하나 장만했습니다. 기존께 ck420이였는데 이번에 나온 ck01이 같은 청축인데 엘이디도 옆에 나오고 시스템엘이디도 기존꺼랑 다르게 바형태로 나오네요 암튼 좋습니다 ㅋㅋ,['https://phinf.pstatic.net/checkout/20200520_261/1589943499147fvecc_JPEG/KakaoTalk_20200519_130827319.jpg?type=f287']
5,"기존에 쓰는 키보드가 점점 갈수록 자판이 연속으로 눌러지는 현상이 발생해서 싸고 좋은걸 찾고 있었는데 괜찮에요 ㅎㅎㅎ
잘쓰겠습니다
조금 흠이 있다면 속목받침이 없는 정도 인거 같네요 ㅎㅎ ..
아직 오래 쓰진 않았지만 그왜에는 괜찮은거 같습니다",[]
1,저가형 키보드가 출시되서 어떤가 해서 샀습니다키보드가 가벼운거는 좋지만 타건시 팅팅 거리는 울림이 너무 거슬립니다.제품하자인 줄 알고 교체 받았지만받은 것도 동일합니다.이 소리만 없으면 너무 좋은 가격인데전 너무 신경쓰이네요,[]
3,그냥 저렴한 가격에 쓸 수 있다는게 장점입니다. 그래도 키캡 측면에 긁힘 자국 있는건 좀;,"['https://phinf.pstatic.net/checkout/20200913_298/1599955333457PQOo7_JPEG/review-attachment-f21164fc-3104-4a73-bd97-1d3b4f359d8c.jpeg?type=f287', 'https://phinf.pstatic.net/checkout/20200913_124/1599955334633kLsaD_JPEG/review-attachment-86c0bebb-46a0-400f-b74d-374770816f08.jpeg?type=f287', 'https://phinf.pstatic.net/checkout/20200913_112/1599955333903q4DQ6_JPEG/review-attachment-0b368682-2814-44cc-9e9e-caf035a1debe.jpeg?type=f287', 'https://phinf.pstatic.net/checkout/20200913_265/1599955333642Lyx4V_JPEG/review-attachment-a225d410-c750-4b8d-b6c7-4a191d3b41b7.jpeg?type=f287', 'https://phinf.pstatic.net/checkout/20200913_272/1599955333843XUeVw_JPEG/review-attachment-21e2bed6-a8d9-4451-a6dd-114935e970c8.jpeg?type=f287']"
5,"엄청 이쁘고 마음에 들어요ㅎㅎ
적축이라서 소리도 적고 엄청 좋네요","['https://phinf.pstatic.net/image.nmv/shopnbuyer_2020_07_23_0/70d173dd-ccd0-11ea-8d5c-48df37ae3fca_03.jpg?type=f287', 'https://phinf.pstatic.net/checkout/20200723_288/1595500584294S0gKE_JPEG/review-attachment-d7f48050-3317-4cff-a917-4c0a32c3e64f.jpeg?type=f287', 'https://phinf.pstatic.net/checkout/20200723_268/1595500584911aiTSr_JPEG/review-attachment-b5e113b9-c0df-487e-bf7b-1ffcce8e6364.jpeg?type=f287', 'https://phinf.pstatic.net/checkout/20200723_231/1595500585168Rt0Dn_JPEG/review-attachment-2e81d694-de9c-4259-9c0c-d56c77ad0c62.jpeg?type=f287']"
5,"포장도 깔끔하게 되있고 색감이 되게 좋네요 ㅎㅎ
갈축으로 싰는데 타격감이 생각보다 좋아요","['https://phinf.pstatic.net/checkout/20201119_89/1605771945470oYFoC_JPEG/review-attachment-80f45b2d-9a27-462b-a43f-2cf90e073ecf.jpeg?type=f287', 'https://phinf.pstatic.net/checkout/20201119_65/16057719453919BEE7_JPEG/review-attachment-03ab0802-8cac-4898-82c5-9fb02f2ebe31.jpeg?type=f287', 'https://phinf.pstatic.net/checkout/20201119_109/1605771944949qjKuJ_JPEG/review-attachment-396e5873-2d99-4f3b-b66e-4d2030131a96.jpeg?type=f287']"
5,넘 이쁨니다ㅜ다들 고민하지 말고 빨리 결제누르세요 저처럼 배송을 늦출뿐이에여 진짜 넘이뻐여 키감도 좋구요!,"['https://phinf.pstatic.net/checkout/20200803_7/1596429655537PaFPm_JPEG/review-attachment-762852f0-264e-4f4e-a18f-d2f92c20d037.jpeg?type=f287', 'https://phinf.pstatic.net/checkout/20200803_26/1596429655906wLf4t_JPEG/review-attachment-33927b4d-d673-4f67-9bdf-cdc4c51f1745.jpeg?type=f287', 'https://phinf.pstatic.net/checkout/20200803_223/1596429656034Q3YxC_JPEG/review-attachment-b8c5e4bf-3bab-412b-b59b-95334f1d612f.jpeg?type=f287']"
5,배송 완전 빠르고 가성비 좋은 듯요ㅎㅎ,"['https://phinf.pstatic.net/checkout/20201028_215/1603861868176M5mn3_JPEG/review-attachment-2eb2ca2d-277e-4425-9bae-e26b29ae50e6.jpeg?type=f287', 'https://phinf.pstatic.net/checkout/20201028_27/1603861868640G1CY1_JPEG/review-attachment-592f5ab6-ce37-43bc-97f6-748f759640c4.jpeg?type=f287']"
4,싼 기계식 키보드 찾는다면 역시 제일 괜찮습니다. 그치만 키보드가 빈 것처럼 텅텅거리는 소리는 좀 거슬리네요. 그래도 배송도 빠르고 가성비로는 최곱니다.,"['https://phinf.pstatic.net/image.nmv/shopnbuyer_2020_10_13_0/1dc736bb-0d58-11eb-be01-48df379ccacc_03.jpg?type=f287', 'https://phinf.pstatic.net/checkout/20201013_158/1602595719349AUVuI_JPEG/review-attachment-1a276e69-6ec3-4626-9ff4-3d33c52d5284.jpeg?type=f287']"
5,일단 키보드 디자인도 너무 고급스럽고 뭐 하나 빠진게 없네요 감사합니다,"['https://phinf.pstatic.net/checkout/20200908_252/1599576501594JxRDt_JPEG/review-attachment-552f0ca2-332a-4911-87b2-dfdba01481e7.jpeg?type=f287', 'https://phinf.pstatic.net/checkout/20200908_233/1599576502868szKy7_JPEG/review-attachment-95b09b2b-1777-427c-9ea4-d4a39e3c10d5.jpeg?type=f287']"
3,적축치고 싼 이유가 있긴하네여 키감이 그닥 좋진 않네요,['https://phinf.pstatic.net/checkout/20201125_286/160628511059824v9L_JPEG/review-attachment-eb79e241-ab8d-4de0-9eb3-4d18e393cd9b.jpeg?type=f287']
5,깔끔해서 좋네요 키감도 좋고 가성비아 조아요,['https://phinf.pstatic.net/checkout/20201119_202/1605783607815WLE5w_JPEG/review-attachment-1291686b-1ea4-4e90-95fe-0dc786ee35da.jpeg?type=f287']
5,깔끔하고 키감이 좋습니다. 만듦새가 좋아요. 무겁지않고 청량한 느낌?추천합니다.,['https://phinf.pstatic.net/checkout/20201126_259/16063975388383CM18_JPEG/review-attachment-2f6b606b-6ecd-40a5-be74-991faeab507a.jpeg?type=f287']
5,기계식 키보드 첨 사용하는데 키감 좋아요~,['https://phinf.pstatic.net/checkout/20201127_175/1606459199947dd0Fl_JPEG/review-attachment-7905fb76-199b-4644-bd94-f30560d2bac4.jpeg?type=f287']
5,"디자인도 이쁘고 깔끔해 성능도 좋아, 꾸미기도 좋고 컴퓨터방 보니 기분이 좋습니다^^",['https://phinf.pstatic.net/checkout/20201107_165/1604716321909dgt34_JPEG/review-attachment-e021813a-8db2-4d10-8ca4-6b22d2380d2e.jpeg?type=f287']
5,색이 진짜 너무이뻐요ㅠㅠ 그리고 텅빈소리?같은거 난다고해서 심한가 싶었는데 저는 전혀 거슬리지 않았어요! 무거운 기계식 키보드쓰다가 이키보드쓰니까 너무 가볍고 조와용 택배도 하루만에왔어요!! 잘쓰겠습니당😊,['https://phinf.pstatic.net/checkout/20201128_57/1606535571786BG5Vh_JPEG/review-attachment-a780ea10-0154-4d1a-8419-394ceec50a0a.jpeg?type=f287']
5,"많이 시끄럽긴하네요..
갈축정도가 좋은것같아요",['https://phinf.pstatic.net/checkout/20201121_31/16059231154117f9CV_JPEG/review-attachment-d3994a26-c34f-456d-836a-dc40879be347.jpeg?type=f287']
5,배송도 빠르고 상품 자체도 넘 예쁘고 좋아요,['https://shopping-phinf.pstatic.net/20201114_26/00d5e722-9211-46f9-8125-0636faf4a60b.jpg?type=f287']
5,배송은 하루만에 왔구요 상품도 모두 양품으로 잘 받았습니다 아주 만족합니다!,['https://phinf.pstatic.net/checkout/20201120_88/16058520443198rHfU_JPEG/review-attachment-bdac3984-22c8-4941-bcb6-ba01006cdfd9.jpeg?type=f287']
4,너무 이뻐요 ㅠㅠ 잘 쓸겠습니다!,"['https://phinf.pstatic.net/checkout/20200730_53/1596100332843IjsDF_JPEG/review-attachment-7150654c-80b8-49bd-b7c6-b579e1e6bfad.jpeg?type=f287', 'https://phinf.pstatic.net/checkout/20200730_234/1596100359141EpU54_JPEG/review-attachment-6b757073-de70-47e2-af83-556a4a04ae8d.jpeg?type=f287']"
5,좋아요 가성비 굿입니다,['https://phinf.pstatic.net/checkout/20201119_130/1605790055681I4kdU_JPEG/review-attachment-6d2f1187-08c3-4fa1-a22d-3750d5a17308.jpeg?type=f287']
5,키보드 백라이트 밝기나 동작 속도도 조절할 수 있고 다른거 둘째 치더라도 타건감이 너무 좋아요 :),['https://phinf.pstatic.net/checkout/20201118_207/1605637387312tFUwG_JPEG/review-attachment-fe9b6180-4fa9-42c9-b5f0-f2204ee688d1.jpeg?type=f287']
1,키가 하나 내려가있어서 교환을 했는데 교환해서 온 키보드가 또 다른 키가 하나 내려가있더라구요 ㅎㅎ,['https://phinf.pstatic.net/checkout/20201126_141/16063780749215uJga_JPEG/review-attachment-7357d75d-0237-49f4-948f-9a12b62b13d2.jpeg?type=f287']
5,"맘에드는걸사서 너무좋아요
너무예쁘네요
전에 너무싼거사서 1년도 안되서고장났는데
이건오래쓰길바래요",['https://phinf.pstatic.net/checkout/20201108_288/1604814006302yJuOj_JPEG/review-attachment-560e28c6-80e5-44be-ad27-61ef2b7af287.jpeg?type=f287']
5,"색감이 이쁘네요.
딸아이가 사달라해서 사줬는데 마음에 든다네요
다만 청축으로 주문했더니
자판 빠르게 칠때 저는 소리가 시끄럽더라구요 ㅋ
다행히 제가 쓸게 아니니까 이뻐서 만족합니다^^","['https://phinf.pstatic.net/checkout/20200617_89/1592372386539970Ls_JPEG/20200617_142933.jpg?type=f287', 'https://phinf.pstatic.net/checkout/20200617_44/1592372356354NdRg0_JPEG/20200617_142919.jpg?type=f287']"
3,아이가 잘 쓰고있습니다~,['https://phinf.pstatic.net/checkout/20201119_178/1605783596007HVt6N_JPEG/review-attachment-ee3bf317-1afd-4645-b54d-7ea0099e5c1e.jpeg?type=f287']
5,적축인데 소음이 조금 있는것같습니다. 그래도 튼튼합니다,['https://phinf.pstatic.net/checkout/20201115_197/1605447920875KIJFi_JPEG/review-attachment-ce5e7ade-2ffa-4d68-a6c6-6c01ba6cc47b.jpeg?type=f287']
5,가성비도 좋고 이번에 나온 신제품이라길래 바로 주문해봤습니다. 청축하고 led 처음 써보는데 파스텔톤?이라 너무 예쁘고 찰깍소리도 좋네요. 착한 가격에 득템했네요~~히힛,"['https://phinf.pstatic.net/checkout/20200615_290/1592181350746JYOlL_JPEG/B612_20200612_193035_045.jpg?type=f287', 'https://phinf.pstatic.net/checkout/20200615_35/1592181371112XlveB_JPEG/20200612_193537.jpg?type=f287']"
5,소리도 깔끔하고 작동도 잘되고 무엇보다 셀프 청소할수 있는것들도 포함되어있어서 구성이 너무 좋네요.,['https://phinf.pstatic.net/checkout/20201020_292/1603203508364reWR6_JPEG/review-attachment-44beed75-48eb-4170-b4ee-7508c64ba925.jpeg?type=f287']
5,"아이가 잘 사용하고 있어요~~^^
디자인도 이쁘고 편하대요~~♡",['https://phinf.pstatic.net/checkout/20201019_37/1603068556591cIwyj_JPEG/review-attachment-1ab14e7b-9a1c-4b98-84a0-3f3b8e4444d3.jpeg?type=f287']
5,배송 빠르고 성능 좋아요~~,['https://phinf.pstatic.net/checkout/20201019_286/1603081812879WCSra_PNG/review-attachment-9002ca6b-513b-412a-9b05-dc9a251ab00b.png?type=f287']
4,사용하기 정말좋아요,['https://phinf.pstatic.net/checkout/20201103_166/1604371788914yXwPj_JPEG/review-attachment-05610229-01e6-4fdd-81d2-ef2ce3e3b584.jpeg?type=f287']
5,"타자를 꾸준히 많이 치는 편이라 손가락이 저리고 아파서 샀어요
확실히 손가락에 피로가 덜해지네요 그리구 적축 사길 잘한것같아요",['https://phinf.pstatic.net/checkout/20201014_203/1602648870781udyg5_JPEG/review-attachment-955d8f08-e48b-4fd3-8638-2e3d9f7f4b92.jpeg?type=f287']
5,키보드의 문자들이 잘 보이고 타건감도 좋고 소리도 크니 게임할 때도 좋네요.,"['https://phinf.pstatic.net/checkout/20200612_129/1591971210450FP22v_JPEG/20200612_230957.jpg?type=f287', 'https://phinf.pstatic.net/checkout/20200612_91/1591971233171T9B4k_JPEG/20200612_225335.jpg?type=f287']"
5,예뻐서 입틀막했어요ㅠㅠ소리도 너무 좋아요 잘쓰겠습니당!,['https://phinf.pstatic.net/checkout/20201011_129/1602348924143fmv62_JPEG/review-attachment-d338165c-ae46-4ecb-b3ea-6ff4b9e58e59.jpeg?type=f287']
5,아직 사용은 안했지만 좋으네요 배송 빨라요,['https://phinf.pstatic.net/checkout/20201018_117/1602952363919vaFBl_JPEG/review-attachment-800aea08-9cf7-44fe-8f7d-ff09e3f114c4.jpeg?type=f287']
5,화이트 깔끔하고 조명꺼도 키가 잘보입니다,['https://phinf.pstatic.net/checkout/20201022_120/1603360322169eWcaM_JPEG/review-attachment-ff83109a-7798-43a7-87e1-06f6cc317e17.jpeg?type=f287']
5,예쁘고 튼튼합니다 키도 잘 눌리고 좋아요,['https://phinf.pstatic.net/checkout/20201017_11/1602872975520IN4fU_JPEG/review-attachment-95abc74e-bc5b-4649-b541-19c3a32d010f.jpeg?type=f287']
5,키보드 가성비 대비 좋습니다,['https://phinf.pstatic.net/checkout/20201007_29/1602045465031RuMul_JPEG/review-attachment-f969bd92-f82f-426a-9a73-da987fdd7dc6.jpeg?type=f287']
5,청축 소리 정말 좋네요^^,['https://phinf.pstatic.net/checkout/20201010_258/1602292117920Kn6iS_JPEG/review-attachment-5c9bd548-cfff-43f8-9c4f-e07f1e2a3022.jpeg?type=f287']
5,"맘에 들어요 ㅎㅎㅎ
잘 쓰겠습니다! 가성비 짱 ㅎㅎ",['https://phinf.pstatic.net/checkout/20201016_244/16028495234453O8D0_JPEG/review-attachment-0b09490b-5bc9-4389-8e4f-d9b516d7eb62.jpeg?type=f287']
5,깔끔하고 소음도적어 좋아요,['https://phinf.pstatic.net/checkout/20200928_132/1601220033834sFr7S_JPEG/review-attachment-5f8463b7-2ba3-4b6a-8444-5627bb06cd17.jpeg?type=f287']
5,흰색 적축 키보드 LED키보드 찾다가 사게됐는데 너무 예뻐요 화면상에 LED 색이 별로여서 걱정했는데 실물이 사진에 안 담기는거였음,"['https://phinf.pstatic.net/checkout/20200612_121/1591895199624PpEUY_JPEG/20200611_232111.jpg?type=f287', 'https://phinf.pstatic.net/checkout/20200612_255/1591895209702HzEe9_JPEG/20200611_232120.jpg?type=f287']"
5,"배송도 빠르고, 조용한걸 원해서 적축으로 구매했습니다. 만족스럽습니다.",['https://phinf.pstatic.net/checkout/20201007_76/1602053521685zF1ud_JPEG/review-attachment-3db0e321-edc0-4b4d-9045-029238c7a231.jpeg?type=f287']
5,터치감도 좋구 색깔도 화려해서 지루하지 않네요 쓰기 편하고 장기간 재택근무에 노트북 연결하니 딱 좋네요,['https://phinf.pstatic.net/checkout/20200928_161/1601257373820tbBgB_JPEG/review-attachment-f70485b8-c718-4852-9556-70c6bc25e09a.jpeg?type=f287']
5,조용하니 조으네요. 색감도 갠춘합니다.,['https://phinf.pstatic.net/checkout/20200927_92/1601215278997xP6bu_JPEG/review-attachment-126e86e1-d982-46f0-a8ad-175283230220.jpeg?type=f287']
5,가성비짱입니다 부담없이 쓰기 좋아요,['https://phinf.pstatic.net/checkout/20200926_46/1601102203058ikc7V_JPEG/review-attachment-75c70925-0afe-40f1-a54e-352706583a7b.jpeg?type=f287']
3,한번씩 키가 안먹힐때있어요ㅜㅜ,['https://phinf.pstatic.net/checkout/20200923_163/1600870394422LT37O_JPEG/review-attachment-52a52d6d-c8c8-4449-a525-350f85618f41.jpeg?type=f287']
5,좋아용~~~~~!!,['https://phinf.pstatic.net/checkout/20200925_296/1601045193362BSeYJ_JPEG/review-attachment-ebeedc92-08dd-4b7a-9afc-61420dda8435.jpeg?type=f287']
5,"화면도 큼직하고 선명해서 좋아요
다만 리뷰보고 알고는 있었지만
어두운화면이나
꺼둿을때는 반사가 되서 좀 아쉬워요
그외 다 만족합니다
수고하세요",['https://phinf.pstatic.net/checkout/20200907_157/1599458517420kNhQH_JPEG/review-attachment-64a7b487-d70e-417b-8c6d-fa132ff6a09e.jpeg?type=f287']
5,"소리 너무 좋아요 딸깍딸깍 이 맛에 청축 씁니다
나는야 저세상 청축빌런",['https://phinf.pstatic.net/checkout/20200922_41/1600746601652F9brY_JPEG/review-attachment-7d210d2a-950f-4c89-bb59-e106f11c131a.jpeg?type=f287']
5,"우선 빨리 도착해서 너무 좋았고요, 키보드가 생각보다 너무 부드럽고 깔끔해서 좋았습니다! 적축이라 그런지 타건도 그렇게 시끄럽지 않고 마음에 들었어요!",['https://phinf.pstatic.net/checkout/20200901_179/1598923516178cHODX_JPEG/review-attachment-575badf5-30f9-4e51-851b-9183f1ff22d0.jpeg?type=f287']
3,사실 전에 같은곳에서 샀는데 한달만에 키보드가 잘 안눌려서 다시 구매했어요. 저렴합니다,['https://phinf.pstatic.net/checkout/20200917_115/1600324841273v8TrK_JPEG/review-attachment-281c6822-f8b8-4674-b094-7e86917077b2.jpeg?type=f287']
5,전체적으로 깔끔하고 좋아요 사진에는 안 나왔지만 LED도 아주 예쁩니다. 살짝 기스 난 게 오긴 했지만 크게 티 안 나서 쓰고 있습니다.,['https://phinf.pstatic.net/checkout/20200908_83/1599536948510p26Jv_JPEG/review-attachment-2d1296d2-ecd1-4d69-a8aa-4b1f83980ab1.jpeg?type=f287']
3,적축시켰는데 탁탁거리능소리는 어쩔수없는듯..배송은빨라요,['https://phinf.pstatic.net/checkout/20200911_300/1599830648904GTOKm_JPEG/review-attachment-22f687d7-9cb6-4fa0-b24b-5547f8525042.jpeg?type=f287']
4,적축 처음써보는데 괜찮네요 생각보다 타건음이 커요,['https://phinf.pstatic.net/checkout/20200916_36/1600234927918wGwdp_JPEG/review-attachment-38357a40-b332-421f-92af-c2398498fb67.jpeg?type=f287']
5,"소음이 적어서 만족합니다.
타이핑감도 좋아요.",['https://phinf.pstatic.net/checkout/20200906_128/1599320836540YNOsM_JPEG/review-attachment-a3ddb9f7-fb50-474a-afec-8aea2acf7869.jpeg?type=f287']
5,"아이가 넘 좋아하네요~~
색상도 참 이뻐요~~^^",['https://phinf.pstatic.net/checkout/20200915_293/16001329746219BxvI_JPEG/review-attachment-b9eebb62-4620-4956-b6bf-e01ef7b5b7b7.jpeg?type=f287']
5,드라이버 설치도 따로 필요없고 잘 작동됨,['https://phinf.pstatic.net/checkout/20200921_164/1600656013853UDh3e_JPEG/review-attachment-e1682b97-b78e-44f0-ac39-4a84828b0dcb.jpeg?type=f287']
5,배송빠르고 제품도 좋네요,['https://phinf.pstatic.net/checkout/20200915_85/1600165157528KUVMD_JPEG/review-attachment-fcadffd6-a052-4214-9793-99e51e32e404.jpeg?type=f287']
5,"선물로 샀는데, 저는 청축을 사용하는데 역시 갈축이 조용하고 타감도 상당히 좋습니다.!",['https://phinf.pstatic.net/checkout/20200917_39/16003353848088l83S_JPEG/review-attachment-12cfb859-e329-48dd-b5f8-33107b273fd0.jpeg?type=f287']
5,배송도 빠르고 예뽀요 성능은 잘 모르겟지만ㅎㅎ,['https://phinf.pstatic.net/checkout/20200919_273/1600505957338WGd3w_JPEG/review-attachment-137e9919-0505-46bb-b091-298387e04b24.jpeg?type=f287']
5,사무실에서 사용하기 위해 구매했습니다. 나쁘지 않네요,['https://phinf.pstatic.net/checkout/20200903_32/1599104248935WOvYk_JPEG/review-attachment-7c93ef15-e92c-4327-9e8e-340161448a4e.jpeg?type=f287']
5,이가격에 이퀄리티 좋아요 디자인도 이뻐요,['https://phinf.pstatic.net/checkout/20200829_213/1598708412393DkgqN_JPEG/review-attachment-5e8e1a64-75c6-41f6-aaaf-69ad7f9a4ae2.jpeg?type=f287']
5,아직 설치는 하지 않았지만 기대됩니다,['https://phinf.pstatic.net/checkout/20200901_214/1598936276548cLMBg_JPEG/review-attachment-a1e85bc8-e01f-4db3-bfa9-85de541ca33f.jpeg?type=f287']
5,손가락에 힘이 많이 안들어가고 너무좋다고하네요. 아들이 게임이 더 잘된다고 만족스럽다고해요.,['https://phinf.pstatic.net/checkout/20200908_45/1599565604261bNXpH_JPEG/review-attachment-b76c2a96-6e15-4260-9008-e23ce7dce606.jpeg?type=f287']
5,생각보다 더 이쁘고 마음에 듭니다.,['https://phinf.pstatic.net/checkout/20200905_22/1599282275864vQ6nT_JPEG/review-attachment-cf4e7212-399b-4444-b6ff-d5cd1c1060f5.jpeg?type=f287']
5,적축이라 소음도 쏘쏘,['https://phinf.pstatic.net/checkout/20200909_212/15996202867851JncQ_JPEG/review-attachment-4b8a86a7-73ab-435d-90d3-67faf153584a.jpeg?type=f287']
5,"키감은 나쁘지 않구요.
일단 소음이 적어서 좋습니다 ㅎㅎㅎ",['https://phinf.pstatic.net/checkout/20200817_134/1597675145811SFgeM_JPEG/review-attachment-cede8e84-de91-4a3b-909f-36a7c05facd9.jpeg?type=f287']
5,"우와 이가격에..이 퀄리티라니 너무 짱이에요 ㅠㅠ 그리고 배송포장하시는거 동영상으로 보내주시는거 완존 신박했어요 짱,,,많이파세여!",['https://phinf.pstatic.net/checkout/20200906_197/1599383481617TzgvL_JPEG/review-attachment-cf5b6dc3-7cb1-432a-81c0-a76030026afd.jpeg?type=f287']
4,"메인키보드 고장으로 AS보내놓고 대충쓸려고 샀는데
메인키보드 안쓰고 이거쓰고있네요 ㅋ",['https://phinf.pstatic.net/checkout/20200831_210/1598859728263ouuv7_JPEG/review-attachment-70a2e010-756b-49e8-8bd4-c2ecfcec8cb7.jpeg?type=f287']
4,사진 그대로에요~ 패드는 너무 냄새나서 바로 사용 못했어요!,['https://phinf.pstatic.net/checkout/20200823_114/1598153756645IbUMN_JPEG/review-attachment-191934f1-903a-4d78-b0cf-83252f9ae809.jpeg?type=f287']
5,믿고 쓰는 콕스 키보드 입니다 ㅎㅎ 가성비 좋아요,['https://phinf.pstatic.net/checkout/20200812_234/1597239320113Onk0X_JPEG/review-attachment-e457b6de-058c-4830-a811-6aad8025b466.jpeg?type=f287']
5,깔끔하고 잘눌립니다. 이만한가격에 아주 좋아요,['https://phinf.pstatic.net/checkout/20200826_47/1598428948808vjtyb_JPEG/review-attachment-14697a1e-2042-4183-81dc-fd62884f349e.jpeg?type=f287']
5,배송도 빨르고 언제나 구입하는곳입니다,['https://phinf.pstatic.net/checkout/20200829_7/1598711308281rqKta_JPEG/review-attachment-02fb5e5e-04b9-49b5-a8ce-e4bd6f075346.jpeg?type=f287']
