star_point,comment,photo
5,"일단 디자인이 너무 예쁘네요.
작업하려고 샀는데 제 메인 키보드가 될것 같습니다.
GHUB연동해서 마우스와 LED 이펙트를 공유할수도 있고 키에 기능을 할당할수도 있네요.
키보드 우측상단에 있는 볼륨조절휠은 처음 돌려봤을때 너무 무게감이 없어서 많이 아쉬웠습니다.
소음을 싫어해서 적축을 구매했는데 타건감또한 나쁘지 않았습니다.
디자인 측면에서는 영어만 LED가 들어오는게 훨씬 깔끔해 보였어요. 다만 제가 가끔 한글자판을 보고쳐서...
몇분간 사용하지 않을때는 자동적으로 LED가 꺼지는데 이게 유선일때도 적용되네요. 유선연결일때는 계속 켜져있었으면 좋겠어요.
USB리시버를 키보드에 장착할수 있는 공간이 있어서 . 빼먹더라도 블루투스연결을 지원해서 대용으로 사용해도 되고 두개다 연결해서 왔다갔다 사용도 가능할것 같습니다만 아직 해보지는 않았습니다.
충전할때나 완충됬을때 알려주는 초록색 LED가 조금 신경쓰이기는 합니다.
배송도 빨랐고 커다란 에어캡에 꼼꼼히 포장해주셔서 박스도 상처하나 없었습니다.
전체적으로 상당히 만족합니다. 다음달에 하나 더 구매해서 그때는 업무용으로 사용하겠습니다.","['https://phinf.pstatic.net/checkout/20200625_219/15930843010778Xx1C_JPEG/20200625_200326_806.jpg?type=f287', 'https://phinf.pstatic.net/checkout/20200625_206/1593084315218G9yzI_JPEG/20200625_201242_930.jpg?type=f287']"
4,비싼것빼고 마음에 드는 제품. 원래 흰색 쓰고있었는데 세일한다고 하길래 회사용으로 하나 더 구매했습니다~ 근데 흰색이랑 버튼 감촉이 다르네요. 검은색은 더 미끌미끌한 느낌입니다. 리니어축으로했는데 마음에 듭니다. 사은품 보온병은 안에 이상한 사인펜으로 그어진 자국이 있어서 못 쓸거같아요 교환되는지 궁금하네요,"['https://shopping-phinf.pstatic.net/20201121_10/01aaed91-8a6a-4bf9-bf2a-3ef498fc3b0c.jpg?type=f287', 'https://shopping-phinf.pstatic.net/20201121_25/b2cd0d82-8bb1-4818-aff0-c8f757ed2a70.jpg?type=f287', 'https://shopping-phinf.pstatic.net/20201121_16/c95213ec-b354-43a0-9c27-af7e6b88c964.jpg?type=f287']"
5,잘 받아서 며칠 사용해보니 무선임에도 끊김없이 입력되네요. 처음엔 한영키 눌러도 작동을 안하고 alt키 본연기능만 하길래 제품고장인줄 착각했습니다. 윈도우10에서 106키를 101키로 바꿔야지 한영키 제대로 작동합니다. 텀블러 사은품 잘 받았습니다.,"['https://shopping-phinf.pstatic.net/20201124_20/46a14f31-a923-488d-8077-8188aea17674.jpg?type=f287', 'https://shopping-phinf.pstatic.net/20201124_7/53818562-ffce-4dbc-989c-844a98107a1b.jpg?type=f287', 'https://shopping-phinf.pstatic.net/20201124_0/e806fbd6-be8d-4c6b-b319-a328c889722f.jpg?type=f287']"
5,"현재 무선 게이밍키보드의 수요는 정말 많지만 다양한 모델이 존재하지 않는다고 생각해요
많은 분들이 무선이면서 usb 수신되어 게이밍이되고, 텐키리스인 제품을 찾았을거라 생각되는데요! 이제품은 확실히 그 니즈를 해결해주는 것같아요. 진짜 예쁘고 사은품으로 온 커버도 너무 이쁘고, 다만 키감에 경우 로우프로파일+리니어 조합은 호불호가 많이 갈릴것같아요. 거의 멤브레인에 가까운 느낌이 들었달까요. 대신 통울림도 없고 타이핑하면 뭔가 창밖에 비내리는 소리 나는 거 같아 좋고 진짜 조용하더라구요. 가격만 좀 딱20만원이엇으면 좋앗을것같네요. 배송은 2일만에 왔어요 그저께 늦은 밤에 시켯는데 오늘왓어요 개빨라용","['https://phinf.pstatic.net/checkout/20200703_136/1593766850256S6vnp_JPEG/review-attachment-dbf902a3-49f6-463b-bd5f-c1a8f787165e.jpeg?type=f287', 'https://phinf.pstatic.net/checkout/20200703_118/1593766866777D8NTr_JPEG/review-attachment-c4237df8-63a2-47ee-98ec-e6348072a5f2.jpeg?type=f287']"
5,키감이 촉촉하고 좋네요. 지프로쓰다가 쓰니까 키가 낮아서 적응이잘안됏는데초반엔 써보니 너무좋네요 무선인거랑 라이팅과.. 먼지 보호용 뚜껑만있으면좋겠어요. 그리고 키꽂는부분이 작아서 키캡이 다가려줘서 먼지털때 키캡뽑고닦기만하면될거같애서 괜춘하네요,"['https://phinf.pstatic.net/checkout/20200717_171/1594946706599Nc22a_JPEG/review-attachment-325294e3-f3c3-4d33-abf1-27336b548e01.jpeg?type=f287', 'https://phinf.pstatic.net/checkout/20200717_181/15949467175623cbPh_JPEG/review-attachment-2f1d03cd-5f99-4f7f-8a03-8d6e1e9df32b.jpeg?type=f287', 'https://phinf.pstatic.net/checkout/20200717_75/1594946726588Fx9sn_JPEG/review-attachment-012a8f75-82f9-44d1-852f-6b22d776c31f.jpeg?type=f287']"
5,"g913의 단점인 매크로 버튼을 깔끔하게 해결한 제품!!!
원하는 그대로 나와서 만족합니다.
볼륨 버튼을 그대로 유지해서 편리성도 그대로 왔네요
진작에 나왔어야할 제품입니다
블루투스 전환도 빠르게 되고요 무선 리시버는 여전히
빠릿빠릿합니다.
다만 아쉬운것은 충전단자를 usb c타입을 적용해줬으면
더 좋았을것 같습니다
개인적으로 충전단자 위치도 왼쪽보다는 오른쪽에 있었으면 좋았늘 텐데 그것은 개인차이니까 단점이라고 볼
수는 없겠네요
사무용 겸용으로 사용하셨던 분이라면 텐키리스가 어색할텐데 게임용으로 사용하면 이것도 편리성이 최고입니다. 마우스와의 거리가 짧아지기 때문에 최상의 편리성을 제공해줍니다
미디어 버튼도 딱 있을것만 있어서 군더더기 없고 위치도 사용하기 편리한 위치에 있어요. 텐키리스의 장점인 크기 덕분에 책상이 깨끗해졌습니다 개인적으로 로지텍 제품만 사용하는데 기존의 913에서 불편했던 내용이 사라져 앞으로도 계속 로지텍 제품만 쓸것 같네요
913에 조금 실망하셨던 분이라면 반드시 선택해야 합니다",[]
5,"K70 로우프로파일 1년 6개월쓰다
겜용 텐키리스 하나 구매할까 싶었는데
마침 출시해서 구매하게 됐어요
10시간 정도 쭉 사용후기
키캡 표면 촉감이 좀 신기해요
분명 ABS인데 G pro 무선 표면 만지는 느낌이고 기름기가 거의 안묻네요?
커세어 제품은 만지자마자 조금씩 묻어났는데
그리고 탭키,캡스락,\(￦)키 밑에 에 스테빌이 있어요","['https://phinf.pstatic.net/checkout/20200612_99/1591954995231WIv23_JPEG/20200612_184222.jpg?type=f287', 'https://phinf.pstatic.net/checkout/20200612_243/1591956513621W8ilC_JPEG/20200612_190809.jpg?type=f287']"
5,"엌 여기도쓸수있군
마찬가지로 너무 영롱하고 제가원하는기능 다들어갔네요 마우스도좀 충전식으로 무선충전패드지원하고 블루투스전환이 상단에 존재하는거 나왔으면 30만원이어도 바로지를듯
이 키보드는 로지텍 로고가 빛나는걸보고 가슴이 웅장해지다못해 남자인데도불구하고 c컵이되었습니다",['https://phinf.pstatic.net/checkout/20201031_237/1604138939052I0pG0_JPEG/review-attachment-2164fe19-67f1-4c26-8c6f-82b8d65db0e0.jpeg?type=f287']
4,다 좋은데 키별로 바인딩은 지원안하네요 한두푼짜리도 아닌데 FN키 조합으로 기능지정도 못하고... 오직 상단 펑션키 12개만 커스텀 가능하고 독보적인 무선 안정성때문에 사긴했지만 거품이 많이낀건 부정 못하겠네요 하지만 스위치 튜닝은 게임용으로 역대최고네요. 온갖 축을 다 써봤지만 압력도 적당하고 도달거리가 가장짧아서 직관적이고 연타하기 좋고 볼륨조절하는건 걸리는게 없이 돌아가서 딱딱 정확하게는 못하지만 편하긴하네요. 루프도 고급스럽고 만족합니다.,['https://phinf.pstatic.net/checkout.phinf/20200703_19/1593745030981JXdAW_JPEG/bcbeb71f9884e49033ad41923cc8bca9.jpeg?type=f287']
5,영롱합니다.. 집에서 작동해보니 작동도 잘되구요 .. 무겁지는 않은데 안정감있고 갈축 처음써보는데 키감도 적응하니 나쁘지않네요. 아는사람이 사서 좋다고 추천해줘서 산건데 예전에는 루프덮개 주는곳도 있었다던데 .. 지금은 다들 안주나봅니다 아무튼 제품은 만족입니다.,['https://phinf.pstatic.net/checkout/20201007_207/1602050235601fK9U9_JPEG/review-attachment-17395094-fdb1-4d2b-a093-52f19b22a8ee.jpeg?type=f287']
5,"일단 G913 풀배열 모델을 쓰고 있었는데, 옆의 매크로 키 때문에 너무 불편해서 중고로 처분하고 G913 TKL 모델을 구입하였습니다.

곧 화이트 모델도 나온다고 했지만, 그냥 빨리 써보고 싶어서 Clicky 제품으로 주문했습니다.

일단 청축 계열의 걸림을 좋아하시는 분들은 무조건 Clicky 입니다. 풀배열 일 때 Tactile 썼는데, 확실히 쫀득거리는 키감은 Clicky 가 더 좋습니다. 그리고 일반 기계식 청축 (레이저의 녹축) 처럼 키압이 높지 않아서 손에 힘이 크게 들어가지 않습니다.

Tactile 타건하다가 Clicky 타건하면 ""어, 좀 무겁네"" 라고 느껴질 수 있는데 이후에 찾아오는 키감에서 모든걸 엎어버립니다.

Linear 는 안써봐서 모르겠는데, 저의 키 타입중에서 걸림이 없는 키감들을 별로 선호하지 않아서, 이번 고려대상에서 제외되었구요.

G913 풀배열에서는 상판 휨 문제가 있었는데, 이번 TKL 모델에서는 가로폭이 상대적으로 좁아서 그런지 상판 휨 문제는 없고,
키들이 흔들리는 느낌을 가끔씩 받긴 합니다.

그래도, 최고의 제품인 것 같습니다. 무선/키감/스피드 등등",[]
5,"비싼 값때문에 망설였는데, 받고 나니 참 좋네요. 일단, 상당히 고급스럽습니다. 로우프로파일 키캡이라 키감도 상당히 편하고, 구름타법이 가능하며, 게임이용시에도 손색이 없는 아주 잘빠진 키보드입니다. 유무선의 경계가 없을만큼 무선사용시에도 초스피드를 발휘해주네요. 굿!","['https://phinf.pstatic.net/checkout/20200704_88/1593810650254NXhPY_JPEG/review-attachment-b66aa2e2-20e6-4e99-92c8-63b4067c160c.jpeg?type=f287', 'https://phinf.pstatic.net/checkout/20200704_118/1593810650525AzFcx_JPEG/review-attachment-4ddc54da-8aab-4c24-83e0-3d2347af6a76.jpeg?type=f287']"
5,"배송이 매우빨라서 상당히 좋았습니다.
제품도 일단 박스 외관은 손상된곳 없이 안전하게 잘 도착했는데
기본 택배박스를 열어보니 30만원 상당의 키보드임에도 불구하고 뽁뽁이 하나 없이 그냥 제품 박스만 덩그러니 있더락요. 이부분은 조금 개선 되었으면 합니다. 단돈 몇천원짜리 제품도 기본적으로 에어캡은 포장해 주시는데....다행이 박스 외관의 찍힘이나 큰 상처는 없어서 다행인듯합니다.",['https://phinf.pstatic.net/checkout/20201019_297/1603105347351bhG7Q_JPEG/review-attachment-1b3e9bbc-403f-49b8-b1c3-046c364822a8.jpeg?type=f287']
5,"일단 아주 빠르게 배송 되어 좋았습니다.
에어캡으로 잘 포장되어 안전하게 배송 되었으며,
박스도 흠집없는 깔끔한 새 제품입니다.

와이파이 동글을 꽃으면 바로 사용이 가능한데
일반적인 청축이 딸깍 거린다면 클릭키는 짤깍 거리는
약간 타건음이 적습니다.

프로파일이 낮아서 익숙해지는데는 시간이 좀 걸릴것 같아요.

예전에는 키보드 루프를 사은품으로 주었다는데, 이젠 사은품이 없어 조금 아쉽습니다.

아무튼 아주 괜찮은 제품입니다. 꼭 경험해 보시길.. )",['https://shopping-phinf.pstatic.net/20201104_14/1c034748-033a-4604-a375-a3389772d690.jpg?type=f287']
4,풀사이즈는 너무 커서 나오면 바로 구매 하려고 기다리는 중에 출시 소식을 듣고 조금 비싸긴 하지만 바로 구매 했습니다 지프로 마우스 파워 플레이까지 풀셋 완성 입니다~——; 키감 쫀득하고 맘에 듭니다 G hub는 반드시 업데이트해야 인식합니다,"['https://phinf.pstatic.net/checkout/20200611_54/1591882292423jbwAQ_JPEG/129822C6-C1F5-471B-BB56-60C9E20DE00A.jpeg?type=f287', 'https://phinf.pstatic.net/checkout/20200611_172/1591882292496uNflA_JPEG/074E6CD3-15BF-4634-B367-6B14B24CA6E6.jpeg?type=f287']"
5,소리도 생각보다 안커요!! 라이트스피드랑 블루투스 전환 사이에 속도도 빠르고 배터리는 밝기등 조절하면 공식 시간보다 오래가는거 같고 키가 흔들린다는 문제는 원래쓰던 키보드도 흔들거려서 신경도 안쓰이네여 ㅋㅋ티비에 연결해서 쓸려고 샀는데 본컴에서 쓸까 고민중이에여 ㅋㅋ,"['https://phinf.pstatic.net/checkout/20200630_259/1593473556057qvmMw_JPEG/1.jpg?type=f287', 'https://phinf.pstatic.net/checkout/20200630_127/1593473556169ubPuf_JPEG/2.jpg?type=f287']"
4,"보고있어도 그저 아름다운 키보드. 라이트스피드와 블루수트기능은 선을 연결한 것과 전혀 다를 것 없이 연결되고 빠릅니다. 망설이시는 분들은 적극추천드리고, 리니어축은 타건하는 맛도 있지만, 조용하기에 카페에서도 무난하게 사용하지 않을까 생각됩니다. 만족감이 큰 제품입니다.",['https://phinf.pstatic.net/checkout/20200708_184/15941798353078f2zP_JPEG/review-attachment-b973d911-ec6b-4a34-8511-dd3041118f02.jpeg?type=f287']
5,"맥북이랑 애플키보드를 좋아하는지라 로우파일 기계식을 찾아헤맸는데 딱 맞는걸 찾았어요. 업무용으로도 텐키를 안 쓰는지라 텐키리스가 딱이네요. 사무실에서는 안 쓰고 집에서 쓰는 용도에요. 게임용 제품이라, 사무실에서는 소음이 아무래도 거슬리겠죠. 맥이랑 완전 호환되지는 않지만 윈도우도 쓰고 있고, 타건감때문에 정했습니다.",['https://phinf.pstatic.net/checkout/20200706_130/1594028642004AwuY8_JPEG/review-attachment-5d336c98-b58d-4ea9-88b1-199d77664eb7.jpeg?type=f287']
5,눈여겨보던 키보드인데 쿠폰할인율이 높아서 구입하게 되었습니다 매장에서 쳐보긴했는데 생각보다는 키압이 좀 있고 빡빡한 느낌? 게임할땐 나쁘지않지만 장시간 타자칠때는 다른키보드 쓰게됨 컴팩트하고 무선시간이 길어서 서브 키보드로 아주 요긴함,[]
5,"상품 배송과정에 해프닝이 있어서 기분이 좋지 않았지만 재품은 만족하고 있습니다. 다만 제품 포장상태가 너무 불량이어서 불만족스럽네요.. 해당 키보드가 싼 제품도 아닌데 큰 박스에 그 흔한 ??이나, 에어캡도 없이 그냥 키보드 상자에 비닐하나만 씌어서 보내주시다니 그 오랜 배송기간 동안 상자가 얼마나 던져지고 흔들릴텐데... 그런 부분을 신견 안 써주시고 파는데만 급급해 보이는 기분이들어서 아쉽네요",[]
5,"오프라인 매장에서 한번 두드려보고 그 느낌을 잊지못해서 구매했습니다. 워낙 적축, 무접점 이런 제품을 사용하다보니 청축의 소리가 너무 거슬렸는데 이제품은 청축과 다른 차원의 키감입니다. 너무 좋아서 계속 두드리게되요. 전용 키보드 루프도 플라스틱 재질(?)이라 고급스럽습니다.",['https://phinf.pstatic.net/checkout/20200712_260/1594496951148tg0L3_JPEG/review-attachment-933ec219-c7ad-442f-bff6-290c0bfa00b8.jpeg?type=f287']
5,무선 기계식키보드를 진짜 오래 기다렸는데 이제 좀 쓸만한게 나온 것 같네요. 클릭을 샀는데 소음 그렇게 안 크구요 펜타그래프 타입방식에서 좀 더 깊게 들어가고 약한 청축 느낌이 살짝 걸리는 느낌입니다. 구매하실 때 참고하세요,['https://phinf.pstatic.net/checkout/20200613_297/15920164311337Tr7y_JPEG/3322F361-4A08-4895-8AD6-B3DD0EF9D0F1.jpeg?type=f287']
5,리니어. 적축이라고 하네요. 엄청 조용하고 부드러워요. 주변에 시끄럽게 소음을 주지 않아서 좋아요. 하루 써보니 진작 살걸 하는 생각이 바로 듭니다. 정말 편해요. 쓸데없이 크지 않아 책상이 정돈이 되는 느낌이에요. 서비스로 아크릴 커버도 주셨어요. 아주 좋네요. 먼지가 쌓이지 않을듯해요. 배송도 빠르고 포장도 꼼꼼하게 잘 되었어요.,[]
5,"일단 아주 빠르게 배송 되어 좋았습니다.
에어캡으로 잘 포장되어 안전하게 배송 되었으며,
박스도 흠집없는 깔끔한 새 제품입니다.

와이파이 동글을 꽃으면 바로 사용이 가능한데
일반적인 청축이 딸깍 거린다면 클릭키는 짤깍 거리는
약간 타건음이 적습니다.

프로파일이 낮아서 익숙해지는데는 시간이 좀 걸릴것 같아요.

예전에는 키보드 루프를 사은품으로 주었다는데, 이젠 사은품이 없어 조금 아쉽습니다.

아무튼 아주 괜찮은 제품입니다. 꼭 경험해 보시길.. :)",[]
5,마우스랑 키보드 다 같이 무선으로 바꿧는데 무선을 처음 사용해보아서 처음에 어떻게 사용하는지 헷갈렸어요ㅠㅠㅠ 키보드 안에 동봉된 usb를 먼저 꽂고 작은 잭으로 키보드 옆면 꽂고 반대편 usb는 본체에 꽂으면 충전이 되고 충전이 다됐으면 키보드 usb를 본체에다 꽂으면 되더라고요ㅎㅎ 그리고 치는 맛이 좀 있네요 비싼 감이 있지만,['https://phinf.pstatic.net/checkout/20201030_138/1604055163727X2AIy_JPEG/review-attachment-1fa9707b-ed77-48d6-93ea-3492fa9fc39d.jpeg?type=f287']
2,"제품은 좋네요 이상도 없구요.
근데 2,3만원짜리 싸구려 제품구매한것도 아닌데 포장상태 너무 심한거 아닌가요? 제품이 나올정돈데 정말 포장에서 기분 확 상하네요. 이상태로 왔습니다.
다른 분들껀 확실히 포장해서 보내주세요

제품은 정말 좋습니다 배송도 빨라요","['https://phinf.pstatic.net/checkout/20200701_286/1593592365877tbIz7_JPEG/E719AA41-75EA-4716-BDEB-250B6170E845.jpeg?type=f287', 'https://phinf.pstatic.net/checkout/20200701_85/15935923775683OLlx_JPEG/8500FA75-55E3-4A08-A5EE-FA42ADE96120.jpeg?type=f287']"
4,"일단 무선인데 잘되서 좋아요!
다만, 생각했던것보다 키감이 조금 애매하네요.
그리고 갈축으로 삿는데, 상대적으로 그전에 쓰던 키보드들 보다 확실히 소리가 덜납니다.
테x로 엑x칼리x나, deck Hxxx 갈축, 레오X드 XX, 필X 마제XX치 갈축.
타격 소리가 조금 덜찰지네요",[]
5,유선 기계식 키보드만 사용하다가 무선으로 바꾸니 동선이 아주 편해졌습니다. 타건감도 조용조용하고 입력 압이 크지않아도 잘 눌리면서 오타도 적네요 손이 마른편이라 부드러운 타건감이 마음에 쏙듭니다. 가격은 비싼만큼 비싼값 하네요 많이파헤요 ~,[]
5,"기존 키보드도 멀쩡한데 무선병 걸려서 고민하고 구매했어요
키보드도 조용하니 좋네요
다만 기존꺼에서 바뀌니 손이 아직 적응이 안되서 어색하네요
쓰다보면 익숙해지겠죠
고급스럽고 연결 잘됨
루프도 탄탄한 플라스틱이라 고급스러웅",[]
4,"텐키리스라서 장소가 별로 차지 않 좋습니다.

블루투스로 연결했는데 딜레이는 별로 없는것 같습니다.
물론 게임할때는 다를 수도 있지만요.

로머 택타일 키감은 체리 갈축하고는 좀 많이 다른것 같습니다.
. 사무실에서도 사용하능한
수준인것 같습니다. 배터리는 5핀 단자로 충전합니다.
배터리 시간은 그럭저럭 쓸만한 것 같습니다.",[]
5,"제품 잘 왔구요. 청축 갈축만 썼었고 적축은 첨인데 키감도 쫀득쫀득하고 조용하고 매우잘눌리니 좋습니다 ㅋㅋ 다만 GHUB 버그땜에 GHUB키면 F1부터 F12까지 먹질않네요 키가 ㅋㅋㅋ끄면 정상작동합니다.
키보드 루프도 꽤나 야무진거로 주시네요 ㅋㅋ 잘쓸게요",['https://phinf.pstatic.net/checkout/20200718_198/1595022722220jNuVu_JPEG/review-attachment-6d5cbed8-08e3-48c7-ad9b-474f5aa8004b.jpeg?type=f287']
5,"조카 선물로 주문했어요.
겜알못 이모는 배송 빠르고 본체 색상 예쁘고 타자감 좋아 만족! 기대하지 않았던 T1텀블러와 귀여운 마우스 모양 USB 덕에 T1 팬인 조카는 완전 신났네요. ^^","['https://phinf.pstatic.net/image.nmv/shopnbuyer_2020_08_08_0/dd478aa9-d947-11ea-b562-a0369ff968b0_03.jpg?type=f287', 'https://phinf.pstatic.net/checkout/20200808_146/1596871353775A5Q4D_JPEG/review-attachment-035c19c7-aedd-46da-aae7-e6726bd26070.jpeg?type=f287', 'https://phinf.pstatic.net/checkout/20200808_32/1596871398883onGQ0_JPEG/review-attachment-43fa0dba-f339-41fe-965c-c23b1a777489.jpeg?type=f287', 'https://phinf.pstatic.net/checkout/20200808_107/1596871377886L8kMX_JPEG/review-attachment-e189a07b-e0b7-47c1-9e6c-a3ba28c8a637.jpeg?type=f287', 'https://phinf.pstatic.net/checkout/20200808_64/1596871386565YdoIB_JPEG/review-attachment-6935f9f6-010e-4950-8706-3713a8d01274.jpeg?type=f287']"
5,잘 받았습니다. 정말 기대이상이네요. 요즘 코로나로 인해 물량이 더욱 밀려서 배송이 +1 되긴 하지만 그건 어쩔수 없습니다. 상품이 기다린 세월을 다 보장해 주니까요! :D,"['https://phinf.pstatic.net/checkout/20200615_26/1592204729544pNRac_JPEG/P20200615_120641967_95933045-BF64-4C1A-A22D-A2D5007EF35B.JPG?type=f287', 'https://phinf.pstatic.net/checkout/20200615_229/15922047297112o31v_JPEG/P20200615_121407577_863B7660-870F-40F6-A207-BD5A7573BFC8.JPG?type=f287', 'https://phinf.pstatic.net/checkout/20200615_297/1592204729751Nrral_JPEG/P20200615_160020767_53C47F7A-CE8D-435D-8A3D-DBC2BC52FE15.JPG?type=f287', 'https://phinf.pstatic.net/checkout/20200615_47/15922047295745QW06_JPEG/P20200615_120830602_91474E5A-B450-4FF0-98ED-41F93B63DFD6.JPG?type=f287', 'https://phinf.pstatic.net/checkout/20200615_278/15922047296375zEkh_JPEG/P20200615_120855542_9481D243-6D19-4D82-9B30-325CBF9177B5.JPG?type=f287']"
5,키감과 디자인 성능 모두 아주 만족스럽숩니다,"['https://phinf.pstatic.net/checkout/20200816_27/1597560967909euu0i_JPEG/review-attachment-cb719de4-728b-4728-8ba0-c38e16860819.jpeg?type=f287', 'https://phinf.pstatic.net/checkout/20200816_142/1597560973270HgfAB_JPEG/review-attachment-3d9da9ca-1d4e-4bb3-9442-6204f6db588a.jpeg?type=f287', 'https://phinf.pstatic.net/checkout/20200816_296/1597560977273yY98h_JPEG/review-attachment-82ff8fd0-9b7c-43a3-9f5b-4ce532bf0797.jpeg?type=f287']"
5,"되게 깔끔하고
913텐키 나오면사려고했는데 딱 나와주었네요
그리구 서비스로 문화상품권 감사합니다","['https://phinf.pstatic.net/checkout/20200613_28/15920471517496UFLT_JPEG/20200612_170543.jpg?type=f287', 'https://phinf.pstatic.net/checkout/20200613_150/1592047178044UqzQr_JPEG/20200612_170526.jpg?type=f287', 'https://phinf.pstatic.net/checkout/20200613_129/1592047183642XaUBX_JPEG/20200612_170348.jpg?type=f287']"
5,키보드가 낮아서 적응이 좀 안 되었는데 쓰다보니 정말 매력있는 키보드네요. 업무용으로는 비추천이지만 게임용으로는 너무 추천합니다.,"['https://phinf.pstatic.net/checkout/20200617_130/1592405977661JAmDP_JPEG/KakaoTalk_20200617_231813931.jpg?type=f287', 'https://phinf.pstatic.net/checkout/20200617_45/1592405977902zNehB_JPEG/KakaoTalk_20200617_231813931_01.jpg?type=f287', 'https://phinf.pstatic.net/checkout/20200617_251/1592405978016Fo4Wj_JPEG/KakaoTalk_20200617_235738694.jpg?type=f287']"
5,"추석 명절기간 임에도 배송 빨라서

좋았고 물론 키보드도 마음에 드네요 ㅎ","['https://phinf.pstatic.net/checkout/20200924_31/1600929946035p2wha_JPEG/review-attachment-a555d80b-c191-4203-9313-c98b6e2a8351.jpeg?type=f287', 'https://phinf.pstatic.net/checkout/20200924_149/1600929958712Ajtdk_JPEG/review-attachment-8e5870c4-4bde-4c7c-a757-da2b07b045a2.jpeg?type=f287']"
5,키감 쫀득하고 좋습니다. 키높이 얇은 것도 컴팩트하고 좋네요.,"['https://phinf.pstatic.net/checkout/20200913_55/1599930984674JG5yR_JPEG/review-attachment-6ad4a8e2-d127-4994-a422-35e6a0908527.jpeg?type=f287', 'https://phinf.pstatic.net/checkout/20200913_207/1599930984816GtmAN_JPEG/review-attachment-770217cb-0aee-43c1-a19c-c6b0108690d7.jpeg?type=f287']"
5,지금까지 샀던 게이밍 키보드 중에 제일 마음에 듭니다. 당분간 기변 안할거 같아요.,"['https://phinf.pstatic.net/checkout/20200913_108/15999790795126Nu1p_JPEG/review-attachment-b1742166-156f-4d71-a24c-5c0c523ff54f.jpeg?type=f287', 'https://phinf.pstatic.net/checkout/20200913_29/1599979097645qgSt3_JPEG/review-attachment-1cc945e4-6ac3-4d22-a591-35cec1534415.jpeg?type=f287']"
5,흔히 알던 청축보다 가볍고 소음 작습니다. 클리키 축 타건감 엄청 맘에 드네요. 묵직하고 알루미늄 상판 디자인 예쁩니다. led 끄니 무선 1100시간 작동이네요.,['https://shopping-phinf.pstatic.net/20201122_5/577f8743-1241-46b4-bc4a-125b47cde929.jpg?type=f287']
5,금액이 좀 나가서 고민했는데 성능도 좋고 가볍고 예뻐요. 만족합니다.,['https://phinf.pstatic.net/checkout/20201127_177/16064843218013Eogu_JPEG/review-attachment-ac7fe444-7708-42fc-ba74-5d1065ace4f6.jpeg?type=f287']
5,디자인 성능 너무 맘에듭니다,['https://phinf.pstatic.net/checkout/20201115_78/1605426571480jHhWM_JPEG/review-attachment-b7b9d7ae-2aba-4b41-8a30-3606c2541f86.jpeg?type=f287']
