star_point,comment,photo
5,"회사에서 작업용으로 구매 했습니다
빅스마일데이와 삼성카드 할인으로 12만 2500원이라는 아랫급인 MX Keys 가격으로 구매했네요
배송은 다음날 바로 도착했고 바로 유니파잉으로 장치 추가하고 사용해보았습니다
키감은 이미 알려진데로 쫀득합니다 펜타그래프 방식인데 가운데 오목하게 들어가서 손가락 이탈을 어느정도 잡아주는듯 하고 키압은 일반 펜타그래프보단 다소 무겁습니다 기계식으로 보면 적축보단 흑축 키압 느낌이네요 키 재열이 살짝 달라서 적응에 약간의 시간이 필요합니다. 다이얼... 즉 크라운은 생각보다 기능이 제한적이네요 볼륨 조절은 자주 사용할거 같은데 그 외 용도는 생각 좀 해봐야겠습니다
최종적으로 정가 주고 사긴 고민이지만 이정도 가격이면 충분히 가치가 있다고 생각하고 강추합니다",[]
5,"회사 업무용으로 기존에 기계식 및 무접점을 사용하던 중에 사무용 끝판왕? 이라는 이 키보드가 눈에 들어와 고민의 고민을 하다가 구입하게되었습니다.이 모델의 크라운이 빠진 mx keys와 비교해서 커뮤니티에서 다양한 의견이 있어 내심 비싼 키보드를 구입하고 하루만에 방출할까 고민이 되서 구입을 망설이긴 했지만, 빅스마일데이 40프로 쿠폰과 삼성카드 중복할인으로 MX Keys와 유사한 가격대가 맞춰져 안살래야 안살수가 없었네요.옆의 여직원도 같이 사달라고 해서 옥션1개 지마켓1개 이렇게 두개 구입했습니다.그리고 다음날 수령 후 개봉... 유니파잉 장치 추가 후 기대반 우려반의 복잡한 감정을 안고 사용을 해보고...둘 다 아주 아주 만족하고 있습니다. 사실 크라운은 기능이 너무 제한적이라 많이 사용을 하진 않고 있습니다. 볼륨 업/다운이나 워드/엑셀/파포 등에서 제공하는 간단한 기능정도가 다네요. 단점이 프로그램별 기능 전환 시 크라운에서 '찰칵'하는 소리가 난다는 겁니다. 조용한 사무실에서 이 찰칵 소리가 유달리 크게 느껴져서 눈치가 보이네요 ㅠㅠ, 반발력은 높은 편입니다. 기존에 무접점 키보드를 사용했던 터라 더욱 반발감이 크게 느껴집니다. 흡사 기계식 흑축의 낮은 키캡 버전을 사용하는 느낌입니다. 그래도 쫀득한 키감이 타이핑할 맛을 나게 해줍니다.총 구매가격이 12만 2천 정도인데, 이정도면 가성비 좋게 구입한거 같습니다.오래오래 고장 나지 않고 잘 사용했으면 좋겠습니다.",[]
5,"책상을 정리하면서 책상 위에 선들이 나와있는게 싫어 무선 마우스, 무선 키보드, 모니터 암 등등책상공간을 활용할 수 있는 모든걸 준비했습니다.MX master3 마우스를 이미 구입한 상태였기 때문에 같은 수신기를 쓰는 MX KEYS키보드와 크래프트 사이에서 고민했는데, 크래프트가 할인행사를 하고 있어서 큰맘 먹고 크래프트로 구입할 수 있었습니다.크래프트의 다이얼은 사실 그래픽이나 영상편집 등 활용할 만한 프로그램이나 작업을 하지 않으신다면전혀 쓸모가 없다고 보셔도 되기 때문에 KEYS와 크래프트 사이에서 고민하시는 분들은 참고하시면 될 것 같습니다.",['https://shopping-phinf.pstatic.net/20200721_29/ae9108fb-f473-4ac8-8c41-4a2927ab8e79.jpg?type=f287']
5,"가격이 좀 비싸긴 하지만. 키보드 마우스는 좀 좋은걸 써야 손목에 무리가 안가더라고요.
키 타격감은 고급노트북의 느낌으로 짱짱하고 저 크리에이티브 다이얼 감도가 좀 높아서 그렇지 쓸만해요!!
일단 사무실에서 주는 저가 가 오래되어 타이핑이 뻑뻑해서 힘들었는데. 지금은 손가락이 날아다님.ㅋ
mx 560인가 삿다가 너무 작고 텐키가 있는 대신 홈버튼 영역과 방향키가 거의 없어지다시피 하는 바람에 차라리 좋은걸로 사보자라고 생각했는데. 이건 풀사이즈라 있을거 다있어서 좋아요!
연결하는데도 무리 없고 등록하려 시리얼 넘버 찾는데 엄청 고생했네요.ㅋ 그 막 제품정보있는 부분 위쪽 흰지부분 안쪽에 있어요. 글자색이 그리 눈에 띄진 않으니 잘 보셔야합니다!
받았는데 박스에 이벤트하고 있다고 상품권준다고 그래서 로지텍 로그인 하고 상품등록했습니다.ㅋㅋ
백화점 상품권 만원짜리 준다니 뭐 만원 더 싸게삿다고 생각하지요~
로그인 하고 로지택 옵션을 다운로드 후 설치하면 크리에이티브 다이얼 활용이 가능해집니다!
!",[]
3,상품 잘 받았습니다 배송이야 이젠 하루 이틀이면 전국 배달되니 머..한달 사용 하고 솔직 리뷰 올립니다.단점부터 말하죠.첫째 F1번키가 문제네요.아니 키간격이 너무 넓다고 해야 할까요?저는 파일명 바꿀때 등 F2번을 자주 쓰는데.F1번이 너무 자주 늘려지네요 손가락이 작지고 ？北嗤？.기존 키보드 보다 키간격이 너무 넓어서 그런지 오타가 많습니다.둘째 크라운은 쓴적이 없습니다 쓸모가 없네요...저는 CAD 프로그램을 거의 사용합니다그런데 휠을 돌릴일이 전혀 없니요.물론 프로그램을 이용해서 셋팅을 바꾸면 되는데 빠꾼다해도도움이 안되고 그냥 줌 인아웃만 쓰지 딱히 쓸필요가 없습니다.셋째 가장 큰 단점인데 한달만에키가 안눌립니다 지금 v키가 꾹꾹 눌렁야 입력됩니다환장하겠습니다 물론 as보내면 새 제품으로 교환해주시겠지만이만 저만 시간과 경비 손해입니다한달만에 고장은 너무 하네요 막쓰지도 않았는데.. 블루투스 페어링 잘되는점 정도 하죠비싼 돈 주고 살 정도는 아닌것같습니다,[]
4,작업용으로 타건음도 적고 왼쪽상단 휠로 커스터마이징을 통한 편집에 효율성을 높혀줍니다.단점으로는 esc키와 휠이 너무 근처라 esc누르면서 휠이 손가락에 닿는경우가 생깁니다. 휠이 돌아가진 않지만 살짝 거슬리네요.그리고 블루투스 연결문제로 보이는데 신호가 한번씩 놓치는지 키를 누르다 입력이 안되는경우가 가끔 있습니다.추후 사용하다 계속 문제발생시 as해야될것 같네요.,[]
5,매직키보드 1세대로 8년을 썼습니다. 이번에 새 맥북을 사서 데탑처럼 쓰다보니.. 역시 수신감도 때문에 스트레스 받아 도저히 안되겠다 판단하여 질렀습니다. 수신감도는 확실히 맥북보다 넓은게 맞는거 같아요. 설령 블루투스 거리가 문제되더라도 유니파잉 수신기가 있어 괜찮겠다 싶어 구매했습니다. 페어링을 쉽게 변경할 수 있으니 구형 타워맥과도 같이 쓰는데 문제가 없네요.,[]
5,도대체 충전램프가 어찌돌아가는건지 찾아보다가 그냥 구매결정합니다. 아니 완충이 되면 불이 꺼지든지 아니면 고정이 되야지 알 수 없음. 심지어 전용 소프트웨어에서 배터리 잔량 표시 없음... 도대체 로지텍 왜들 좋아하는지 모르겠네요. 그래도 상품은 잘 작동합니다. 유니파이나 블루투스도 다 잘됨.,[]
4,"-배송빠름
-크라운기능으로 대박 편함 까지는 아직 못느낌(사용초기라..)
-크라운기능으로 대박 멋있어 까지는 금방 느낌(이게핵심ㅋㅋ)
-한영 각인도 깔끔
-키촉감은 손끝에서 굉장히 부드러움
-키 눌리는 느낌이 툭툭 눌리는 느낌, 확실히 뭔가 누르고 있는 느낌이 들게끔 해놓은듯
-기본으로 지원해주는 프로그램들 외에 유저가 추가 프로그램 설정도 가능함( 아직 기능을 제대로 활용해보진 못했음 )
-한영 전환키 누를때 불편함 : 오른쪽 하단 fn + 한영 눌러야됨
-키스킨도 같이 동봉되었으면 너무 좋았을 것같은데.....아쉽...너무...아쉽..
-키보드 자체 무게감 있음 : 잘 안밀림
-키소리가 크게 들리지는 않음
- 대만족
-핸드크림 바르고 썼는데 지문이.....키스킨 사야지....
- 설정도 쉽게할수있음
-설정프로그램 키지않는 이상 그 어디에도 위젯으로 키보드 배터리 상태 알수가 없음 ( %표시가 필요한데 )
-설정프로그램에 개발자 모드같은게 있는데 (사용안해봄) 이런거 잘 이용하면 더 편리하고 자신에게 맞게 사용할수 있지 않을까 생각해봄",[]
3,포토샵할때 편하게 쓸려고 로지텍크르프트 키보드 주문한건데요.. 근데.. 포토샵cs6 가 로지텍옵션 프로그램안에 연동이 되질 않아요.. ㅜㅜ 로지텍 as o70-9860-18207 전화도 해봤는데.. 일반사원이라서 잘모르겠다고만 하고.. 모든응용프로그램 자체에 포토샵이 뜨질않아요. 이거 어떻게 해야 하나요... ? ㅜㅜ 키보드 뿐만 아니라 mx 마스터3 마우스도 연동이 안되요 아에 포토샵이 뜨질 않아요..ㅜㅜ 이것떄문에 산건데.... 다이얼 쓰는 이유가 없어졌네요.. 디자인은 예쁜데..,['https://shopping-phinf.pstatic.net/20200924_0/721bbc22-e809-480e-b19d-f6036a30b157.jpg?type=f287']
4,"해피해킹 몇대를 주력으로 쓰고 있는데.. 쎈딜가격이 좋아서 충동적으로 구입했습니다. 그 전에 mx keys 모델을 보고 있었는데, 몇만원 차이 안나니 크래프트로 가보자 생각했거든요.. 구입하기전에는 애플키보드처럼 전체 재질이 당연히 알루미늄일거라 생각했습니다. 받아보니 다이얼 부분은 알루미늄인데, 나머지 하우징은 플라스틱이네요;; 급실망해서 다시 포장해놓고 중고판매 할려고 했더니, 이번에 많이 풀려서 그런지 문의도 없네요ㅎ 당분간 묵혀뒀다가 시간날때 셋팅해 봐야 겠습니다. 잠깐 만져본 느낌으로는, 스트로크가 짧고, 자판 사이에 간격이 넓어서.. 적응하는데 시간이 좀 걸리겠구나(워낙 해피해킹을 오래 사용해서 그런듯;;) 싶네요.. 암튼 20만원 주고 사기에는 거품이 심한거 같고;; (차라리 예전 디노버 엣지가 더 고급져 보임~) mx keys 정도의 가격대가 적당한 제품인거 같네요ㅎㅎ",[]
5,얼마전 같은 상품 구입하고 너무 좋아서 일주일만에 재구매 했어요. 너무 비싼 제품이라 처음 살 때는 엄청 망설였는데 일단 사서 사무실에서 써보니까 집에서도 같은 것 써야겠더라구요. 일단 키감이 너무 좋습니다. 이전에 쓰던 것도 팬터그래프 방식 중에서 키감 좋기로 유명한 K811이었는데 크래프트를 써보니 811은 장난감이더라구요. 그만큼 묵직하고 안정적인 키감이 발군입니다. 물론 휴대용이랑 비교하는게 이상할만큼 크래프트는 무겁고 풀사이즈라 크기도 큽니다. 구매 전에는 신형 mx keys와 엄청 비교하고 고민했는데 다이얼 하나 차이로 훨씬 비싼데도 선택했고 결과적으로는 만족합니다. 다이얼이 설정만 잘 하면 다양한 용도로 쓸 수 있습니다. 물론 다이얼이 필요 없으시면 훨씬 싸고 무게도 가벼우면서 묵직한 키감은 그대로인 mx keys를 구매하시면 됩니다. 그리고 지난번에 X팡에서 샀는데 그땐 그게 최저가인 줄 알았는데 카드할인까지 받으니 롯데가 더 싸네요. 배송도 바로 왔고 여러모로 만족합니다.,[]
5,사무실에서 무접점 기계식 키보드를 썼었는데 오타도 많이 나고 손가락도 좀 피로했던 것 같습니다.비싸서 조금 고민했는데 키감이 너무 좋네요. 왜 사무용 끝판왕이라고 하는지 알것 같습니다.휠은 별로 쓸 일이 없긴 한데 크롬에서 탭 전환할 때 쓰니깐 좋네요 ㅋㅋ,[]
3,"백라이트 밝기 조절이 잘안될때가 가끔있어 좀 짜증이나네요
판매처는 저희는몰라요 as가져가세요 하시고..
가끔 그런상황 발생해서 as가져가도 그자리에서 될지 안될지도 모르겠고여ㅋㅋ 저만그런건 아닌것같고 가끔 다른분들도 나타나는 현상인것 같습니다

그리고 스페이스바가 너무길어서 한영키 누를때 스페이스를 자꾸 눌러요",['https://phinf.pstatic.net/image.nmv/shopnbuyer_2020_05_28_0/4faea303-a089-11ea-b5c3-48df379cca40_03.jpg?type=f287']
5,"배송 빠르고, 키감은 딱 좋아하는 스타일, 키배열이 익숙치 않은건 쓰다보면 나아질, 돌돌이버튼은 생각보다 그닥. 같이 쓰고있는 MX MASTER3와 잘어울리는, 책상 위 전쟁터로인해 미안한 마음이 드는 쓸데없이 고급진 데스크의 완성,",[]
5,"어디까지나 사견 입니다만, 가성비가 그리 좋은 제품은 아니라 생각합니다.
그냥 딱 환불하지 않고 쓸 정도의 만족감 입니다.
마감, 디자인, 만듦새는 훌륭합니다.
그러나 취향을 심하게 탈 법 한 타건감. 살짝 낮고 쫀득한 느낌.
스위치가 눌러지는 임계값도 일반 키보드 보다는 살짝 큰 것 같습니다.
캐드 같은 명령어 입력 프로그램(속도를 요구하는)에서. 흐르듯 스치듯 입력하는 방식과 맞지 않다 봅니다.
디자인과 무게감, 디테일에서의 간지는 훌륭합니다. 그 외의 요소는 취향이 변수.",[]
1,"06.01에 구입해서 집에 배송이 06.02에 완료되었습니다. 제가 사정이 있어서 06.12에 집에 와서 열어보니까 제품에 하자가 있어서, 12일 당일에 판매자분과 연락을 시도하는데, 전화해도 안받고, 문자 남겨도 연락이 없다가.
참다가 15일에 다시 전화하니까 그제야 받아서 주소랑 이름 문자로 남겨달라고 해서 남겼어요.
16일인 오늘, 택배기사분이 제품 다시 수령해 가셨길래, 문자로 이제 어떻게 되는지 알 수 있냐고. 반품인건지, 교체인건지를 묻는데도. 대꾸도 안하구요.
왤케 연락이 안되냐고. 불친절하다고 했더니, 자기는 전화로 얘기했다네요.
전화로 얘기한거, 15일에 제품 한번 받아보겠다, 그냥 딱 한 번 언급한게 다 구요.
이게 잘 진행되는 건지 묻는데도 하 정말... 안내라고 하는게..
이게 소비자한테 할 태도인가요?
그것도 하자 있는 제품 받아서 기분 안좋은데,
제가 짜증 안내려고 노력하는데도 이렇게 대우 받는 건 너무 부당한 것 같아요.",[]
1,"일이만원 하는 제품도 아니고, 로지텍에서 나름 고가인 제품인데 배송상태가 매우매우 마음에 들지 않네요. 박스도 찌그러져있더군요. 키보드와 크라운 연결부분의 유격으로 인한 소음 발생으로 문의 드렸더니, 맞교환이 안되는건 그렇다 해도 네이버페이에 교환요청이 아닌 직접 택배를 보내라니요..제품 불량건으로 인한 교환인데 코로나 때문에 밖에도 안나가는데 편의점, 우체국까지 가서 직접 택배를 보내야하나요? 당장 키보드가 없으면 안돼서 교환하진 않지만 판매측이 정말 별로네요.

로지텍 명성에 걸맞게 키보드는 매우 만족합니다.",['https://phinf.pstatic.net/checkout/20200307_257/1583508107919YVSRU_JPEG/20200304_164050.jpg?type=f287']
5,"벌크제품이라 스크래치가 좀 있는데 그냥 써도 날 정도라 그냥 쓰려구요
상품은 맘에 쏙 듭니다.
키보드랑 마우스는 로지텍꺼만 쓰는데 크래프트는 가격대가 좀 있어서 고민하다가 구매했는데 만족스럽습니다. 배송 하루만에 왔어요",[]
5,키보드 비싸서 살때 고민좀 했었는데 후회없이 사용 중. 키감이 너무 좋고. 자판 많이 두두리는 직업인데 손에 피로감이 엄청 줄었음. 왼쪽 위에 저 둥그런 버튼은 생각보다 안쓰임. 그냥 키감에 만족함. 그리고 로지텍 프로그램으로 기능키 설정하는거 정말 좋음. 키감은 지금껏 사용한 키보드중 최고다 ㅜㅜ,['https://phinf.pstatic.net/checkout/20200205_59/15808976261218Y1JS_JPEG/A7279420-EF71-44B0-A51F-7E51C22E6488.jpeg?type=f287']
1,로지텍 크래프트 구매후 로지텍 옵션이라는 프로그램을 깔았습니다 이 프로그램도 문제가 많은게 각종 포털을 검색해도 설치 하는데 고생을 하시는 분들도 많더군요 저도 그중 하나였구요 설치하고 삭제하고 설치하고 살제하고 몇번을 했는지 기억도 안나네요가장 문제가 되는점바로 크라운이라는 다이얼인데요 이 기능이 작동을 안합니다...크라운을 돌리면 볼륨만 조절되고 프리미어 프로 포토샾 크롬등에서 죽어도 작동 안합니다노트북에서도 실험해보고 친구 컴퓨터에서도 실험해봐도 안되네요 그래서 로지텍 a/s센터에 전화를 했습니다조선족?같은 아주머니가 받으시더니 설명을 해주시는데 프리미어 버전 뭐쓰냐고 묻더니 2020쓴다니까 버전 문제라고 하네요 그래서 노트북에는 2019버전 있어서 그거로 했는데도 안됬다 하니 이 제품은 2017제품에 호환이 되는거라고 그 이후 제품은 그냥 업데이트를 기다리랍니다제가 그래서 크롬도 안된다고 하니 설명도 안해주시고 그냥 기다리라네요 어이가 없어서 반품을 신청 했습니다 그러나 몇일제 깜깜 무소식 문자 한통 없어서 그냥 구매 확정으로 바꾸고 중고나라에 판매하기로 했습니다 이 제품에서 가장 밀고있는 기능이 안되는데 이건 반품 사유가 안되는건가요?ㅋㅋ2017이상 정품 어도비 사용자분들은 구매 안하시길 추천합니다 ㅋㅋㅋ 하루종일 이거 세팅하느라 아무것도 못하고 뻘짓만하다가 분노를 여기다 표출합니다,[]
5,"좋다 좋다 하길래 어느정도길래 저러나 했어요. 써보니 알겠네요. 좋은 거 맞습니다. 몇 가지 아쉬운점도 있긴 있네요. 바디 전체가 스틸은 아니란 것, 높이 조절이 안된다는 것 등. 아, 조그 버튼을 100프로 자유롭게 셋팅하지 못하는 것도 좀 아쉬운 점. 배터리가 생각보다 빨리 빠지는 점 등. 그래도 이점들 말고는 전부 좋습니다. 키감, 디자인, 독특한 사용성의 조그 휠 등. 가격만 좀 더 착하면 최고일 듯 하네요.",['https://shopping-phinf.pstatic.net/20191217_27/2d03adcd-2d30-4641-bf9f-44439b63a15e.jpg?type=f287']
4,"3개 기기 페어링 전환 빠른 점, 노트북 펜s 사용하면서 포토샵 사용할 때 브러쉬 크기/농도 조절이 편한 점, 펜타그래프 키보드로 정숙성이 높은 점, 배송이 빠른 점은 장점입니다. 단점은 키보드 높낮이 조절이 애매한 점(의자 높이를 따로 조절해야 함), 생각보다 크라운 기능이 많지 않은 점(엑셀 횡스크롤 같은 건 mx master 3 사용중이라... 마우스 썸휠에 다른 기능을 넣으면 되긴 하지만), 기존에 사용하던 기계식 키보드에 비해 키감 및 반발력이 강한 점(이건 적응하면 될 거 같긴 합니다)이 있습니다. 보통 단점으로 말하는 스페이스바가 긴 건 이미 이전 키보드로 적응한 터라 못느꼈지만, 그때 감각을 생각해보면 처음 쓰시는 분은 확실히 적응이 좀 어려울 거 같습니다. 키가 낮아서 구분이 좀 어려운 면도 있고. 여튼 사무실에서 기계식 키보드 두들기다 눈치보여 바꾼건데 조금 적응하면 괜찮을 거 같습니다.",[]
4,가격이 사악하게 나온거 빼고는 묵직하니 메탈의 고급짐은 혀를 차게 하네요. 사고나니 가격이 올랐어요. (사길잘해뜸 헿) 진짜 고급짐이 이루 말할수가 없음 가격대비 이 녀석을 가치있게 쓸수있을까 고민 많이 하다 샀는데 기능다 쓰든지말든지 그냥 디자인으로 다 가만이 되네요.ㅋㅋ 다이얼버튼은 일단 볼륨버튼으로 사용해봄ㅋㅋ 프로그램 돌리면서 기능을 고루 써봐야겠어요. 아휴 보기만해도 흐믓하네요. 키감은 쫀득하진않아요.그냥 펜타방식의 키감임 스페이스바가 길게 나오긴 했는데 크게 거슬리진않음,['https://shopping-phinf.pstatic.net/20191128_8/15111f93-0ed7-47ee-9240-32a03d502dd5.jpg?type=f287']
5,"mx craft 와 mx keys 고민하다가 크래프트 구매했습니다. 저는 크래프트의 휠기능 유/무로 크게 영향을 끼쳤던 것 같습니다. 일렉트로 마트 오프라인 매장에 가서 두 모델 실물 보고서 크래프트로 정했습니다. 두가지 모두 장점이 많고 품질에 대해서도 두말할 것 없기 때문에 휠에 큰 의미를 두지 않으신다면 mx keys 하셔도 무방할 것 같습니다. 유튜브에 각 리뷰를 비교해봐도 휠 빼고는 기능 동일한 것 같습니다ㅋ 가격에서 차이가 많이 나니 나머지는 각자의 선택ㅋㅋ 저는 포토샵과 영상편집 프로그램을 자주 쓰는데 포토샵 경우 브러쉬나 수치+,-할때 유용하게 씁니다. 물론 브러쉬 크기는 [,]키로도 조절해도 되고 수치는 숫자 키나 컨트롤바 움직여도 되지만.. 쓰다가 휠의 불편함(esc키와 가까워서 불편하다는 유튜브 리뷰가 있긴 함)때문에 mx keys로 갈아타게 될지는 모르겠지만 현재 데스크탑, 아이패드 페어링 후 간단히 써봤는데 아무래도 쭉- 쓸 것 같습니다. 후기에 에어캡 없이 본박스로 배송왔다는 글이 있어 불안하긴 했는데 에어캡에 잘 싸여 큰 박스에 넣어져 왔습니다ㅋㅋ 그리고 데스크패드? 키보드패드? 보내주셨습니다. 마침 패드도 살려고 키보드 오면 그런것도 하나 주문해야겠다 했는데 이런 데스티니ㅋㅋㅋ (패드 케이스 보고 달력인줄 알고 신년달력을 벌써 나눠주네? 생각함..ㅋ) 감사합니다! 잘 쓰겠습니다;)",[]
5,"키감이 정말 압도적이네요. 펜타그래프를 좋아하시는 분은 펜타그래프 중 최고의 키감을 느끼실 수 있을 겁니다. 지금까지 서피스 데스크탑 키보드, Dell 키보드, 삼성 유선키보드 등 펜타그래프 키보드만 여러 개를 써봤지만 비교 불가네요. 다만 스페이스키가 상대적으로 커서 적응이 필요하고 맥 공용이라 윈도우키에 윈도표시가 없이 start라고 나오니 좀 어색합니다.",['https://phinf.pstatic.net/checkout/20200128_104/1580217283464HXd13_JPEG/1580217247163.jpg?type=f287']
5,"원래 가격은 많이 비싼 편이었는데 mx keys 구하기도 쉽지않아서 크래프트 사봤는데 아주 만족합니다 배송 빠르고 상품 이상없이 잘 왔어요 기본 10자 이상 작성시 100P 즉시지급 이미지 등록시 100P 즉시 추가지급개당 상품 가격이 5,000원 이하 상품은 적립대상에서 제외되며,리뷰 포인트는 최초 1회 작성시에만 지급됩니다.같은 단어가 반복된 내용은 임의로 삭제되며, 지급된 포인트가 회수될 수 있습니다. 다른 고객님들에게 유용한 상품 리뷰를 작성해주세요.",[]
5,"한성 gk888b 쓰다가 블루투스 연결이 자주 끊겨서 넘어왔습니다
역시 잘됩니다 유니파잉 수신기로 다른기기랑 묶어서 기기전환도 잘되구요!! 생각보다 크라운의 활용성이 떨어지기에 mx keys랑 이제품이랑 고민하시는분들은 keys를 사셔도 괜찮을것 같습니다",['https://phinf.pstatic.net/checkout/20200106_74/1578309102795PmiEM_JPEG/image.jpg?type=f287']
5,"키감이 좋습니다.
손목에 무리가 와서 낮고 편한 키보드 찾다 구매했습니다
한영전환 키가 적응이 안되서 좀 불편하고
엑셀할때 부가기능단축키도 숫자자판위로 가서 좀 불편합니다.
디자인 성능 등등 적응하면 엄청 편할 것 같습니다.",[]
1,"이게 벌크였네요; 혹시 저처럼 착각 하실 수 있으니 조심하세요. 보통 벌크는 이름에도 표기하고 눈에 띄게 해놓지 않나요? 무슨 상세 페이지도 그렇고 크게 표시도 안되어있고, 이름에도 없고, 가격도 싼편도 아니라서 그냥 국내 들여놓고 파는 병행 상품인 줄 알았더니 다시 잘 보니 상세 페이지에 벌크라고 써놓고 판매하고 있네요. 상태도 신품인데 상자만 없다거나 한게 아니고 스크래치있는 중고 상품 수준입니다. 상판 스크래치, 하판에 찍힘과 흰색 페인트 뭍은 자국... 기분 좋게 택배 뜯었다 기겁했네요. 벌크라 스크래치 어쩔 수 없다고 적혀있는데 제대로 못 본 제가 잘못이죠. 다른분들도 혹시 놓치셨을까봐 길게 써놓습니다. 구매에 참고하시기 바랍니다.",[]
5,"세일기간에 잘 산듯하며, Mx master 3(별도구매)와 사치를 부렸네요. 굳이 제목과 같은 직업군이 아니면 사치라고 생각되나 디자인만으로 칙칙한 사무실 책상위를 밝혀 줍니다. 추가 기능도 자주 쓰는 기능만 잘 넣는다면 만족할 것같다고 생각합니다. 사무용으로는 로지텍 만큼 사용자를 생각하는 제품은 없다고 생각되네요.",['https://shopping-phinf.pstatic.net/20191121_25/b1c820d8-e8ce-4bbb-bde5-e48eec9102a0.jpg?type=f287']
