star_point,comment,photo
5,"첫 출시됐을때부터 보고 있었는데요 가격이 좀 비싼편이고 해서 망설이다가 결국안샀습니다 그리고 적축 청축 이렇게 되어있는게 아니고 택타일 리니어 이런식으로 되어있어서
헤깔리기도 했구요 저는 로지텍 출시된 키보드 마우스는 수십개를 사본사람입니다
마우스도 g903, g pro 부터 그전제품까지 다 써보고 최신버젼은 다가지고 있구요
키보드도 커세어부터 razer제품 로지텍도 왠만한 제품은 다 써봤습니다
청축 , 적축, 은축, 갈축 다 써봤구요 되게 깐깐하게 평가하는 스타일은 아니지만
청축은 안씁니다 적축이나 갈축쪽을 좋아하는데요
기계식 키보드에 무선까지 되는 적축 갈축 무선키보드는 거의 없습니다
유명한제품중에는 로지텍이 거의 유일했고 얼마전에 razer에서 31만원짜리가 무선 기계식 키보드가 나오긴했는데 한글프린팅이 안되어있습니다
고민중에 이제품이 싼가격에 나왓고 택타일이라서 보니까 갈축이라고 생각하면되더군요
갈축을 제일 좋아해서 바로 샀습니다

택배는 이틀만에 왔고 아마도 기계식 무선 키보드 중에 제일 가볍지 않나 싶네요
소음은 그냥 갈축보다는 약간 덜나는거같긴한데 사무용으로
쓰시면 아마 상대방이 거슬려 할꺼같습니다

옆에 매크로키는 거슬린다고 하는분 많은거같은데 제가 g613도 가지고 있는데
그제품은 크기도 커서 상당히 거슬리고 매크로키를 치는경우도 종종있는데
이제품은 별로 거슬리지않았습니다 매크로키를 잘못치는경우도 별로 없었고요
배터리가 30시간이라고 별로라고 하시는분 많던데 g903써보신분은 아시겠지만
배터리가 상당히 오래갑니다 그리고 1분정도 입력안하면 자동으로 절전들어가서
배터리소모를 최소화하고요 저는 지금 3일내내 쉬면서 컴퓨터를 했는데 아직 배터리가 50%남았습니다 전체적으로 20만원초반가격이면 이만한 키보드도 없을꺼같네요

단점은 최대의 단점인데 키보드의 단점은 아직모르겟고 로지텍 as가 참 거지같습니다 제가 몇번받아봤는데 커피쏟거나 버튼파손되거나하면 as자체가 안됩니다 유상으로도 안해줍니다 그게 최대의 단점입니다",['https://shopping-phinf.pstatic.net/20201109_23/733808d2-dcae-4bbf-a46e-bf6332eaa67f.jpg?type=f287']
5,"정말 몇달을 사고싶어서 보았던 것..
일렉트로마트가서 리니어 버전으로 타자 쳐보고 몇달간 리니어만 생각했다가
우연히 다나와 검색끝에 택타일이 싸게 판매하시는 것을 보았어요.
가격적 메리트에 안살 수가 없었죠
지금 그것으로 쓰고 있는데, 멤브레인보다도 더 조용한거같아요
주로 사무 공간에서 사용하다보니, 다소 조용하면서 키감이 편하고, 손목이 부담안가는 ( 키보드를 많이쓰는 환경에 살아서, 자주 손목이 아팠어요 그래서 어쩔 수 없이 멤브레인 그것도 노트북처럼 낮은 것만 썼거든요 )
그런 걸 원했는데, 음.. 진짜 편하고 좋아요. 정말 말해뭐해입니다.

사람들이 function키 불편하시다고 하는데, 저는 조금만 쓰면 익숙해질거같아요 ㅎㅎ tab키를 쓸때에 조금 헷갈리지만, 컨트롤 키는 그렇게 방해받는 느낌이 아니네요.
정말 추천드리구싶어요 짱 좋습니다.",['https://shopping-phinf.pstatic.net/20201104_27/907fc679-20ee-465b-b553-7c985d125d6d.jpg?type=f287']
5,"남친 선물로 구매함 와 진짜 일단 하자라고 꼽자면 한글안써져잇는건데 어짜필 독수리 타자아닌이상 다외우고 사니깐 쓸만함 ㅋㄷ 배송은 4일걸림 정확히 ㅋㅋ
2주이상 걸릴까바 걱정햇는데 해배인데 총알이고 이정도면 씹ㅅㅌㅊ 진짜 개봉하자마자 영롱그자체.. 하..
저세상 클릭키임 청축인데도 불구하고 부드러움 ,,아무튼간에 진짜 꼭사세여 !!!! ㄹㅇ 개좋음 !!
p.s 남자친구 로지텍 에디션도 올려봣어요 ㅎㅎ
남친 이렇게 컴터방 꾸며주면그날로부터 우대받고 살수잇삼 ㅎㅎ","['https://phinf.pstatic.net/checkout/20201023_124/16034241411646WDT3_JPEG/review-attachment-af836c4c-df58-4c8d-938f-f0002cbe6b99.jpeg?type=f287', 'https://phinf.pstatic.net/checkout/20201023_102/1603424162631QTASV_JPEG/review-attachment-15a5eb24-2ff5-4a53-bfd7-e318829e7c8c.jpeg?type=f287', 'https://phinf.pstatic.net/checkout/20201023_300/16034242356625U4Ei_JPEG/review-attachment-69c172bf-5292-4f72-9f64-c9639a4c41c1.jpeg?type=f287', 'https://phinf.pstatic.net/checkout/20201023_33/1603424252015FWuB7_JPEG/review-attachment-defa8a4f-1b70-4357-8377-14bdd0385bac.jpeg?type=f287']"
5,"일단 너무나도 가볍고 쓰기가 편합니다. 아름다운것도 큰 장점이고요. 기존 기계식에서는 느끼지 못한 아주 좋은 느낌입니다. 메크로키는 평균 이상의 공간지각 능력을 갖추고 있다면, 전혀 불편하지 않습니다. 저의 블로그 리뷰를 인용하면

로지텍 G913의 아름다운 소리를 느껴보라. G913은 로우 프로파일 기계식 스위치라는 로지텍이 직접 만든 기계식 스위치다. 아주 느낌이 좋다. 과거에 회사를 다닐 때는 무접점 키보드를 사용했는데, 그것과 비교도 안 될 정도로 키감이 좋다. 매우 쫀득쫀득한 느낌이다. 거기다 키보드가 매우 얇기 때문에 손목의 무리가 적다. 참으로 좋은 장점으로 써보면 확실하게 느낄 것이다. 그리고 왼쪽의 G키가 헷갈린다는 사람들이 있는데, 음.... 나는 그런 적이 없다. 이건 개인차가 큰 거 같다. 본인이 머리가 어느 정도 좋고 공간지각 능력이 평균 이상이라면 아무런 문제도 없을 것이다.

나의 경우 게임을 안 하기 때문에 반응 속도가 큰 상관은 없지만 확실하게 느끼는 것은 다른 기계식 키보드들 보다 반응속도가 빠르게 느껴진다. 그리고 오른쪽 상단의 볼륨 크기를 조절하는 스크롤바도 매우 좋다. 써보면 진짜 편하다. 그리고 이렇게 예쁘고 때문에 컴퓨터로 글을 자주 쓰고 싶게 된다는 장점이 있다. 직업이 작가인 내게는 아주 좋은 점이다.",['https://phinf.pstatic.net/checkout/20200623_249/1592893503874pUF1y_JPEG/%B4%D9%BF%EE%B7%CE%B5%E5.jpg?type=f287']
5,제가 딱 원하던 키보드였는데 그동안 가격이 부담스러워 구입 못하고 있다가 이번 기회에 구입했네요. 원래 다른 기계식 키보드 쓸 때에도 갈축이 취향이었기 때문에 마침 딱 택타일이기도 했구요. 실제로 받아보니 포장도 고급스럽고 기계식치고는 얇고 RGB 불 들어오는 것도 좋네요. 아무래도 기계식이라 보기보다 묵직한 건 있고 옆에 G키들이 단점이긴 합니다만 개인마다 적응하기에 따라서 큰 문제는 아닐 거구요. 암튼 만족스럽습니다.,"['https://shopping-phinf.pstatic.net/20201115_19/690f0678-9e5a-4a7f-b331-432fd2999495.jpg?type=f287', 'https://shopping-phinf.pstatic.net/20201115_18/7bc2d947-c1e4-40f0-9416-4e81b03cf36a.jpg?type=f287']"
5,배송도 빨랐고 키보드가 이쁘게 잘 나왔네요ㅋ 근데 제품을 개봉하고 보니깐 아주 약간에 찍힘이 있던데 이런건 교환이 안되겠죠?^^;; 별거 아닌데 그부분만 계속 보여서 신경이 쓰인다는ㅋ 그리고 포장에 신경 좀 쓰셨으면 하네요. 키보드/마우스/헤드셋 같이 주문했는데 한박스에 뽁뽁이도 없이 배송이 됐던데 포장에 신경 좀 쓰셨으면 합니다^^,"['https://shopping-phinf.pstatic.net/20200825_10/898cfe9c-19ae-4917-a55b-c236059e6a4d.jpg?type=f287', 'https://shopping-phinf.pstatic.net/20200825_9/e08a2a04-1f3b-46d5-b7a3-d4b28e19f6f8.jpg?type=f287', 'https://shopping-phinf.pstatic.net/20200825_25/6b002291-fa73-4d70-a105-833d7c948931.jpg?type=f287', 'https://shopping-phinf.pstatic.net/20200825_4/7adfcda5-25aa-4e9a-a0c9-92ac1bfd8f89.jpg?type=f287']"
5,"2월 219,000에 할인하는거 하루 놓쳐서 2달넘게 기다리다가 너무 가지고 싶어서 그냥 삿어요
키감도 너무 좋고 3가지 버전 전부 실물로 생각해보고 골랐습니다
클릭키가 청축이라 많이 시끄러울수도 있다고 하던데 생각했던거 보다 시끄러운건 없구요 G키 또한 익숙해지기 어렵다는 이야기가 많은데 똥손인 제가 하루만에 익숙해지는걸보면 과장이 많은거 같습니다
와이프는 로지텍 크래프트 생일선물로 사줬어요
드디어 mx master2s랑 와이프는 로지텍 버티컬 마우스+크래프트로 더욱 삶에 질이 올라가는 컴퓨터 생활을 할수있는거같아요 아주만족스럽습니다","['https://phinf.pstatic.net/checkout/20200423_259/1587651325805Ghnkb_JPEG/20200422_233947.jpg?type=f287', 'https://phinf.pstatic.net/checkout/20200423_228/1587651325638gCrSL_JPEG/20200422_233935.jpg?type=f287']"
5,"g913 g933s g903 함께구매 했고 지금껏 썻던 제품들중에 단연 탑입니다
특히 키보드는 고급진 정도가 아니라 엄청납니다
마우스야 당연히 말할것 없고 헤드셋도 이가격에 이정도라니 라는 생각이듭니다 (모비우스 3d등등 많은것을 경험했지만 무선이 최고라는 생각이드네요 특히 마이크 넣다뺐다하는게 너무 센스있습니다)
키보드마우스도 커세어 제품이든 레이저제품이든 같은 로지텍이든 프리미엄 라인업을 경험해봤지만 단연 이제품들이 최고의 만족감을 주네요 주문하자마자 로지텍측에선 배송을 바로해줬지만 cj이가 너무 밀려서 4일정도 걸렸습니다 로지텍 배송은 정말 빠릅니다",['https://phinf.pstatic.net/checkout/20201016_119/1602816344436SgbfE_JPEG/review-attachment-e2b95611-51b6-4bd1-83e8-fa8f0ec6a05a.jpeg?type=f287']
5,"크흐 무친 클릭감...
남자친구랑 일렉트로마켓 같이 갔다가 너무 좋아하길래 서프라이즈로 생일선물을 이걸로 샀어요
구성품도 넘 좋아요
간지터지는 어둠의다크니스블랙 텀블러랑
마우스모양 유이스비 넘 기여워요 ㅋㅋㅋ 유에스비는 제가 갖게요 비밀로해야지 홀홀
30만원 어치를 할지는 모르겠지만 알아서 잘쓰게죠머 암튼 누를때는 여태까지 눌렀던 키보드 들을 쌉 쓰레기로 만들어버리는 클라스를 보여줍니다.
굿이에용",['https://phinf.pstatic.net/checkout/20200730_22/1596092567892gdTem_JPEG/review-attachment-9278642a-0c15-42bd-83e3-4953144c87b6.jpeg?type=f287']
3,"현재 키보드로 작성중입니다. 먼저 배송에 대해서 말씀드리면, 쇼킹딜로 물건이 나와서 주문량이 폭주해서 어려움이 있었다는 것은 이해할 수 있으나, 사전에 충분히 고지하지 않은 점이 아쉬웠습니다. 두 번째로, 누가봐도 상품이 개봉되었었다는 것입니다. 무려 정가 30만원하는 제품이 개봉의 흔적이 있다는 것이었습니다(사진 포함). 어차피 쓰다보면 중고제품이 되는 것은 당연하지만, 이 부분도 아쉬웠습니다. 저의 경우에는 쇼킹딜로 저렴하게 단순개봉상품 샀다고 생각하려고 합니다. 세 번째로, G913이라는 제품의 퀄리티입니다. 상품이 휘어져있다는 평을 몇개 보았는데, 제 제품도 실제로 그러했습니다. 상당히 당황스러웠지만, 금속제품으로 온도에 따라 팽창하기 쉽다는 점을 감안해도 30만원의 제품이 휘어져있다는 것이 놀라웠습니다. 이 부분은 손으로 반대로 휘어주니까 잡혔습니다.(그럼에도 불구하고 싸구려도 아니고 이게 뭐하는 짓인지 하면서 했습니다.) 그 외에는 훌륭합니다. 기계식 키보드의 고질적인 문제가 스프링 소리와 함께 통울림이 있는데, 이건 진짜 통이라는 것이 없는 것 같은 느낌입니다. G613는 거의 이게 악기인가? 할 정도인데, 이건 진짜 대박입니다. , 레오폴드 저소음 적축에서 넘어온 바로는 . 그리고 G613에서는 동그란 버튼이 딱딱한 느낌이었는데 이건 좀 물렁물렁 아쉽습니다. 무엇보다 디자인이 잘 빠지고 무선이라는 것이 좋습니다. 끝으로 다른 구매자분은 개봉도 안되어있고 휨도 없는 좋은 녀석으로 뽑길 바라겠습니다...",[]
4,배송은 적당히 빨랐고요. 키감은 아주 좋습니다. 기계식 특유의 구분감도 있고 적당한 키압입니다. 실제 타자 쳐 보면 오타도 적은 느낌이고 다른분은 문자열이 조밀해서 적응이 필요하다고 하는데 별 불편한 점은 없었습니다. 키보드 라이트도 색상 조절가능하고 맥미니에서도 잘 작동하고 g hub를 설치해서 매크로키에 키값을 설정 가능합니다. 단 맥에서 특수키 기능키는 다 작동하지 않네요. 유.무선 가능은 한데 유선시에는 lightspeed가 작동되지 않고 유선 연결한 것만 반응이 오고 블루투스 연결은 가능합니다. 유선 케이블을 빼면 그제서야 lightspeed연결이 됩니다. 즉 최대 패어링은 2대입니다. 키보드 상단의 스위치를 끄면 유선만 스위치를 켜면 lightspeed와 블루투스 연결되게 만들었으면 참 좋았을 것을 로지텍에 그이 머리 좋은 사람은 없는 듯... 아니면 유선버튼을 나란히 lightspeed버튼 옆에 만들었으면 더 좋구요. 기기간 전환은 단추만 누르면 잘 전환됩니다.,[]
5,"배송이 무척 빠르고 제품 마감이 훌륭하네요. 역시 비씬것은 이유가 있습니다. 이전 커세어 70 lux rgb 적축 사용하다가 바꾸니 좌측 g 버튼이 적응이 아직 안되어 오타가 나기는 하지만, 눌려지는 힘도 덜 들고 linear 제품이라 그런지 통울림 소리도 안나 사무실에서 소음도 안나서 주위 눈치 안보고 칠수 있어 좋네요. 무선이라 자리 이동도 편하여 아주 만족스럽습니다. 마우스랑 같이 g903 사용하니 g hub 한가지만 써도 되서 아주 편리합니다. 배터리도 하루당 4~5만 줄고 있어 2주는 쓸수 있을것 같습니다.",[]
4,"써보니 무선인데도 유선이랑 차이가 없는 반응 속도도 좋았고로우프로파일이라서 손목에 부담 적게 드는거 같아서 더 좋았음무엇보다 rgb도 티사 키보드는 빛샘이 있어서 깔끔 하지 않은데g913은 그런게 없이 키에만 딱 라이트가 들어와서 깔끔한 느낌을 줬음그러나 역시 여러 블로그에서 본 키간 간격이 좁아서 타사 키보드에 적응이 된 나에겐 적응할 시간이 더 필요한거 같음g1~5키를 실수로 누른다고는 하는데 난 그것보다 1을 눌러야 되는데 '을 누른다던가, z키를 눌러야 되는데 쉬프트키를 누른다던가 하는 불편함은 있다그래도 확실히 좋은건 좋은거라서 혹시 g913이 고장 나서 수리가 안되는 상황이 온다던가 해도 이거 살거 같다물론 이후에 후속 버전으로 더 좋은게 나오면 그거로 사겠지만 그런게 아니라면 재구매 의향이 있을 정도임",[]
5,"기대하지 않았는데 배송 확실하네요 엄청 빨리 왔네요 이미 제품 제조사의 브랜드 가치는 다 아는 것이고, 많이들 선택하지 않는 종류를 구입했지만 이 또한 개인차이는 있겠지만 난 무지 만족합니다. 게임을 할려고 산건 아닌데. 게임하고 싶어지는 키보드임. 추천",[]
3,"품질 및 마감 좋고
타감 및 소리는 딱 취향저격인데
다만 처음 오배송되서 교환 받는데
일주일이나 걸릴줄은 생각도 못했네요
그래서 별 세개 드립니다
처음부터 오배송이 아닌 구매한 제품이 왔다면
별 다섯개도 아깝지 않았을 텐데요...",['https://phinf.pstatic.net/checkout/20200905_200/1599308746325c6paB_JPEG/review-attachment-4414f804-0134-48f8-82f3-82f80a9ca23a.jpeg?type=f287']
5,"일단 무선이라 좋았는데 충전하면서 유선처럼 사용가능해서 더 좋았고 키보드 백라이트도 4단계로 밝기 조절가능해서 그렇게 눈부시지도 않고, 일단 박스에서 딱 꺼내고 받은 첫 느낌은 29만원 주고 살만한 마감과 퀄리티가 나오기에 딱히 불평할 만한게 없음. 아 근데 택배 포장은... 좀 별로임 아무튼 돈 있으면 살만한 키보드 인듯","['https://shopping-phinf.pstatic.net/20200216_2/a6252b4d-8f6e-4f78-8fe5-4b7478bf5f23.jpg?type=f287', 'https://shopping-phinf.pstatic.net/20200216_28/83503333-481f-4b3d-a45b-91c52085a949.jpg?type=f287']"
5,"기계식 키보드에 무선이라는 측면이 매우 좋습니다.
책상이 깔끔해집니다.
별로 필요 없을 것 같았던 사운드 조절 기능도 유용하게 쓰고 있습니다.
사무실이라 소리랑 음료 쏟는 문제가 있어서 커버를 쓰고 사용합니다.
가격은 부담스럽지만 전체적으로 만족스럽습니다.",['https://phinf.pstatic.net/checkout/20200620_255/15926270570306zTvQ_JPEG/G913.jpg?type=f287']
3,"무선, 빠른 속도, 키감, 디자인, 가벼운 무게, 화려한 rgb led, 그리고 여러 로지텍 제품을 사뇽하고 있는 저로서는 g hub를 통한 동기화 등의 이점으로 정말 맘에 드는 제품입니다. 다만, 고가의 제품임에도 불구하고 에어캡 하나 없이 포장된 상태로 배송된 점은 정말 혀를 내두를 정도로 맘에 들지 않았고 제품의 높은 가격으로 낮은 가격에도 다수의 선택지가 존재하여 제품 구매 시 상당한 고민을 요합니다.",[]
5,"고가의 키보드라 구매가 망설여졌는데 일렉트로닉 마트에서 두둘겨보고 쫀득쫀득한 키감에 반해서 구매했네요. 리니어살지 클리키 살지 고민고민했지만, 실제두둘겼을때 키감이 좋아서 구매했어요.세일가에 구매하게 되어서 다행입니다. 번창하세요",[]
5,"일렉트로마트에서 실물 확인하고 구매했습니다. 클릭소리가 크지 않고 쫀득한 타건감이 마음에 들어 택타일과 비교해서 선택했습니다. 품질에 비해 가격대가 비싼 느낌이고, 테두리 마감이
날카로워 문제 있어 보입니다. 참고해서 구매하세요~",[]
5,우선 G913을 선택한 이유는..일단 무선인 부분이 가장 주요 했으며 얇고 선으로 충전된다는 부분이 매우 만족스러웠습니다.비싼 부분도 어느정도 동의 하지만 위와 같은 조건을 충족 시키는 제품은 많이 없다고 생각합니다.잠깐 10분정도 사용하고 있는데 역시 매크로 부분이 신경이 쓰이긴 하지만 다른 분들에 비해서 크게 신경 쓰이지는 않습니다. 가끔 오타가 발생 하지만 신경 쓸 부분은 아니라고 생각합니다.회사에서 사용할지 집에서 사용할지는 아직 정하지 못했지만 나름 만족스러운 제품이라고 생각합니다.,[]
3,제품을 2개 구매했으나 제품의 종특인 휘어짐이 약간은 있으나 사용하는데 크게 불편할 일은 없을 듯 해서 그냥 사용중입니다. 정가 30만원 제품인데도 불구하고 2만원짜리에도 들어가 있는 에어캡 포장을 안한다는 사실이 굉장히 어이가 없으나 이 점은 필히 말로만 개선하겠다는 것이 아닌 꼭 개선을 하시기 바랍니다.,['https://shopping-phinf.pstatic.net/20200307_10/4e710b65-3faa-46f5-a838-38aed3e37a20.jpg?type=f287']
3,"제품은 대체적으로 만족하며, 약간의 휘어짐이 있으나 사용하는데 문제가 없을 것으로 보여 사용중입니다. 2만원짜리 제품에도 들어가 있는 에어캡포장을 30만원짜리인데도 불구하고 전혀 안한채로 박스공간이 남은채로 배송하는 그런 행위는 말로만 개선한다 하지 마시고 꼭 개선을 하시길 바랍니다.",['https://shopping-phinf.pstatic.net/20200307_0/12d2ea8e-d7a0-4250-b5f1-e2b4028c76b2.jpg?type=f287']
5,로지텍 G613 에서 G913 클리키로 넘어왔습니다. 키감은 보통 청축보다 경쾌하며 소리또한 깔끔한 느낌입니다. 디자인은 여타 기계식 키보드보다 훨씬 세련되어 보입니다. 가격이 쌘편이긴 하지만 한 꼭 써볼만한 키보드라 생각 합니다.,['https://phinf.pstatic.net/image.nmv/shopnbuyer_2020_04_01_0/7a65f56a-741c-11ea-9968-505dac8c38f5_03.jpg?type=f287']
5,아.. 맨정신에 결제 못해서.. 술먹고 결제했는데.. 젠장.. 비싸도 할말이 없습니다 ㅠㅠ 클릭키 자체가 청축스타일인데 소리가 크지도 않고 딱 적당해요 단!! 많은 블로거 들이 언급한대로.. 왼쪽 컨트롤이 좁아요 이거 적응하기에 시간이 필요할 듯합니다. 메트로 버튼이 생각보다 거슬리거든요,[]
5,"우선 럭키박스까지 보내주신거 너무 감사합니다! 마우스도 갖고 싶었는데 정말 대박이네요..감사합니다ㅎㅎ
키보드 디자인도 제가 좋아하는 스타일이고요 타이핑도 부드럽게 술술 쳐집니다. 청축이라 소리도 꽤 클 줄 알았는데 딱 듣기 좋을정도로 납니다. 좌측에 부가 자판이 있는 키보드는 처음 써봐서 좀 어색하긴 하지만, 자주 사용하면 금방 적응 할 것 같습니다. G903도 제가 무게감 있는 마우스를 좋아해서 G502마우스를 썼었는데, 무게추를 넣지 않으면 비교적 가볍고, 무게추를 넣으면 적당히 무게감이 있어 취향에 따라 선택하시면 좋을 것 같네요 ㅎㅎ 잘 쓰겠습니다.","['https://shopping-phinf.pstatic.net/20190829_12/80026558-20d1-41ba-950c-510e7e1fe5c8.jpg?type=f287', 'https://shopping-phinf.pstatic.net/20190829_22/2dc2902e-eebc-4896-8c6e-9b7269d28fee.jpg?type=f287']"
5,"이번에 가전세일할때 고민하다 구매했습니다유튜브에서 키 소리랑 조명효과 등등 미리 봤구요. G903 히어로 마우스랑 같이 구입하니 지허브를통한 조명 연동도 가능하네요. 매크로는 15개 지정 가능하고 프로그램 실행을 지정하는 등 기능이 정말 좋아요. 풀 충전하면 30시간정도 사용 가능한것으로 나오는데 미사용시 조명 꺼지는걸 설정하면 생각보다 배터리도 많이 안줄어요 ㅎㅎ주문하고 배송 하루만에 왔고요. ㅎㅎ레오폴드랑 고민했는데, 아마 편의성 VS 타건감 이 선택에서 갈릴듯하네요. 전 편의성선택했는데 정말 대 만족입니다. ㅎㅎ 다른 분들께도 추천 드립니다.",[]
5,"우선 배송 너무 빨라요!
그리고 키감 좋습니다! 클릭키랑 리니어중에 고민했는데..
리니어 사길 잘한것 같습니다! 조용하고 좋아요!!!
옆에서 탐낼정도로 예쁘고 좋습니다 ㅋㅋㅋ!
다만... 매크로 키가 옆에 있어서 손이 방황을 합니다..
""어딜 보시는 거죠!! 그건 제 매크로 키 입니다만!!!""
이런 느낌입니다..- ㅅ-; 적응하려면 시간이 좀 필요할 것 같아요
그래도 예쁘니까 만점입니다 ㅋㅋㅋ 좋아요!
무선 마우스에 무선 키보드라니 아주 나이스...",['https://phinf.pstatic.net/checkout/20200318_266/1584528040528D79hp_JPEG/KakaoTalk_20200318_194018970.jpg?type=f287']
5,세일할때 21만원에 구매했습니다. 클릭축 샀는데 키감은 쫀쫀하니 괜찮은것같아요. 하지만 문제의 메크로키는 상당히 거슬리고 처음 사용시 조금은 익숙해지기까지 시간이 걸립니다. 디자인측면으로는 정말 이쁜 키보드는 맞습니다.,[]
5,101키라서 전에 쓰던 103/106키에 비해 콘트롤키 한영키 등의 위치나 크기가 달라서 적응이 필요하고 윈도우 설정도 101키로 바꿔줘야 한영키가 먹혀요 처음 매크로키 때문에 탭이나 쉬프트등이 잘못눌렸는데 esc키 옆에는 매크로키가 없어서인지 금방 적응했고요가격이 비싸거 빼고는 좋군요스페이스키에 작은 흠집있어서 별 반개 깍습니다,[]
5,가격 비싸서 엄청 고민했지만 .... 정말 후회없는 선택을 했습니다! 사은품도 잘 챙겨주셔서 구매만족도가 어마어마하게 높아졌습니다.다른분들도 이 만족도를 느끼셨으면 하네요키보드는 진짜입니다 ! 로지텍 만세 ! 판매자님 만세 !,[]
5,"키감은 CLICK 제품인데요. 키감 눌렀을 적에 손이 아프지 않고요. 부드러워요. G CLICK 제품입니다.
그다음에 휴대폰 거치대 주셔서 감사합니다.
로지텍 에서 휴대폰 거치대 까지 포함해 주셨습니다.
먼지 들어가지 않게 키보드 보호 용을 주셨습니다. 감사합니다. 가격 저렴해서 좋아요. 부품 깨지지 않게 와주시고 또한 포장을 잘해 주셔서 고맙습니다. 후대폰으로 키보드 연결해서 사용을 잘하고 있습니다.
가격 저렴해서 좋아요. 사장님 키보드 만족합니다. 불량없이 보내 주셔서 감사합니다.","['https://shopping-phinf.pstatic.net/20190920_24/b3f792b8-ff7f-420a-9c84-05c41a8d1a04.jpg?type=f287', 'https://shopping-phinf.pstatic.net/20190920_16/4ce28a4e-ff8b-4069-8589-80f7dc2063ea.jpg?type=f287']"
3,배송 하루 늦은건 기다릴 수 있었습니다. 하지만 제품 가격이 어느정도 하는데 박스가..재사용했는지.. 누가 중간에 뜯어？f는지 테이프도 엉성하게 붙어있고.. 좀 찝찝한건 사실이네요. 다행이 내부 박스는 개봉흔적이 없는것 같아 그냥 쓰려고합니다. 다음부터 신경 쓰시기 바랍니다.,[]
