star_point,comment,photo
5,"배송 빠르게 잘 받았습니다~ 며칠전까지 파는 곳이 한 곳도 없어서 단종된 줄 알았는데 물량 수급이 됐는지 다시 판매하네요 :)
회사에서 맥북 쓰고 있는데 맥북 기본 키보드로 사용하려니 자세가 너무 불편해져서 맥용 키보드 알아보다가 맥 전용 키보드는 따로 나오는 제품이 다양하지도 않고 무선은 더더욱 제품이 한정적이라 다들 썩 맘에 들지가 않더군요.
무선 지원에 맥북 키보드랑 완벽하게 동일한 레이아웃을 제공하는 키보드는 이 제품 뿐인 것 같아 가격이 좀 쎄지만 이 키보드로 구입했습니다.
로지텍 브랜드면 PC 주변기기의 명가이기도 하고 MX 시리즈는 로지텍의 사무용 기기 최고 사양 제품이라 가격이 좀 쎈 부분은 납득이 됐습니다.
서론이 좀 길긴 했지만, 받고 나서 개봉 해 보니 . MX Keys for Mac은 그냥 MX Keys와는 다르게 색상이 맥북과 비슷한 컬러인 것도 하나의 포인트라 할 수 있겠네요~ 전반적으로 가격은 좀 비싸지만 충분히 제 값을 하는 만족스러운 제품 같습니다 :)","['https://phinf.pstatic.net/checkout/20201027_300/1603804806858rtSue_JPEG/review-attachment-89410108-5652-4889-b82e-c52a443d96a8.jpeg?type=f287', 'https://phinf.pstatic.net/checkout/20201027_94/1603804807093Vl2Yl_JPEG/review-attachment-9c84384f-5fef-40f3-97a2-b075bf55dc20.jpeg?type=f287', 'https://phinf.pstatic.net/checkout/20201027_279/1603804809268JKWkh_JPEG/review-attachment-a95784af-4dd7-497e-ac57-23869f580665.jpeg?type=f287', 'https://phinf.pstatic.net/checkout/20201027_121/1603804809492hlanH_JPEG/review-attachment-bcd137c4-db1d-4fd7-b3ac-13eb4fd3729d.jpeg?type=f287']"
5,"원래 mx keys 보통 버전을 구매하려했는데 맥용이 따로 있다는걸 알고 맥용으로 구매했습니다. 보니 키 레이아웃이 다르더라구요. 처음에 연결하는법을 잘 모른채로 막 사용을 해보려다 안돼서 고장난건가 했는데 지금은 잘 연결해서 사용하고 있습니다.

키가 깊게 들어가는 스타일이 아니어서 호불호는 갈리지만 키감이 매우 마음에 드네요. 움푹파인 키들도 매우 좋구요.

얇은 두께로 휴대성이 좋으나 금속재질 바디로 인해 무게는 조금 있습니다. 물론 그만큼 견고한 느낌입니다.

현재 맥북, 아이패드, 아이폰 3개를 연결해서 쓰는데 .","['https://phinf.pstatic.net/checkout/20201015_4/16027273164619mWxp_JPEG/review-attachment-930a63e9-a0e3-41cf-a9bf-72198d8b42ca.jpeg?type=f287', 'https://phinf.pstatic.net/checkout/20201015_11/1602727316593daDRY_JPEG/review-attachment-8d8c61e2-2d4a-4b3e-b12d-f8b5d8d41088.jpeg?type=f287', 'https://phinf.pstatic.net/checkout/20201015_234/1602727316620LiPCg_JPEG/review-attachment-8ac17f3a-a206-4aab-be78-f472b3fdcd5b.jpeg?type=f287']"
5,"요새 다시 회사 재택이 시작되는 바람에
집에 있는 사무 환경 강화를 핑계로 MX for Mac 키보드를 하나 구입했습니다. ㅎㅎ
(사무실에서는 로지텍 k780 쓰고 있습니다.)

저는 기존에 각종 기계식 키보드와 무접점 키보드 (키크론, 해피해킹, 리얼포스) 등 많이 사용해 왔고,
소위 끝판왕 키보드들도 써봤습니다.

허나 맥북에 정착하면서 맥북 특유의 나비식 키보드 및 매직 키보드를 접하면서
오히려 기계식, 무접점 키보드 같이 먼가 움푹 누르는 키감이 상당히 불편해 졌습니다.

엠플레인 키보드와 애플 키보드 왔다갔다 하나가 정착한게 로지텍 키보드 입니다.
그 중 이번에 산 MX for Mac 키감은 딱 k810가 비슷합니다. (사진 속 작은 키보드. 키감으로 최고의 키보드. 현재 단종)
키감이 상당히 쫀득쫀득 한게 특징이고, 키가 움푹 들어가지 않아서 피로감도 없습니다.
게다가 업무에 적합한 . :)

진작에 샀어야 하는데,
그 와중에 이번엔 다른 키보드 사볼까? 고민했던게 시간 낭비 였네요...
이 키보드가 끝판왕 입니다.

잘 쓰겠습니다. :)","['https://phinf.pstatic.net/checkout/20200902_194/1599026537976xLf6f_JPEG/review-attachment-f7516afd-5e53-4440-9bcc-a1181a107fb6.jpeg?type=f287', 'https://phinf.pstatic.net/checkout/20200902_54/1599026546186o4bDL_JPEG/review-attachment-65591fe1-11fa-4d37-aea0-39ca11f1271a.jpeg?type=f287', 'https://phinf.pstatic.net/checkout/20200902_110/1599026546380ykyMy_JPEG/review-attachment-32386e30-1fe4-4577-8518-c01181a3082c.jpeg?type=f287']"
4,"제품이야 말할 나위도 없이 최고인데요, 배송의 상태가 조금 아쉽기는 합니다 .이미 뜯은 흔적이 여실히 남아있는 박스에 뽁뽁이만 둘러 재포장이라서... 뭐 박스낭비 줄이는 것은 좋지만 찜찜한 기분이 드는 건 사실이네요 그 외에 제품미개봉 씰링은 잘 붙어있더군요.

다만 맥전용 제품임에도 불구하고 초기 설정할 때에 mac OS와의 버전 충돌 문제 등등, 아직 개선이 필요한 부분이 있었어서, Logitec Options에 연결 하는데까지 시간을 좀 잡아 먹었습니다.

배송 늦은건은 미리 자세히 안내주셔서 별로 개의치 않았어요.","['https://phinf.pstatic.net/checkout/20200919_240/1600521779472rMxJU_JPEG/review-attachment-235ebe92-2870-4d3e-916f-673780d783c9.jpeg?type=f287', 'https://phinf.pstatic.net/checkout/20200919_224/1600521779471rxAqC_JPEG/review-attachment-f7af4aa6-90b6-443b-aeef-901e8c4ced93.jpeg?type=f287', 'https://phinf.pstatic.net/checkout/20200919_5/1600521779412AX2Ah_JPEG/review-attachment-3ff37bc0-d8ed-43cc-9cd9-abcbde0cb094.jpeg?type=f287']"
5,"기존에 사용하던 매직키보드랑 비교 샷입니다~ 1세대 사용중이었는데 너무 오래 사용하기도 했고, mx keys 나왔을때부터 눈여겨보고 있던터라 mac 버전 나왔다하니 구매하게 되었네요. 키감은 쫀쫀한게 여타 펜타그래프랑 비교불가이기는 한데(나비식 맥북프로 키보드랑 비교는 정말..), 살짝 키압이 있는터라 기계식 키보드를 병행해서 쓰는 사람들은 좀 호불호가 있지 않을까 싶습니다. 키압이 낮은 적축키보드도 같이 사용하고 있는데, mx keys가 더 키압이 높을려고 하니깐요. 하지만 그 외에는 맘듬새도 너무 좋고 이동성이 떨어질수는 있겠지만 묵직한 무게감 덕북에 타이핑시 키보드가 흔들리는 느낌이 전혀없어서 안정감있는 느낌이 너무 좋았어요. 풀사이즈키에 텐키까지있는거라 크기는 좀커서 사실 휴대용은 아니죠 ㅎㅎ 특히 사소하지만 마음에 드는건 잠금버튼!! 물론 단축키로도 잘 사용하고 있지만,우측 상단의 자물쇠 버튼만 눌러도 맥북이 화면잠금으로 전환되는게 은근히 편하네요. 타이핑 하면서 오타율 테스트도 해봤는데 매직키보드나 기계식키보드보다도 적어서 당분간 메인 키보드로 사용될 것 같네요.",[]
5,"MX MASTER 3 for mac 구매 후
결국 키보드 까지 구매했습니다.

역시 매우 마음에 드네요. 매직키보드와 비슷한 느낌입니다.
웹서핑/사무용으로 최고인거 같습니다.
LED는 아주이쁩니다. 배터리때문에 매일 켜놓을지는 모르겠네요. ㅎㅎㅎ

맥북/윈도우노트북/아이폰/아이패드 (최대3개) 와따가따 이거 정말 물건이네요 ㅎㅎ
마우스보다 연결이 더 쉽습니다~~~~
영문제품도 판매하면 좋을 거 같습니다.
에스라이즈님 팜레스트도 같이 판매하면 좋을거 같습니다. 배송비포함.
에스라이즈/로지텍님 영문판도 판매해주시면 좋을거 같습니다.
로지텍님 텐키리스도 출시해면 좋을거 같습니다.","['https://phinf.pstatic.net/checkout/20200901_299/1598951316372WuXsX_JPEG/review-attachment-6f10c42f-dd3a-402e-8fbf-fd752166390e.jpeg?type=f287', 'https://phinf.pstatic.net/checkout/20200901_56/1598951417864uTIdT_JPEG/review-attachment-add3f620-6485-424d-902c-c8eda9e60c2d.jpeg?type=f287', 'https://phinf.pstatic.net/checkout/20200901_209/1598951418008EwFPW_JPEG/review-attachment-f7ed1601-6109-4a85-b03b-aded3fb13551.jpeg?type=f287', 'https://phinf.pstatic.net/checkout/20200901_163/15989514180005QxAY_JPEG/review-attachment-b1242ac3-1df2-4475-a7d9-8ad717aaec95.jpeg?type=f287']"
5,애플키보드를 사려다가 로지텍에서 맥용으로 MX Keys 제품이 나와서 구매했는데 가격은 애플에 비해 저렴하고 백라이트나 여러기기에서의 사용성 등 기능은 더 뛰어납니다. 생각보다 묵직하지만 책상에 올려주고 사용하는 제품이니 크게 불편함은 없구요. 키감이나 전체적인 마감등도 만족스럽습니다. 색상도 스페이스그레이 제품들과 잘 어울려요,"['https://phinf.pstatic.net/checkout/20200818_281/1597708343430W289h_JPEG/review-attachment-83c02620-09b0-400b-963e-56015a70b48b.jpeg?type=f287', 'https://phinf.pstatic.net/checkout/20200818_212/1597708343479aYAW2_JPEG/review-attachment-d0ba01ed-2af4-41de-8457-581f5332cf60.jpeg?type=f287']"
5,"원래도 로지텍 블루투스 키보드 사용하고 있기는 했는데 (k380인가) MX master 마우스를 구매하고나니 키보드도 세트로 맞춰줘야할 것 같더라구요 그래서 고민하다가 매장가서 눌러도 봤는데 키감이 너무 좋더라구요 냉큼 구매해버렸습니다 ..세트로 같이 있으니 간지도 2배네요

물론 mac용이여서 윈도우에서 사용하기에는 조금 어색한 감이 없지않아 있기는 한데...? 익숙해지면 괜찮긴합니다 alt자리나 한영키 자리..?가 헷갈리긴 하지만...맥용으로 나왓는데 윈도우에서도 쓸 수 있다니 감사해야죠 뭐 ㅋㅋ

일단 타자치는 맛이 납니다 ㅋㅋ 최고.",['https://phinf.pstatic.net/checkout/20201019_40/1603107151230d0mDf_PNG/review-attachment-8881939b-a044-4353-856e-db8ab0b5a47b.png?type=f287']
5,배송이 그리 빠르지 않았다는 점을 제외하고는 마음에 듭니다 키보드를 치는 순간 쫀득하다는 키감이 뭔지 알것 같았어요 펜타그래프 키도 맥의 스페이스 그레이 색상인것도 마음에 들고요 키보드 체인지가 엄청 빨라요 정말 마음에 드는 점이에요 윈도우용으로 살까하다가 맥도 쓰기에 샀는데 아직 키 설정이 익숙하지 않아서 그렇지 키감이나 대체적으로 만족이에요 키보드는 유니파잉인데 마우스는 유니파잉이 아니어서.... 블투안되는 컴터에서는 사용이 안되네요 잘 참고하세요,['https://phinf.pstatic.net/checkout/20200820_184/1597896560544boqbh_JPEG/review-attachment-1a5d916a-d8d5-425b-95d3-62e07407439e.jpeg?type=f287']
5,"비싸지만 비싼값하네요
맥 윈도우 아이패드에서 전부 연결 잘 되고
색상도 스그색상이라 맥북하고 너무 잘 어울려요
그리고 기분 탓인지 모르겠지만
백라이트가 기존 mx keys제품보다 좀더 어둡고
키보드가 쫀득쫀득한 느낌입니다
키보드 캡 자체가 다른 느낌??
전체적으로 너무 만족합니다
최근 지른 전자기기중에","['https://phinf.pstatic.net/checkout/20200812_67/1597215987275LFADe_JPEG/review-attachment-e5222e2f-c97c-4fe8-8fa4-19b5ddfceb1f.jpeg?type=f287', 'https://phinf.pstatic.net/checkout/20200812_252/1597215989680kKlDt_JPEG/review-attachment-223fe4a4-f72c-410b-a839-7a857f70e1ec.jpeg?type=f287']"
5,"매직키보드만 사용하다가 이번에 로지텍으로 갈아탔습니다. 매직키보드의 따닥거리는 소리에 익숙해져 있다가 적응을 하려면 조금 걸릴것 같지만,

백라이트의 아름다움과 여러 디바이스를 함께 사용할 수 있다는 편리함과 무엇보다 로지텍 마우스와 함께 사용하기위한 지름신의 강림으로 인해서 구입을 하게 되었답니다.

이 된것 같습니다.

펑션 키를 마음대로 조정해서 사용할수 있어서 더 유용한것 같네요.

배송도 하루만에 와서 완전 좋았습니다. 감사합니다.

팜레스트는 판매하지 않아 로지텍 공식 판매점에서 구매를 하였는데 궁합이 잘 맞네요.",['https://phinf.pstatic.net/checkout/20200908_274/1599569227855M8Tw2_JPEG/review-attachment-3dc75872-b519-4330-acd3-f31f02cf1761.jpeg?type=f287']
5,"1. 배송포장 박스에 담겨져 오진 않았지만 내용물을 확인할 수 없도록 안전 비닐백에포장되어 있고 본품은 에어캡으로 정성스럽게 포장되어 와서 박스에 손상없이안전하게 잘 배송되었습니다.2. 개봉제품 박스는 상당히 고급스럽게 되어 있고 이중 박스로 되어있으며내부 박스를 개봉하면 연결방법에 대한 Quick 가이드가 그림으로 표시되어 있습니다.3. 제품외관MX Keys for MAC 키보드는 고급스러운 외관으로 되어있고 키캡은 쫀득한 느낌이 들며견고한 느낌이 듭니다. 키보드 높이 조절이 안된다는 점이 아쉽긴 하지만 약간 기울어져있어서 쓰는데에 딱히 불편함은 없습니다.4. MAC 전용 키보드키캡 표기가 맥용으로 되어 있어서 기존에 맥 사용자는 손쉽게 적응할 수 있습니다.또한 손을 가져가면 자동으로 백라이트가 켜지고 키보드 백라이트 또한 맥북의 키보드와동일하게 키보드의 F5, F6키로 조절할 수 있어서 아주 좋습니다.5. 연결성키보드 오른쪽 상단에 배터리 인디게이터가 있고 윗면에 USB C 타입의 충전 포트와전원버튼이 위치하여 손쉽게 전원 온/오프와 .로지텍의 다른 고급 키보드와 마찬가지로 최대 3대까지 멀티 페어링이 가능하고 키를 이용하여 손쉽게 전환이 가능합니다. 또한 유니파잉 수신기를 지원하여기존 유니파잉 수신기를 가지고 있는 사람은 손쉽게 연결할 수 있습니다.또한 로지텍의 Flow기능을 사용하여 여러 기기간에 손쉽게 전환이 가능합니다.로지텍 Options 소프트웨어를 이용하여 펑션 키의 커스터마이징이 가능합니다.",[]
5,"재택근무중 갑자기 키보드가 고장이 나서 평소 고민하던 키보드를 주문했습니다.
딱 하루 써봤는데 정말 최고입니다.
무게감도 좋고 키감도 최고입니다.
업무특성상 노트북과 스마트폰을 둘다 써야 하는데 키터치 한번으로 쉽게 전환 가능해서 너무 좋네요.","['https://phinf.pstatic.net/checkout/20200821_216/1597978390135uTr7L_JPEG/review-attachment-f7f06f86-d697-4208-9c16-018e8c129da1.jpeg?type=f287', 'https://phinf.pstatic.net/checkout/20200821_188/1597978400219I47xT_JPEG/review-attachment-b6ea308a-a083-4b01-8417-50396bd2e3c3.jpeg?type=f287']"
5,확실히 처음에 적응하는 시간은 필요해요... 근데 한번 적응하고 나면 진짜 좋고 그리고 다른 전자기기와 무선연결이 버튼하나만 누르면 되는게 진짜 좋았어요! 너무 좋고 없으면 못살 것 같아요... 상품은 좋은데 뭔가 패키지에서 좀 .. 묘하게 낡은 느낌?? 새거뜯은 느낌이 안나요... ㅜㅜ 로지텍이 원래 이런가.. 잘 모르겠지만 그래도 쓰다보니 뭐 제품은 좋아서 만족해요! mx 마우스도 있던데 한번 잘 알아보려고요. 이 시리즈 괜찮은 것 같아요.,[]
5,"PC, 아이패드, 안드로이드 스마트폰 연결용으로 샀는데 셋다 만족하면서 사용합니다

색감이 스페이스 그레이라 깔맞춤 할 생각으로 샀는데 디자인과 색감 전부 만족합니다 단점이라면... for Mac 이므로 컨트롤 옵션 커맨드가 윈도우에서 어떤걸로 작용하는지 항상 알고 있어야합니다 ... 보고는 못해요

무엇보다 직접 전달 있어서 좋았습니다",['https://phinf.pstatic.net/checkout/20200828_97/15986032346750hkbp_JPEG/review-attachment-9ff2b990-4885-4168-9140-6ab33df3112c.jpeg?type=f287']
5,아이패드와 맥북을 동시에 사용할 키보드를 찾다가 맥용 mx keys가 출시됐다고 해서 주문했어요. 생각했던것보다 좋고 키보드에 필요한 키들이 다 들어가 있어서 유용하게 쓸 수 있을 것 같아요. 건전지가 아닌 충전기로 충전할 수 있는것도 엄청난 장점이네요.,['https://phinf.pstatic.net/checkout/20200920_55/16005876255999mJXV_JPEG/review-attachment-8f1cc29e-5276-45db-95c0-619bafa9c057.jpeg?type=f287']
5,"스페이스 그레이 색상과 99% 동일하고 맥 풀배열 키보드랑 키 배열 거의 같아서 쓰기 좋네요.
일단 펜타그레프 방식의 키보드중에서는 키감은 최고 일것 같습니다.
단지 키켑이 좀 쓰면 번들거리는건 아쉽습니다.
한대로 3대 연결을 키 하나로 할수있는 이지 스위치는 정말 편하고요.
디자인도 이쁘고 기능도 많아서 진짜 강추 키보드입니다.
좀 비싸다는것과 A/S기간 다른 브랜드에 비해서 짧은건 진짜 아쉽네요.
오랜만에 마음에 쏙 드는 키보드 찾은것 같아서 기분 좋네요.",[]
5,"역시 로지텍입니다 ㅋㅋㅋㅋ
한달 좀 넘게 사용해보고 작성합니다..
애플 정품 키보드를 쓰다가 바꿨습니다..
사실 처음나왔던 MX Keys는 윈도우키가 있어서 고민하고 있었는데..
마침 for Mac 버전이 나와서 이거다 싶어서 샀습니다..
이게 정품보다 매직트랙패드랑 먼가 더 잘 어울려요..!!
당연히 ~!!
상단에 맥북쓰는것처럼 터치바 기능키도 다 있고 정말 편리합니다..
이제는 애플키보드 팔아야 할 거 같네요 ㅋㅋ
이걸 써본 사람들은 잘 알겁니다..!!
맥북 쓰시고 책상에서 듀얼모니터로 사용하실 때 꼭 필요한 키보드입니다..
이런 제품도 만들어 준 로지텍 짱짱~~!!",[]
5,"허술하게 뽁뽁이로 두르고 비닐봉투에 담겨진 택배 포장에 비해 제품 박스는 이중으로 단단하게 포장 되어 있어요.내부에 검정색 박스가 하나 더있어요 하얀 얇은 종이로 또 한번 꼼꼼히 포장되어 있고요.키보드를 들어내면 usb 동글과 한글 설명서, c to c 케이블이 구성품으로 들어있어요.디바이스간의 호환을 버튼 3개로 가능하다는 설명이 박스 내부에 인쇄되어 있어요.모든 패키지는 미니멀하게 심플하면서 꼼꼼하고 단단해요.환경을 생각했는지 전부 종이로만 만들어져 있어요.키보드는 얇고 묵직한 무게감이 있어요.뒷면에는 미끄럼 방지 처리가 깔끔하게 되어있어요.",[]
5,"연휴가 끝나고 물량이 밀려서 택배를 좀 늦게 받긴 했지만 판매자께서는 바로 출고해주셨습니다. 중간에 배송 관련 문의에도 친절하게 답변해주셨어요.
원래 뉴메릭 키보드를 사용하다가 제가 키캡을 빼고 청소하다가 고장내는 바람에 멀티페어링 되는 제품과 맥에서 사용하기 편한 키보드를 찾다가 주문했습니다.
금방 오자마자 맥북에 무선 연결해서 후기 남기고 있는데 키감도 좋네요~ 게다가 무게감이 있어서 키보드가 책상에 고정되어 있는 느낌도 참 좋습니다.
BTT로 f19까지 설정해놓은 단축키도 잘 작동하고요. 무엇보다도 맥북이라 키배열이 같아서 사용하기 편할 것 같습니다.
아주 만족합니다.",[]
5,"노트북을 모니터에 연결하여 사용할때는 로지텍 (단종된) K810을 즐겨 사용했습니다.실사용도 3-4년 하였고, 한글 각인이 없는 버젼을 구매 하였기에,대체품을 고민 하던중에 MX Keys가, 키 감이 좋다는 의견이 있어서 충동 구매 하였습니다역시 듣던대로, 손에 착착 붙는 쫀쫀한 키 감과, 너무 가볍지도 않아서 무게의 밸런스가 잡혀 있어서 좋네요.비록 고가 이지만, 키 감을 중시하는 분께 적극 추천드립니다.",[]
5,"총평 : 아주 좋습니다. 추천합니다.1. 외관위 MX KEYS(구), 아래 MX KEYS for Mac(신)키캡은 구보다 더 까맣습니다바디는 신이 좀 더 밝습니다매직 트랙패드 2(스그)와 비교하면 사진으로는 반대인데,실제로 보면 구 바디하고 좀 더 매치됩니다2. 자판 배열구가 키캡에 Mac배열도 있고, 애플에 연결하면 애플배열대로 잘 동작했기 때문에 기능상 차이는 없을 줄 알았지만 좀 다릅니다.글자수 제한이 있어 윈도 배열과 다른 부분은 사진에 표시해뒀으니 윈도 유저분이 구매하시려면 참고하시기 바라며,윈도 기준 핵심적인 차이는 1. 한영 2. 윈도/alt키, 3. 잠금 키 입니다.윈도에서는 우ctrl 왼쪽 option키가 우alt로 한영키 동작해서 엄지로 누르기 어렵습니다.윈도-cmd, opt-alt 대응이어서 윈도/alt가 반대입니다.잠금 키가 options 프로그램에서 f1-f12 사용하면 fn과 조합해야 잠금이 됩니다.",[]
5,텐키리스로 K810처럼 나오면 얼마나 좋을까 생각해봅니다.현재는 단종된 기종이라 숫자키를 거의 쓰지 않는 입장에서는 텐키리스로 나왔으면 더 좋겠습니다.로지텍 게이밍은 텐키도 계속 나오는데 아쉽게도 게이밍 아니면 뭐..자판각인만 맥용이지 윈도우 10도 무리는 없네요.어차피 각인을 보고 치는건 아니니까...키감은 개인적으로 K810만 못한거 같아 아쉬운거 말고는세련되고 무게감이 있어서 좋습니다.ㅎㅎㅎ.,[]
5,전자제품을 뽁뽁이 두어바퀴 돌리고 비닐백에 넣어주는 곳은 처음 봤습니다. 덕분에 배송중 입은 데미지로 포장지와 제품박스가 손상 되었길래 뜯지도 않고 바로 교환신청 하려다가 참습니다. 아직 사용전이긴 한데 문제 없어야 할텐데..,[]
5,맥 용으로 구매했어요 확실히 블루투스로 연결하는것보다 usb 로 연결하니 타자 인식률이 높아졌는데 그래도 오타가 있긴 해요! 아직 좀 더 두고봐야될 것 같은데 디자인이나 키감은 아주 만족스러워요. 개인적으로 애플보다 로지텍 제품을 선호하는데 이 키보드도 그 중 하나가 될 것 같아요~~~ ^^,[]
5,"적은 가격이 아님에도 솔직히 설마 하면서 구매했는데요.. 매뉴얼이 별도로 없고 온라인으로 확인해야했지만, 예상외의 높은 품질과 성능으로 매우 만족하면서 사용하고 있네요~ 손목 받침대는 필요할수도요 ㅋ (생각보다 높이가 많이 낮음)",[]
2,"상품 자체에 대한 불만은 없으나, 분명 이벤트 상품임을 알고 진입을 했는데... 뭐... 여차저차해서 결제가 늦어져 날이 바뀌어... 몇푼 되지도 않을 USB 상품을 못 받게 되니 기분은 그렇네요.상품 타이틀이라도 없었으면 이렇지도 않았을텐데...괜히 연휴 기다렸다는 생각이 드니... ㅎㅎ",[]
5,"빠른배송에 정말 기분이 좋았습니다.
상자 포장도 딱 정사이즈 맞는 상자로 기분좋게 배송되었습니ㅏㄷ.
제품의 만족족도야 개인차이겠지만 노트북 키감을 원하시는 분들은 만족하실 제품이라 생각되네요 생긴거치곤 무게감이있어 키보드가 밀리거나 하진 않는거 같습니다. 좋아요 만족해요~!",[]
5,맥북프로에서 외장 모니터 사용시 쓸려고 고민고민하다가구입했습니다. 일반 중저가 키보드에 비해 가격이 꽤 되어 망설였는데 맥북과 동일한 키배열과 키보드를 두드릴때의 키감이 매우 좋습니다. 이래서 로지텍 로지텍 하나봅니다. MX마우스도 살려고 고려중입니다.,[]
5,한 5년 썼던 애플 매직 키보드 마우스 세트를 이번 기회에 큰맘 먹고 로지텍 MX 시리즈 맥전용으로 바꿨네요. 신세계 상품권 이벤트도 하고 겸사겸사 너무 좋습니다. 세상 참 편해졌네요. 추가적으로 윈도우노트북까지 멀티페어링하고 플로우기능까지 너무 참신합니다. 오랜만에 돈 안아까운 투자한듯 합니다.,[]
5,맥전용으로 나왔다고해서 구매했습니다지인의 mx 시리즈와 비교해보니 색상이 좀 다르고 키들이 다르네요전용 키 각인이 되어 있어 좀더 맥을 위한 키들이 들어가있고 fn 키들도 전용으로 나와 세팅하기가 좋군요맥을 주로 사용하시는 분들께 강추합니다,[]
5,"좋아요 맥 레이아웃의 키보드 마땅한게 없었는데
정말 최곤듯 싶네요
그동안 기계식, 무접점 써오면서
펜타그래프에 대해 안좋은 인식이 있었는데
그걸 없애주는 물건이네요","['https://phinf.pstatic.net/checkout/20201027_115/1603804938147i4xHX_JPEG/review-attachment-6ab5bc27-c73e-46bf-a7b6-4ee9440afac8.jpeg?type=f287', 'https://phinf.pstatic.net/checkout/20201027_36/1603804938256g0T7f_JPEG/review-attachment-9ca25f23-48b8-4854-a886-f4da1bebf7a3.jpeg?type=f287', 'https://phinf.pstatic.net/checkout/20201027_221/1603804938255M7zIb_JPEG/review-attachment-f64f9979-431a-44d2-9a67-43061d4a16cd.jpeg?type=f287', 'https://phinf.pstatic.net/checkout/20201027_26/1603804938125aPXgw_JPEG/review-attachment-cda56a2f-b5e8-45e2-a16a-c96314268d4c.jpeg?type=f287', 'https://phinf.pstatic.net/checkout/20201027_32/1603804938340MPe1C_JPEG/review-attachment-d4435e8a-1405-43a4-a391-e1cf362583c3.jpeg?type=f287']"
