star_point,comment,photo
5,배송도 빠르고 제품도 만족합니다^^,['https://phinf.pstatic.net/checkout/20200625_253/1593038871198KEVhD_JPEG/6FB77A49-029C-4B46-BE82-62E8640C44B8.jpeg?type=f287']
5,무선 기계식 게이밍 키보드 끝판왕,['https://phinf.pstatic.net/checkout/20200713_105/1594633651332mvRAC_JPEG/review-attachment-d26b5793-6090-401d-87e5-5ca123400d67.jpeg?type=f287']
5,타격감 조용하고 키감 좋네요. 블루투스인데 반응도 빨라서 불편한게 없네요,[]
5,가격값 하는 키보드. 추천합니다,[]
5,좋아요 배송빠르고..불량 없어요,[]
5,진심진짜 좋아요 비싼거만 빼고,['https://phinf.pstatic.net/checkout/20200713_184/15946016061995TDx5_JPEG/review-attachment-d5311fd2-531e-46f7-9825-f0996a30da3f.jpeg?type=f287']
5,깔끔하고 쓰는데 매우좋아요.,[]
5,"엄청난 빠른 배송입니다.
키보드 너무 이쁘네요
키감은 키보드 마다 다른데요.
기계식만의 특유의 감이 너무 좋아요",['https://phinf.pstatic.net/checkout/20200702_166/1593667891712e3qTN_JPEG/image.jpg?type=f287']
5,배송도 빠르게 만족합니다,['https://phinf.pstatic.net/checkout/20200710_258/15943657380898bwG6_JPEG/review-attachment-a1d15c2d-118c-4e09-a755-1b2549a8237c.jpeg?type=f287']
5,좋아요 선없이 깔끔해요,['https://phinf.pstatic.net/checkout/20200710_287/15943718288323Ve0p_JPEG/review-attachment-8bb009f3-456b-4f58-b1d9-e49546a4b3b3.jpeg?type=f287']
5,잘쓸깨요 감사합니당,['https://phinf.pstatic.net/checkout/20200712_156/1594531955585FKBw4_JPEG/review-attachment-7a27196e-5eb3-4166-88fe-49bb7a6a2fab.jpeg?type=f287']
5,배송 빠르고 좋아요~,[]
5,확실히 비싼만큼 키보드 비쥬얼과 키감은 참 좋습니다. 키보드 루프랑 led효과 뽕에 취합니다^^,['https://phinf.pstatic.net/checkout/20200703_208/1593774205501JRbLj_JPEG/review-attachment-056bb8a4-3fb3-4bdd-8872-fd69bf008706.jpeg?type=f287']
5,"무선+텐키리스라 바로 구매했어요. 타건감도 좋고 연결 문제도 없어요.

가장 좋은건 책상이 깔끔해져서 아주 좋아요.

키보드 루프도 있어서 든든하네요",['https://phinf.pstatic.net/checkout/20200629_1/1593404429435O3g4m_JPEG/image.jpg?type=f287']
5,키압이 낮으면서도 키 입력시 클릭감이 있어서 사무용으로도 개인적으로는 최고입니다. 로우프로파일+무선까지 제 취향에 딱 맞는 대체 불가능 제품.,['https://phinf.pstatic.net/checkout/20200703_79/1593739404113kzPnT_JPEG/b3ed2131b8cadaf68e9b19831567bea5.jpeg?type=f287']
5,레오폴드 갈축 적축 쓰고잇고 이번에 처음으로 로지텍 청축 써보는데 가격면만 빼면 좋네요 소리는 생각보다 작아요,[]
5,가격은 비싸지만 가볍고 속도빠르고 led감성에 없는거 빼곤 다있는 로지텍 키보드 . 처음써보는데 좋네요 잘쓸게요,[]
5,배송도 빠르고 제품상태도 좋습니다,['https://phinf.pstatic.net/checkout/20200628_113/15932744648301JQsn_JPEG/20200628_011416.jpg?type=f287']
5,"기계식 키보드 + 무선의 조합을 찾고 있었는데, 이 제품이 딱이네요. 타이핑 느낌도 딱 원하는 느낌입니다.",['https://phinf.pstatic.net/checkout/20200628_159/1593341660083gqRrb_JPEG/KakaoTalk_20200628_195232499.jpg?type=f287']
5,이키보드를 잘 활용할수 있을지 걱정 이지만 잘 써볼랍니다.,[]
5,진짜 대박이예요 제 지역은 옛날부터 로젠택배가 일을 제데로 안 해서 기본 7시고 10까지도 오는데 이번에도 안 오네요 ㅠㅠ 품질은 대 만족 입니다^^,[]
5,키보드 가격도 좋도 제품도 좋고 배송도 빨라요~~^^,[]
5,괜찮아요 좀 쓰는데 별로 그렇게 문제는 없는듯,[]
5,원래도 적축을 좋아해서... 느낌 넘모 조하여 핡,['https://phinf.pstatic.net/checkout/20200622_2/1592814872319gfTPg_JPEG/7406520B-8356-49F3-91D4-C7B82B2DB8CA.jpeg?type=f287']
5,배송빨랐고 여기가 가장 저렴한 것 같습니다.,['https://phinf.pstatic.net/checkout/20200702_123/15936917571591XNLC_JPEG/56f218a54581e5cd8038a2ccf280ccf5.jpeg?type=f287']
5,조금 묵직하고 얇고 소음도 많이 안나고 좋음,[]
5,일단 너무 이쁘고 너무좋아요 무선이라서 진짜 너무좋고 삶의 질이 올라가요 왜 이걸 이제샀나 왜 사기전에 고민했나 고민은 배송만늦출뿐,[]
5,아주 맘에들어요 잘 쓰고 있습니다,[]
5,제가 원하던 키보드 입니ㄷㅏ,[]
5,양품으로 빠르게 배송왔네요~,[]
5,배송빠르고 제품만족합니다.,[]
5,아주 좋네요 추천합니다...,['https://phinf.pstatic.net/checkout/20200623_154/1592877441609oJjIo_JPEG/%C8%BF%B8%AE.jpg?type=f287']
5,딴대보다 싸게 잘 샀어용,[]
5,아주 만족합니다 좋아요,['https://phinf.pstatic.net/checkout/20200626_95/1593155268525YjyV4_JPEG/image.jpg?type=f287']
