star_point,comment,photo
5,"새제품으로 왔습니다. 봉인라벨 잘 붙어있고 비닐포장도 잘 되어있습니다. 박스 손상 흔적도 없고 제품 자체도 깨끗합니다.
그리고 건전지 포함되어서 옵니다. 배려가 기가 막힙니다.

키보드가 생각보다 큽니다. 대략 30cm 정도 되는 것 같습니다. 휴대용으로는 조금 큰 것 같고 스마트 tv 용이나 집에서 노트북 거치하고 사용할 경우에 적합할 것 같습니다. 저는 노트북에 연결해서 사무용으로 쓰려고 샀는데 큼직해서 오히려 타이핑 하기에 굉장히 편하네요. 따로 적응 안해도 오타 거의 안납니다.
타건 느낌 좋습니다. 되게 폭신폭신하고 . 장기간 타이핑이 자주 있는 것이 아니라면 사무용으로도 적합해보입니다.
. 특히 볼륨 조절이 굉장히 수월해서 좋아요. 키패드 위에 있는 폴더 키? 도 유용합니다.

단점으로는 마우스패트 클릭 버튼이.. 처음 쓸때는 뭐랄까... 좀 이상합니다. 보통 클릭버튼처럼 딸깍 딸깍 하는게 아니라 키보드가 유격이 안맞아서 흔들리는 것처럼 덜컥 덜컥하는 소리가 나요.
펑션키를 자주 사용한다면 조금 불편할 것 같네요. 저는 뭘 닫을때 alt f4를 많이 쓰는데, 이 키보드에서는 펑션 키를 사용하려면 오른쪽에 Fn키를 같이 눌러야 합니다. fn 없이 f4를 누르면 절전 모드라서 프로그램 닫으려다 노트북 재워버린게 벌써 세번째네요...

암튼 소소한 단점은 있지만 전반적으로 매우 만족하는 제품입니다.","['https://phinf.pstatic.net/checkout/20201028_224/1603862802153ghTFK_JPEG/review-attachment-814d0847-ae1e-4fc9-8e32-863d34a58e31.jpeg?type=f287', 'https://phinf.pstatic.net/checkout/20201028_233/1603862802215C56f5_JPEG/review-attachment-31c67da6-490d-4d64-8c97-342b458cbdfc.jpeg?type=f287']"
5,배송 빠르게 잘 받았습니다. 스마트티비에서 인터넷검색을 리모콘으로 하다보니 너무 힘들어서 키보드 마우스가 필요해서 거실용으로 쓸만한 제품 찾다가 가격 적당하고 터치패드 일체형이라 구매했어요. 한영전환이 잘되는 앱이 있고 제한되는 앱도 있어서 완전 쾌적한 건 아니지만 브라우징 할 때는 도움이 돼서 좋은 것 같습니다. 리시버를 티비 뒷면에 꽂다보니 감도가 좀 아쉽지만 연장선 하나 사서 노출시키거나 좀 가까이서 쓰면 괜찮습니다. 배터리도 동봉되어 있어서 바로 사용 가능해요.,"['https://phinf.pstatic.net/checkout/20200921_146/1600617244599Id2Aa_JPEG/review-attachment-d3a23038-ae28-4a33-8cd3-7c8e7c38148e.jpeg?type=f287', 'https://phinf.pstatic.net/checkout/20200921_14/1600617266538UFGru_JPEG/review-attachment-cdcb7dd8-7225-4a18-a3cc-e4a13e8c2a1d.jpeg?type=f287', 'https://phinf.pstatic.net/checkout/20200921_40/16006172912859vvGS_JPEG/review-attachment-9025922b-d068-40d9-b40b-5118992c5b47.jpeg?type=f287']"
5,마감 품질도 다른 무선키보드보다 좋구요. 2.4무선이라 블루투스보다 연결이 안정적입니다. 터치패드 감도도 괜찮아서 LG그램 노트북과 비교시 사용성이 비슷할 정도로 편리합니다. 숫자패드는 없지만 대신 터치패드가 필요하신분께 강추합니다.,"['https://phinf.pstatic.net/checkout/20200915_187/160015512856849i4B_JPEG/review-attachment-62f3270a-81bc-4cb1-98aa-40a22fe68915.jpeg?type=f287', 'https://phinf.pstatic.net/checkout/20200915_160/1600155128540O0RDS_JPEG/review-attachment-fd7c428b-5faf-41ae-9cdf-3abec84d60d5.jpeg?type=f287', 'https://phinf.pstatic.net/checkout/20200915_174/1600155128686N2bEk_JPEG/review-attachment-17ca2cce-0707-4e63-940a-f72e4c3eed75.jpeg?type=f287']"
4,기존에 사용하던 무선키보드가 내장 배터리라 좋다고 비싸게 주고샀는데 배터리수명 다하니 교체할방법도 as도 안되 유선처럼 쓰면서 속썩이다 그냥 버렸네요ㅠ 오래쓰기엔 건전지가 최고인듯 다만 좀 마감이 많이 아쉬워요ㅠ 때묻은것 같은 마감과 헐렁거리는 터치감... 윈도쓰니 기능이 좋아서 별점네개ㅎ,"['https://phinf.pstatic.net/checkout/20200714_224/1594719005455oIRwJ_JPEG/review-attachment-062f8224-ddf4-4ab4-ace2-8d2acbff9cd2.jpeg?type=f287', 'https://phinf.pstatic.net/checkout/20200714_265/1594719013179aqqVj_JPEG/review-attachment-561f9e06-b93d-4fc8-9055-c16026dcec3c.jpeg?type=f287']"
4,"듀라셀 건전지가 동봉되어 있습니다.
설명서에 없는 기능으로는
1) FN키 + Caps락 : 펑션키(F1~F12)의 기본 작동을 전환시켜줍니다.
2) FN키 + 스페이스바 : 프린트스크린 키가 작동
그외 특이사항이라면 터치패드가 2점터치라서 3점이나 4점터치는 사용이 불가합니다.
윈도우OS 용으로 MS키보드마우스 센터라는 프로그램을 쓰면 터치패드 스크롤 반전이나 터치패드 상단의 3개 버튼의 동작을 변경할 수 있습니다.
그리고 삼성덱스에서 정상작동 됩니다.",['https://phinf.pstatic.net/checkout/20200915_186/1600167563262aGqWb_JPEG/review-attachment-28439544-7fda-45f1-b1ae-567707768d25.jpg?type=f287']
3,"더 비싸고 기능 더 많은 신상품들 살까하다가 그냥 싼거 샀는데 조금 후회됩니다.
스마트 tv에 쓰려고 산건데 크게 편하지 않네요 볼륨버튼이 먹통인게 제일 아쉽구요
한번에 한 기기씩만 연결돼기 때문에 다른 스마트폰이나 탭에 연결하려면 다시 블루투스 다 잡아줘야돼서 좀 불편합니다
다 알고 불편함 감수하고 저렴한거 골라서 샀기 때문에 크게 불만은 없습니다
기기 자체는 괜찮아요",['https://phinf.pstatic.net/checkout/20200716_50/1594826601980f3JQY_JPEG/review-attachment-8116c386-4a8a-42cc-85fc-4eb3bec0962c.jpeg?type=f287']
5,티비에 수신기 꽂아서 리모콘 대신 검색어 입력하는 용도로 쓰고 있어요. 웹브라우저에선 잘 되고 티비 메뉴마다 조금씩 다르네요. 영문만 되기도 하고 아예 입력 안되는 메뉴도 있네요. 머 그래도 리모콘으로 네이버 검색하는 것 보단 편하게 잘 쓰고 있습니다.,['https://phinf.pstatic.net/checkout/20201029_103/1603903578486aFyQl_JPEG/review-attachment-59ecb4e9-707e-4e4d-8132-bf56e3367c41.jpeg?type=f287']
4,"양옆 길이가 조금 짧아서 어색한 건 있지만 키감도 좋고 작동도 잘되네요! 그리고 옆에 터치패드 있는 것도 재밌고요ㅎㅎ
게임할 때 타자치려고 샀는데 게임용으로 딱 좋은 것 같아요!
가성비 굿이라 만족합니다^^
별은 택배 기사님이 물건을 던지고 가셔서ㅠㅠ
그래서 하나 뺐습니다.
집에 있는데 뭐가 대문으로 날아와서 쿵 부딪히는 소리가 들리더라고요.
파손주의 스티커를 붙혀주시거나,
배송 업체에 주의 좀 주셨으면 좋겠어요ㅠ",['https://phinf.pstatic.net/checkout/20200917_46/1600333169838xUHba_JPEG/review-attachment-6e9b06ef-85fa-4071-9218-7c71e2094d57.jpeg?type=f287']
4,"삼성 스마트TV용으로 사용하기 위해 구입하였습니다. 결정적인 단점부터 말하자면 ( 제품의 불량이 아닙니다. 삼성TV와의 호환성 문제입니다) 좌측에 배열되어 있는 볼륨조절키와 음소거 키는 삼성 스마트TV와의 연결에서 작동하지 않습니다. 리모컨 대신 쓰려고 했는데 볼륨조절키가 먹지 않는다는 건 좀 충격입니다. 이건 키보드의 문제가 아니고 삼성tv와의 호환성 문제입니다. 삼성서비스센터에 문의하니 대부분의 무선키보드는 연결에 이상이 없으나 각 키보드들의 특수키들의 호환성까지는 확인하지 않는다 그래서 시중에 있는 어느 무선키보드도 100퍼센트 호환을 장담할 수 있는 제품이 없다 삼성 자체에서 스마트TV용 무선키보드를 생산했었으나 단종되었고 해당제품도 2015년 이전 제작된 TV만 호환되고 그 이후 제품들과는 호환이 안된다 라고 하네요. 즉 삼성스마트TV에 연결하여 쓰실 분들은 특수키가 안먹힌다는 점 알고 구입하시면 되겠습니다.그리고 이 제품에서 삼성tv연결시 볼륨조절기능을 쓰려면 fn 누르고 f8,f9,f10을 누르면 각각 음소거,볼륨-,볼륨+로 작동합니다. 삼성tv의 OS에서 볼륨키를 F8,9,10으로 세팅해놨다고 하네요. 그런데 마소 올인원키보드는 펑션키를 사용하려면 반드시 fn키를 누르고 f1~12까지 눌러야 하기 때문에 굉장히 불편합니다. fn키를 누르지 않고 f1~12를 바로 사용할 수 있는 소프트웨어적인 키맵핑 프로그램이 반드시 필요합니다. 로지텍 제품은 이게 되거든요.제품의 장점은 키 간격이 조금씩 벌어져 있어 오타발생률이 조금 낮아지며 그렇게 완전 싼마이제품으로는 보이지는 않는다는 점입니다. 터치패드도 로지텍제품에 비하여 넓은 점도 장점입니다.단점으로는 키보드를 열심히 치다보면 타자가 씹혀서 초성중성종성이 다 따로 쳐지는 경우가 자주 발생합니다. 어쩔 때는 괜찮다가 어쩔 때는 안괜찮다가 하는 걸 보면 동글 수신률에 문제가 있지 않나 생각됩니다. 수신거리 10m라고 하긴 하는데 그건 연결이 가능한 최대거리를 말하는 것 같고 원활히 쓰려면 usb연장선으로 동글을 당겨서 키보드 바로 앞에 갖다놓고 써야 할 겁니다. 장애물이 없는 1.5m거리에서도 해당 증상은 자주 발생합니다.또다른 단점으로 터치패드의 조작감은 별로이고 이건 이정도 가격대에서 기대하는 게 무리입니다.이 제품은 메인으로 사용하기에 너무 때문에 들고 다니거나 호환되는 tv에 연결하여 쓰는 것이 가장 좋을 것 같습니다.",[]
5,"정말 제가 원하던 딱 그 키보드입니다~~
혹시나 안드로이드와 물려서 쓰실 분들은 걱정 안하셔도 될 것 같아요.
너무나 잘 작동 합니다~~
참고로 저는 덱스환경에서 사용하려고 구매했는데 너무나 잘 작동합니다~~
오른쪽 왼쪽 창 분활할때 쓰는 단축키가... 안먹기는 하는데
그대신 새로운 단축키들이 활욜가능하네요~
굿굿!",['https://phinf.pstatic.net/checkout/20200519_166/1589884604988zVcEN_JPEG/20200519_193348.jpg?type=f287']
4,"생각보다 괜찮은 제품이에요. 이 가격에 이런 제품이 있길래 굉장히 저가형일 것이라고 생각했습니다. 제 예상은 맞았습니다. 바디가 조금만 잡아도 삐걱거리면서 쉽게 쉽게 휘어버리고, 트랙패드는 굉장히 깊이 눌리는데, 그 정도가 비정상적이라고 생각합니다. 그래도 작동은 잘 돼요.",[]
2,"일단 타건감이 그다지 좋지 않네요. 전에 쓰던 무선 키보드가 MS ARC 키보드여서 그 독특한 키감이 좋아서 같은 ms 걸로 샀는데 굉장히 느슨하면서 약간 TV 리모콘같은 키감이고요. 옆에 터치패드는 실수로 건드리는 경우가 많네요. 백스페이스 칠때 그리고 스페이스바가 너무 작아서 치기 불편하네요. 간단히 침대에서 프로젝터로 영화볼때나 간단한 검색할 때는 마우스 일체형이라서 사용할 만한 제품이네요. 이 키보드를 메인 키보드로 하는 것은 매우 비추이고, 간단히 침대에서 쓸만한 마우스 통합된 키보드 정도로 쓸 정도입니다.",[]
1,LG 스마트 TV 와 같이 사용하기 위해서 샀습니다. 제 불찰이긴 한데 결과적으로 작동이 안 됩니다. BTV 쓰고 있는데 BTV 어플로 같이 호환이 되지 않습니다... LG TV 내 구글 어플에서는 됩니다. 그런데 구글 앱을 써서 뭘 보는 게 없잖아요... 유투브 어플로도 안 됩니다. 유선 키보드로 해도 안 됩니다... 미리 확인해보고 샀어야 하는데 아무튼 돈 ㅈㄹ 한 셈이 되었네요.... 컴퓨터에 연결해서 쓰려고 했는데 자판이 너무 작고 스페이스나 엔터키가 생각보다 작고 사용하기 너무 불편하여 쓸수가 없습니다...;;; 중고로 팔고 싶지만 팔리지도 않을 것 같고... 에혀...,[]
3,"만듦세나 마감은 괜찮은데 장애물이 있는경우 신호가 씹히는 경우가 있네요. 고가의 제품과 비교라 좀 그렇지만, G903 동글 바로옆에 키보드 동글이 있는데, 903은 문제 없는데 키보드만 씹히는 경우가 발생합니다.

수신 잘 될땐 터치 감도도 괜찮고 누워서 유툽이나 영화보기엔 좋네요",['https://phinf.pstatic.net/checkout/20200114_278/15790088584440OCgn_JPEG/KakaoTalk_20200112_125138752.jpg?type=f287']
4,"티비로 유튜브를 이용 중인데,
리모컨으로는 불편해서 해당 제품을 구입하였는데
전반적으로는 만족합니다.
다만, 가격대가 저렴하다 보니 제품마감 상태가 다소 아쉽고, 수신기가 티비 뒤편에 있다보니 수신 면에서 다소 불안정해서 그런지 타자시 반응이 늦거나 잘못 입력되는 측면이 있습니다.",['https://shopping-phinf.pstatic.net/20190823_15/c995ba48-e96b-4e15-8395-1160e332d302.jpg?type=f287']
4,"멀티터치는 감도가 별로지만 쓸만합니다.
리시버를 잃어버렸습니다.
Q&A에서 마소 고객센터에 물어보라고 나와있어서
따로 구매할 수 있는지 마소 고객센터에 전화를 5일넘게 하루 3번씩 전화했는데 받질 않네요...
버리고 유니파잉 있는 로지텍 사야겠어요...",[]
4,TV(LG)에서 쓰려구 구매했습니다...패드는 그렇저럭.. 리모콘으로 사용하는것 보나는 훨신 좋구요..윈도우키로 홈메뉴 불러올수 있구요..볼륨버튼 및 음소거 버튼 동작이내요..페이지 업다운 버튼으로 체널변경가능하네요..통합검색등에서 한영키도 잘 동작하구요...단.. 넷플렉스와 유튜브 검색 메뉴에서 한글이 안되네요...쉬프트 스페이스도 안되구용...걍 통합겁색으로 하면 넷플렉스와 유튜브도 검색걸과로 나오길레.. 그거로 써네요.. 방법을 찾아 봤는데.. 제와 같은 고민을 하시는 분들은 있는데.. 방법은 아직인듯요..그래도 로그인 할때나 인터넷 할때는 편하네요..,[]
3,"흠.... 일단은... 키패드와, 키보드가 하나로 되어있다는

것이 장점이고, 가격도 장점이라고 봅니다.

하지만, 키패드가 작은편이라, 좀더넓었으면 하는 아쉬움이 많습니다.

키감은 가격대를 생각해보면 그냥 무난한것 같습니다.

왼쪽에 간편 버튼을 넣어줘서 그건 좋았던것같습니다.",[]
3,키보드 박스에 테이프가 개봉되어있고 박스가 열려있는채로 배송이 왔습니다. 내부에 있는 포장들은 개봉이 안됐던거 같긴한데 저가 제품이라도 신경좀 더 써주셨으면 좋겠습니다. 돈주고 샀는데 남이 쓰던거 받은 기분이라 좀 찜찝하네요.. 문제는 없는거 같으니 그냥 사용하도록 하겠습니다. 키감은 마음데 들고 터치패드는 좋지 않지만 이 가격대에서는 만족할 정도 입니다.,['https://phinf.pstatic.net/checkout/20190403_123/1554219577540plKCD_JPEG/20190402_231126.jpg?type=f287']
5,키감 동급 무선에비해 가벼우면서도 쫀득거리고 자판크기가 있어 그런대로 오타는 적습니다. 크기도작아 요구조건에맞지만 터치패드가 문제가 좀 있네요. 윈8최적이라 제스쳐가 좀다르고 터치인식도 좀 별로이며 터치패드가 붕뜬 느낌으로 되어있습니다. 다만 사용에 큰 문제는 없습니다,"['https://shopping-phinf.pstatic.net/20200417_27/4b1b1211-9fc8-436a-b8cd-c99d19db6827.jpg?type=f287', 'https://shopping-phinf.pstatic.net/20200417_9/b59546ad-d98a-40d0-88cc-d7628428f4dc.jpg?type=f287', 'https://shopping-phinf.pstatic.net/20200417_28/68ab6952-489a-4d3f-a676-99a83d4b34a3.jpg?type=f287', 'https://shopping-phinf.pstatic.net/20200417_21/53da0174-4dde-40df-81c8-0e82423712c8.jpg?type=f287', 'https://shopping-phinf.pstatic.net/20200417_28/bcbbd7bb-3ea1-44c0-9020-652e6c4c9349.jpg?type=f287']"
4,전에 샀다가 너무 괜찮아서 친구 주려고 재구마했습니다. 왠만한 무선 키보드 정말 고장 잘나고 그 전에 꽤 높은 편인 이층침대에서 쓰다가 많이 떨어뜨려먹었는데 웬만해선 멀쩡합니다. 한번은 아주 대차게 낙하해서 키 하나가 빠진적 있었는데 다시 잘 끼워지더라구요. 건전지도 그 전에 쓰던것보다 훨씬 오래가요,['https://phinf.pstatic.net/checkout/20190325_135/1553456773674RYRyp_JPEG/F648D9CF-D5C8-4E28-AAF3-47490C409BE5.jpeg?type=f287']
5,"사실 가격이 저렴하여 퀄리티에대하여 신경을 쓰지 않았습니다제품 받아보니 쓸만합니다. 장점-마우스사용이 참 편리하다, 키감이 괜찮다, 재질이 플라스틱이지만 견고한 느낌이 난다.. 등등 단점-펑션키를 눌러야만 F1~F12를 사용할수 있다..(이점은 리뷰를 통해 알고 샀지만..실제로 사용해본 큰 단점입니다.)",[]
5,"올인원이라 매우 편리하구요, 자판도 아주 조용하여 밤 중에 타이핑 하는데 부담이 없습니다. 스크롤 기능이 없어 아쉽다는 평도 봤는데, 손가락 두개를 올려 위 아래로 문지르면 스크롤 기능이 되네요. 아이들이 있어서 마우스 따로 쓰기도 불편한데, 아주 심플하고 편리합니다.",[]
4,이런거 첨이라 어색하지만 잘 사용해보려고요마우스 쓰다가 패드로 조정하는건 정확성이 좀 떨어지긴하지만 그건 감수하고 써야겠죵 나름 편의성고려한 디자인같아요 노트북쓸때 좀 화면과 거리두고 쓸수있을듯 ㅎ포장 엄청던던히 해놓으셨어요 무사히 잘 받아서 잘사용해보겠습니다,['https://shopping-phinf.pstatic.net/20190128_7/eb8ea0ba-1831-48fa-bf21-bebe77896037.jpg?type=f287']
5,"확실한 원격동작을 원하시는 분에게.. 제가 컴퓨터에서 약 3미터 가량 떨어진 곳에 앉아 키보드를 사용합니다. 유선은 3미터 가량 떨어지기도 힘들고 해서 진짜 찾고 찾아서 이 제품으로 결정했는데, 원격 동작에서는 확실히 만족감을 느낍니다.키보드 소리나 느낌은 매우 조용하고 부드럽습니다. 미니 키보드의 특징을 그대로 보여주는..텐키리스이니 숫자패드 자주 이용하시는 분들은 감안하세요. 저도 약간 적응이 안되네요.트랙패드는 민감한 편은 아닌것 같습니다. 마우스와 같은 세심한 동작이나 빠른 동작을 보여주기에는 많은 한계가 있는 것 같습니다.저는 기기 개수를 줄이고 선을 없애는 방향으로 결정했기에 감안해서 사용하고 있습니다만, 불편함이 없다고는 못하겠네요.뭐, 적응해 가고 있고 익숙해지면 별일 아닌 일이 되겠지만요. 여하튼, 이만한 가격에 이정도 품질, 그리고 믿을 만한 마이크로소프트 제품이니 적극 추천합니다.(X지텍 제품을 예전에는 좋아했는데 서비스 문제 얘기를 많이 듣고 선택을 안했습니다. 매우 안타깝습니다.)",[]
5,왼쪽 상단에 마우스 버튼도 있어서 터치 드래그 할때 편하고 패드 자체에도 버튼 있음 건전지로 작동 되는지라 교체 편하고 오래감전원 버튼은 오른쪽 옆구리에 있음블루투스가 아니라서 그렇지만 빨리 접속되고 누워서 컴터 하기도 좋음,[]
3,집에서 사용하기 위해서 주문했습니다. 타이핑 해보니 조금 빡빡한 듯한 느낌입니다. 타이핑할때 경쾌하다면 느 낌은 없습니다. 트랙패드와 키보드를 한번에 쓰실 분들에게 추천하지만 사무용이나 타이핑을 많이 하시는 분들에게 추천하기는 어려울 것 같습니다.,['https://phinf.pstatic.net/checkout/20190125_17/hwangom_15484052777643gUjd_JPEG/image.jpg?type=f287']
5,"가성비가 매우 좋다고 생각합니다. 터치패드가 아무래도 마우스보다는 조작이 힘든데, 왼쪽 상단에 마우스 왼쪽키가 버튼으로 따로 있어서 조작이 훨씬 좋습니다. 볼륨도 버튼으로 컨트롤 할 수 있어서 더욱 좋네요.키감도 이정도면 나쁘지 않고 여러 면에서 매우 만족합니다.",[]
4,만족합니다 만족합니다 배송은 빨라서 좋아요 다만 포장상태는 영 아니더라고요 그리고 마이크로소프트라서 손 마우스 감도가 좋을줄 알았는데 생각보단 민감하지 않고 수신본체에서 멀어지면 수신이 안되는 점 참고하시길 바랍니다,[]
3,디자인 깔끔하고 괜찮음하지만 키보드 부분에서 펑션키를 자주 쓰는 사람에게는 불편할 수도 있습나다.상단 f1~f12... 같은 경우 펑션(fn)키를 누르고 눌러야 작동 합니다. 그냥 누르면 각 키의 왼쪽에 놓인 기능 키가 작동합니다.터치패드... 감도가 별로입니다. 당황했습니다 ㅎㅎ키보드 좌측에 놓인 마우스 좌클릭은 좋군요.터치패드 상단에 놓인 키값 설정하는 기능은 좋고.그래서 제 점수는요. 플러스 마이너스 땡땡. 별점 3점 드립니다.거실에서 동영상 감상용으로 쓰는 노트북에서는 꽤 매력적인 아이템이라 생각합니다.,[]
5,"배송도 빠르고 너무좋네요
제품명에 +마우스패드라고 써있어서 사은품으로 주는건가했는데
키보드만 들어있네요.. 제품명에 마우스패드는 왜적으신건지 모르겠네요
뭐 제품은 좋습니다~ 때마침 이벤트라 여러개 장만해놨네요 ㅎㅎ",[]
5,"만족합니다. 키감이 의외로 만족스럽습니다. 터치패드도 아주 민감하진 않지만 지 역할을 하구요. 이게 미디어키보드라 그런지 펑션키가 모두 디폴트로 미디어 기능으로 세팅되어 있어서, 불편하실 분들도 있겠습니다. 소프트웨어에서 약간의 변경은 가능하던데, 완전히 F1~키로 변경하는건 저는 찾지 못했습니다.. 이점 참고하세요.",[]
3,키감도 좋고 스페이스바 크기도 적절합니다. 타자쪽은 우수한데 터치패드는 마우스를 대용하기에는 많이 부족합니다. 추가로 마우스를 들이는 순간 쓸모가 사라집니다. 차라리 터치패드를 빼고 소형 키보드로 출시함이 어떨까 싶습니다.,[]
4,"기본적인 기능은 부족한게 없지만,세세한 기능을 사용자화 시키는 기능은 부족합니다.제일 큰 불편은 하드웨어적 결함인듯 한데, 터치패드쪽 아랫부분이 인체와 닿아있을때는 키보드와 컴퓨터의 통신이 제대로 이루어지지 않습니다. 터치와 키보드 입력이 제대로 안됩니다.펑션키 커스터마이징도 좀 더 자유롭게 하고싶지만, 지원되지 않습니다.적당한 가격에 적당한 기능을 필요로 하신다면 OK,섬세한 설정까지 원하신다면 추천하지 않습니다....ㄷㄷㄷ",['https://shopping-phinf.pstatic.net/20200417_6/97669243-feca-4114-ac78-6451051d6b4e.jpg?type=f287']
5,"디자인 이쁘고, 미니멈해 좋기도 한데.. 작아서 좋기도, 나쁘기도 한...이전 쓰던 키보드 보다 많이 작아서, 오타가 계속 나는 중인데, 요건 적응하면 괜찮아지려나요. ㅎㅎ;;근데 일반 키보드 사이즈보다 많이 작긴 하네요.델키. 엔터키. 등 모든 키 사이즈가 아주 작고.다 작아서, 키 사이 폭도 좁고, 버벅대다보니 괜히 컴맹된 기분 들기도 하고. 이를 어쩔..;;ㅎㅎ;;",[]
4,"마우스 오른쪽 키가 키보드 왼쪽 상단에도 있습니다 키보드 마우스는 소모품이라 여겨서 좋은거 쓰지 않습니다.적당한 가격 적당한 사용감, 조용하고 적당한 키감입니다. 가장 좋은건 잘 안쓰는 숫자패드 대신 터치바가 있다는거고요. 이게 나쁘지도 않지만 좋지도 않습니다. 터치감은 적당한데 별 기능이 없다는건 아쉽고요. 출시된 시기나 가격을 보면 쓸만한편에 속합니다.가장 좋은건 왼쪽 상단에 오른쪽 클릭키가 따로 또 있어서. 제일 많이 쓰는 오른손 검지 손가락 부담이 덜합니다. 추천합니다.",[]
4,역시 맥보다는 pc에서 더 괜찮을 것 같네요. 맥에서도 기본적인 동작은 잘 됩니다. 단 터치패드 드래그는 좀 짜증나네요. 그리고 맥에서는 멀티터치가 손가락 2개까지 밖에 안됩니다. 그리고 서드파티에서 나온 마우스 설정 툴을 쓰지 않으면 스크롤 방향을 바꿀 수가 없습니다. 맥이 스크롤 방향이 반대여서 유료 마우스 설정 툴 안 쓰는 맥 사용자들은 구매 시 주의 요망. 건전지 커버 열면 리시버 넣는 공간이 있는데 자석으로 리시버가 착 붙습니다. 나름 신경쓴 부분. ㅋ,[]
4,"괜찮아요 일단 단점부터 말하면 윈도우 8 때부터 나온거라 그런지 윈10에 있는 대부분의 트랙패드 제스쳐들이 잘 작동하지 않습니다., 하지만 그것 빼고 기본적인 기능들은 다 잘 작동하기 때문에 현란한 조작을 하지 않고 마우스 없이 사용한다면 괜찮지 싶습니다.",[]
5,"저렴하게 구입했구요, 빠르게 받았습니다.키보드는 조용하면서 괜찮게 느껴지구요,터치패드는 반응이 살짝 느린 편으로 생각됩니다.터치패드 윗쪽에 있는 세 개의 버튼은기본값과 다르게 사용자가 설정이 가능합니다.잘 쓰겠습니다. 고맙습니다.",['https://shopping-phinf.pstatic.net/20200417_3/da8a11bf-d3d5-4453-b749-2893efb09e76.jpg?type=f287']
