star_point,comment,photo
5,키보드 완전 대 만족입니다. 색도 너무 예쁘고 깔끔하고 키보드 소음도 많지 않고 타자눌르지는 감도 좋아요. 다만 마우스가 연결도 잘되고 좋은데 뒷부분 건전지 넣은 부분 덮개 잘 안열립니다.. 조금더 쉽게 여는 방법을 연구해서 다시 만드시길...!,"['https://phinf.pstatic.net/checkout/20200905_222/1599284359683Mzeog_JPEG/review-attachment-8dacfac3-94eb-4c8e-b9f6-8b27af7a4fed.jpeg?type=f287', 'https://phinf.pstatic.net/checkout/20200905_177/1599284379780xTpqo_JPEG/review-attachment-64939184-8596-4ce7-a8e4-9830dff98808.jpeg?type=f287']"
5,"기계식 키보드 계열로 글을 계속 쓰다보니 너무 시끄러워서 펜터그래프를 샀습니다. 타건 소리가 다른 분들의 리뷰 영상에서 들리는 것 처럼 날카롭지 않더군요. 아무래도 스마트폰 마이크 특성상 더 날카롭게 녹음된 것 같습니다. 저는 더 둥근 느낌으로 들리네요. 첫 인상은 '단순 비교로 소리 크기만 봤을 때 엄청 작지는 않구나' 였는데요, 좀 더 써보니 기계식 키보드는 세게 치면 소리가 그만큼 커지는데에 반해 이번 키보드는 별로 커지지 않는 것 같습니다. 애초에 세게 칠 필요성 자체가 없는 키보드이기도 하구요.

하지만 Alt버튼보다 한자 버튼이 큰 것은 좀 아쉽습니다. 아직 적응이 덜 되어서 자꾸 한자 버튼을 누르게 되네요. 각 키마다 동그랗게 음푹 들어가있는 것이 상품 설명에서 보이는 것 처럼 충분히 들어가게 느껴지지는 않습니다. 빛에 비춰보지 않으면 눈으로도 잘 보이지 않는 만큼 손가락으로 그 차이가 유의미하게 다가오지는 않네요. 워낙 얇은 키보드니 더 어렵긴 하겠다 싶습니다. 키보드가 애초에 방수 같은 튼튼함을 보장하는 컨셉이 아니긴 하지만, 쓰다보니 빵 부스러기 같은 게 들어가면 금새 망가질까봐 조심하게 되긴 합니다. 만약 들어가도 쉽게 뺄 수 있는 형태는 아니니까 걱정이 되네요. 좀 더 써봐야겠지요.

색상으로 실버와 화이트(약간 노란 빛이 도는 눈이 편한 화이트입니다.)를 사용하셨는데 이런 류의 제품들이 실제로 봤을 때 자칫 싸보이는 경향이 있었습니다만, 이 제품은 예쁘게 보이네요. 색 뿐 아니라 키 배치의 균형이 잘 맞아 있습니다.

낮은 키캡 특성상 오타율이 늘지 않을까 했는데 제 손가락에는 오히려 이게 더 잘 맞나 싶습니다. 오타율이 줄고 타수가 는 것 같아요. 힘을 안 줘도 입력 잘 되니까 그런가 봅니다.

개인적으로 비프렌드라는 브랜드에 좋은 관심이 생긴 것 같습니다. 조금 더 믿고 사지 않을까 싶네요. :)",[]
5,"펜타그래프를 산 이유가
1. 깊게 눌러서 손가락 무리주는 거 싫어함(코드 짜는데 손가락 아작남)
2. LED 빤짝이 무조건 없어야함(빤짝거리는게 거슬림)
3. 내가 소리에 민감해서 소리가 작아야 함
4. 휴대용으로 쓸거라서 얇아야 함

이런 이유인데 이런 요건 충족하는 ms 서피스 키보드나 로지텍 mx키보드를 굳이 14만원이나 주고 사야 하나 생각했습니다(학생이라 그럴 돈도 없고...). 그래서 이것저것 알아보다 이걸 구매하게 되었고 위의 네가지 조건을 충족해서 좋습니다. 노트북처럼 스르륵 쳐도 되서 좋고 . 제가 리눅스 유저라 맥이랑 윈도우 환경에서 테스트를 하지 못해 기능키에 대한 리뷰는 못하지만 리눅스 유저라면 상단의 기능키 커마해서 바로 쓸 수 있습니다. 그리고 4만원이란 가격도 진짜 만족스럽습니다.
오자마자 바로 쓴 후기이기 때문에 한달 사용하면 좀 단점도 보이겠지만 일단 원 목적은 달성해서 기분 좋습니다. 기계식 키보드가 판치는 시대에 저처럼 조용하럼고 부드러운 타자와 LED없는 키보드를 원하는 사람이면 추천합니다.",['https://phinf.pstatic.net/checkout/20191022_18/1571751511404g04tr_JPEG/mail.naver.com.jpeg?type=f287']
5,"한달 써보고 올립니다. 키감 좋고요, 디자인 군더더기없이 매우 마음에 듭니다. 다른 유사 제품은 뭔가 한군데 마음에 들지 않더라고요. 뜬금없이 이상한 로고가 있거나...완성도 높은 키보드입니다. 조금 비싸도 디자인과 퀄리티를 추구하는 분들에게 강추해요.",['https://phinf.pstatic.net/checkout/20200921_59/1600698705097bUej7_JPEG/review-attachment-81938190-e306-4d4d-af32-184e2703e03d.jpeg?type=f287']
4,우선 디자인이 너무 맘에 들어서 구매했어요 키보드 키 크기가 제가 생각했던것보다 조금 더 커서 더 맘에 들었구요 무소음까지는 아니고 노트북 타자 소리라고 생각하시면 될 거 같아요 요샌 무선 키보드를 다들 사용하시지만 저는 굳이 뭐 ㅎ 그래서 유선이어도 샀는데 주변 분들이 다 제꺼 보고 예쁘다고 사고 싶지만 유선이라 아쉽다고 하셨어요 ~~ 키 하나가 기스가 있어서 문의드렸는데 키보드를 다시 보내서 확인후 교환해주신다고 하셔서 ... . 이미 키보드 사용중이고 책상 세팅도 다 했고.. 일을 해야 하는 입장이라 ㅜ 그냥 사용하기로 했어요 고부분이 좀 아쉽네요~ 키보드는 암튼 엄청 맘에들어요~~,[]
5,"오래전부터 꾸준히 비프렌드 키보드만 사용하고 있습니다. 워낙 덤벙거려서 음료수를 자주 끼얹는 바람에 자주 구매하는데 이만한게 없어요..
집에서 맥이랑 윈도우 같이 사용하게 돼서 겸용 키보드 처음으로 구매해봤는데 투인원이라 정말 편합니다!!",['https://phinf.pstatic.net/checkout/20201006_130/1601995903154gOMpy_JPEG/review-attachment-6234f291-1fcb-4101-ad67-8ce572a46eca.jpeg?type=f287']
3,키보드는 편하고 좋아요 alt 키가 불편한건 어쩔 수 없지만 다른 사 키보드보다 디자인이나 재질에 있어서 가장 맘에 들어서 샀고 만족은 합니다! 키감도 부드럽고 좋습니다. 아쉬운 점은 키스킨이 없고 하얀색이 아니라 상아색같은 누리끼리한 감이 좀 있네요. 그리고 가장 사람들이 많이 말하는 배송 문제는 여전히 안고쳐지나봐요.. 너무 불안하게 오네요 포장 신경 좀 써주시길..,"['https://phinf.pstatic.net/checkout/20190807_284/1565150317924ciSs6_JPEG/1A8D701E-F1D7-4AFA-A99B-55541287A006.jpeg?type=f287', 'https://phinf.pstatic.net/checkout/20190807_202/1565150318224Umgpc_JPEG/2C50630D-51F8-471E-80C7-67B19710376C.jpeg?type=f287', 'https://phinf.pstatic.net/checkout/20190807_172/156515031817485KSW_JPEG/48EF16E2-C7BA-491E-BB1C-A189CF2FC35B.jpeg?type=f287']"
5,"통 알루미늄, 키감, 자판 디자인, 인쇄상태 모두 상급인 것 같습니다.
백스페이스 위의 위험한 절전모드 버튼은 펌웨어 업데이트로 펑션키를 같이 눌러야만 실행되게 바꿀수 있습니다.
개인적으로 키스킨을 사고 싶었는데 곧 나오다고 하니 기다려보겠습니다.
통짜라 그런가 세게 타이핑해도 떨림없이 탄탄하게 받쳐주는 느낌이 있어 세게 타이핑해도 재밌네요 타자치는 맛이 좋아요
위에 기능키들 아주 좋네요 노트북 쓰시는 분에게는 아주 찰떡이에요",[]
5,키보드가 깔끔한게 좋습니다. 단점은 설명이 자세하게 써있지않아 csr에 불이 들어오니 한자/한글이 바뀌지않고 시작메뉴가 자꾸 뜨는 오류가 있었는데 불량인줄 알았는데 csr바로밑이 키를 길게 꾹~ 눌르고 있으니 불이 꺼지고 작동이 되어 오류가 나지 않았습니다.,[]
4,"키감은 쏘쏘해여' 디자인이 너무 맘에 들어요
깔끔하고 적당한 무게로 덜컹거리지 않고
쓰거먼 로지텍쓰다가 갑자기 확 밝아진 기분임당
다만 배송이 ㅠ 조콤 늦었어요
쿠팡 로켓배송시킬려다가 본사에서 구입하는게 좋을거같아서 산건데 이부분이 좀 아쉬워오!",['https://phinf.pstatic.net/checkout/20200716_164/1594870770272AjLIo_JPEG/review-attachment-5bf94213-b41e-4a4f-bcd6-2f1de99f8f86.jpeg?type=f287']
5,"키감도 좋고, 연결도 바로 되네요! 다른 분들은 백스페이스 위에 전원버튼 실수로 누르면 꺼진다고 하던데, 저는 펌웨어 설치 안했는데도 눌러도 안꺼지네요 ㅋㅋㅋ 기능이 안되는건지 삭제된건지 모르겠지만 안되서 오히려 다행인듯하네요. 아무튼 전에 쓰던 키보드보다 조금 묵직한 감이 있긴한데 디자인도 이쁘고 맘에 들어요!","['https://phinf.pstatic.net/image.nmv/shopnbuyer_2019_11_07_0/e4823744-0103-11ea-bcc3-505dacfbaa5c_03.jpg?type=f287', 'https://phinf.pstatic.net/checkout/20191107_261/1573092672196vQQwb_JPEG/D983D2C9-0973-4EE1-9AD4-3E2F87EB762C.jpeg?type=f287']"
5,"비슷한 제품을 써봤는데(아이**) 이제품은 쎄게쳐도 딱딱하는 소리가 좀 부드러운것 같습니다. 일단 키 배열과 각 키별로 모서리 라운드 진것, 각 키별로 약간 파여있어서 타자시 키감이 더 좋은것 같습니다. 다만 엔터키가 약간 작은것이 적응이 안됩니다.(전에쓰던게 엔터키가 큼) 그리고 왼쪽 alt 키를 많이 쓰는편인데 배열이 한자 자판이 조금 커서 왼쪽으로 쏠리다보니 손가락을 왼쪽으로 더 가야한다는 불편함(익숙함 때문에)이 있지만 적응되면 괜찮을것 같습니다. 알류미늄 바디라 약간 무거운데 뭐 들도 다닐것도 아니고 오히려 무게감있게 버텨줘서 움직이지 않으니 좋아요. 알류미늄 바디라 아주 견고하고 좋습니다. 이때까지 샀던 어느 키보드보다 좋은것 같습니다. 굿!!!","['https://phinf.pstatic.net/image.nmv/shopnbuyer_2019_04_22_0/e137e65f-64c6-11e9-b4c3-48df3726a06a_09.jpg?type=f287', 'https://phinf.pstatic.net/checkout/20190422_244/1555914080600tI3Jj_JPEG/KakaoTalk_20190422_151126676.jpg?type=f287']"
5,예뻐요! 사무실 책상엔 무조건 깔끔한 디자인의 물건만 올려두려 하고 있는데 딱 제가 원하는 느낌의 키보드네요. 키감도 무척 부드럽고 손에 힘이 많이 안 들어가서 문서작업을 많이 하는 제게 적합한 키보드예요. 소음도 적어서 사무용으로 딱인 것 같습니다,['https://phinf.pstatic.net/checkout/20200428_54/1588069974129BIDFa_JPEG/0FCD36F3-9636-4703-9118-EDC40249B4EE.jpeg?type=f287']
4,"키감 편안하고 디자인 예뻐요. 알미늄이라 묵직해서 안 움직이고요. 단점이 있다면 왼쪽 컨트롤키, 알트키가 작아서 자주 쓰는 사람 입장에서는 아쉽네요. 스페이스바와 한자키 크기를 줄이는 게 나은데요. 소음은 기계식만큼 심하지는 않지만 약간 있어요.
사은품으로 받은 케이블정리 집업..그것은 냄새가 심해서 버렸어요. 단순한 폴리에스터 소재였다면 냄새가 덜 났을 텐데 두툼한 것을 보니 폴리우레탄 폼이 들어가 있어서 냄새가 난 것 같아요.",['https://phinf.pstatic.net/checkout/20191130_246/1575080049003rhuir_JPEG/20191130_111309.jpg?type=f287']
4,"배송괜찮았고 포장은 좀 불안해보였긴하지만 손상없이 잘 받았습니다. 디자인이나 크기가 컴펙트하여 예쁘고 좋은데 커버가 제작되지 않고 다른 커버로도 호환이 불가한 것은 단점인듯 합니다.
먼지도 문제지만 흰색이라서 쉽게 변색되거나 때탐 때문에 오랜기간 사용할수 있을까 하는 생각에 아쉬움이 남습니다.
아직 많이 사용해보진 않았지만 사용중에 불편함은 없네요. 잘 쓰겠습니다~!",['https://phinf.pstatic.net/checkout/20200113_134/1578874476176EAVOB_JPEG/20200111_145146.jpg?type=f287']
5,"배송빨랐구여~~키감도 너무 부드럽고 손가락에 쩍쩍 붙네여~
청축키보드쓰다가 작업할땐 너무시끄러워서 작업할때만 쓰려고 구매했는데 금방적응되고
무엇보다 디자인이 아주 깔끔하고 세련되서 좋았어요~
전 다시 재구매 의사 100%입니당~^^
많이파세용~^^",[]
5,전에 i-rocks의 알루미늄 키보드를 좋아라 쓴 적이 있지요. 그런데 표면에 미세하게 전기가 흐르는 느낌은 별로더군요. 이번 키보드는 자판 표면부터 테두리가 날카롭지 않게 처리한 것까지 세밀함이 참 좋습니다. 팬터그래프 방식을 선호하시는 분들에게 추천하고 싶습니다.,[]
5,"아직 사용전이지만 소음도 적은거 같고 디자인도 깔끔하니 마음에 들어요.
포장도 꼼꼼히 오고 배송도 빨라서 너무 좋습니다.
기존에 사용하던 사무실 키보드가 소음이 너무 심해서 눈치보였는데, 이걸로 바꾸면 눈치 안봐도 되겠어요!ㅎㅎ",[]
5,"확실히 무게감이 있어서 밀리지 않습니다.

외관도 고급스럽고, 키감도 쫀득하네요.

생각보다 타건음은 큰 편입니다.

사진 보시면 아시겠지만, 키스킨을 씌웠어요. 이거면 얼추 맞겠다 싶은 키스킨을 구매해봤는데, 소름끼칠정도로 딱 맞네요.",['https://phinf.pstatic.net/checkout/20200104_65/1578131404314sj2SW_JPEG/%B4%D9%BF%EE%B7%CE%B5%E5.jpg?type=f287']
4,애플 감성ㅋㅋ 디자인이 일단 너무 이뻐서 골랐는데 키감도 나쁘지 않고요! 애플이랑 호환되는게 좋아요. 맨처음엔 맥용으로되서 한영키 안돌아가서 좀 헤맸는데 상세페이지 설명읽고 해결했습니다! 다만 백스페이스 위에 있는 종료키 계속 눌러서 계속 꺼지네여..ㅎㅎㅎ,[]
5,옛날 맥키보드랑 키감이 비슷하네요~ 원래 쓰던게 고장나서 똑같은 걸 사려고 했더니 아예 안나오는 거 같아서 이걸 주문했는데 무겁고 너무 차갑다는 것만 빼면 너무 만족스럽습니다~ 최근에윈도우용도 맥 키보드 같은 키감 찾다가 펜터그래프 키보드 하나 샀다 실망한적도 있는데 이건 너무 만족이네요~ 이걸 먼저 알았다면 이걸로 샀을 텐데 아쉽습니다~,['https://phinf.pstatic.net/checkout/20191204_146/1575445150101zliNx_JPEG/A800F6B2-4AA3-4074-BDD3-77F340A32CDA.jpeg?type=f287']
5,"노트북 키패드 좁아서 답답해서 샀는데, 이거 연결해서 사용하니까 너무 편해요. 일단 타자칠때 느낌이 좋고, 라운딩 된 알맞은 키 크기, 적당한 간격들이 적응이라고 하지 않아도 될 정도로 금방 손에 익네요. 한달 썼는데 이상없이 새상품처럼 사용하고 있습니다, 많이 파세요!",[]
4,"언뜻 보면 맥정품 키보드 같아서 좋구요. 디자인 예뻐요! 키감도 600보다 훨씬 낫고요!(가격이 1.5배인데 그럼...) 다만, 왼쪽 키보드들이 좀 좁은 느낌...? 익숙해지면 괜찮을지도 모르죠
+ 반년 좀 넘게 쓴거 같은데 왼쪽 커맨드표시기 반이나 벗겨졌네요 ㅠㅜ",['https://phinf.pstatic.net/checkout.phinf/20191104_103/15728611323652TDui_JPEG/20191104_163053.jpg?type=f287']
3,윈도우 OS 에선 돌아가는데 제 맥북에서는 안되네요. 그리고 꽤 무겁습니다 호불호가 있으실 듯 해요. 키캡 영문만 있는 깔끔한 버전 있으면 좋을 것 같고 스페이스 키 위에 이상한 로고 그려져 있는거 아쉬워요. USB 단자 디자인이 투박한 점도 아쉽네요. 사은품도 안왔습니다. 따로 배송요청을 해야 주시는 거라면 그 부분이 주문과정에서 더 확실하게 명시되어 있었어야 한다고 봅니다.,['https://phinf.pstatic.net/checkout/20190831_229/1567237647773bK1rw_JPEG/image.jpg?type=f287']
5,"잘 쓰고 있습니다.

키스킨 없어서 구매 망설이는 분들께 정보 제공해드리겠습니다. 이 제품은 이마트JAJU키보드와 규격이 같습니다.

그래서 저는 네이버스토어 https://smartstore.naver.com/jl2188/products/2248436536?site_preference=device&NaPm=ct%3Dk697ngev%7Cci%3Dshopn%7Ctr%3Dslsl_myz%7Chk%3D3b5ebf203a505c9b76a867528b76b57b9d1d794f

여기서 부드러운타이핑 어쩌고 저쩌고 하는 제품을 구매했습니다.

상판을 완전히 덮는건 아니지만, 키캡은 완벽하게 보호해줍니다.

이 키보드 정말 좋으니까 키스킨때문에 망설이는 분들은 꼭 사세요.

한달째 쓰고 있는데 정말 마음에 듭니다. .",[]
5,"원래 무선 일반키보드 사용하다가 손목도 아프고 중간중간 끊기거나 두세번씩 눌러지는 현상때문에 짜증나서 다시 유선으로 돌아왔습니다.
제품을 찾아보다가 팬터그래프 방식 키보드를 알게되었고 이 제품 디자인보고 반해서 바로 구매했습니다.
일단 터치감?은 노트북과 비슷한데 간격이 꽤 넓은편이라 오타 생각보다 많이 안나서 좋아요! 근데 색이 흰색이라 누렇게 때탈거 생각하면 눈물이....ㅠㅠ
그리고 알루미늄재질이라서 그런지 엄청 묵직해서 장점이자 단점입니다. 절대 움직이지 않아서 좋은대 가끔 들때는 좀 무거워요ㅎㅎ 그래도 아주아주 만족합니다!",[]
5,오 비싼 키보드는 얼마나 다를가 햇는데 너모너모 좋네요 가격대비!! 마넌 이만넌짜리랑 차원이 달라요 일단 좀 무게가 잇어서 손에치여서 안 움직여서 좋네여 자판은 지금까지 본거즁에 젤 낮아여 글스 손 아플 줄 알앗는데 생각보다 갠찮네요!! 생긴것도 넘 이브고ㅠㅠ 흠잡을 때ㅏ가 없네유ㅠㅠ👍🏻👍🏻굿굿 사만원이면 싸게 잘 산 거 같아여,['https://phinf.pstatic.net/checkout/20190913_294/1568374787533Enodb_JPEG/B67E8568-51E8-4D01-9507-7BA8319A11AD.jpeg?type=f287']
5,"오늘 받아서 바로 사용 중입니다. 소음 크지 않고 키높이가 낮아서 타격감이 가볍고 좋습니다. 키보드에 글자들이 큼지막하게 박혀 있습니다만, 알트키가 작고 텐키 위쪽에 다른 기능키들이 있어서 간혹 잘못치기는 하는데 적응되면 괜찮을 것 같습니다. 사무실용으로 구매하였는데, 더 써보고 괜찮으면 집에도 장만하려구요~ 키보드 자체는 매우 묵직합니다.",[]
4,만듬새좋고 무엇보다 참 예쁩니다. 근데 저는 사무용으로 샀는데 키높이가 낮다보니 장시간 타이핑시 약간 불편함이 있네요. 사무용으로는 키높이가 높은 게 나을것 같아요. 사용하다 한영키와 한자키가 윈도우키로 인식되서 고생했는데 해결책은 오른쪽 상단 mac/win 버튼을 계속 누르고있는겁니다. 맥에서도 쓸수있는 키보드이다보니 맥모드로 들어가면 이런오류가 납니다. (맥모드일땐 SCR에 불이 들어와요),['https://phinf.pstatic.net/checkout/20190313_213/1552463416375khtQg_JPEG/20190312_180253.jpg?type=f287']
5,배송은 조금 느렸지만 상품은 아주 좋네요 다만 백스페이스 상단에 슬립버튼이 있어서 처음에 당황했는데 펌웨어 업데이트로 설정 가능해서 괜찮았습니다. 소음측면에서는 노트북에 사용하는 팬타그래프 키보드 보다는 소음이 있는 편입니다,['https://phinf.pstatic.net/checkout/20190416_135/1555418394368eBbBY_JPEG/20190415_111347.jpg?type=f287']
1,제품은 무게감도 있고 키감도 좋습니다. 일반 노트북 보다 좀 더 가볍게 치는 느낌에 살짝 탁탁 치는 소리까지 그런데 잘쓰다가 레지스트리가 꼬였는지 어쨌는지 한영키가 눌리지 않았습니다.(한영키와 오른쪽 한자키를 누르면 윈도우키로 인식 오른쪽 alt키가 한영으로 되었음)비프렌드에서 빠른 답변을 주셨지만 해결책을 주시지는 못했네요.전화가 와서 자세하게 본인들은 너무 다양하기에 딱 이거다 할 수 있는 방법이 없다 초기화를 하던가 저보고 더 찾아보라고 하시더군요. 뭐 틀린말은 아니지만 소비자 입장에서는 완벽한 물건을 파는건 아니구나 했습니다. 그래서 1점,[]
4,"실버 화이트 조합인 팬터그래프 키보드를 찾고 있었는데 비프렌드가 제일 마음에 들어서 구매하게 되었어요! 불편한 점은 백스페이스바 바로 위에 모니터 전원 버튼이 있어서 조금이라도 잘못 누르면 모니터를 꺼버려요ㅜㅜ 그것말고는 전반적으로 만족하네요ㅎ,ㅎ",[]
5,"비프렌드 KB600 키보드를 검색하다 KB700이 새로 나온 것을 보고 바로 구매했어요. 비록 이벤트 기간을 벗어나서 할인 못 받아서 아쉽긴 하지만요. 오늘 받았습니다. 알루미늄 하우징이 너무 고급스럽구요, 사무실 책상에 두고 일하는데 멋이 납니다. 펜타그래프 키보드라 조용하고 타건감도 편해요. 너무 만족합니다. ^^",['https://phinf.pstatic.net/checkout/20190208_219/1549594595897m6hue_JPEG/IMG_20190208_115132.jpg?type=f287']
5,"별도 박스가 없이 와서 '읭?' 했지만,키보드는 참 맘에 듭니다.얇고 키 누르는 감촉도 좋고 그리고 무게감이라 해야하나 전체적으로 책상위에 가볍게 얹혀 있는 느낌이 아니라 묵직하게 위치하고 있는 느낌이 좋더라구요.그래서 이 리뷰 쓰면서 들어보니 조금 무겁네요. 그래도 들고 다니는거 아니니까 좋아요.",[]
5,"디자인, 타건감 모두 최고네요! 튼튼해 보기이기도 합니다ㅎㅎ 무광 알루미늄재질이 고급스러움을 더해주고 동그란 자판이 모던한 디자인을 한층 더 올려주네요.. 한가지 아쉬운점은 19년 6월까지하는 케이블주머니 사은품이 안왔어요...😭😭..",['https://phinf.pstatic.net/checkout/20190302_11/1551534353796qydyi_JPEG/00EECB79-1195-476F-B094-94CE4FB3C9EA.jpeg?type=f287']
5,오랜만에 만족스런 키보드 찾았네요.만듦새에 민감한 편인데 마감이나 견고함이 최고네요애플키보드에 비해 부족하지 않습니다. 다만 왼쪽 alt키가 너무 왼쪽이어서 한자키와 배열을 바꾸고 싶고 F12옆에 파워키 잘못 누르면 sleep 모드로 전환되어 버리는건 개선 필요합니다,[]
3,네.. 제품은 뭐 하자도 없고 배송도 빠르고 좋습니다. 그런데 사은품은 선택 사항이였다니... 선택사항이였다니...부주의하게 주문창을 자세히 보지 않은 제 자신을 탓합니다...제품은 너무 좋아요.. 알루미늄에 무게감도 있고 고급지고..,[]
5,"기존에 회사 키보드가 너무 뻑뻑하고 타자치는데 너무 힘들어서 샀는데 타자 치는 느낌이 너무 좋고 무엇보다 디자인이 진짜 깔끔하고 너무 이뻐요!
무게가 조금 나가긴 한데 어차피 들일도 없고 덕분에 밀리지도 않고 좋아요 :)","['https://phinf.pstatic.net/checkout/20200609_33/1591682953994lsStC_JPEG/KakaoTalk_20200609_150849567.jpg?type=f287', 'https://phinf.pstatic.net/checkout/20200609_26/1591682953906XJi9r_JPEG/KakaoTalk_20200609_150711868_01.jpg?type=f287', 'https://phinf.pstatic.net/checkout/20200609_165/159168295393432UEC_JPEG/KakaoTalk_20200609_150711868_02.jpg?type=f287']"
4,"일단 디자인은 예뻐요
근데 타자감이 약간 무거운듯 하네요",['https://phinf.pstatic.net/checkout/20201110_257/16049639560083mcFw_JPEG/review-attachment-e137247d-2aa1-448a-a5cc-4b668c6f3eea.jpeg?type=f287']
5,배송도 빨리 오고 키감이나 디자인 모두 맘에드네요 잘 받았습니다!,['https://phinf.pstatic.net/checkout/20201022_78/16033419507196jaJR_JPEG/review-attachment-faa81e4d-142c-40ab-8e64-05011721d0e6.jpeg?type=f287']
5,배송빠르고 역시 좋아요. 이뻐요.,['https://phinf.pstatic.net/checkout/20201119_207/16057524007895Ppg7_JPEG/review-attachment-f46d65ee-f50a-4411-bdb7-558d14028c4b.jpeg?type=f287']
5,작동도 잘 되고 소음도 적어 사무실사용에 딱 입니다.,['https://phinf.pstatic.net/checkout/20201020_243/1603150244494apRbM_JPEG/review-attachment-37736f14-bfbd-46df-aa7f-0caf2f225e1a.jpeg?type=f287']
3,후기 보고 샀는데 생각보다 버튼이 높고 소리도 많이 나네요. 무게감은 있어서 좋습니다. 엔터 버튼이 작아서 고민했는데 역시나 좀 불편합니다.,['https://phinf.pstatic.net/checkout/20201012_266/1602500812766bc7Vu_JPEG/review-attachment-56c2709e-cd61-48bc-960b-6e1a02e48974.jpeg?type=f287']
5,"디자인보고 구매했어요 ^^;
저는 기계잘 몰라서... 성능을 평가하진 못하지만 디자인 깔끔하고 생각했던대로네요~
저는 만족합니다.~
스킨커버, 마우스도 같이 구매했어요 ^^",['https://phinf.pstatic.net/checkout/20200925_24/1601033289773KVDgE_JPEG/review-attachment-bb92d645-0ab6-45d2-8f9a-ef00a3eb06d2.jpeg?type=f287']
5,이쁘고 색상도 마음에 드네요,['https://phinf.pstatic.net/checkout/20201006_239/1601935823896gfXse_JPEG/review-attachment-b9aa3fa4-e922-46c2-be82-24f46eabb508.jpeg?type=f287']
5,아직도 잘사용하고있습니다!!,['https://phinf.pstatic.net/checkout/20201006_68/1601995347640wyhBF_JPEG/review-attachment-3c02b950-8d3d-4278-8511-19b43181633d.jpeg?type=f287']
5,일단 생각보다 더 무거워요 근데 키감은 괜찮고 그냥 쓸만합니다 첨에 받았을때 화면보다 좀 누렇다고 생각했는데 키스킨도 없어서 ㅜ 땡안타게 잘써보겠습니덩,['https://phinf.pstatic.net/checkout/20200917_240/16003263049127lfcI_JPEG/review-attachment-c6569848-6ac0-457a-9cbe-d0263af35c84.jpeg?type=f287']
4,"디자인이 예뻐요
좀 더 무소음이면 좋겠어요",['https://phinf.pstatic.net/checkout/20200921_52/1600671289097Or4kz_JPEG/review-attachment-bdf86f53-91ae-483a-9716-c6f72e35e481.jpeg?type=f287']
