star_point,comment,photo
5,"고무받침을 어디에 붙이는지 몰라 힌지부분에 붙었다가, 포토후기를 보니 전부 끝에 붙이셨더라구요.사이즈 아담하고 구매잘한듯 보입니다.딜레이는 거의 없지만 아직 자판이 손에 안익어서 오타가 납니다.익숙해 지겠지요.블투 가능한 여러기기에 써도 되고 배터리도 오래가는듯 보여서 좋습니다. 감사합니다","['https://phinf.pstatic.net/checkout/20190504_5/1556952690754KL1tR_JPEG/20190503_160422.jpg?type=f287', 'https://phinf.pstatic.net/checkout/20190504_1/1556952711236Yuyc7_JPEG/20190503_131008.jpg?type=f287', 'https://phinf.pstatic.net/checkout/20190504_296/1556952736068S9Wa4_JPEG/20190503_131021.jpg?type=f287']"
5,"코로나 바이러스 사태로 재택근무를 하게 되면서 좀 더 용이하게 업무를 보고자 구매하게 되었습니다. 주로 아이패드에 사용하고자 찾아 보았더니, 폴더노트 키보드 평이 정말 좋더군요.지금 상품평도 폴더노트로 작성하고 있는데 키감이 너무 좋습니다. 제 노트북 키보드 보다도 더 편한 듯.같이 산 키보드 케이스도 만족합니다. 스토퍼라고 해야 하나요? 거치하는 하단부 부분이 뻑뻑한 게 좀 아쉽지만 언제고 요긴하게 쓸 듯 합니다. 사업번창하세요!",[]
4,"지인 추천을 받고 샀는데 만족해요. 아이패드 에어3 기준으로 첨부한 사진 정도의 사이즈고, 접이식이기 때문에 다들 많이 쓰시는 ㄹ사 키보드와 다르게 아이패드 전용 파우치(11인치)에도 함께 넣을 수 있습니다. 사이즈 측면 이외에 눌림도 나쁘지 않고 휴대용으로 쓰기에 매우 좋습니다.",['https://phinf.pstatic.net/checkout/20200226_64/1582694172547N6HtI_JPEG/KakaoTalk_20200226_141516232_01.jpg?type=f287']
4,"오래 전부터 사고 싶었는데 비싸서 내꺼 못 사고 조카 녀석 것만 샀었는데, 사 조고 일주일도 안 돼서 쿠폰이~ ㅠㅠ만 원 가까이 차이가 났네요~ ^^;;;;휴대용 키보드로는 제일 좋을 것 같다는 생각이 들어요~그래도 배송은 많이 아쉬워요~뽁뽁이를 전체로 한 번만이라도 더 감아주시지~","['https://shopping-phinf.pstatic.net/20191207_7/d8ed4424-1b32-42ae-b21f-6d6aa3249ebb.jpg?type=f287', 'https://shopping-phinf.pstatic.net/20191207_1/cf53237c-83db-403c-800d-25f179dc1bc4.jpg?type=f287']"
5,피스넷 3단 접이식 키보드가 드디어 왔네요??(갖고 싶었던거ㅠㅠ)사진 올려드릴테니 사진 참고해서 읽으시길 바랄게요 :)먼저 포장을 뜯었을때 입니다(물론 에어폼은 뜯은상태ㅎㅎ) (뜯기전에 두근거리고 설램ㅜㅜ)케이스를 뜯으면..! ???? (헤헿)본품과 설명서. 그리고 바로 위쪽에 충전 케이블과 미끄럼방지 스티커로 보이는 동그란 고무스티커와 함께 들어있네요??(센스 짱????)이렇게 케이스 안에는 총 3개의 제품이 들어있네요??본품인 키보드의 무게는 반정도 남은 각티슈의 무게와 비슷한거같아요(완전 가볍.. 휴대용 짱일듯...??)접혀진 키보드 펴는데.. 완전 신기하더라요...????(신기방기 ????)키보드를 펴면 상단 LED에 불빛이 나오네요( LED 라이트 찍느라 4번은 접었다 편듯..??)다 키보드를 완전히 펼쳤을때 크기는 PC용 키보드의 7/4 정도 되는거같아요PC용 키보드와 크기가 같다고 사시는 분들은 다시한번 생각을 해보시고 구매하시는걸 추천드릴께요PC용 키보드는 Q~P의 길이가 18.2~18.3cm정도 되고본 제품은 Q~P의 길이가 16.2~16.3정도 됩니다2cm차이밖에 안나는데 딱히 큰 불편함이 있을까? 하시는 분들도 계실거같은데 제 객관적으론 조금 불편한거 같아요(익숙치 않아서겠죠..?????)자판의 거리가 조금씩 달라서 그런거 같아요이상 상품평 끝내겠습니다??블루투스 키보드 잘사용하겠습니다??고마워요 피스넷!,"['https://shopping-phinf.pstatic.net/20190628_27/ac130107-523f-455b-9000-35d0fbeb2625.jpg?type=f287', 'https://shopping-phinf.pstatic.net/20190628_26/159444cd-0ed0-42d0-9303-56000ff5c6f5.jpg?type=f287', 'https://shopping-phinf.pstatic.net/20190628_29/2a846f54-74c0-4b1e-b752-58ff677f3f94.jpg?type=f287', 'https://shopping-phinf.pstatic.net/20190628_16/fd7139e9-19fd-40b9-897c-c11e3f28499a.jpg?type=f287', 'https://shopping-phinf.pstatic.net/20190628_19/5cb4f549-0fe4-416c-afe3-f8d8ae9e5210.jpg?type=f287']"
5,좋습니다. 태블릿사용 할 때 단축기 사용하려고 샀습니다. 어차피 ctrl+z shift+ctrl+z 만사용해서 공간활용차 오른쪽 부분 덮어두고 사용하려고했는데 오른쪽 덮으면 페어링 꺼지네요ㅠㅠ 다만 충전포트 c타입아닌건 너무 아쉬워요. 요즘에 5pin충전기 찾기도 힘든데,[]
5,"같은 가격대의 블루투스 키보드중에서도 꽤 괜찮은 마감과 휴대성을 감안했을 때 정말 좋은 키감을 선사합니다. 특히나 굉장히 간편하고 빠른 페어링 속도와 열고닫고의 on/off 기능은, 이 물건의 가장 큰 메리트이지 않을까 싶습니다. 그리고 돈이 더 들더라도 케이스까지 꼭 꼭 같이 구매하는 걸 추천드립니다.",['https://shopping-phinf.pstatic.net/20191118_9/998be0e3-9406-4c39-b802-641d282aa882.jpg?type=f287']
5,"상품 잘받았습니다
배송도 빠르고 좋았는데요, 카카오톡 연결해서 쓰다보면
자음모음이 분리돼서 입력되는 현상이 계속 발생합니다.
가나다 -> ㄱㅏㄴㅏㄷㅏ
광통 -> ㄱㅗㅏㅇㅌㅗㅇ 이렇게요
해결방안이 무엇인지요? 기기문제라면 교환 가능한지 문의합니다.
(8/27에 수령했고 안드로이드기반 핸드폰 연결해서 사용중입니다.)",[]
5,신세계. 코시꺼 접이식 주문했다가 엄청 덜그덕거려서 반품. 일체형은 커서 파우치에 안들어가서 접이식 다시 주문. 두께감은 있지만 안정감 대박. 접히는 부분도 튼튼함. 무게감은 살짝 있지만 불편하진않음. 씹히는것도 없고 알아서 연결되니 엄청편함. 빠름.,[]
5,"롤리키보드가 단종 되어서 구매했는데.
괜찮네요.
키보드가 좁다는 것 빼고는 일반 키보드에 가까운 느낌입니다.
사용하면서 좀 더 구체적인 리뷰를 해 보고 싶네요.
좀 더 작았으면 좋았겠는데, 그러면 너무 키 사이가 좁겠죠?
^^;;;",['https://phinf.pstatic.net/checkout/20200313_90/1584100989843oHLCI_JPEG/KakaoTalk_20200313_204040733.jpg?type=f287']
5,"발송도 빠르고 서비스도 좋네요 :) 처음에 왔을 때 물건에 약간 불량 있었는데 바로 확인하고 교체품 보내주셨습니다!! 아이패드랑 쓰려고 샀는데, 빠르게 인식되고 좋습니다~ 사용법에 iOS 용 매뉴얼 더 있으면 좋을 거 같습니다!! 케이스도 같이 샀더니, 키보드도 보호되고 패드 세우기도 좋습니다 추천해요~~",[]
5,"작아서 가벼워서 좋습니다.
스마트폰에 연결시
한영키 전환 까지 되어
한글 영어 구분을 해가며 확실히 키보드의
느낌을 주어 좋습니다.
스마트폰에서 사용시 펑션키보드 까지 모두 잘
동작해서 좋습니다.
구매가 후회되지 않습니다.
키보드 외 마우스 패드가 달렸다면 궁극의
상품이 될 뻔한 좋은 제품이었습니다.",[]
5,배송은 지난주에 받았는데 바쁜 나머지 후기가 늦었네요ㅜ라즈베리파이 셋팅을 할때 매번 키보드연결이 불편하고 휴대성이 낮아서 검색하던차 가격은 저렴하고 성능은 짱짱한 피스넷 제품을 발견했네요 ㅎ완전 맘에드는 기능은 3대까지 연결가능한 멀티페어링기능!! 3대 좌라락 놓고 선바꿀일없이 작업이 가능하다는거!!ㅎ 휴대성 좋은건 사진으로만 봐도 알겠죵??,"['https://shopping-phinf.pstatic.net/20190622_24/b03713a0-bd01-4046-96fd-988b3182c355.jpg?type=f287', 'https://shopping-phinf.pstatic.net/20190622_3/35451e85-84dc-4755-8227-c2143653bd4b.jpg?type=f287']"
5,처음에는 일반 키보드 치듯이 했더니 키를 한번만 눌렀는데도 연타 친 것처럼 되는 오류가 많았습니다. 예를 들어 ㄱ을 한번 쳤는데 ㄱㄱㄱㄱㄱㄱ 이렇게 되는 증상이 있었습니다. 며칠 쓰면서 요령이 생기니깐 지금은 잘 쓰고 있습니다. 일단 한 글자씩 천천히 또박또박 칩니다. 타자실력 있다고 후루룩 치면 블루투스 반응속도가 못 쫓아갑니다. 그리고 양손을 모으고 손가락 이동거리를 평소보다 짧게 간다는 느낌으로 치면 됩니다. 제가 경험으로 터득한 나름대로의 요령입니다.,[]
4,진짜 노트북 키처럼 되있어서 쓰기 좋고제가 좋아하는 키감입니다! 입력도 잘되고 아이폰 사용하는데 연결도 빠르게 되요~좀 더 큰 사이즈가 있는걸 못봤는데 손이 크시거나 하시면 폴더보다 더 큰 걸루 구매하시면 좋을거같아요!작은거라도 한 5분정도 써도 충분히 적응되서 사용하실수있으세요! 만족합니당!!,['https://shopping-phinf.pstatic.net/20191118_9/d96363bf-6ed1-41d6-8106-27ab2f220c83.jpg?type=f287']
4,"3대 연결기능, 슬림한 사이즈와 접혀도 키보드가 나누어지지 않는 디자인, 적절한 펑션키 모두 마음에 듭니다.
사이즈가 미니 하다보니 타이핑 적응이 조금은 필요합니다. 손이 크신분은 노트버젼 쓰시고, 가벼운 휴대성을 높으시려면 폴더가 좋을듯하네요~",['https://phinf.pstatic.net/checkout/20191125_213/15746760370122v0su_JPEG/175B7429-D1A6-41AD-BB64-499F47F13CF6.jpeg?type=f287']
4,요즘 상담을 카카오톡으로 진행하는 업체가 참 많이 생겨서 타이핑을 길게 해야 하는 경우가 늘다보니 겸사겸사 구입하게 되었습니다.다 좋은데 문제가 좀 있다면..1.펼쳤을때 양쪽 끝에 받침 대용으로 붙이는 고무 패킹이 생각보다 잘 떨어집니다.(가방이나 협소한 공간에 슬라이딩 방식으로 수납시 신경 써줘야 함)2.접히는 부분이 생각보다 톡 튀어 올라와 있어서 왼쪽 알트키 누르는게 참 성가십니다.이거 말고는 배터리 유지시간도 상당히 길고 휴대성도 참 좋은 제품으로 잘 샀다는 생각이 듭니다.첨부사진은 일반 키보드와 크기 비교용 입니다,"['https://shopping-phinf.pstatic.net/20190627_1/c8b1cb99-00bd-4367-86bf-27f728dff508.jpg?type=f287', 'https://shopping-phinf.pstatic.net/20190627_23/fe81a682-195c-454f-b15d-8106654c30ca.jpg?type=f287']"
5,"제품 배송 잘받았습니다~~ 배송도 빠르고 배송 상태도 좋았습니다~~처음에 택봉이로 와서 기계가 상했을까 걱정했었는데 안쪽 뽁뽁이로 잘 싸서 보낸데다 원래 케이스 안쪽도 고정으로 되어있어서 택봉이도 괜찮은 것 같긴해요~그리고 제품이 생각보다 더 괜찮은것 같아요~~ 블투연결도 빠르네요~~키보드 사이즈가 기존보다 작아서 살짝 적응이 필요하지만 크게 문제될것 같진 않아요~~
구매해서 사용하니 남편도 하나 사달래서 재구매도 했어요^^ 갤탭s5e 가로랑 거의 사이즈가 같아서 갤탭용으로도 괜찮네요~~앞으로도 좋은 제품 착한 가격에 많이 올려주세요~~감사합니다^^",[]
3,하루가 더 늦게 도착했기는 했지만 택배기상의 수고로움을 잘 알기에 불만이 없습니다.선물용으로 구입한 물건인지라 개봉하지 못했지만 크기가 생각보다 아담하여 좋아 보입니다.선물 받는자가 어떤 기분을 갖는지 상상되군요.. 그 분은 문서작성광 입니다. 폰을 두고;;,['https://shopping-phinf.pstatic.net/20191207_19/c83c46c5-b8d1-42bd-8c25-91b3a310574a.jpg?type=f287']
5,"키보드 강추합니다.
인식률 젛고 타격감 시원하네요..

가죽케이스 구매 추천합니다.
보관에 좋고. 거치대로 굿입니다.
갤놋.. 아이패드.. 다 가능해요.

블루투스도 신속하게 연결되네요.
아주 만족합니다.
좋은제품 감사해요~~~ 피스넷~~",['https://phinf.pstatic.net/checkout/20200127_184/15801352879822ojtI_JPEG/1580135272517.jpg?type=f287']
5,"한달동안 사용해 보고 작성해야 하는데...... 코로나 땜에 집에만 있어서 굳이 사용할 일은 거의 없었지만, 스마트폰과 태블릿에 연결해서 동시에 왔다갔다 하며 사용해야 할 일이 있어 해봤더니 너무 잘 되네요. 제가 은근히 블루투스 연결에 서투른데 한 번에 되어서 기분이 좋아요!",[]
4,제품은 좋은데 배송이 너무 늦어 별하나 뺍니다. 무려 8일만에 제품 받았어요. 전에 써 보고 좋아서 다시 주문했는데 그 때는 케이스를 함께 줘서 키보드도 보호하고 폰을 거치대에 올려놓고 쓸 수 있게 되었었는데 현 제품은 케이스를 함께 안 주네요,[]
5,예전에 한번 사용한 제품인데 다시 이번에 구입했내요. 휴대성이 좋고 가벼운데 멀티페어링이 되서 좋습니다. 특히 키 배열도 노트북과 비슷하구요. 같이 구매했던 가죽케이스도 태블릿거치대로 쓰기 좋습니다. 개인적으로 같이 구매하시는걸 추천드립니다.,[]
5,"반심반의하면서 구입했는데 제품 퀄리티가 상당히 좋습니다. 일반 키보드보다 약간 작은 노트북키보드 정도인데 키감도 좋고 배열도 똑같아서 편합니다. 접었을때 부피도 적어 휴대성도좋네요.
펼치면 자동으로 연결되는 점도 매우 만족!",['https://phinf.pstatic.net/checkout/20191026_288/1572100100875i4Dk5_JPEG/20191026_232556.jpg?type=f287']
5,진작 살 껄 ~~~^^너무너무 편하고 진짜 좋으네요. 이렇게 좋은 제품이 있다니 신기하고 편해서 마음대로 글씨 쓰니 날아갈 것 같아요. ㅋ전엔 후기도 자판 일일이 하나씩 칠려니 불편해서 짧게 쓰고 저장단어 찾아쓰고 근근히 그랬는데 이제 상품평도 글도 여러가지 업무도 다양하게 활용하여 쓸 수 있어 넘 좋아요.다른 제품 알아보다가 그건 너무 고가인데다가3개 제품 동시에 되지도 않고오히려 기능이 피스넷보다 적고 불편하더라구요.이 제품은 노트북 키보드처럼 익숙햇 두 손으로 자판치기에 불현함이 전혀 없고 좋습니다. 아주 강추합니다.올킬로 사고 쿠폰과 포인트로 26000원으로 아주 착한 가격에 구이 했네요.종종 피스넷 제품 좋은게 있나 둘러보러 와야겠어요.이건 타자의 혁명이네요. ㅋ갤럭시 노트5랑 삼성2014 에디터에도 잘 연결되고작동이 잘 됩니다.노트북에도 연결해서 3개 기기 모두 사용할렵니다.판매자님 정말 감사해요.^^블루투스 연결도 잘 되는데 한가지 엔터키가 말을 안들어 그게 좀 불편합니다.엔터키 사용법도 좀 알려주시면 감사하겠습니다.,"['https://shopping-phinf.pstatic.net/20171027_12/3946ce16-322b-445a-9ea2-a25889b15344.jpg?type=f287', 'https://shopping-phinf.pstatic.net/20171027_0/5d524db2-8149-4dad-94ad-fa7f8869d056.jpg?type=f287', 'https://shopping-phinf.pstatic.net/20171027_9/d063adbc-ba08-4a9d-935a-1a1d11aa6a79.jpg?type=f287', 'https://shopping-phinf.pstatic.net/20190627_22/4b0b5e27-36f8-4214-9473-09181ee27c1d.jpg?type=f287']"
5,아이패드 6세대 사용중인데 타이핑할 일이 많아서 구매했습니다. 다른 블루투스 키보드 제품보다 타자소리도 덜나고 폈을때 크기가 아이패드랑 비슷해서 적당한것같아요!! 또 타자배열이 기존 노트북과 거의 동일해서 오타도 거의안납니다~!,[]
5,lg g패드 10.1에 연결하니 한/영 변한이 안되고 영문만 입력되었는데 댓글중에 키보드 어플 설치하고 해결했다는 글 보고 구글 키보드 어플 설치 하고 어플 설정에서 한국어 추가 하니 변환이 됩니다. 왜인지는 모르겠지만 여튼 해결 됐으니 그냥 사용합니다;;,[]
5,"제 손이 일반 키보드 기준 F1~F10 정도 되는 크기인데
이 키보드가 조금 작긴해도 무리없이 사용가능하고 금방 적응할 수 있습니다. 저 보다 손 크신 분들은 이거 말고 좀더 큰 폴더노트 제품 추천드립니다.
이거 진짜 휴대성도 좋고 연결도 빠르고 최고에요!",['https://phinf.pstatic.net/checkout/20191109_286/1573287737518vEy7M_JPEG/KakaoTalk_20191109_171826467.jpg?type=f287']
5,제 휴대용 노트북이 레노버 요가북이라고키보드가 터치식인 노트북이에요.이게 늘 불편해서 고민이 많았는데우연히 피스넷 제품 후기 보고 괜찮아 보여서 구매하게 되었어요.상품페이지 사진만 보고는 사실좀 투박하고 두꺼운 디자인인 줄 알았는데실제로 실물을 보니 디자인도 슬림하고 예쁘네요.생각보다 키보드가 많이 작지 않아서 그렇게 오타가 심하게 나는 편도 아니고요.전반적으로 흠잡을 곳 없이 너무너무 좋습니다.굳이 단점을 꼽자면 키를 누를 때 좀 힘줘서 탁탁 눌러야하는 감이 있어서 소리 때문에 조용한 독서실에서 쓰긴 힘들 것 같다는 거..?전 지하철에서 쓸 예정이라 상관 없지만요.저는 피스넷 키보드가 너무 마음에 들어서아직 고장나지도 않았는데 고장을 대비하여 똑같은 거 하나 더 사고 싶어요 ㅋㅋㅋ망설이시는 분들 얼른 구매하세요,['https://shopping-phinf.pstatic.net/20181216_29/e1f5ec15-1bf7-498f-af65-1ad5574a581e.jpg?type=f287']
4,"하얀색이 3년간 쓰던 이전 물건이고까만색이 이번에 산 새 물건이에요.비교해보고 싶어서 같이 찍었어요.자판이 더 편하게 바뀌었네요.Fn키하고 ?키가 더 쓰기 편한 자리에 와서 좋아요.디자인, 편리함, 휴대성, 키감, 빠른 배송 다 좋아요.다만 전에 쓰던 것에 비해서 입력이 잘 안 되네요.특히 모음 ㅣ를 쓸 때 많이 버벅여서 굳이 두번 눌러야 해요.전에 건 안 그랬는데 품질이 떨어진건지 유독 제 것만 불량인건지...전에 쓰던 건 편하게 쓰기만 하면 됐는데지금건 눌렀는데 입력 안 됐을까봐쓰면서 화면을 예의주시해야해요^^;다시 누르면 그제야 두개씩 입력되어서... 지우고 다시 쓰고그런 일이 좀 생기네요ㅠㅠ3년간 너무 잘 썼던 제품이라 고장 후에도 망설임 없이 재구매 했는데조금 아쉽습니다.",['https://shopping-phinf.pstatic.net/20190225_25/d3a8b62f-6f60-44c3-a9e2-434b8cdd2522.jpg?type=f287']
5,"너무 작고 가벼워서 휴대하기에는 참 좋을것 같습니다.자판도 생각보다 편안하게 잘 쳐지구요.제가 여차하면 무릎위에 올려놓고 쓰게 될거라사진에서처럼 무릎에 놓고 지금 타이핑 하고 있습니다. 막 접힌다거나 하는 걱정없이 아랫부분 탄탄하니 좋습니다.저에게 한가지 아쉬운 점은, 자판소리가 좀 난다는 거예요.저는 강연등의 메모용으로 휴대용 자판을 희망한 터라 엄청나게 시끄럽지는 않지만 잘그락 잘그락 자판소리는 납니다.기존에 로지텍 k380이나 k780을 쓰고 있는데 그런 키소리랑은 조금 차이가 있는 소리예요. 강연장, 도서관등에서 사용을 희망하는 경우 참고하셔야 할 것같아요. 그것빼고는 아주 마음에 듭니다. 좋은 제품 많이 판매하세요~ 감사합니다.아 배송은 제가 주문하고 이틀만에 왔어요요즘은 하루만에 대부분 도착하니까 엄청 기다린 느낌이었는데 겨우 하루더였네요^^감사합니다.",['https://shopping-phinf.pstatic.net/20190627_1/f8b6a46a-cd73-4cee-9227-1408e5bc5d41.jpg?type=f287']
5,박스 포장안에 박스 안으로 와서 안전하게 보내주셔서 좋았습니다. 사용설명서도 잘 되으니까 읽어면서 이것저것 설정도 할 수 있었습니다. 휴대용으로는 딱 좋았습니다. 평균적이 키보드하고는 크기가 작아 손가락이 익숙해지기에는 시간이 걸릴것 같습니다. 외출할때도 타자를 칠 수 있게 되어서 좋습니다.,['https://phinf.pstatic.net/checkout/20191031_162/15725005332236twfN_JPEG/KakaoTalk_20191031_091848909.jpg?type=f287']
2,제품은 맘에 듭니다. 다만 택배가 박스가 아닌 등기 비닐봉투에 와서 ...그래도 전자제품(?)인데...그점이 아쉽습니다.. 제가 손이 작은 편이라 그런지 크기 만족합니다. 케이스를 살까말까 고민했는데 사길 잘한거 같아요 싱크는 조금 느린듯합니다.,[]
4,보시는 바와같이 크기가 작아서 휴대하기에 너무 편하구요 3대의 기기를 연결할수 있어서 그것도 좋습니다 작아서 쓰는데 불편할수도 있다고 생각하겠지만그건 장점이되기도 하고 단점이 될수도 있겠죠?저는 쓰는데 전혀 지장없이 너무나 잘쓸것 같네요 ㅎ,['https://shopping-phinf.pstatic.net/20191118_0/d59de53f-c172-4998-9d11-b0fe479d3eb1.jpg?type=f287']
5,배송 하루 만에 와서 깜짝놀랐어요... 너무 무리하시는 건 아닌지ㅠ.ㅠ 항상 감사합니다 진짜 타자칠때 나는 소리도 좋고 접이식이라 간지나요ㅎㅎ 근데 지우기 버튼이 맨 오른쪽 위에 있어서 첨엔 약간 불편했는데 익숙해지면 또 괜찮을 것 같아요 감사합니다!,[]
5,폴더와 폴더노트 고민하다가 크기만 보면접어서 가지고 다니기 불편함없고 타자편한 폴더노트를 사고싶었지만5만원에 육박하는 키보드를 사기에는 부담이 좀있었죠컴터 키보드도 기계식 적축쓰고있는데 10만원짜리지만이 블투 키보드가 과연 그 절반값어치 정도를 하느냐에 대한 질문에그렇다는 답변이 전 안나와서 조금은 가성비로 폴더로 구입했습니다노트북과 같다고는 하지만 작아서 혹시나 불편하진 않을까 했지만지금 폴더 키보드로 사용중인데 오타별로 없고 정말 맘에듭니다성인남자 손좀 큰편인데 PC키보드보다 작긴해서 불편함이 전혀없는건 아닙니다만 충분히 3만원주고 살만합니다. 다시사도 재구매할것 같네요반응 이야기도 있었는데 글쎄요컴터 키보드와 비교했을때 제 눈으로 차이는 1도 안느껴집니다반응이 너무칼같아서 오히려 놀랬습니다.잘쓰겠습니다.타자로 치니 상품평이 좀 길어졌네요 ㅋㅋㅋㅋㅋ,['https://shopping-phinf.pstatic.net/20190627_17/a4c3538b-cce8-4b45-bc6f-a5358342989a.jpg?type=f287']
5,요거 꽤 괜찮은 물건이네요접이식 키보드 들이 대부분 간격이 벌어져있거나 특수키가 있거나 열이 몇개 없거나해서굉장히 사용성이 떨어지는 물건들이 대부분인데이건 어느상황에서 펼쳐도 노트북 풀사이즈 정도 키배열공간을 확보할 수 있으니..양옆에 꼬다리를 내려야 안정감이 확보되는게 좀 귀찮긴 하지만펼쳤을?? 사용성을 생각하면 감안할 수 있는 수준입니다. ㅎ,"['https://shopping-phinf.pstatic.net/20191118_19/6d6c6aaf-b562-4a48-b622-a6d7dca4804f.jpg?type=f287', 'https://shopping-phinf.pstatic.net/20191118_24/3bebfd88-7727-4f78-8164-38c007d72370.jpg?type=f287']"
5,"사용기를 블로그에 작성하였습니다.https://blog.naver.com/weonjulee/222063351820ESC키, 펑션키 등이 숫자키 행과 중복된 제품이었는데, 혹시 별도의 ESC 키 및 펑션키를 필요로 하시는 분은하나 윗 모델인 무선 블루투스 키보드 폴더노트를 구매하시면 됩니다.",[]
5,다른거 사봣는데... 접는 부분에 버튼키 사이즈가 다른건 오타율이 진타 높아요.. 근데 이건 접히는 부분 키 사이즈가 더른 키들이랑 동일해서 오타율이 확실히 적습니다.좀 단단한 느낌이 들고 사이즈도 들고 다니기 괜찮아요.모양이 쬐끔 덜 세련된 감도 잇고 약간 두꺼운 것 같긴 한데 딱이에요. 블투 연결도 잘됩니다. 바로 딱.,[]
5,기대 이상이에요~ 워낙 평이 좋아서 구입했는데생각했던 것보다 더더슬림하고 부피도 작아서 정말 휴대하기 편할거 같아요.페어링도 쉬워서 멀티 페어링하시는 분들도너무 편하실 듯 해요.저는 오늘 받아서 키보드로 많은 작업은 못했지만 100% 만족입니당,[]
5,"작고 가볍고 좋아요. 들고다니면서 사용하기 딱이에요.
평소쓰던 기계식카보드와 비교해서 생각보다 강하고 정확하게 키를 쳐야 입력됩니다. 며칠 써야 완벽하게 적응할것같네요. 백스페이스키가 멀리있어서 자꾸 \를 누르게되네요.",['https://phinf.pstatic.net/checkout/20190911_282/1568177206319Pcv6m_JPEG/20190910_205446.jpg?type=f287']
5,무선키보드 계속 구입하려고 알아보려다가 뭐 필요하겠어라고 생각했는데 구입하니 좋네요 지금 키보드 펼치고 글 적는건데 아직 익숙하지 않고 접히는 부분이 나사부분이 살짝씩 걸리기는 하지만 사용하다가 보면 익숙해 질것가아여. 키감이 좋습니다.,['https://shopping-phinf.pstatic.net/20191022_7/fc4d517a-250c-408c-8bca-039d3bf086a2.jpg?type=f287']
5,폴더 노트와 폴더 사이에서 고민하였는데 폴더를 선택하였고 오늘 받아서 사용해 보니 결과적으로 잘한 선택이었다고 생각합니다. 물론 폴더 노트보다 사이즈가 작아 조금 불편하지만 작은 만큼 이동성이 좋으므로 이정도 불편이면 작은 크기의 폴더를 선택할 만하다고 생각합니다. 크기 말고 키감은 매우 좋습니다.,[]
