star_point,comment,photo
5,"이 리뷰리뷰는 해당 제품을 사용해서 작성하고 있습니다.
항상 검정색 자판 키보드만 사용했었는데 흰색자판은 처음 구매했는데 엄청 이쁩니다.
블루투스 연결도 잘되고 타자감도 너무 좋습니다.
약간의 단점은 평소 사용하던 키보드보다 크기가 작아서 타자칠때 적응이 잘 되지 않는 편입니다.
조금은 연습과 적응이 필요해보입니다.
그외에는 너무 잘 만든 블루투스 키보드인듯 합니다.
열고 닫을때 뻑뻑하다는 분들도 있는거 같던데 저는 뽑기운이 좋았는지 부드럽게 열고 닫칩니다.
함께 제공해주시는 스티커 붙이니 키보드 양쪽끝 지지도 잘되어서 타자칠때 전혀 불편감이 없습니다.
이 제품을 구매하면 후회하지 않을듯 합니다.
접어서 가지고 다닐때 전혀 불편감이 없을듯 합니다.","['https://phinf.pstatic.net/checkout/20201101_126/1604203006099M5ODx_JPEG/review-attachment-3fada3e2-3eb9-4ba1-83b2-dcd6f548670d.jpeg?type=f287', 'https://phinf.pstatic.net/checkout/20201101_71/1604202994045nmi2V_JPEG/review-attachment-83720b89-3e10-42fc-80cd-169fed16f619.jpeg?type=f287', 'https://phinf.pstatic.net/checkout/20201101_102/160420300082579s1m_JPEG/review-attachment-b9b3f0a3-7962-4370-a681-8ca950315a25.jpeg?type=f287', 'https://phinf.pstatic.net/checkout/20201101_201/1604203006884VxdQe_JPEG/review-attachment-98319e4b-3ba3-4b06-adcb-088242bd9f39.jpeg?type=f287', 'https://phinf.pstatic.net/checkout/20201101_35/1604203006845Oo6jN_JPEG/review-attachment-b7466421-1aa4-45f9-a9f8-4d9d7f437e22.jpeg?type=f287']"
5,"핸드폰 타자를 한손으로 하는 저는 당연히 타자가 느리겠죠... 게다가 그 손으로 블로그를 했었는데요... 한손만 계속 쓰다 보니....손목도 아파했었고...그런 저에게 동생이 피스넷을 선물로 해줬었어요. 그렇게 처음 피스넷에 입문 했지요...ㅎ
덕분에 블로그할때도 편하게 썼었고... 오래쓰다보니 망가져서 못쓰게 되었는데 저희 아들이 생일선물로 사줘서 두번째 쓰게 되었네요...
지금 리뷰도 피스넷으로 쓰고 있다는 ㅎㅎ
저는 너무너무 편리하게 잘 썼던 그리고 또 다시 잘 쓸 상품이랍니다.
여러방면에서 사용하기가 너무 좋아요~ 잘 쓰겠습니다~!","['https://phinf.pstatic.net/checkout/20201120_166/1605850784182awymp_JPEG/review-attachment-08c7e14c-94d3-4866-a03d-ce64b64775e6.jpeg?type=f287', 'https://phinf.pstatic.net/checkout/20201120_125/1605850784163BC6hN_JPEG/review-attachment-9f733347-d072-4283-b80c-0ee9318c6aef.jpeg?type=f287', 'https://phinf.pstatic.net/checkout/20201120_192/1605850784228IrSVH_JPEG/review-attachment-1c4cb9b6-4bee-471d-a938-f72cdd843aa8.jpeg?type=f287']"
5,"기전에 쓰던게 모음이 두번씩 눌리고 오류가 너무 심해 구매 했어요! 블투 3.0이구 출시한지 쫌 오래됐지만 평도 너무 좋구 3단 접이식! 휴대가 나무 편해서 구매했습니다 (◍•ڡ•◍)
배송은 말할 것도 없구 대 만족쓰 입니다!!","['https://phinf.pstatic.net/checkout/20200805_143/1596626034720ftAOr_JPEG/review-attachment-3e24e106-f784-4006-9ff4-5932f8a68c68.jpeg?type=f287', 'https://phinf.pstatic.net/checkout/20200805_141/1596626035211TISM8_JPEG/review-attachment-cb792123-277a-42af-91fe-8b3bf90a5f4e.jpeg?type=f287', 'https://phinf.pstatic.net/checkout/20200805_101/1596626035820xrNhT_JPEG/review-attachment-6ef4c0e5-02d4-40fd-a55c-1b2d29819aa1.jpeg?type=f287', 'https://phinf.pstatic.net/checkout/20200805_49/1596626035621rQluN_JPEG/review-attachment-ce3f72a6-6165-419d-b4ab-ec4a6d153f22.jpeg?type=f287', 'https://phinf.pstatic.net/checkout/20200805_167/1596626037589sy5Jx_JPEG/review-attachment-e6dc9c1a-0c08-4138-94b3-5c2aa8377c96.jpeg?type=f287']"
4,처음에 받고서 왼쪽이 반만 열려서 불량인줄 알고 실망했다가 힘줘서 열었더니 접합부가 맞아져서 잘 작동한다는 후기보고 용기를 얻어서 똑같이 해보니까 활짝 펼쳐졌어요. 첫번째사진 펼져지는 부분 양쪽을 보면 왼쪽이 엇나가 있는게 보일거에요 이걸 맞춰야 한다는 느낌을 갖고(?) 열었어요. 두번째 사진은 맞춘 후 입니다. 아마 다른 분 후기 없었으면 시간이 걸리더라도 교환했을것 같아요. 저는 급해서 이렇게 해결했구요 상황에 따라 마음편하신 방법을 추천해요. 이런 경우가 있을수도 있다는걸 전하기 위해 써봅니다. 이제는 열고닫고 잘돼서 잘쓰고있어요. 블루투스 키보드 알아볼때 무조건 휴대성이 1순위였던만큼 접으면 작고 가벼워서 만족스러워요. 쓰던 키보드보다 작아서 오타가 쫌 있었지만 금방 적응이 돼서 잘 사용할듯 하네요.,"['https://phinf.pstatic.net/checkout/20200521_257/15900291180814PJCR_JPEG/20200521_09044301.jpg?type=f287', 'https://phinf.pstatic.net/checkout/20200521_44/1590029129860HyAJL_JPEG/20200521_114415.jpg?type=f287']"
5,"정말 맘에 듭니다. 다른 키보드도 같이 알아보고 다른거에 미련도 좀 남았는데 받고 나니 싹사라졌어요 ㅋㅋ
아이패드가 골드라 골드사고 싶었지만 없어서 실버샀는데 잘어울리고 예뻐요 손이 작은편인데 접으면 손에 쏙들어옵니다.
키감도 좋은편이고 블루투스 키보드 첨써보는데 불편함없어요.

고무스티커는 붙이면 못생김이 더해지지만.... 붙이는게 안정감있고 쓰기에 더 좋아요","['https://phinf.pstatic.net/checkout/20201005_161/1601883944840lO6Ny_JPEG/review-attachment-fda36055-a2c0-45a2-ac5b-11900c1645a7.jpeg?type=f287', 'https://phinf.pstatic.net/checkout/20201005_75/1601883945120SH7jL_JPEG/review-attachment-fdd18f46-2dd6-4341-b883-3ce5eb0a9254.jpeg?type=f287', 'https://phinf.pstatic.net/checkout/20201005_5/1601883945052nPAE8_JPEG/review-attachment-cec9cdb0-f117-457a-bc7e-1e537e9d4a2f.jpeg?type=f287']"
5,"일단 정말 휴대성 갑 입니다! 진짜 가벼워요. 디자인도 군더더기 없이 깔끔합니다. 키감도 괜찮아요. 다만, 소리가 조용한 편은 아니라서 독서실같이 조용한 장소에서는 사용할 수 없을 것 같아서 그 점만 조금 아쉽네요 그래도 전체적으로 만족합니다. 산거 후회안하고 잘 쓸 거 같아요. 전 손이 작은편이라 오래 사용하더라도 불편하진 않더라구요. 아이패드 에어3기준으로 가로길이가 키보드 펼쳤을 때 전체길이랑 거의 같아요. 일단 가볍고 접이식이라 들고다니기 전혀 불편하지 않아요. 주변에 추천하고 다닙니다!","['https://phinf.pstatic.net/checkout/20200521_300/1590046352138aD7MH_JPEG/5CC9E437-3483-49F7-B1DC-D59CBE080B8C.jpeg?type=f287', 'https://phinf.pstatic.net/checkout/20200521_125/1590046351792LpIFI_JPEG/154BCE83-DA8E-4435-88FA-03E3DE42AD12.jpeg?type=f287', 'https://phinf.pstatic.net/checkout/20200521_300/1590046418744IBJ38_JPEG/image.jpg?type=f287']"
4,세번째 구입하고 있습니다. 주로 여행지에서 시용하는데 휴대성 좋구요 키감도 좋습니다. 추천합니다. 다만 세번째 구입이유는 키보드가 2년 정도 사용하면 버튼이 한 두개 눌러지지 않는 경우가 있습니다. 또 별도 구입한 커버는 모서리 부분이 금방 헤지는 느낌이 있습니다.,"['https://phinf.pstatic.net/checkout/20200818_155/1597736852829zlNdz_JPEG/review-attachment-3c48855e-8a6a-4d9d-b200-da34760f120f.jpeg?type=f287', 'https://phinf.pstatic.net/checkout/20200818_252/1597736854387XjSlg_JPEG/review-attachment-30aa996a-2574-44ed-ba84-ec27a0039cfb.jpeg?type=f287', 'https://phinf.pstatic.net/checkout/20200818_148/1597736854255EqiC4_JPEG/review-attachment-9a28c063-b117-414e-9ebb-219091fea084.jpeg?type=f287', 'https://phinf.pstatic.net/checkout/20200818_79/1597736854735SxmMb_JPEG/review-attachment-a0e76b51-a65e-4812-8bdc-4dc0528b3895.jpeg?type=f287']"
5,최근에 아이패드를 사서 함께 사용할 키보드가 필요했습니다. 시중에 정말 다양한 제품이 있더군요. 그래서 반신반의로 구입했는데 제품 받고 바로 사용해보니 잘 샀다는 생각 들어요! 페어링도 잘 되고 키 배열이 노트북과 거의 비슷해 타이핑 하는데 불편함이 없어 금방 적응 할거 같습니다. 게다가 작고 예쁘기까지 하니 더 마음에 들어요 좋은 제품 잘 받았고 잘 쓰겠습니다!,"['https://phinf.pstatic.net/checkout/20201110_205/1604984979495mkUNV_JPEG/review-attachment-593f986d-92af-4201-9ee3-576e750da9ac.jpeg?type=f287', 'https://phinf.pstatic.net/checkout/20201110_176/1604984980114gcJiG_JPEG/review-attachment-23833ece-9218-49af-8ef1-470450d2d754.jpeg?type=f287']"
5,"2019년초에 구입한 엘지 블루투스 롤리키보드(KBB-710)를 사용하다 블루투스 접속이 자주 단절되고
노트북 키보드와 다른 배치로 어려움을 경험하다 바로
8월 중순에 결국 키보드 두번째 줄이 물리적으로 아예
동작이 안되는 사태가 발생하였읍니다.
10만원 넘는 거금을 주고 구입해서 어찌하든 서비스를 받을려고 서비스 센타로 연락하니 물리적 고장은 수리비가 더 나온다고 새로 구입하라고 충고하더군요.
여러 지인께 물어보니 피스넷폴더 제품이 품질 및 성능대비 가성비가 좋다는 애기를 듣고 속는샘 치고 구입
했는데, 저의 예상을 훨씬 뛰어넘는 사용편의성, 내구성
특히 삼단 폴더로 이전 엘지 롤리키보드보다 확실히
고장날 위험이 낮다는 확신을 가지게 되었읍니다.
얼마전 구입한 엘지 G패드5(LMT605) 태블릿과 페어링
하여 문서작업도 했는데 블루투스 접속, 키보드 터치감,
키보드 입력 편의성이 이전 엘지 제품과는 비교가 되지
않을 정도로 좋았읍니다. 아주 만족합니다!",[]
5,"옷가게를 하다보니 항상 고객 상담을 폰으로 하기가 손목 손가락 근육 경련이 일어날 정도인데, 상담의 신서계가 열렸어요 정말 신박해요 타자감도 좋고 페어링도 자동으로 잘 되고, 아직 쓴지 이틀이라 더 써봐야 알겠지만... 휴대성도 좋고, 이틀 써본 상태론 만족스럽구요 아쉬운 점도 분명 있긴하지만 ... 없는것보단 일하기 훨 편리하니까요
케이스 같이 구매해서 어디에서나 세울수있고 여튼 좋슴당~ 잔고장만 안났음 좋겠어요 간단히 몇분만 사용해본거지만 혹 안되는부분이 있는건 따로 문의할려구요
사세요 여튼 있으니 좀 더 편해진건 사실이니까요
아 그리고 디자인도 실버에 만드신분 복받아요~~",['https://phinf.pstatic.net/image.nmv/shopnbuyer_2020_07_08_0/4a370611-c0f2-11ea-bdf8-505dac8c38f5_03.jpg?type=f287']
5,"배송 : 빨랐어요.
제품 : 아주 만족합니다.
외관 : 완성도 좋아요. 성능도 좋아요. PISnet 블루투스 이어폰 만족하며 쓰고 있는데.. 블루투스스피커도 잘 쓰고있구요. 다른 브랜드랑 고민하다가 후기가 좋고 키 배열이 일반 키보드랑 거의 흡사한게 괜찮을듯 해서 결정했는데, 아주 만족스러워요.
뽑기가 잘 된건지.. 아직 불량한 면은 발견 못했어요. 처음에 점 더 비싼 폴더노트를 주문했는데 비싸서 좋을 줄 알았는데, 사이즈가 더 크더라구요. 그래서 얼릉 취소하고 폴더로 주문했어요. , 여자인 저는 딱 좋아요. 신랑도 큰 불편은 없다고 했어요. 후기에서 말한 고무스티커 때문에 케이스 잘 안닫히는 문제는, 걍 스티커 안붙였어요. 그래도 큰 불편함 없어요. 케이스에 넣으면 너무 단정하고 이뻐요. (아 맞다.. 폴더노트는 고무를 안붙여도 되서 선택했었어요. ㅋ) 휴대 안하시고 사용하실거면 고무 붙이면 더 안정감 있을지도요..신랑이 회사서 회의록 쓸때 좋겠다며 가져갔는데.. 하나 더 구입하고 싶네요. 접힐때나 열릴때도 아주 부드럽고 좋네요. 접히는 부분에 공간이 넓지도 않고 아주 깔끔해요. 폭이 1000m 우유곽보다 약간 더 얿구요 접으면 폰이랑 크기 거의 비슷해요.
인식도 잘되요. 저는 타자가 엄청 빠른편이 아니라서 그럴지는 몰라도 아주 좋아요.
피스넷은 고객 CS 도 좋은것 같아서 일단 믿고 구매해봤는데, 추천드려요~!",[]
2,"일단 빠른 배송과 판매자와 신뢰 있는 친절한 소통을 원하시는 분들은 다른 곳이나, 다른 키보드를 권합니다.

제가 5월 7일, 늦어도 8일에는 사용할 일이 있었는데 7일 받을 수 있다고 해서 4일 주문을 했습니다.

5월 6일, 불안해서 배송 시작되었는지, 내일 받을 수 있는지 문의했더니, 7일 발송된다는 것이었습니다. 결국 7일에는 받을 수 없다는 것이었지요. 그래도 배송지연 안내를 해주셨고, 늦어도 8일에는 사용할 수 있으니 그러려니 했습니다. 최근 황금연휴도 있었구요.

노심초사 기다리다가 7일 목요일 저녁 6시즈음에 상품 발송되었다는 메시지를 받을 수 있었습니다. 그런데 8일 오전까지 배송조회가 되지 않았죠. 그래서 다시 한 번 연락을 드렸더니, '송장 출력 후 제품발송 중 재고가 품절되어 송장 흐름이 보이지 않는다면 오늘 입고되는 제품으로 발송처리 예정입니다. 원하지 않으신 경우 언제든지 취소요청 주시고 궁금하신 사항은...'이란 답을 받았습니다.

이게 무슨 말인지. 발송처리 하지 않고도 발송처리 했다고 알림을 주더니, 제품 발송 중 재고 품절???이라는 이해되지 않는 알림에 화가 많이 나더군요. 그리고 이런 상황이면 미리 알림을 줘야지 고객이 계속 문의를 해서야먄발송 상황을 알 수 있는 것도 어이가 없고 불쾌했습니다.

결국 7일에 받을 수 있다고 했던 물품을 4일에 주문해서 8일로 한 차례 연기되고, 한 번 더 연기된 후 9일 오전에서야 물품을 받을 수 있게 되었습니다. 필요했던 시간에 받을 수 없었구요.

물건이 늦게 올 수도 있겠죠. 다만 그렇다면 미리 선재적으로 알려줘야하며, 두 차례나 받을 수 있는 날이 변경이 된 것에 판매자와의 신뢰감이 없어졌습니다.

접이식 블루투스 키보드는 다른 것도 여러 있습니다. 시간적 여유가 있어서 판매자와 소통을 하지 않으실 분들 외에는 고려해보시길 바랍니다.

. 가볍고, 고정 나쁘지 않습니다. 사진은 15.6인치 노트북 키보드와 비교 컷 입니다. 당연히 작긴 하지만 남성인 제가 사용하기에는 큰 무리는 없더라구요. 안드로이드 태블릿과 애플 폰 모두 호환 잘 되고 페어링 빨리 됩니다.
다만 아무래도 키보드가 작기때문에 쉬프트 사용하는 쌍음 사용할 때 좀 불편하고, 딜리트 커서가 일반 키보드와 위치가 달라서 좀 불편합니다. 이는 적응하면 괜찮아질 것 같기도 합니다. 휴대용 키보드를 사용하면 괜찮은 편이구요. . 그리고 고무패드는 키보드 자체가 매우 가볍기 때문에, 부착하고 타이핑 할 때 꽤 안정감을 더해줍니다. 손이 작으신 분이 사용하시기에 더 적합하고, 대부분의 남성의 경우 적응기간이 좀 더 필요해보입니다.",['https://phinf.pstatic.net/checkout/20200509_62/1588993130109UI1yP_JPEG/KakaoTalk_20200509_111500700.jpg?type=f287']
3,"우선.. 사진에서 보듯 처음 왔을 때 접합부가 비뚤어져 있어서 제대로 펼쳐지지도 않아 '아..불량인가 ㅋㅋ..' 싶었습니다. 근데 도박하는 셈 치고(부서지면 환불도 안되는 거 아닌가 조마조마..) 힘 꽉 줘서 여니까,
'뿎낏!' 하는 괴이한 소리와 함께 펼쳐지더니..;
이제 정상작동 되네요. 일단 펴진 이후로는 막힘없이 절컥절컥 잘 접혀집니다. 그 외 멀티페어링 잘 되고 키감도 크기에 비하면 아주 괜찮네요 특히 애플 스마트 키보드 이런 것 보다.. 닫았을 때 자석 강도도 적당하고 무게도 가벼워서 휴대용으로는 제격일 것 같은데, 일단 밖에서는 아직 안 써봤으니 좀 써보고 한달 리뷰 남겨드릴게요.","['https://phinf.pstatic.net/checkout/20200513_259/1589295608274pypun_JPEG/20200512_235949.jpg?type=f287', 'https://phinf.pstatic.net/checkout/20200513_250/1589295667705E0uPX_JPEG/15892956128628997507774407799433.jpg?type=f287']"
5,"생각보다 더 마음에 드는 제품이네요.
사실 막 받아서 쓰는거라 정확하지는 않지만, 구매 시 참고 하시면 좋을 것 같아요.
저는 폰으로 쓰는게 불편해서 구매한거라, 컴퓨터 키보드 대용으로 사용한다면 불편할 수 있어요.
장점
1. 키보드 자판과 배열이 같다
배열이 다른 제품들이 많더라구요.
아무래도 손에 익은 제품이 더 편하니까, 쓰다보면 손에 익는다고는 하지만 쓸 때마다 신경쓰기 싫어서 제일 중점적으로 보고 구매했어요.
2. 가볍고 작은 크기
노트폰보다 작고 가벼워요
너무 놀람
들고다니기 좋은 제품으로 찾았는데 너무 잘 샀어요.
가로로 긴것도 있던데 그것도 가방에 넣기에는 불편할 것 같아서 이 제품으로 산건데 참 잘한듯 !
3. 타자 인식이 잘돼요
접이식 키보드는 블루투스 3.0이 제일 많더라구요.
그래서 반응속도가 늦으면 어쩌나 걱정했는데
버벅거림 전혀 없어요.
지금도 키보드로 쓰고 있는데 너무 잘 써지네요.
단점은 키보드를 한번 닫았다가 열었더니 글이 다 사라졌음 ㅠㅠㅠㅠㅠ
단점
1. 남자가 쓰기엔 불편할 듯 ?
아무래도 작은 사이즈다보니 신경써서 적으면 괜찮지만, 평소처럼 적기에는 오타가 날 수 있어요.
2. 커버가 없어서 기스가 날 수도 있을 듯
보관이야 집에 있는거 대충 맞춰쓰면 되겠지만, 사용할 때 소중히 써야겠어요. 기스나면 맘 아플듯
그 외 단점은 더 써봐야 알 것 같아요.
이 제품과 똑같은 타사 제품이 있던데, 차이점은 모르겠으나 현재 이벤트를 해서 여기서 구매했어요 ㅋㅋ
손난로도 좋으면 많이 홍보할게요~! 수족냉증이 심했는데 이벤트하는거 보고 완전 행복했어요 ㅋㅋ
카톡은 shift+Enter 하면 전송돼요
그리고 이리저리 눌러봤더니 설명서에 적힌거 외에도 키보드로 폰 제어가 가능하길 래 더 맘에 들어요
폰이라서 그런지, 한자키는 안먹더라구요!
따로 방법있으면 알려주세요 ~!
그리고 설명서에 없는 정격입력값과 배터리 용량은 따로 기입되어 있으면 좋을 것 같아요!
좋은 제품 감사합니다.
구매에 도움되시길 바라며..",[]
5,"지금 이 구매후기도 받은 키보드로 작서하고 있습니다. 휴대성이라는 측면을 보시고 키보드를 구매하시고자 한다면 이 키보드는 강추입니다. 3대 기기까지 쉽게 연결되고 장시간 사용할 수 있으니까요. 노트북 키보드보다 크기는 작아서 일부 키들은 치기가 불편하지만 휴대성을 생각하면 참을 수 있는 정도입니다. 굳이 불편한 부분을 말하자면 접히는 부분에 있는 키들은 조금 신경써서 해야하는 수준입니다. 예를들면 숫자 '3', '0', 'ALT' 그리고 '한자' 변환 키 입니다.
DELETE키와 BACKSPACE는 같은 키를 사용하고 있기 때문에 Fn키를 누르고 DELETE를 해야하는 단점이 있네요. 보기에 따라서는 조금 불편한 정도라도 보시면 됩니다.
이 키보드를 사용하다가 원래 노트북의 키보드를 사용하게 되면 너무나 공간이 넓어서 편하다는 것을 알게 됩니다. 그러니까 이 키보드는 휴대성에 포인트를 맞춘 것입니다. 그것을 고려하면 충분히 잘 만들었다고 생각합니다.",[]
5,"저는 사기전에 몇 미리인지 봐도 감이 안 오더라구요 그래서 대략적인 크기 알 수 있는 사진 첨부 해요~^^ 11인치 인데 파우치에 잘 들어가고 작고 가벼워요!!
키 소음은 좀 있는 편이라 도서관이나 스터디 카페 같은 곳에서 쓰려는 분은 피하셔야 할 거 같아요,, 그냥 일반 카페 같은 곳은 괜찮지 싶네요.
가격이 이거보다 저렴한 키보드 잠시 썼을 땐 입력이 바로 안 돼서 불편했는데 이건 치면 바로 글자가 나와요ㅎㅎ 제가 손이 커서 오타는 조금 나는데 이건 적응하면 문제 될 거 같진 않네용 완전 만족입니당ㅎㅎ!","['https://phinf.pstatic.net/checkout/20200519_235/15898913065586GtkX_JPEG/824DEB26-91C8-4563-A912-452FC8D90148.jpeg?type=f287', 'https://phinf.pstatic.net/checkout/20200519_19/1589891318447UYEQf_JPEG/DB87D1C0-FE21-4385-84DB-F35756F29055.jpeg?type=f287']"
5,"키감이 그렇게 좋은 건 아니지만
이정도면 키보드쓰는 느낌나니까 저는 괜찮았습니다
일단 생각보다 정말 가볍고 사이즈가 작더라구요
가지고 다니기 정말 좋았습니다
자동으로 켜지고 꺼지는 점도 좋고 연결도 잘되고
무엇보다 안드로이드 윈도우 맥 OS별로 선택할 수 있는데 이게 엄청 편하네요 !!!
그리고 무엇보다 배터리 잔량 체크가 한눈에 된다는 점
원래 쓰던 키보드가 안돼서 그런지 엄청 신기하고 세상 편하더라구요 ㅎㅎ
개인적으로는 케이스도 같이 구매하시는 걸 추천
거치대가 된다는게 자리도 많이 안차지하고 휴대성 갑입니다 완전만족♡
참고로 사진 속 태블릿은 갤럭시탭a8.0 with spen입니다 크기 비교하세요 ㅎㅎ","['https://phinf.pstatic.net/image.nmv/shopnbuyer_2019_10_10_0/eadf2596-eb04-11e9-9d6f-505dac8c38f5_03.jpg?type=f287', 'https://phinf.pstatic.net/checkout/20191010_15/1570674131160bEFby_JPEG/20191002_162834.jpg?type=f287', 'https://phinf.pstatic.net/checkout/20191010_11/1570674131264KhWXi_JPEG/20191003_120355.jpg?type=f287', 'https://phinf.pstatic.net/checkout/20191010_59/1570674131322x5o7C_JPEG/20191002_162722.jpg?type=f287']"
5,"최고의 제품입니다. 지금도 피스넷 키보드로 타이핑하고 있습니다. 탁월한 키감, 정확한 타이핑, 수려한 디자인, 가벼운 무게 모두모두 최고입니다. 가성비 최고이 제품입니다. 개인적으로 케이스는 그닥 필요없을 듯 한데... 있으면 더 좋겠지요??? 나도 케이스 갖고싶은데^^^ 어쨌든 피스넷 키보드! 강추합니다.~~~~","['https://phinf.pstatic.net/checkout/20200801_299/1596251566725uIxpX_JPEG/review-attachment-86e99a0b-8691-4e59-9c81-39f4fac6fe9e.jpeg?type=f287', 'https://phinf.pstatic.net/checkout/20200801_51/1596251597211531x5_JPEG/review-attachment-bf6966cd-ac66-4555-b28c-a1c67a331083.jpeg?type=f287', 'https://phinf.pstatic.net/checkout/20200801_8/1596251619334FHIdO_JPEG/review-attachment-d20ca032-bd75-40d6-8dd2-b47047f85ef3.jpeg?type=f287']"
4,"여자손인데 작은편 이면 기본타자기처럼 사용하는데 큰 문제가 없어요 불편한거는 ㅋ,ㅌ 칠때? 말고 사용감은 좋았구요. 몇일전에 ㅣ자 누르면 ; 키가 같이 입력되서 (딱31일째사용) 좀 황당했는데 폰에 블루투스 등록삭제하고 다시 등로가니까 되더라구요. 핸드폰으로 장문쓰는일이 많아서 구매하겠는데 핸드폰으로 요즈음 재난문자 많이 오는데 미리보이는 문자 넘기고 다시 이어서 글작성할때 또 영타만 되더라구요 (한/영 키 눌러도 계속 영타만되서) 다시 작성하던글을 닫고 다시 적으니 한글인식되더라구요 . 추천하신분꺼는 계속 잘쓰시던데 저는 간간히 미미한오류들이나서 좀 그래요
주5일동안 쓰다가 주 4일한번쓰는데 오랫동안안쓰면 그럴수있다고 하던데 그것도 좀 말이 안되고 ..
일딴 AS되니까 좀더 써봐야겠어요",['https://phinf.pstatic.net/checkout/20200618_121/1592446232498U9P4v_JPEG/1592446202339.jpg?type=f287']
5,"배송 정말 빠릅니다.
피스넷 폴더 노트를 가지고 있었는데, 조금더 가볍고 작은 키보드가 필요해서 주문해봤어요.
와..실환가? 좀 두툼해지긴 하는데, 남자 바지 뒷주머니에 쏙들어가네요.

지금 이 글도 휴대폰 연동시켜서 피스넷 폴더로 작업 중입니다.
ESC키와 DEL키는 Fn과 같이 눌러야 해서 좀 적응이 필요해 보입니다.

적극 추천합니다.","['https://phinf.pstatic.net/checkout/20200902_252/1599029205066lkN8n_JPEG/review-attachment-cdb46678-f76f-4ec9-af91-2e19e842ab26.jpeg?type=f287', 'https://phinf.pstatic.net/checkout/20200902_100/1599029204876QlX5b_JPEG/review-attachment-2ced6ce2-7763-482d-acc3-9d8603249537.jpeg?type=f287']"
