star_point,comment,photo
1,"**4월이 되어 후기 추가합니다.
첫 후기를 올린 후 피스넷 사에 문의를 했어요. 제가 해외거주중이라 이미 키보드를 받았을땐 교환/환불 가능 기한이 지난 시점이었는데 혹시 한국에 방문하는 길에 제품을 가져가서 업체로 보내면 불량 여부 확인 및 수리라도 받을 수 있겠냐고요. 업체에선 굉장히 친절한 답변과 함께, 불량이었던 키보드를 교환해주셨습니다. 별 하나의 후기를 올렸음에도 교환 후에 후기 수정요청 한번 하지 않으시고 순수한 고객서비스 차원으로 도움을 주신 같아 참 감사했습니다. 뒤늦게 후기 수정이 되는 것을 확인하고 짧게 적어봤어요. 감사드립니다. 잘 쓰고 있습니다^^
----------------------
우선 정말 가벼워요. 케이스와 함께 구매했는데 . 다만 . 키보드로 한참 치고 보면 스크린에서는 이제야 문장의 반쯤 입력된 상태랄까요.
쓰다쓰다 답답해서 구매를 후회한 정도인데 제가 받은 제품만 그런건지는 모르겠습니다.

키감은 좋지만 개인적으로는 작은 키보드가 오타율이 높아 풀사이즈 키보드로 다시 구매하려했는데 반응속도가 늦어 구매가 망설여집니다.",['https://phinf.pstatic.net/checkout.phinf/20191207_267/1575657704920NVQ65_JPEG/1572912025575.jpg?type=f287']
5,"블루투스 키보드 여러가지 비교하다 피스넷 폴더로 구매했습니다.제가 좋았던 점은1. 가볍다!! 제 기억으로는 180g?였던 것 같은데 저는 태블릿이랑 같이 들고다니면서 사용할 용도라 휴대성이 1순위였어요.2. 편하다! 키 배열이 노트북과 같고, 다른 접이식과 다르게 일부 키 크기가 들쭉날쭉함이 없다!3. 페어링이 3대까지 된다. 전 주로 태블릿이랑 휴대폰? 정도 왔다갔다 해서 3대까지 필요없긴 하지만 PC까지 같이 사용할 여지가 남아있다는 심리적인 만족감은 있네요ㅋㅋㅋㅋ쓰면서 아쉽거나 약간 불편한 점은휴대성을 위해 크기를 작게 하다보니 백스페이스( 그리고 메인(?) 키보드로 사용하기에는 약간 좁은 느낌은 있어요 손 크신 분들은 사용하기 불편하실듯ㅠㅠ 제가 쓰는 아이패드 에어랑 같이 놓았을 때 길이가 딱 맞아요! 타자 치기 불편한 거 싫으신 분들은 요거랑 같은데 크기 좀 더 크고 열 하나 추가한 폴더 노트 추천드립니당ㅎㅎ저처럼 게 우선이라면 이 제품 폴더!!. 주변에서 블투 키보드 찾으면 추천할 의향 1000%",['https://shopping-phinf.pstatic.net/20191118_12/d18554fe-ae8c-4784-9dfe-fcdd4162a55f.jpg?type=f287']
5,"사용용도 : 아이패드 미니 키보드
로Gㅌ꺼에 꽂혀서 사려고 했었으나 피스넷껀 접이식이라서 휴대성이 더 좋고 사이즈도 더 알맞아서 이 제품으로 구매했었습니다.

역시나 제 선택에는 후회없구요!
BT1에는 아이패드, BT2에는 아이폰으로 등록해놓구 잘 쓰고 있습니다.
호환도 빨라서 완전 ㅎㅅㅎ",['https://phinf.pstatic.net/checkout/20200604_266/1591281949031DGxiL_JPEG/198B8F69-5DED-4B84-8376-2E9745A625D4.jpeg?type=f287']
4,"크기 무게 디자인 배송 모두 좋아요

별 한개 뺀거는 크기를 너무 줄이려 하다보니 일반 자판에 비해 숫자칸이 한칸씩 오른쪽으로 밀려있어요;;
아 이게 좀 짜증나고 또 숫자에 붙어있는 특수문자도 자연스럽게 한칸씩 밀려서 나옵니다
예를들어 키보드에서 ^^ 입력하듯이 누르면 %% 이렇게 뜬달까요?
그담에는 백스페이스키가 작아서 좀 불편합니다

정말 맘에 드는 제품이지만 크기 조금만 더 키워서 키간격 조금 더 늘리고 숫자키 배열도 일반키보드처럼 만들었으면 좋겠습니다

Ps. 케이스 끼워보니 미끄럼 방지 스티커랑 호환이 안되네요 전 걍 떼고 씁니다ㅋ",['https://phinf.pstatic.net/checkout/20200205_167/1580901052549umrf2_JPEG/20200205_200406.jpg?type=f287']
5,원래 피스넷 무선이어폰을 잘 쓰고있었어서 기대가 컸었는데 기대이상이네요 ㅎㅎ 그냥 불편한게 하나도 없어요. 자판도 따로 적응하지 않아도 원래쓰던 그대로고 연결도 잘되고 ! 딱 노트북에서 키보드 부분만 오려서 휴대성있게 쓰는 것 같은 느낌일 정도로 불편함 없이 좋습니다♡ 앞으로도 좋은 제품 많이 만들어주세요!!:),[]
4,"만족합니다!!크기가 작고 생각한 거 보다 훨씬 가벼운데
휴대폰 무게 쯤 되는 것 같네요. 가방에 쏙 넣고 다니기에
아주 유용할 키보드입니다.
근데 그만큼 크기가 작다는게 손이 크신 분들은 많이
불편하실 것 같아요. 저도 손이 그렇게 큰 편은 아니거든요.
근데 좀 가동범위가 좁다고 해야하나 암튼 불편하긴 합니다.
적응되면 괜찮을 것 같긴하네요.
. 근데 아주 조용한 곳, 예를 들면 도서관 같은 장소에서는 소리가 나니까 사용하지 못할 것 같습니다.
아 그리고 블루투스 연결도 빠르게 잘됩니다.
이 뭔가 회색 색깔도 은근 멋지고 추천합니다. 배송도 괜찮았습니다!^^",[]
5,"펼쳤을때 전체크기는 상당히 작지만 키캡이나 인쇄된 문자는 제법 큼 ,잘보입니다 .생각보다 편함
키 타건감 쫀득하고 소리도 편한 느낌 딱딱한 바닥을 치고 올라오는 견고한 느낌
사용 편하고 타블릿이나 스마트폰용으로 적합한데 BT1,2번에 타블릿,스마트폰 등록하고 쓰고있음
점퍼 주머니에 들어감
폴더노트보다 폴더를 휴대용으로 더 추천합니다",[]
5,"구버전을 사용해 본 경험에 의하면, 접어두면 배터리가 상당히 오래가서 자주 안써도 다시 충전하느라 불편하지 않은 점이 좋고, 키감이나 간격이 접이식이라해서 특별히 이질감이 많이 들지않는다는 점이 좋습니다. 그냥 노트북 키보드 사용하는 느낌입니다. 이 제품도 장점을 그대로 이어받았네요. 추가로 구버전에 없던 del 키가 생겼고, 방향키도 수정하여 타이핑이 더 편해졌습니다. 휴대용이라 여러기기에 페어링되면 편한데 구버전은 하나만 되어서 아쉬웠죠. 이 역시 개선되었고, 이제 흠잡을 데가 별로 없네요. 가격도 적당해서 더욱 좋습니다.",['https://shopping-phinf.pstatic.net/20191130_17/7ca3ce75-e874-49e2-83bf-015b4cdc4929.jpg?type=f287']
5,"진짜대만족키배열 만족 무게.뭐 나쁘지않음페어링편함접이식좋당 지금도 키보드로 쓰는데 뭔가 어색하긴 하지만다른 키보드보다는 빨리 적응할것 같네요 단점 : 양 옆이 약간 쳐지는 느낌 딱 일자가 아니라는 점? 근데 아주아주 작은 단점많이 헐겁지도 않고 장점 9.5 단점 0.5 정도 ???블루투쓰 키보드, 접이식키보드 작은 사이즈 키보드 다 알아보고오랫동안 공부하면서 결정 내렸움 소음도 이정도면 없는 편 폴더 노트를 삿는데 폴더 는 어떤지 궁금함 폴더도 써보고 싶음나한테는 키가 뭔가 좁기보다 넓은 느낌.이라서 더 좁아도 잘쓸수 잇을거 같음하지만 페어링 부분에서는 폴더노트를 사야햇음~~~거치대를 사는게 맞는지 지금도 고민됨;;;;한번에 삿어야햇는데......모르고 그냥 사버림 ㅠㅠ",[]
5,"블투 키보드 사기 전에는 아이패드로 텍스트 어떻게 입력했나 싶을 정도로 잘 쓰고있어요.
다만 가끔 한영키가 먹통이 된다는 점, ~ 표시를 쓸 때 ₩로 입력되는것과 같이 자잘하게 불편한 부분이 있긴 해요.
그래도 삶의 질 향상템이라 5점 남겨요~~",['https://phinf.pstatic.net/checkout/20200608_27/1591616808669WWIlM_JPEG/CCD88DA7-A7F2-4839-A4F0-0FE70A0235F8.jpeg?type=f287']
5,"블루투스 키보드 검색하다가 피스넷 접이식 블루투스 키보드가 좋다고 추천하길래 구매했어요^^
결과는 대만족!!! 정말 마음에 듭니다!!!
블루투스 키보드 사용하는 이유가 휴대성 때문인데, 정말 가볍고 3단으로 접히니 컴팩트해서 핸드백에도 넣고 다니기 좋아요!!
8인치 태블릿과 이용하려고 구매했는데 사이즈도 딱 알맞고, 키보드 배열도 편리합니다!!!
고민하지 마시고 구매하세요~~~",[]
5,멀티페어링 잘되고 펼치면 자동 전원 on에 페어링도 바로 되고 편하고 좋네요. 기존에 쓰던건 멀티페어링이 안되고 연결도 그때그때 해줘야해서 번거로웠는데 너무 편해졌습니다. 고무패드는 딱히 안붙여도 쓰는데 지장없을거같네요. 휴대성때문에 작은거 샀는데 오타는 좀 나지만 익숙해지면 괜찮을것 같아요. 전용가죽케이스도 물건이네요. 따로 거치대 안갖고 다녀도되고 사진만 봐서는 케이스옆면?으로 키보드가 빠질거같았는데 케이스에 키보드 뒷판만한 큰 홈이 잇어서 키보드를 잘 고정해줘서 안빠지네요. 거치도 잘되고 각도도 어느정도 조절되고 좋습니다.,"['https://phinf.pstatic.net/checkout/20190922_77/15691285355909s4ks_JPEG/6DD1E689-86F1-47FC-B51C-40BDFAA4EBB6.jpeg?type=f287', 'https://phinf.pstatic.net/checkout/20190922_238/15691285355656TTy8_JPEG/3F509F09-6EFE-4663-BDE0-357B8FBE18C8.jpeg?type=f287']"
4,"좋아요!!! 이 후기도 블루투스 키보드로 쓰고 있습니당ㅎㅎㅎ 화이트깔끔하고 정말 이쁜거 같아요.
타자도 잘 쳐지고, 다만 제가 한/영/일 3개의 언어를 사용하는데 한영키를 누르면 한국어에서 일본어로만 바뀌고, ctrl+spacebar키를 눌러야 원하는 언어로 바꿀 수 있어서 조오금 번거롭긴 하네용ㅎㅎㅎ

그래도 가격 괜찮고, 정말 가벼워서 사용하기 좋아 추천드립니다!!!",['https://phinf.pstatic.net/checkout/20200918_222/1600415431157VxYNA_JPEG/review-attachment-a5538484-57a3-4e65-a3b8-f70905448f2a.jpeg?type=f287']
5,"2년 반 동안 사용한 폴더 노트가 고장나서 작은 사이즈인 폴더를 구입했어요. 휴대폰, 노트북, 패드까지 세 대를 필요에 따라 연결할 수 있어서 좋습니다. 폴더 노트보다 키가 약간 작지만 가벼운 게 가장 맘에 들어요. 생각보다 오타도 별로 없고, 인식도 빨라요.
사이즈 비교해 보시라고 사진 첨부합니다.
참고로 AS가 굉장히 친절해서 또 구입했어요.",['https://phinf.pstatic.net/checkout/20200513_251/1589363599636aKMPo_JPEG/20200513_173936.jpg?type=f287']
5,"생각했던 것보다 작고, 생각했던 것보다 두껍긴 합니다
그래도 펼쳤을 때 꽤나 큰 사이즈의 키보드로 변하고 딱 떨어지는 메카니컬 적인 설계가 다른 저가품과는 품질이 다릅니다
타건 시 적당히 소리도 나고 눌리는 감이 확실한 걸 좋아하는데 딱 그렇더라구요
아이패드용으로 구매했는데 알루미늄 재질이라 아이패드와 보관할 땐 별도의 파우치가 필요할 듯 합니다",[]
5,휴대성 하나는 진짜 좋아요!! 로지텍이랑 고민하다가 로지텍 반품했는데 그러길 잘한 것 같네요ㅎㅎㅎ 다만 컴팩트한 사이즈다보니 키보드에서 쓰는것보다는 한계가 있지만 이만한 가격에 이 퀄리티면 만족합니당ㅎㅎㅎ 다른 사람들한테도 영업하는중이에요 번창하세요~~~,"['https://phinf.pstatic.net/checkout/20200326_150/1585184803386sWotT_JPEG/11.jpg?type=f287', 'https://phinf.pstatic.net/checkout/20200326_93/158518480320189QkC_JPEG/22.jpg?type=f287']"
5,배송받자마자 상품평으로 테스트 해보는데 이상없이 잘 작동되네요. 페어링도 간단하게 잘 되고 너무 간편합니다. 지금까지 힘들게 핸드폰 자판 두드렸던게 너무 억울합니다.다른 저렴한 제품들도 많이 있지만 노트북 키 배열과 동일하면서 폴더로 접혀서 휴대성도 좋으며 키감도 좋고 디자인까지 좋은 제품은 이 제품 말고는 없는것 같아요^^!! 아무쪼록 고장나지 않고 오랫동안 사용가능했으면 좋겠습니다. 참고로 선물용으로 또 하나 구입했습니다!!정말 너무너무 좋아요~~^^!!!,['https://shopping-phinf.pstatic.net/20191206_17/baf9106e-4be1-4c9b-80a0-43b862c2c6e4.jpg?type=f287']
5,"제가 라이딩할 때 쓰는 블루투스 스피커가 피스넷인데 (뮤직라이더), 스피커 살때도 피스넷이라는 이름이 낯설지 않다 생각했는데 일전부터 사려고 찜해둔 이 폴더 키보드가 피스넷이었네요.무결점 스피커는 물론 사은품까지 꼼꼼하고 빠르게 챙겨줘서 좋은 인상을 가진 곳이에요.드디어 구매했는데, 실용성을 넘어 감동입니다.저가형 키보드인데 흠집도 하나 없고, 키감이나 포장상태, 마감성 등 뭐하나 흠잡을데가 없네요.특히 폴딩..접히는 부분도 영구적으로 쓸 수 있도록 고안되어 있습니다.폴딩하고나면 스마트폰 정도로 작아지는 수준이며, 충전 시간은 2시간 이내입니다. 광고에는 일반 노트북과 동일하다고 나와있지만, 자판은 살짝 조고마한 느낌입니다. 타이핑하는데는 전혀 무리가 없고, 오히려 미니사이즈로 특화된 느낌입니다. 팬터그래프의 키감도 기기별로 다른데, 이 기기는 쫀득하니 손에 잘 달라붙는 느낌이에요.푹신한 배게같은 곳에 놓고 써도 지장이 없습니다. 전 실버 화이트 색상으로 주문했는데, 매우 이쁘네요.충전 케이블 꽂은채로 충전하면서 쓸수도 있습니다. 유일하게 살짝 아쉬운 것은, 5핀 충전포트의 위치가 애매하게 쑥들어가 있어충전할 때 케이블잭이 완벽하게 체결되는 느낌이 부족해 살짝 불안정합니다. 가만 놔두면 괜찮긴한데, 충전하면서 들었다 놨다 하면 램프가 불안정해요.작은 단점 하나에도 불구하고 이를 상쇄할 만큼 전체적으로 대만족입니다.","['https://shopping-phinf.pstatic.net/20171111_19/2ba142cc-00b5-4277-905b-67abc63f4eeb.jpg?type=f287', 'https://shopping-phinf.pstatic.net/20171111_15/e5e49d05-438d-4ab2-8b39-1cde7ddfc16e.jpg?type=f287', 'https://shopping-phinf.pstatic.net/20171111_27/e8306253-8596-4198-8dea-341e36403f86.jpg?type=f287', 'https://shopping-phinf.pstatic.net/20190627_25/4d5fdf25-04c1-477a-a7b0-ba651a7e7461.jpg?type=f287', 'https://shopping-phinf.pstatic.net/20190627_18/fa40109a-0be9-4296-932d-8e6fdb492c15.jpg?type=f287']"
5,굉장히 작고 가벼워요 접어두면 손바닥안에 다 들어오는 정도? 전자사전사이즈예요. 펴면 사진만큼이예요. 무거운걸 싫어하는데 피스넷키보드는 가볍다고해서 사봤어요 키감도 상당히 좋은 편이고 정말..이세상 가벼움이 아니네요 전체적으로 너무 만족스러워요 다만 백스페이스키가 너무 작고 위쪽에 있어서 자꾸\키를 누르게 된다는점과 타자칠 때 약간 덜컹거려서 동봉된 실리콘을 붙였는데 이게.. 미관상 썩 좋지가 않아서 아쉬워요 그래도 가볍고 키감좋아서 강추입니다!,['https://phinf.pstatic.net/checkout/20191114_133/1573663610130sFNBG_JPEG/8737A60D-818E-4A6C-B92F-BF148BE5D66D.jpeg?type=f287']
5,"접이식 휴대용 키보드를 알아보다가, 충전식 피스넷 휴대용 무선 블루투스 키보드 폴더 3단을 구매하였습니다.
가볍고, 휴대하기 좋은 장점이 있네요.
충전식인 것도 좋구요.
충전단자가 5인것은 아쉽고요.
위에 기능키가 기능버튼이랑 같이 눌러야 되는 것은
아쉬운 부분입니다.
그래도 .",[]
4,처음에 한쪽이 좀 눌려있고 안펴지는줄 알고 불량인가 했는데한번 펴고나서는 제대로 작동합니다. 완전히폈을때 의외로 탄탄하며 고급진 느낌이있고 유격이나 흔들림도 적습니다. 들어있는 고무로 고정하면 조금 더 안정적이며 접이식키보드로 왜 유명한 지를 알것같습니다.가격대비 강추입니다.,[]
4,"블루투스 연결도 엄청 빨라요 기...
가볍고 사용이 간편해요
블루투스 연결도 엄청 빨라요 기기간 블투 변경도 빨라요
소음이 보통정도로 있어요 조용한 도서관은 무리지만 카페 정도는 괜찮을정도입니다
단점이라면 기기 자체 무게는 183이지만 케이스까지 합하면 300g이 넘어서 들고 다니는데 아주 가볍다고 할수는 없어요","['https://shopping-phinf.pstatic.net/20190627_18/ef6fe820-b4ca-4be3-975c-8b2b935633aa.jpg?type=f287', 'https://shopping-phinf.pstatic.net/20190627_15/4e91d52d-7559-4dac-8488-52adc7bea607.jpg?type=f287', 'https://shopping-phinf.pstatic.net/20190627_12/d180a060-f9ce-47de-9dab-a631a074149f.jpg?type=f287', 'https://shopping-phinf.pstatic.net/20190627_19/b2792ba2-3109-40f4-b232-91a35e8ffb16.jpg?type=f287']"
5,배송 무지 빠르네요~ 두근두근 첫인상은 만족입니다~ 생각보다 퀄리티가 아주 좋네요~ 타자감이 안 좋다고 하시는 분이 만았는데 전 만족하고 있습니다. 한영키 전환도 아주 잘되네요. 일본어까지 샥샥 아주 잘 변환됩니다. 다만 전 키보드를 약간 사선으로 두고 치는데 넘 평평해서.... 이건 뒤에 뭐를 받쳐야 겠네요. 그 외에는 만족하니다. 오타가 많다는 분들도 계시던데 미니노트북 사용하시던 분은 충분히 적응하실 수 있을 거 같아요. 12-13인치 노트북 쓰던 경험이 있어서 충분하네요.^^,[]
5,"원래는 B사 제품의 5만원대 제품을 사려고 했습니다.
그런데 트랙패드가 어차피 iOS계열에서는 작동하지 않는 다는 후기를 읽고나서는,,
어차피 트랙패드 지원이 안되니, 다시 후보를 선정하려고 하는 찰나,
하단에 추천된 제품에 피스넷 폴더 블루투스 키보드가 보였습니다.
정말 별 기대하지 않고 클릭해봤는데,
후기도 정말 많고, 평점도 너무 높아서 긴가민가 했던게 사실입니다.
그런데,, 받은 직후부터 완전히 이 키보드의 매니아가 됐습니다.
기동성 좋고, , 키보드감 좋고, 반응성도 좋고요.
무엇하나 빠지는게 없습니다.
2만원대의 가격으로 이런 제품을 쓸수있게 해주셔서 감사합니다.",['https://shopping-phinf.pstatic.net/20191118_20/e19c02a4-a78f-4232-836c-e1ecc43391ec.jpg?type=f287']
4,"아이패드미니랑 같이 들고다니면서 쓸용도로 구매했어요! 사이즈 딱이에요!아이패드미니 1, 5 두개가지고 있는데 전부 연결 잘되구요!접이식특성상 좀 힘이없는 느낌이긴 하지만 인식도 잘되고 사이즈보고산거라 너무 만족스러워요!자판도 쓰기편하고 디바이스 세개까지 연결되는점 그리고 기기전환도 빨리되네요.고장안나고 오래 쓸 수 있었음 좋겠어요!","['https://phinf.pstatic.net/checkout/20190717_121/1563334471212cxSAA_JPEG/0056B7C5-CD04-4F01-8A32-D2F36C1198B6.jpeg?type=f287', 'https://phinf.pstatic.net/checkout/20190717_226/1563334470073hKXh0_JPEG/289E34E1-B79B-493F-8E35-2661F7ACCD0E.jpeg?type=f287', 'https://phinf.pstatic.net/checkout/20190717_94/1563334460506pQxNo_JPEG/F5E7B8CC-82D4-455C-A581-3263A7707E59.jpeg?type=f287']"
5,기존에 로지텍 k480을 사용하다가 휴대성이 안 좋아서 이것저것 찾아보다 이 제품을 구입하게 되었는데 키감도 이 제품이 훨씬 나아 보인다. 여자 치고 손이 큰 편인데(남편과 거의 손사이즈 일치) 작아서 와타가 많이 난다는 느낌은 없다. 아직 숫자키가 익숙하지 않아서 그것만 익히면 될 듯하다. 이 제품을 하루 써본 후 만족도는 제일 높다. 이 금액에 이정도 휴대성과 키감은 최고인 듯 보인다.,['https://shopping-phinf.pstatic.net/20191212_25/99912745-92fb-4d94-b764-be8adf2b3856.jpg?type=f287']
5,"여러 키보드와 비교 후 구매를 했습니다. 일단 자판 크기가 접히더라도 그대로여서 마음에 들었습니다. 그런데 펼치면 어느 정도 딱 잡아주는 느낌은 납니다만 벌어진 무릎 사이에서 자판을 치면 접힙니다. 그리고 자판 자체 크기가 작다보니 초반에는 오타가 많이 생깁니다. 이건 적응하기에 달렸겠지요. 터치감도 괜찮고요. 하루만에 배송 되었고. 만족합니다.
-제 테블릿에선 한영 키가 작동을 하지 않네요. 핸드폰에서는 한영 키 작동합니다.
삼성스마트티비의 유튜 검색에 사용 가능합니다. 키 하나를 계속 누르고 있으면 계속 글자가 입력이 되고요.",[]
4,블루투스 키보드는 처음 구입하여 사용해봅니다. 아직 익숙해지지 않아서 오타가 많이 나지만 지금도 상품평을 블루투스 키보드로 연결해서 사용하고 있습니다. 백스페이스가 일반 키보드보다 위에 있다보니 지우려고 하다가 다른 키가 계속 눌리게 되네요. 그래도 적응하면 좋아질 것 같습니다. 다만 안타까운 것은 블루투스로 연결한 다른 기기를 거치할 수 있는 받침이 없다는 점을 제외하면 괜찮습니다.,[]
5,가장 좋은점은 접힌다는거예요. 접으면 한 손 안에 쏙 들어와서 좋아요. 블루투스 연결되는 속도도 빠르고 정확하게 잘 됩니다. 타자치는 느낌도 너무 좋습니다. 휴대성 좋고 페어링 빠르고 전부 다 좋아요 가성비 좋은 것 같아요.,[]
5,"회사 업무용으로 블루투스 키보드가 필요해 구매했습니다이번 제품 전에는 앱코 BT200을 사용했었는데, 키감이나 배열은 좋지만 바인더, 다이어리와 함께 들고 다니다보니무게의 압박이 생길 수 밖에 없었네요그래서 가벼운 제품을 선택하려다 용도에 딱 맞는 이 제품을 선택하게 됐습니다갤럭시노트9과 페어링 속도도 빠르며, 입력 딜레이 또한 없습니다다이어리와 사이즈가 딱이다 보니 크기나 무게로 인한 스트레스는 없을 듯 합니다다만, 펼쳐지는 흰지 부분과 충전부의 마감이 아쉬우며 충전중시 램프가 키보드 안에 들어가서 잘 안보이는 부분은추후 제품에서 개선해 주셨으면 합니다",['https://shopping-phinf.pstatic.net/20191118_1/740b8119-7a7c-43b0-aa52-7512c2457678.jpg?type=f287']
4,굉장히 컴팩트하고 좋아요. 케이스까지 샀는데 키보드 흔들리는거 보정해주는 고무 붙이면 케이스에 완전히 착 감기지 않는건 조금 아쉽네요. 키감은 괜찮은 편이지만 아무래도 컴팩트한 제품이다 보니까 적응은 조금 해야할 것 같아요,['https://phinf.pstatic.net/checkout/20200506_221/1588746860139rCtRw_JPEG/15887468516238998870348281705692.jpg?type=f287']
5,경쾌하게 펼쳐지고 키감도 아주 좋습니다 딜레이도 거의 없는 편이고요 컴팩트한 사이즈에 걸맞는 기동성이 핵심인 키보드네요! 그런데... del키가 너무 작아요ㅜㅜ del 아래에 있는 키랑 크기를 바꿨음 좋겠습니다 단 하나의 아쉬움...,['https://phinf.pstatic.net/checkout/20200402_39/1585825199043RpoRE_JPEG/20200402_195946.jpg?type=f287']
5,"모든기능 잘됩니다 상품은 만족합니다 튼튼해보이고 블투도 금방 페어링됩니다 정말 신세계입니다
노트북 같아요 적극추천합니다 받침고무도 포함되어
붙였더니 안정감있게 타이핑할수 있어 좋습니다
강추합니다 옛날꺼와는 비교가 안될정도로 품질이 좋습니다",[]
5,매끄럽게 열리고 닫힙니다. 커이스도 거치대로 쓰기 딱 좋네요. 3가지 기기 모두 연결해 봤는데 연결도 원활히 잘 됩니다. 휴대도 간편하고 넘 좋아요. 단 키보드 소리가 조금 커서 조용한 장소에서 사용하시기는 좀 불편하실 듯 합니다.,[]
5,지금 이상품평도 이 키보드를 활용하여 작성중입니다. 잘 받아보았습니다. 써보니 무선인터넷과 간섭현상도 있으니 인터넷에서 설정하는 법을 배우셔서 간섭일어나지 않게 설정하세요... 인터넷방송볼 때 끊겨서 재접할 때는 불편합니다. 대역폭 문제 인거 같습니다.,[]
5,글쓰는 직업인데 노트북을 들고다니기 번거로울 때가 있어서 핸드폰이랑 연결해서 쓸 수 있는 휴대 편한 키보드 찾다가 피스넷을 발견했어요. 다른거랑 고민하다가 폴더노트가 접히기도 하고 펼치면 사이즈도 노트북키보드랑 똑같아서 이걸로 주문!!ㅋㅋ 인기가 많아서 그런지 품절되는 바람에 재입고 기다리느라 힘들었지만 미리 안내된 기간보다 빠르게 받을 수 있어서 좋았어요. 12월이나 돼야 받을줄 알았는데^^ 키 다 잘 먹고 생각보다 크고 생각보다 가벼워요. 핸드백에 부담없이 들고다니기 좋을 것 같아요. 요거 진짜 물건이네요^^,['https://shopping-phinf.pstatic.net/20191124_17/d7d62d84-743b-4528-84c6-a2a15bdf378e.jpg?type=f287']
