star_point,comment,photo
5,"구입한 키보드로 상품평을 작성하고 있습니다. 신세계입니다. 제품 좋아요 다만, 뒷면 판데기만 알루미늄이고 연결고리는 금속재질이 아니네요, 프라스틱 재질입니다. 그래도 품질은 만족합니다. 밧데리 성능은 더 사용해봐야 알것같으니...",[]
5,"저렴하고 쓸만한 무선 키보드를 사용하다가, 접이식은 틈새가 벌어지는 보기흉한 모습때문에 거르고 거르다가틈이 없는 피스넷 접이식 키보드를 보고, 고민할 것도 없이 구매를 눌렀네요. 터치감이 부드럽고 좋습니다. 접이식이어서 흔들릴것 같은데, 키보드 받침대가 생각보다 견고합니다. 전혀 흔들림 없이 작성되어서 편안하네요. 이 작성하는 글도 피스넷 키보드로 작성하는데, PC에서 사용하는 키보드보다 터치감이 좋아서 타자수가 더 높게 나오네요. 손이 키보드위에서 가볍게 날아다니는 느낌 토도도도독 토도도독 소리도 적당히 시끄럽지 않고 좋네요. 펼치면 자동으로 켜지고 연결되는기능 너무 멋지네요.닫으면 자동으로꺼지는것이 참 스마트한 기술이네요. 모든것이 만족이고, 이것이 망가질때까지 다른것은 생각 날 일 없겠어요. 좋은 제품 만들어주셔서 감사하고, 잘 배송해주셔서 감사합니다.","['https://shopping-phinf.pstatic.net/20191118_11/5d0fb38e-f860-4213-b728-219037078462.jpg?type=f287', 'https://shopping-phinf.pstatic.net/20191118_11/e7c2cc37-214c-4563-a57f-1e1a85b728d1.jpg?type=f287']"
5,20년 1월 14일 후기스타일: 깔끔하고 모던함.타이핑 느낌: 일반 키보드느낌과 비슷함. 다만 휴대 사이즈라 손큰사람들은 좀 불편하기도 할듯함.사이즈: 큰 물티슈 크기정도.휴대성: 최고안전성: 최고충전: 5핀 스타일이여서 영구적임.불편함: 아직까진없음완전 탐 나는 키보드. 최고!,[]
4,일요일에 주문하고 화요일에 도착해서 기분 좋게 개봉했었는데 방향키 불량으로 반품하고 오늘 교환상품 받았네요 그래도 이번주 내로 보내주셔서 다행이에요 택배 오자마자 확인했는데 이번에는 정상제품으로 와서 기쁘네요 디자이도 괜찮고 크기도 좋아서 휴대하면서 글쓰면 될 것 같아요 배터리도 이상없이 오래갔으면 좋겠네요. 후기보고 구매하실분들은 구매하신다음 꼭 충전이 잘 되는지 키보드 키는 다 정상작동하는지 꼼꼼히 보시길 추천해요 행낭포장으로 택배배송이 되는거라 제품에 하자가 생길 수도 있나봐요 고객센터도 신속히 처리해주고 좋으니 무선 키보드 필요하신분들은 이 제품 추천드립니다:D,['https://shopping-phinf.pstatic.net/20191118_24/e89a6e32-b5bb-44a8-9a45-05c82000a1ac.jpg?type=f287']
4,블투 키보드 하나 있는데 외출용으로 샀어요. 원래 700타 속도로 치면서도 오타 잘 안 나는 사람인데 자판 배열이 묘하게 손에 안 맞아서 자꾸 오타가 나네요. 그래도 엄청 가볍고 딱 맞는 사이즈여서 맘에 들어요. 아이패드 파우치에 펜슬이랑 같이 넣어서 들고다니면 기분굳ㅎ,['https://phinf.pstatic.net/checkout/20190709_255/1562652266209Y1CgM_JPEG/1562652019333.jpg?type=f287']
5,"두번째 사용하는 건데요.
페어링도 빠르고 기기를 3개나 등록하여 사용할수 있어서 아이폰이랑 아이패드랑 번갈아 가며 사용하는데 완전 마음에 듭니다.
다른제품도 사용해보고 다시 사용하는건데
요 가격대에 피스넷만큼 괜찮은거 없는거 같아요.",['https://phinf.pstatic.net/checkout/20191113_176/1573615562565Ag54J_JPEG/E6139DCA-3CF4-4D95-8F54-A56E80F32B58.jpeg?type=f287']
5,"어두운 색은 싫고, 실버는... 혹시 그냥 금속색상(반짝임없이 그냥 회색..)일까봐, 골드는 촌스러운 금색 많잖아요.. 너무 노랗다던가, 베이지색상같다던가.. 그래서 실버랑 골드 중에 고민하다가, 이상하면 차라리 어두운 색으로 교환하지 뭐!!!! 라는 심정으로 질렀는데, 세상에 이 색상 엄청 예뻐요.. 그 간의 고민이 무색할 만큼 예쁩니다ㅋㅋㅋ 그리고 애석하게도 사진에 그 예쁨이 다 안 잡히네요ㅠ 일반적인 진짜 예쁜(메이컵에 관심 있으신 분들은 흔히 샴페인골드 아이섀도우에서 살짝 톤다운 된 색상 생각하시면 될 거 같아요) 톤다운된 샴페인골드 색상에 아주 살짝 붉은 기가 돈다고 상상(ㅠ)하시면 될 거 같아요. 성능 끝내주고요, 타이핑하는 순간 화면에 나타납니다. 전에도 접이식 썼는데 그것도 빨랐거든요 분명! 긍데 이게 더 빨라요.. , 접이식 펼치면 전원 바로 켜져서 폰에서 블튜만 키면 바로 타이핑할 수 있습니다. 미끄럼방지 스티커도 함께 왔는데 붙여보니까 색깔이 맘에 안 드는... 스티커 붙여도 케이스에도 무리없이 담기는데 그래도 색상이 맘에 안 들어서 투명 미끄럼방지로 사서 붙이려구요 :-) 이건 제 취향인 거니까요 뭐, 기능 자체엔 아무 문제 없습니다! 접이식 키보드 고민하시는 분들 지체없이 이거 구매하시길 바랍니다. 케이스랑 넘나 찰떡궁합.. 폰&패드지지대 역할도 짱입니다! (제가 올린 사진에 붉은 기가 아주 조금 더 섞여있다고 생각하시면 될 거 같아요!)",['https://shopping-phinf.pstatic.net/20180729_7/9fe7276f-367d-4663-8b0f-b78047d4c43b.jpg?type=f287']
5,괜찮네요 노트북을 거치대에 놓고 사용하게 된대다가 공간도 협소해 작은 키보드가 필요해서 샀어요 장점은 작고 가벼워서 좋네요. 어디 이동하면서 쓰기도 좋을 것 같아요그리고 따로 전원키가 없이 접고 펼지기만 해도 on/off가 되서 편리합니다.그리고 작아서 공간활용도 좋구요어디 리뷰서 보니까 키가 씹힌다고 했는데 아직 그런 경험은 없네요그리고 키감은 나쁘지 않아요아.. 타건 소리가 크다고 했는데 아주 작지는 않지만 그렇다고 해서 엄청 큰정도는 아닙니다. 키보드가 작아 키가 오밀조밀하게 모여있어서 오타가 좀 나는데 이거는 적응문제에다가 제품자체의 컨셉이 그러니 이거는 제가 적응해야 되서 단점은 안되네요진짜 단점은 경첩부분의 키를 누를때 약간 거슬립니다. 경첩부분이 튀어나와 있어 근처 키를 누를때 같이 건드리게 되네요그리고 접었다 폈을때 펑션키와 조합해서 사용하는 설정이 돌아갑니다.예를들어 윈도우에서 사용하려고 윈도우에 맞춰놓고 F1~F12 키로 설정해 놓고 접었다 펴면 다시 안드로이드 설정으로 돌아가 다시 윈도우로 맞춰줘야 합니다.그리고 ESC 버튼 누를때 펑션키를 눌러줘야 되네요ㅠ이건 몰랐는데 은근 좀 불편하네요. 그래도 작고 가볍고 공간활용 좋고 이만한 키보드 찾기 어려워 괜찮은 제품이라 생각합니다.이 리뷰도 해당 제품으로 작성중인데 아직까지 적응이 안되서 오타가 나서 자꾸 썼다 지웠다를 반복하네요얼른 적응해서 편히 쓰고 싶습니다.,[]
5,통학생에게 꼭 필요한 필수품인 거 같아요!키보드도 다른 노트북보다 큰 편이라서 넉넉하게 손을 잡을 수 있고 반응속도도 매우 빠릅니다진짜 색깔도 너무 이쁘고 진짜 적극 추천합니다.선풍기도 상품평을 남기면 준다니 너무 좋구요!저는 핑크색 선풍기나 하얀색 선풍기를 주신다면 더할 나위 없이 좋을 거 같아요!!,"['https://shopping-phinf.pstatic.net/20180802_18/bc136305-7399-48ca-8779-e4c62b8ea877.jpg?type=f287', 'https://shopping-phinf.pstatic.net/20180802_5/1c029a91-b8ae-4704-8515-fa2dbdc0dfb3.jpg?type=f287', 'https://shopping-phinf.pstatic.net/20180802_8/1ef0c3b8-c85a-49c3-b1e5-93a692303c29.jpg?type=f287', 'https://shopping-phinf.pstatic.net/20190627_24/5d78e522-2663-484c-809e-be80fb723210.jpg?type=f287']"
5,"디자인이 심플합니다.무게도 편리하게 이동성 좋아 가볍습니다.주머니에 쏙 들어가요.아이디어가 좋네요.
베터리잔량,캡스룩,등등이 발광LED로 표시가됩니다.상품이 알차요.ㅎㅎ
이상 상품 후기였습니다.많이 번성하길 응원합니다.힘내십시오!!",[]
4,작고 귀여워요! 손이 작은 편인데도 확실히 키보드가 작긴 해요.ㅅ을 써야하는데 ㅛ가 눌리던가 숫자 1을 누르고싶은데 엉뚱한게 눌리는등 불편한게 조금 있긴 한데 한 3일 쓰면 익숙해질것같네요. 지금 3번째로 키보드 사용중인데 그럭저럭 처음보다 잘써져요~사알짝 반응속도 느린것도 있어요. 그래도 가벼운걸 원했어서 만족합니다.,['https://phinf.pstatic.net/checkout/20190506_252/1557147466659d7w6W_JPEG/597BC3F6-809A-461E-90EF-C94F007B1097.jpeg?type=f287']
4,"오타가 많이 나서 글쇠 간격이 다른 탓이라 생각했습니다.그러나 시험해 보니, 간격이 아니라 누르는 위치에 따라 입력이 안되네요.글쇠의 중앙이 아닌 가장자리를 누르면 입력이 안됩니다.확실히 글쇠가 눌려졌는데도, 글쇠의 중앙이 아닌 모퉁이를 누르면 입력이 안되었습니다.다른 불편한 부분도 있지만, 이 점만 개선해도 충분히 좋은 제품이 될 것 같습니다.지금으로서는 휴대성도 높고 튼튼하지만, 긴 글을 빠르게 입력하기에는 적당한 제품은 아닌 것 같습니다.",['https://shopping-phinf.pstatic.net/20190627_11/ac063870-5d8b-4d77-837e-0ea29a6c5f58.jpg?type=f287']
5,핸드폰으로 일본어키 쓰기가 불편해서 구매했습니다일어변환 잘되구요. 자판 키감도 좋아서 오타도 적습니다.노트북 자판보다 살짝 작지만 일주일 써보니적응되서 불편한건 잘 모르겠네요.카톡 보내기할땐 쉬프트키+엔터 누르면 보내가가 되네요가볍고 크기도 작아서 휴대성도 좋고 접은 상태에서 충전도가능해서 가방에 넣은상태로 충전하면 나름 편리합니다주변친구들에게도 추천중입니다.,"['https://shopping-phinf.pstatic.net/20190624_27/672b0501-08c1-4829-a519-88582b8dc449.jpg?type=f287', 'https://shopping-phinf.pstatic.net/20190624_28/f8583a33-a079-4aad-8913-56f71164add3.jpg?type=f287']"
4,가격대비 최고의 상품입니다. 배송도 빠르게 왔고 상품도 손상없이 배달되었습니다. 키는 밀집된 형태여서 기존의 통상적인 키보드에 익숙하신 분들은 적응 기간이 필요합니다. 금방 익숙해지니 염려는 하지 않으셔도 됩니다. 다만 아쉬운 점은 키보드 기울기 높이 조절이 되지 않아 좀 아쉽습니다.,[]
4,"아이패드 프로 11인치랑 사용하려고 샀는데 ㄹㅇ 만족그자체
손이 작아서 작은 사이즈 시켰는데 불편한건 아니지만 큰거 샀어도 후회는 안했을거같은 사이즈
아이패드 X 랑 세로길이 똑같고 옆으로 조금 더 큰 사이즈
페어링 빠르고 전체적으로 만족스러운데 적응기간이 필요해보여서 별 4개",['https://phinf.pstatic.net/checkout/20190925_284/1569400143660jP0j8_JPEG/003E6E76-04DE-4522-AE40-7B8A29A0A83D.jpeg?type=f287']
5,가로로 접히는 걸 살까 조금이라도 작게 접히는 걸 살까 고민하다가 이걸로 결정했는데3단으로 접혀서 작아서 더 괜찮은 것 같네요~태블릿에서 늘 화면을 가리는 키보드가 불편했는데 이제 편하게 쓸 수 있게됐네요많이 파세요~,[]
5,"휴대하기 좋고, 가벼워서 좋아요.
하지만 약간의 단점이 있어 3가지만 적어봐요.
1. 노트북 키보드에는 Backspace 버튼이 큰데 피스넷 키보드는 작아서 버튼 누를때 불편한점.
2. 스페이스바를 왼쪽 엄지손으로 누르는데 폴딩되는 스프링의 방해를 조금 받아 걸리적 거려요.
3. 손가락이 긴 사람에게는 버튼 간격이 좁아
키펀치 에러가 조금 생겨요.
이러한 단점이 있지만 대체적으로는
쓸만한것 같아요.
사업번창하세요~",[]
1,"문제점을 짚어드리겠습니다.1. 키보드의 배열이 비대칭적이고 크기차이가 극단적이라 오타율이 높고 빠르게 치기 어렵습니다. 왼쪽에 있는 Tab키는 정말 작아 누르기가 힘든 반면, 오른쪽 Shift키는 사용 빈도가 적음에도 매우매우 커다란 공간을 차지합니다. 더불어 눌러도 완전히 인식하지 못하는 점, 오래된 버전의 블루투스라서 그런지 끊김이 있어 글자가 인식되지 않는 경우도 빈번합니다.2. 알류미늄 바디를 홍보하지만 경칩부는 플라스틱이라 불안정합니다. 가장 기계적인 움직임과 힘을 많이 받는 경첩부가 플라스틱이라 알루미늄보다 매우매우 연약합니다. 또한 펼쳤을 때 위로 살짝 떠서 고무 받침이 제 역할을 하기 어렵습니다.3. 사용자가 직접 붙여야 하는 고무 받침 역시 이동 간에 떨어지기 쉬워보입니다.4. Fn키의 위치 및 기능이 매우 불편합니다. 윈도우 키와 붙어 있어 잘못 누르기 쉽상입니다. 기능들은 Ctrl +C, +V처럼 사용자들에게 더 익숙한 대체키가 있음에도 어거지로 우겨넣은 느낌입니다. (Fn + F3, +F4가 훨씬 불편함)5. 생각보다 디자인이 투박하고 심미적으로 이해하기 힘든 부분이 있습니다. LED 점등이 찌그러져 있다든가, 키보드의 폰트 위치가 중간이 아닌 것, 회색글씨라서 잘 안보이고 어지러운 지판 등이 있습니다.6. 접히는 것이 안쪽으로 접히는데, 반드시 평평한 곳에 놓고 사용하여야 합니다. 그렇지 않으면 글을 쓰다가 접혀버립니다.7. 키보드의 누르는 느낌은 매우 얇으나 시끄러운 소리가 납니다. 키감이 계산기처럼 종이를 치는 것 같고 오래치면 손이 피로해집니다. 천천히 치게 됩니다.",['https://shopping-phinf.pstatic.net/20190627_5/e6be323a-b9f4-45a5-8cc2-e86bec9309b5.jpg?type=f287']
5,배송도 빠르구 손이 작은 저한테는 타이핑하는데 전혀 불편함이 없어요~추가 구매한 케이스도 견고하니 마음에 들구! 무엇보다 펼치면 바로 켜지는점이 너무너무 편리하네요!로지텍이나 다른 브랜드 제품들과 많이 비교하고 고민하다가 샀는데 아주 만족스럽습니다!아직 자판 적응이 안되서 불편한점이 하나 있다면지우기 버튼(<-)이 좀 작아서 자꾸 아래있는 (\) 버튼과 헷갈리네요 ㅠㅠ 물론 적응하면 괜찮아 질 것 같지만요 ㅎㅎ,"['https://phinf.pstatic.net/image.nmv/shopnbuyer_2019_02_17_0/583f7d61-327c-11e9-b9f2-505dac8c3721_03.jpg?type=f287', 'https://phinf.pstatic.net/checkout/20190217_99/1550384133072XmiR4_JPEG/image.jpg?type=f287']"
5,일단 휴대성을 우선으로 사고 싶었던거라 이 제품 크기랑 무게는 만족합니당. 페어링도 탭이랑 폰 둘다 왔다갔다 비교해보니까 곧이 곧대로 잘 따라다니네용후기도 지금 이걸로 쓰는데 너어어어무 편해용ㅋㅋㅋ 다만 아직 손에 안익어서 그런지 오타가 잦은부분이 있는데 그 외에 좀 빨리치면 인식못하는 점도 있네용근데 전반적으로 좋아용,['https://phinf.pstatic.net/checkout/20190418_151/1555519734653z7BQg_JPEG/20190418_014723.jpg?type=f287']
5,제가 삼성에서 아티브탭이라고 당시 초고가인 태블릿pc를 샀었는데 이놈들이 모델도 전용 키보드독도 단종시켜버렸어요. 함 망가지고나니 중고도 못구해서 블루투스키보드를 마련해야했죠첨엔 마이크로소프트 웨지키보드를 썼는데 딴엔 일반키보드와 유사하다고 하는데 세로야 그렇다쳐도 가론 절대아니고 키가 빽빽해서 불편했어요키보드 덮개 겸 태블릿스탠드는 튼튼은 하나 처음부터 키보드를 덮을때 제대로 덮지 못해 항상 위에 반쯤 걸쳤을 뿐인 상태로 가방에 넣고고 다녔죠. 이 키보드가 망가진 것도 결국 그때문이 아닌가 싶습니다. 반면 이번에 산 폴더노트는 굉장히 만족스럽네요. 흔들리지도 않고 자판이 진짜 일반 키보드 수준이에요. 약간 차이 있다 느끼시는 분도 노트북 새로 사면 기종마다 키보드 살짝 차이 있다 느끼는 정도로 느끼시는 걸 거라 생각합니다.멀티태스킹도 잘되고 배터리 잔량확인할 수 있는 것도 참 좋고요. 이벤트 대상에 속했던 건지 같이 이어폰도 보내주셔서 참 감사하네요.번성하세요.,"['https://shopping-phinf.pstatic.net/20170625_27/45293a7d-0302-49db-9ad2-f996c157b623.jpg?type=f287', 'https://shopping-phinf.pstatic.net/20170625_2/00fb8718-b979-4c18-9657-d836d671cba0.jpg?type=f287', 'https://shopping-phinf.pstatic.net/20170625_20/5e222a0b-1210-4506-9d17-3a689365547d.jpg?type=f287', 'https://shopping-phinf.pstatic.net/20190627_19/cd67aa9a-d5fa-49d7-b7f2-5d928565239e.jpg?type=f287']"
3,바로 펼치면 인식이 빠릿빠릿 되서 너무 좋습니다. 아쉬운점은 생각보다 배터리가 빨리 다는 느낌이고 조금 흔들리면 펼쳐져서 케이스같은 걸로 감싸서 보관해야하는 점이 있네요. 포토샵이나 그런 프로그램 다루는 분들은 컨트롤 알트 자주 쓰실텐데 알트쪽이 접히는 고리 부분이라서 클릭이 잘 안됩니다. 참고하세요,[]
5,"갤럭시탭과 미패드4를 사용중인데 블루투스 키보드를 검색중 접이식이 있어 구매하게 되었습니다. 평도 좋아서 구입했는데, 배송도 빠르게 오고 물건도 아주 만족합니다. 더 구매할 일 있으면 또 구입할 거 같습니다. 예전에는 귀사의 손난로하고 손선풍기를 구매했었는데 상당히 마음에 들었고 아직도 잘 사용하고 있습니다. 그래서 믿음이 갑니다. 항상 좋은 제품 감사드리고 더 좋은 제품으로 힘내주세요~",['https://shopping-phinf.pstatic.net/20190627_3/f720b6c1-db25-4a3b-99cc-336dd40cad22.jpg?type=f287']
5,"키감도 나쁘지 않고 적당한 텐션과 토독토독 소리 좋아요다행히 첫 테스트에서 불량키도 없어서 다행입니다.다만, 정말 컴팩트하고 좋은데손 큰 남자들은 살짝 작겠구나..싶은~전 여자치고도 손이 작은데제 손에도 작게 느껴지는 자판입니다.좀 더 써서 손에 익으면 엄청 편할듯휴대하기 정말 좋겠어요",['https://shopping-phinf.pstatic.net/20190521_11/86b9eb98-259c-4a9a-80bd-81b2536341af.jpg?type=f287']
5,가격 값 할 듯 지옥의 가챠맨이라 금전감각이 관짝들어간지 좀 됐긴한데.. 이 정도면 일반적인 시각에 비추어 볼때도 사만사천원 투자할 만하다고 생각이 되네여무게도 가볍고 좋아요 펼때 챡챡 소리나는게 찰짐 걍 살때 더 쓰자 싶어서 케이스 샀는데 아패로 작업하실분들은 따로 거치대 없으면 사는것도 좋은 선택일것입니다 ㅋㅋㅋ 여기서 좀만 더 누웠으면 싶은 바램도 있지만 생각보다 좋아서 놀랐음요 각도 조절하는게 좀 뻑뻑하긴 하지만 힘이 좋아서 아돈케어,"['https://phinf.pstatic.net/checkout/20180809_58/1533812754476DYV69_JPEG/KakaoTalk_20180809_195739604.jpg?type=f287', 'https://phinf.pstatic.net/checkout/20180809_230/1533812754609xVW1Q_JPEG/KakaoTalk_20180809_195738189.jpg?type=f287']"
5,피스넷 으로 입력 중입니다. 무엇을 살까 3일 밤낮으로 검색하다가 상품평이 제일 많고.. 판매량이 많아서 선택했어요... 고장 나지 않고 오래오래 썼으면 좋겠습니다. 사용감은 좋으네요.... 그리고 외출시 가지고 다니려고 접히는 걸로 선택했어요... 그럼 수고하세요,['https://shopping-phinf.pstatic.net/20190622_0/23c2bf33-fc9f-4225-b793-7da804b494aa.jpg?type=f287']
5,제가 늦게 공부를 다시 시작하게되었는데 우연히 오프라인에서 블루투스 키보드를 봤어요 키보드 자판 느낌도 좋고 휴대성도 좋으며 또 무게까지 가벼워 이동시애도 편할 것 같아 온라인으로 주문했습니다~ 엎으로도 좋은 재품 많이 팔아주세요~,[]
5,"우선 3만원대 라는건 이제품 만드는 회사가 파격적인 가격으로 내어 놓은거라 생각한다. 펼쳤을때, 접었을때 티나지 않는 이음새의 자연스러움.접고 펼때의 경퀘한 느낌, 이건 마치 SF 영화에서 나올법한 가젯으로 느껴진다..상품리뷰 안쓰는 사람인데....이 회사 칭찬하고 싶어서..쓴다...갑","['https://shopping-phinf.pstatic.net/20180520_15/14cdbc92-07ff-4c04-9d25-78c28e79633d.jpg?type=f287', 'https://shopping-phinf.pstatic.net/20180520_18/47287ceb-67fb-45c4-88ed-0fdea286580f.jpg?type=f287', 'https://shopping-phinf.pstatic.net/20180520_19/e22a6a14-dc6d-417c-b270-15b560627be4.jpg?type=f287', 'https://shopping-phinf.pstatic.net/20190628_5/3000eea7-be5f-4e6d-85d0-b3a4e0c57b6d.jpg?type=f287']"
5,"휴대하기 아~~주 좋아요. 단점은 딱 2개 있는데 1. 무릎 같은 딱딱하지 않은 공간에 올려두고 사용할 때, 접히는 방향이 위라서 무릎 사이로 접혀 들어갑니다. 책같은걸 받쳐야해요 2. 키간격이 처음에 생소합니다. 일반적인 키보드와 키간격이 닮은듯 아닌듯 미묘해요. 살짝 적응할 시간이 필요합니다. 이외엔 다 좋아요!! 강추",[]
4,제품은 상당히 괜찮은 것같습니다. 워낙 자판이 작고 컴팩트하다보니 탭키와 백스페이스가 누르기 번거롭다는 것은 이해해야 할 부분인 것 같습니다. 다만 안드로이드 갤럭시탭으로 인터넷 유튜브 및 동영상시청시 스페이스바와 방향키를 통해 일시정지 및 빨리감기 뒤로가기가 작동하지않는 것이 단점이네요. 단축키를 이용한 fn+8로 정지는 가능하네요. 동영상을 많이보는 저로써는 분명 보완이되어야 할 부분인듯 합니다. 하지만 상담직원들이 매우 친절하고 성심껏 답변해주셔서 기대했던 기능이 없음에도불구하고 기분좋게 구매결정하게되었습니다. 많이 파세요.,[]
5,"진작 구매할껄 그랬어요!!생각보다 너무 가벼워서 휴대하기 너무 좋네요~여성분들께도 강추!!노트북 키보드에 익숙해져있기는 한데, 조금 작은사이즈라서인지오타는 조금 나네요;;익숙해질 시간이 조금 필요하겠지만 넘 만족합니다~",['https://phinf.pstatic.net/checkout/20190620_274/1561006441268pwoUg_JPEG/%A4%B1%A4%A4.jpg?type=f287']
5,"1. 디바이스전환 : 전환유무 확인이 잘안되었으나 몇번해보면 상단 램프에 변환과정을 램프로 확인하면서 디바이스에 연결 문구가 보여서 바로확인됨(딜레이 1~2초정도)2. 폴더노트 쓰다가 폴더를쓰면 갯수가적어져서 델키 , 화면끄기 , 방향키 좁아짐 등을 감수해야함(개인적으로 화면 껐다 켰는 버튼이 없어서 무척아쉬움)3. 키감도 : 누르는 손맛이 폴더노트 만큼이나 좋은편이다그러나 소음이 좀 큰편이다 마소의 계곡진 단종된 9만원짜리와 비교불가다 한편으로는 가볍게 타자치듯이 사용하면 소음이 신경쓰일만큼이진않다 4. 고무받침이 번들로 들어있어서 키보드 균형과 미끄럼방지를할수있다그러나 케이스구매를 한다면 고무받침을 붙이고는 케이스를 닫을수없다5. 가족이 피스넷 폴더노트외엔 사용하지않아서 고장시 쓰던패턴 그대로 사용하고 본인도쓸겸 겸사겸사 구매합니다 (폴더노트사용했어서 키사이즈가 다르므로 적응하는데 몇일정도는 감수해야할것같다)6. 충전기 : 아이노트 20000 외장배터리 충전시 발열 심함 ( 외장배터리 이상인지 불확실 사양미달로 반품 신청함) 그냥 쓰기로함. 2A이나 퀵차지 지원 안함.",['https://shopping-phinf.pstatic.net/20190627_3/9c1751e1-f4c6-41bd-bed9-0f27f7008e0e.jpg?type=f287']
3,"나쁘지는 않아요. 글자도 타이핑에 맞게 바로바로 써지고, 단축키도 다양해서 좋은반면 자판의 좌우가 중앙보다 낮아요.
이것이 자판을 사용하는데 약간 불편합니다.
익숙해지면 어떨지 모르겠지만 날개처럼 좌우가 낮다 보니 살짝 불편함이 있습니다.",[]
5,"피스넷 파티 스피커 쓰다가 고장도 안나고 AS도 잘되서 신뢰가 가서 이번에 블루투스 키보드 주문했네요.아니나 다를까 페어링 완전 빨리되고, 키판도 잘맞고, 또 블투를 3개나 페어링 할수있어서 가성비 좋고 너무 좋네요.나중에 필요하면 하나 더 사서 회사용으로 비치해놔야겠어요. 감사합니다.",['https://shopping-phinf.pstatic.net/20190627_28/b00e3f4f-ee8a-467b-b965-bc2ba2a43857.jpg?type=f287']
5,"작고 예쁘장합니다. 어디서든 쓸 수 있도록 가방에 넣고 다니고 있는데, 파우치에 쏙 들어가고 가볍습니다. 잘 작동되구요. 키감도 좋습니다. 키보드 열자마자 핸드폰 블루투스 연결되니 신기방기해요. 쓰다가 너무 좋아서 친구에게도 선물했는데, 아주 좋아했습니다.","['https://phinf.pstatic.net/checkout/20190117_228/1547714103164h62NS_JPEG/1.jpg?type=f287', 'https://phinf.pstatic.net/checkout/20190117_12/1547714103403YAftr_JPEG/2.jpg?type=f287']"
