star_point,comment,photo
4,일단 포장은 그냥 비닐포장이었어요 박스에 넣어서 올 줄 알았는데 ㅠㅠ 좀 허술하지 않았나••• 하지만 본품 자체는 괜찮았습니다! 상처 없었고... 키보드 자체는 진짜 예뻐요 디자인적으로는 완전 만족입니다 전에 쓰던 키보드랑 비교하니까 자판이 조금 작고 한글 인쇄 크기도 쫌 작더라구요 이거에 익숙해져야겠죠...? 이상하게 키보드 라이트만 켜면 삐 소리가 나던데 이건 제 컴퓨터가 이상한 건지 키보드가 이상한 건지 잘 모르겠어요... 이미 포장 다 뜯어버렸는데 ㅋㅋㄹ... 그리고 타건감은 부드럽긴 한데 손가락이 힘이 좀 들어가내욥...? 게임하는 사람들은 상관 없을 거 같긴 한데 문서 작업용으로는 손가락에 무리가 갈 것 같습니당 주의하새요,"['https://phinf.pstatic.net/image.nmv/shopnbuyer_2020_10_22_0/daadcd17-1429-11eb-85cb-a0369ff968b0_03.jpg?type=f287', 'https://phinf.pstatic.net/checkout/20201022_209/1603345314113kxVTB_JPEG/review-attachment-3f8928e1-8156-4e9d-adef-450bd7bcfbc2.jpeg?type=f287']"
5,"타건음 : 생각보다 크진 않은 편
촉감: 크리스탈 키캡이 장착되어 있어 굉장히 좋음
성능: 게이밍 할 때 기존 쓰던 키보드보단 훨씬편함
+ 키락기능이 가장 유용함(청소 시)

한 달이 넘게 사용하고 있습니다. 한 컴퓨터에는 적축 앱코키보드를 사용하고 다른 컴퓨터에는 갈축을 사용하고 있는데 개인적으로는 광축이 가장 좋습니다.

적당한 타건음도 그렇고 적응도 되게 빨리 됐어요.

그리고 약간 무채색을 좋아하는 타입이라 흰색과 회색이 너무 이쁘네요.
키보드는 조금 .

.

앱코 키보드를 많이 사용해와서 그런지 이젠 앱코 아니면 안되겠어요..!
ㅋㅋㅋ

다음에도 사게되면 여기서 구매할 생각입니다.

번창하시구 .","['https://phinf.pstatic.net/checkout/20200416_257/1587036681591moPbX_JPEG/KakaoTalk_20200416_202512294.jpg?type=f287', 'https://phinf.pstatic.net/checkout/20200416_67/1587036681653FikHT_JPEG/KakaoTalk_20200416_202512683.jpg?type=f287']"
5,첫 만남은 PC방에서였음. 쫀쫀한 스페이스바 느낌이 너무 좋아서 하단에 적혀있는 모델명을 찍어옴. 근데 주문하려니 그 피방꺼가 클릭인지 리니언지 몰라서 뭘 살지 모르겠었으나 왠지 그 쫀쫀한 느낌이 클릭은 아닐꺼라 생각이 들었음. 그렇게 리니어를 오늘 배송 받고 스페이스부터 눌러봄. 아..이거다.. 됐다. 기계식이면서 쫀쫀한 느낌 좋아하면 이거 사면 됨. 더 쫀쫀한거 뭔하면 기계식 아닌 무접점인가 그거로 가야함. 그리고 기본 키보드 쓰고 있던 입장에서 완전 편한거는 키보드내에 단축키가 있다는거 음량조절 할 일이 좀 자주 있는데 완전 편함. 마우스도 앱코꺼로 샀는데. 앱코..우리나라 메이커 이기도 하고 점점 더 맘에 드는 중,['https://phinf.pstatic.net/checkout/20200616_52/15922801974732Ga6n_JPEG/20200616_125942.jpg?type=f287']
5,"이전에 쓰던 청축 키보드가 레트로 키캡이라
좀 불편하고 시끄러워서 광축 리니어로 바꿔봤어요
약간 쫀득한 키감이 맘에 듭니다 소리도 전에 쓰던 거 보단 작고 낮아서 좋아요
모노톤이지만 빛나는 것도 여러가지로 설정할 수 있어서 한동안 질리지 않겠어요
방수방진이라 고장 걱정도 덜겠죠
사실 집에서 일만 하다가 열 받아서 충동구매한건데
ㅅ ㅣ발 비용 치고는 꽤 훌륭한 소비생활이 되어서 약간 어리둥절 합니다",['https://phinf.pstatic.net/checkout/20200721_31/1595309170037IKk9a_JPEG/review-attachment-ef9567b6-d1cc-4c6e-94aa-36b49190b4a9.jpeg?type=f287']
5,"1. 배송 : 일단 배송이 무지막지하게 빠릅니다. 수도권지역이 아닌데도 이틀만에 도착하네요

2. 상품 : 마감도좋고 딱 제가 생각하는 그대로 왔습니다. 일단 디자인이 흑백흰으로 너무이쁩니다

3. 키감 : 대부분 피시방에서 써보고 구매하셨을텐데 클릭 특유의 딸각거림이 좋고 과하지않네요. 카일광축 물건입니다.","['https://phinf.pstatic.net/checkout/20200317_210/1584436718181I0CF9_JPEG/20200317_181716.jpg?type=f287', 'https://phinf.pstatic.net/checkout/20200317_204/1584436718703mRlrq_JPEG/20200317_181713.jpg?type=f287', 'https://phinf.pstatic.net/checkout/20200317_199/1584436719272GBoAr_JPEG/20200317_181702.jpg?type=f287']"
5,"피시방에서 써보고 저랑 잘 맞고 이 키보드로 할 때 준수한 플레이를 하게 되어 주문하게 되었습니다. 배송도 빠르게 잘 왔고 상태에도 이상이 없으며, 타건감도 괜찮습니다. 다만 스페이스바 같은 넓은 키는 좀 더 부드러운 맛이 있으면 해서 윤활을 하려 합니다.",['https://phinf.pstatic.net/checkout/20200901_50/1598933566506SdmTU_JPEG/review-attachment-10c0d926-9e73-486b-9806-fb2221b44152.jpeg?type=f287']
5,"기계식 키보드는 처음 구입해서 사용해보는거였는데
피시방꺼가 생각나서 키캡 크리스탈로 된걸 찾아보다가
디자인이 맘에 들어서 구입해봤어요
크리스탈키캡 키감이 너무 제 취향이라서
아직까지 후회없이 너무 잘쓰고 있어요ㅎㅅㅎ","['https://phinf.pstatic.net/checkout/20200605_27/15913599446688Nyux_JPEG/KakaoTalk_20200605_212306952_01.jpg?type=f287', 'https://phinf.pstatic.net/checkout/20200605_147/1591359948648APGRH_JPEG/KakaoTalk_20200605_212306952.jpg?type=f287']"
4,"배송 빠를줄 알았는데 실망..
그래서 별한개 뺌요!
전 리듬게임용으로 샀는데
한시간정도 해본결과 매력있고 재밌었음
걸리는 느낌이 강해서 손목에 힘이줘지는데
본인이 쎄게 치는 버릇이 있다면
찰떡같은 제품이지 않을까? 생각함
키캡 참 좋다.왜 다들 좋다고 하는지 알것같음
캡은 손에 착착 붙는다.
그래서 좀 더 사용해볼것임",[]
4,훌륭한 제품인데 크리스탈 키캡에 일반 키보드보다 손때가 잘 묻습니다. 무슨 방구석 폐인도 아니고 멀쩡한 직장인에 신혼부부라서 컴퓨터 그리 오래 하지도 않는데 한 2주정도 쓰면 너무도 투명해서 오히려 더 잘 티나는 크리스탈 키캡위에 손때가 묻어있는 모습을 볼 수 있습니다... 상대적으로 더 자주 닦아준다는 점 말고는 아주 준수해요.,[]
5,예쁜 키보드 구매하려고 3일동안 찾아다니다가 정말 많고 많은 것 중에서 이것만 맘에 들어서 샀어요! 결과도 흡족합니다^^ 짱 예쁘고 깔끔하고 좋아요~ 크리스탈 커버된 그레이 색상 키보드 진짜 찾기 힘들던데 겨우 찾아서 쓰네요 잘 쓸게용~!,['https://phinf.pstatic.net/checkout/20200526_72/1590476204931WIoeN_JPEG/20200526_155637.jpg?type=f287']
4,"1. 배송 : 양호(2~3일 소요)
상품 박스도 딱히 찌그려지거나 뭉게진 곳 없어서 만족
2. 상품 : 만족(88%)
요새 pc방에서 많이 쓰는 크리스털 키보드가 맘에 들어 구매했습니다. 전에 사용하던 3~4만원대의 앱코 자회사 콕스의 CK450 모델을 사용했는데 타건감은 양호했지만 타건음은 키들이 싸구려 플라스틱 치듯 뭔가 가볍고 통울림이 있는 편이었는데, 앱코 K8900은 타건감도 완벽하고 타건음도 묵직하니 싸구려같은 느낌은 전혀 안듭니다. 완전방수까지 된다니 너무 좋네요. 그럼에도 불구하고 7만원이라는 가격이 조금은 부담되는 건 사실입니다. (결론 : 사서 후회할 건 없습니다. 돈값은 하는 녀석입니다.)",[]
5,"저희 동네 PC방에서 이 키보드를 처음 사용 해봤었는데 그때 첫눈에 반해서 결국 구매까지 하게 되었습니다.

그동안 집에서는 사무용만 사용하다 기계식으로 바꾸니 입력 속도 체감 차이가 엄청 좋은걸 느꼈습니다. 가격 때문에 조금 고민도 했지만 잘 산 것 같아 만족 합니다.","['https://phinf.pstatic.net/checkout/20190831_36/1567233924837zFNBQ_JPEG/image.jpeg?type=f287', 'https://phinf.pstatic.net/checkout/20190831_47/1567233925097uqMwt_JPEG/image.jpeg?type=f287', 'https://phinf.pstatic.net/checkout/20190831_265/1567233925160PXukB_JPEG/image.jpeg?type=f287']"
5,키보드랑 마우스 딱 구비해놓으니 기분이 좋네요 마우스 리뷰에서 이미지 첨부하는걸 깜박함 비오는날 배송왔는데 상자가 젖어서 온건 아쉽네요ㅠ 그래도 내용품엔 문제x 해커키보드 쓰다 한영전환 안되면 검색해서 드라이버 설치해야합니다,['https://phinf.pstatic.net/checkout/20200526_238/1590456904944Ed2Uz_JPEG/%C5%B0%BA%B8%B5%E5%B8%B6%BF%EC%BD%BA.jpg?type=f287']
5,일단 키알못인데 어느정도 가격대 키보드를 사람들이 쓰는이유를 알겠음. 너무조하요 소리도좋구 부드랍고 불나오는것듀 빨주노초 총천연색 아니라서 이뿌구 무게감도있어서 택배받구 기분저쿠 아주그냥 키보드바꾸고나서 일계속하고시픔. 업무용으로쓰는데 이거 백년정도쓸수있겠져?,['https://phinf.pstatic.net/checkout/20200302_210/1583138174335rTz8S_JPEG/20200302_173348.jpg?type=f287']
5,빠른 배송 감사합니다. 키보드가 무척 튼튼함이 느겨지내요 제품에 문제없고 사무용으로 사용하기에 키감. 소리 적당하게 있고 밀림이 없어 좋네요 led효과는 단색이라 조금 심심하지만 사무용에선 튀지 않는것이 더 적당합니다. 키보드 디자인은 엔틱하여 좋습니다 가성비 추천합니다,"['https://phinf.pstatic.net/checkout/20191019_59/1571493867609MNAjc_JPEG/20191018_220930.jpg?type=f287', 'https://phinf.pstatic.net/checkout/20191019_152/1571493890055VGzBd_JPEG/20191018_221225.jpg?type=f287', 'https://phinf.pstatic.net/checkout/20191019_46/1571493905709bDxLr_JPEG/20191019_085854.jpg?type=f287']"
5,"역시 믿고쓰는 앱코 해커! 전에쓰던 키보드도 앱코였는데 3년동안 샷건 ㅈㄴ쳤거든요 그래서 그런지 키캡이 많이 깨지고 그랬습니다.
하지만 키보드 문제는 하나도 발생하지않았습니다.
그래서 이번에 또 새로운걸로 바꿨는데요. 앞으로는 샷건안칠려고 노력해야겠어요",['https://phinf.pstatic.net/checkout/20200708_281/1594190652531giPLj_JPEG/review-attachment-7a6c7597-aeae-489d-8695-f4d2f6f2f553.jpeg?type=f287']
5,"집근처에서 제일좋은pc방에 한번씩가는데 키보드가 너무좋아서 모델명 사진찍어서 구매했습니다. 역시 타견감 끝내주고, 키보드하나하나에 코팅?이도있어 너무고급스럽네요. 더욱 놀란건 19가진가 하는 led 불 들어는게 있다는건데, 정말 놀랗네요. 키보드칠때 불끄고하면 정말 멋집니다. 지루하질않아요. 19가지라 바꿔가며 할수있고. 뭐 내가아는 키보드중 최고인거같네요.말이필요없어요
배송도빠르고, 뽑뽁이포장 너무 잘되있네요 ㅎ
사업 번창하세요. ^^",[]
4,가성비 키보드로 많이 알려진 앱코 시리즈중 가격조금 높은 이제품을 구매한 이유는 키보드 버튼들이 아크릴로 한번 더 덮혀 있어서 때가 좀 덜탈거 같은 생각에 구매하게 되엇는데. 괜찮은거 같습니다. 이제품을 과 동일제품(클릭 리니어 두종류)을 다른 사이트에서 하나더 구매햇는데 여기는 뽁뽁이로 한번더 신경써주신거 같아 너무 감사하네요. 만족합니다. 일단. 추가로 사용하다보면 한/영키가 안먹힐경우잇는데 네이버 검색하면 처리방법나오니 검색해보세요. 해결됩니다,"['https://phinf.pstatic.net/checkout/20190507_31/1557221852111zGRjo_JPEG/0EB2EE1F-8D82-487E-A73F-2AF2A95038AE.jpeg?type=f287', 'https://phinf.pstatic.net/checkout/20190507_298/1557221852216xza3p_JPEG/0F0C2CD4-1204-4005-A15E-6588EA1E0ED0.jpeg?type=f287']"
5,앱코 해커 제품 중 여러가지 고민하다가 K8900 V1 리니어 제품으로 구매했습니다. 역시 V1이 LED효과를 더 확실히 보여주는 것 같네요. 리니어 타입이라 사무실에서 사용하는데 너무 요란스럽지 않으면서 타건감이 쫀득하니 좋습니다! 6만원대에 구입할 수 있는 광축 키보드 중에는 최고지 않을까 생각합니다!!,"['https://phinf.pstatic.net/image.nmv/shopnbuyer_2019_08_27_0/b3750158-c871-11e9-9a31-48df3726a06a_05.jpg?type=f287', 'https://phinf.pstatic.net/checkout/20190827_33/1566872518068lmiJO_JPEG/KakaoTalk_20190827_111511414.jpg?type=f287']"
5,"기존 K660 ARC 광축(스위치)를 썻었습니다.
다만, 집에서 쓰기에 너무 시끄럽고, 또한 프로그래밍을 하는 키보드로는 조금 손가락에 피로도가 있었던것 같습니다.
그래서 찾던중 현재 구매한 리니어 타입으로 쓰고 있습니다.
처음에는 어색했지만 쓰다보니 정말 마음에 듭니다.

손가락 피로도도 많이 줄어들었으며, 리니어 타입에 타이핑 그리고 . . .",['https://phinf.pstatic.net/checkout/20191102_292/1572668533817BlPd6_JPEG/KakaoTalk_20191102_131952007.jpg?type=f287']
5,"사용기, 크리스탈키캡 --> 감촉이 훌륭합니다.. LED 가 더 진하게 나오는 효과가 보기 좋음타건 --> 기계식 못지않게 타건감이 있으나 기계식 보단 조용함색감 --> 어반그레이 색감이 잔잔하고 고급스러움 전체적으로 봤을 때 사용하기 만족스러운 제품입니다.. 까다롭게 고른 결실이 있네요..",[]
4,캡 색상이 좋아요 깔끔해요하얀 LED도 좋아요화려한거에는 금방 질리는 분에게 좋은 선택이에요단지 제 기대가 너무 컸던지키가 좌우로 조금 흔들려서 거슬려요견고한데 견고하지 않은 느낌이들어요소음은 적당해요 멤브레인 보다는 크지만 조용한편 이라고 하는게 맞겠어요,[]
4,키보드 상태 좋구여 타건감은 먼가 제가 잘몰라서 잘모르겠지만. 소리때문에 리니어를 샀는데 먼가 조용한느낌은 있는데 타건감은 경쾌하다고는 못할거 같아요. 클릭으로 할걸 그랬나 하고 살짝 후회하지만 그래도 너무 이쁘고 딱히 불편한건 모르겠네요 ㅋㅎ,[]
5,빠른 배송 잘 받아서 설치를 하여보니 똿!! 아름 다운 광택을 띄는 키보드가 등장 했습니다.유리 코팅을 한것과 같이 엄청 매끈하고 깔끔한 촉감이 마음에 들었습니다.키보드 소리 또한 적게 나며 누르는 무게감도 괭장이 적당한것 같습니다.,[]
4,저번에 샀던 키보드가 왼쪽에 있는 단축키가 전부 안되서 새로 샀는데 스페이스바쪽 통울림이 너무 심한 것 같네요 카일 광축은 처음이라서 키가 좀 묵직한 감이 있는데 익숙해질 것 같고 그래도 디자이면에서 깔끔해서 좋은 것 같아여.,[]
5,"스*이디지털 청축, 레오*드 청축, 커*어 적축, 기가*이트 적축, 필* 마제스*치 흑축을 거쳐 드디어 정착했습니다. 만족도 10점 드립니다.장점1. 레오*드 청축(체리)과 아주 흡사한 키감을 보여주나, 키압이 더 낮음.2. LED 모드를 변경할 수 있어서 싸구려 PC방 같은 싼마이한 맛이 덜함.3. 크리스탈 키캡이라 각인 지워짐이 덜할 것으로 보임즐거운 타건하세요.",['https://phinf.pstatic.net/checkout/20190704_111/15622196427090AO3l_JPEG/KakaoTalk_20190704_145202297.jpg?type=f287']
5,"아 너무 좋아요 적축 스근하게 눌리는 소리랑, 깔끔한 아크릴 코팅이 진짜 빛나는거 같습니다. 너무 좋네요 그전에는 청축섯는데 처음에는 타건감이 좋앗는데 나중에 가니까 너무 시끄럽더라구요 밤에 혼자 두들기기도 민망하고 근데 이건 너무 좋네요 조용하고 조명도 은은하고 ㅋㅋ 완전 맘에 듭니다. 회사에서 일할때 쓰는 키보드도 이거로 바꿀까 고민중입니다 ㅎㅎ 감사합니다~! 많이 파세여","['https://phinf.pstatic.net/checkout/20190801_78/1564663043420H5j5k_JPEG/KakaoTalk_20190801_212927895_01.jpg?type=f287', 'https://phinf.pstatic.net/checkout/20190801_109/1564663043611Pmu3z_JPEG/KakaoTalk_20190801_212927895_02.jpg?type=f287']"
4,"엄청 잘눌리고 소리도 크지 않아서 좋아요
코팅이 되어있어서 관리도 편합니다👍🏻
그리고 배송도 엄청 빨랐어요 이점은 진짜 감동 ㅠ 회사분들도 간지템이라며 ㅎㅎ 무게감도 있고있고 만족입니다 다만 너무 잘눌려서 조금 오타가 난다는점..ㅎ",[]
5,"기계식 키보드 특유의 타다다닥 타격감과 키보드가 코딩되어 있어 방수까지 됩니다.타격감, 디자인, 색감 모두 정말 마음에 듭니다. led 불빛 변경해가면서 쓰면 정말 게임 할 맛 나는거 같습니다.배송도 빠르게 왔고, 이정도 가격에 이 키보드면 최고라고 생각합니다.많이파세요 감사합니다.",[]
5,"광축 클릭제품이 묘하게 끌리더라구요. 제리 청축보다는 가볍고, 백축보다는 약간 센듯한 부드러운 클릭감... 적당하게 쓰기좋은 딸깍거림이라고 생각합니다. 청축을 좋아하지만 이놈도 맘에 듭니다..근데 앱코제품은 가끔 키캡이 날라댕긴다죠..",[]
5,기존 가성비 앱코 시리즈보다 가격대가 조금 높은 제품임에도 불구하고 이제품을 구매한 이유는 덮게에 크리스털키캡이라 투명으로 한겹더 입혀져 잇습니다. 더 깔끔해보이고 고급 스럽네요. 처음엔 차이점을 잘 몰랏는데 고객센터 연결햇더니 친절히 설명까지 해주시네요. 조금 비싸지만 (같은 라인 비슷한제품보다) 개인적으론 나름 만족스런 제품입니다. 동생이보고 이쁘다고 맘에든다고 타 사이트에서 같은제품 하나더 구매햇어요.,[]
5,"PC방가서 앱코 광축 키보드를 만져보고 키감이 굉장히 마음에 들어서 하나 구매했는데, 기대 이상이네요. 키감 좋고 디자인 좋고 마감도 아주 깔끔하네요. 커세어 제품을 많이 가지고 있는데, 세 배 이상 비싼 커세어 제품에 비해서 부족한 점을 찾기가 어렵네요. 카일 광축 느낌은 청축이랑 아주 유사합니다.",['https://shopping-phinf.pstatic.net/20190426_7/293fdff7-8eb2-4432-b140-334b0f36e90d.jpg?type=f287']
5,회사에서 앱코 K8900 제품을 처음 써봤는데 타격감이 너무 좋아서 월급타면 꼭 사야지! 했다가 결국 샀네요.일단 타격감이 너무 좋습니다. 키보드 두드리는 맛이 상당히 좋아서 무슨 게임을 하든 다 재미있네요. ㅎㅎ그리고 led도 너무 이쁘게 나오고 종류도 많아서 골라서 쓰는 재미도 있구여크리스탈 캡으로 보호되서 때가 탈 일도 없고 정말 제 인생 최고의 키보드가 아닐까 생각합니다.강력추천해요! 가격은 조금 비싼 감이 있지만 가격값 충분히 합니다. ^^,['https://shopping-phinf.pstatic.net/20190627_14/241ba1a1-c8c0-4615-bf91-7e82e11a95ae.jpg?type=f287']
5,평소에 다니던 피시방에서 k8800을 사용해보고키보드는 앱코꺼를 사야겠다 마음먹어서 디자인만 다른 k8900을 샀습니다v1이랑 v2가 있는데 저는 v2가 더 색상이쁘고 더 마음에 들어서 v2으로선택했구요디자인 너무 마음에 들고 원래 8800을 써봐서 타이핑이나 사용감이 너무 좋네요^^,['https://shopping-phinf.pstatic.net/20190627_5/153c968e-df20-4f37-9036-948754cdacfd.jpg?type=f287']
1,"키씹힘.전에 쓰던 기계식 키보드는 누르는대로 입력됐는데이건 스페이스바, 시프트 외 랜덤으로 씹혀버림.했어요 -> 햇어요ㅇ비 -> 입등...굉장히 천천히 꾹꾹 눌러서 써야만오타없이 쳐짐.타속 8~900나오는데이 키보드가 날 미치게 함뭣같아서 못써먹겠음.이 댓글 치는데도 오타 개 쩔게 나서쓰고 지우고 쓰고 지우고...심지어 꾹꾹 눌러써도 오타날 때 있음^^개-같음^^아, 근데 이쁘긴 겁나 이쁨이쁜 쓰레기^^",[]
5,"키보드 먼지 덮개도 있고~
크리스탈 키가 주는 영롱함~
기대치보다 훌륭한 키감~
적당한 무게로인한 안정감~
13가지 모드의 Led 효과등등~
7만원정도의 중저가 키보드 치고는
매우 만족스럽습니다","['https://phinf.pstatic.net/image.nmv/shopnbuyer_2020_04_03_0/0d872c04-7574-11ea-a0f4-48df379cc9e4_03.jpg?type=f287', 'https://phinf.pstatic.net/checkout/20200403_148/1585895153267tW6YC_JPEG/20200403_143738.jpg?type=f287', 'https://phinf.pstatic.net/checkout/20200403_277/1585895164860oayTO_JPEG/20200403_143944.jpg?type=f287', 'https://phinf.pstatic.net/checkout/20200403_219/1585895174489xlHha_JPEG/20200403_144416.jpg?type=f287', 'https://phinf.pstatic.net/checkout/20200403_276/1585895180975FW6kK_JPEG/20200403_145403.jpg?type=f287']"
5,"기대했던 타격감과 현란하지않은 고급스런 LED와 무게감으로 작업,게이밍 모든쪽에 만족스러움.","['https://phinf.pstatic.net/checkout/20201126_260/1606373194946qPb73_JPEG/review-attachment-15254b78-54a3-49c3-811a-183617bc197c.jpeg?type=f287', 'https://phinf.pstatic.net/checkout/20201126_127/1606373206801o03ca_JPEG/review-attachment-925dff09-3520-462e-9b3e-016ca7c2a0aa.jpeg?type=f287', 'https://phinf.pstatic.net/checkout/20201126_3/1606373219432m1neA_JPEG/review-attachment-419f09b5-e4d9-448c-8901-9ba3299fba08.jpeg?type=f287']"
5,아들생일선물로 갖고싶다고해서 구매햤어요~~~완전굿이래요^^깨끗하고이쁩니다~~~터치감도좋고 색도 흰색이들어가있어 깨끗하고 키하나하나쌓여있어 잘쓸것같아요....완전대대만족입니다~~~굿굿굿ㅇㅇㅇ^^,"['https://phinf.pstatic.net/checkout/20200828_173/1598616522513UO1ji_JPEG/review-attachment-f2c1b0de-7fe7-4062-b27f-04138e170f5a.jpeg?type=f287', 'https://phinf.pstatic.net/checkout/20200828_174/15986165522354whTw_JPEG/review-attachment-c6afeea0-6ba4-49c5-8b2e-e3cdfe9304f2.jpeg?type=f287']"
5,질릴 때쯤 되면 불빛 모드 바꿔서 써주면 무한 사랑 가능 진짜 예뻐요... 소리도 너무 크지 않고 딱 적당 행복,['https://phinf.pstatic.net/checkout/20201130_80/1606737087958iTJK8_JPEG/review-attachment-7e51ad15-71b6-4cab-bf4e-d196ccdaa32a.jpeg?type=f287']
5,pc방에서 사용 후 구매했습니다. 게임용으로 좋네요 ㅎㅎ 소리도 저는 너무 만족해요! 색상도 넘 이쁘구요 ^^,"['https://phinf.pstatic.net/checkout/20200806_128/15967085584339mKvO_JPEG/review-attachment-98471151-c2f4-4fe8-ad29-506ba304e01f.jpeg?type=f287', 'https://phinf.pstatic.net/checkout/20200806_7/1596708558398Ikjp4_JPEG/review-attachment-3f051f0a-fa07-4400-af89-7c7e5423b860.jpeg?type=f287']"
5,영롱그자체! 아무래도 광축?이라 소리가 생각보다 좀 나긴 하는데 크리스탈 캡이 이뻐서 눈치보며 잘 쓰고있어요. 감사합니다~,['https://phinf.pstatic.net/checkout/20201130_277/16067471809840WGRN_JPEG/review-attachment-119135c6-393c-469f-bf85-bda3260e7be3.jpeg?type=f287']
3,사용전이라서 성능은 잘 모르겠지만 디자인은 예뻐요!!,['https://phinf.pstatic.net/checkout/20201121_225/1605940847986Xy5An_JPEG/review-attachment-d46e5b1f-5973-42b7-a290-eaadc957b5f7.jpeg?type=f287']
5,생일선물 해줬는데 좋아해요,['https://phinf.pstatic.net/checkout/20201123_198/1606101507137FGVuS_JPEG/review-attachment-a0cd2044-a7d3-4545-9fb0-82f6843aa897.jpeg?type=f287']
5,"배송이 진짜 빨랐어요 하루만에옴 ㄷㄷ
그리고 실물너무 이쁨 토체티 쓰다가 이거쓰니까 키감 음청가볍네요 ㅋㅋ",['https://phinf.pstatic.net/checkout/20201029_264/1603969318182Yrvyf_JPEG/review-attachment-daa4e992-565e-455c-97e3-d88d825d4bd0.jpeg?type=f287']
5,아 너무 좋습니다. 가성비 최고고 배송도 빨라 많이 만족스럽습니다.,['https://phinf.pstatic.net/checkout/20201118_283/16057069403124V5z8_JPEG/review-attachment-cf64b55e-d5b3-4064-8cec-52c28c3249ce.jpeg?type=f287']
3,예뻐요 생각보다 부드러운데 키보드 자체 무게가 좀 나가는것같아요,['https://phinf.pstatic.net/checkout/20201103_293/1604376453200TRqUj_JPEG/review-attachment-706931ea-e0a7-4e87-b161-e4a09e8810b6.jpeg?type=f287']
5,"이거 첨 써보는데 좋아요
재구매 100퍼",['https://phinf.pstatic.net/checkout/20201112_273/1605160118890uiMWS_JPEG/review-attachment-cbba964c-424f-49ae-b9f9-cea1bbdc13d1.jpeg?type=f287']
5,"키보드가 고정나서 이쁜걸로 하나 시켰는데
키보드 자체도 넘 이쁘고 키감도 재밌네요 ㅎㅎ","['https://phinf.pstatic.net/checkout/20200722_276/15954081106500IgmJ_JPEG/review-attachment-a26423b9-eeb8-408c-b056-31e18666d475.jpeg?type=f287', 'https://phinf.pstatic.net/checkout/20200722_54/15954081225751i1nl_JPEG/review-attachment-fa0d3988-e8c6-4285-92ca-4523b8a43431.jpeg?type=f287']"
5,키보드 색깔도그렇고 전체적으로 맘에 들어요 ㅎㅎ,['https://phinf.pstatic.net/checkout/20201030_244/1604038647210DG1M8_JPEG/review-attachment-66764e01-cd2d-474f-977e-856f534febd7.jpeg?type=f287']
5,늘 가던 피시방에 있던거라마음에들어오,['https://phinf.pstatic.net/checkout/20201102_245/16042805280301sqie_JPEG/review-attachment-ccf676e3-94d3-40e4-9031-901ccb5a5101.jpeg?type=f287']
5,너무 이쁘고 배송도 빠르고 좋네요,"['https://phinf.pstatic.net/checkout/20200714_150/15947003987032eBxk_JPEG/review-attachment-56325f30-fe12-456e-931f-715df6af1c13.jpeg?type=f287', 'https://phinf.pstatic.net/checkout/20200714_277/1594700398449vXTCD_JPEG/review-attachment-7ca89a33-a6b2-4baf-9189-022873617703.jpeg?type=f287']"
