star_point,comment,photo
4,"1. 이건 유사 기계식 키보드라고 불러야 할까요 ㅎ 저렴한 멤브레인만 써오다가 기계식도 아닌 플런저 키보드는 처음 사용해 보는데요. LED 기능도 있고 생각보다 저렴해서 구매. 기존 TG 키보드는 물 한 번 엎질렀더니 그대로 사망 ㅠ 생활방수 기능도 있고 기계식 느낌도 받고 싶어서 구매했는데, 기존 멤브레인에 익숙해서 그런지 아직은 적응중이네요.2. 일단 타자시 소음이 있어서 적응이 잘 안되지만, 키보드 자체는 무게감 있고 키감도 나쁘진 않아요. 다만, 지금 사용 한달 되었는데 키 하나가 말썽을 일으켰네요 ㅠ 내구성은 좀 약한 것 아닌가 싶습니다. 아쉬운 부분이네요.3. 디자인도 깔끔한 편이고. LED는 고정으로 3가지 패턴으로 켤수 있습니다.4. USB 케이블 선이 노이즈 필터도 있고 좋습니다.","['https://shopping-phinf.pstatic.net/20191208_3/2af83aaa-9a38-46ff-8908-605aec35086e.jpg?type=f287', 'https://shopping-phinf.pstatic.net/20191208_18/f13d5277-ecdc-47b7-adfb-953872055bfc.jpg?type=f287', 'https://shopping-phinf.pstatic.net/20191208_28/7a87d7ab-129d-4a5b-84bd-2d52500c75a0.jpg?type=f287', 'https://shopping-phinf.pstatic.net/20191208_8/c6897bd0-cd9f-46c1-9c08-a27f2f030a0e.jpg?type=f287']"
4,친구 생일 선물로 구매하였어요 코로나19로 벌써 몇개월째 갇혀지내다시피 생활하면서 노트북으로 게임좀 했더니 자판도 나가고 메인보드도 나가서 친구가 속상해 하더라구요 곧 돌아오는 친구 생일선물로 이게 적당할거같아 선택했는데 배송비가 있어서 부담스럽네요. 키보드는 친구가 좋아하네요 pc방에서 많이 사용하는 키보드라 훨씬 좋은 제품들도 많지만 가성비를 따져보고 서로 부담스럽지 않은 부분에서는 괜찮은거 같아요,"['https://shopping-phinf.pstatic.net/20200517_15/29f2e64f-105b-43df-9384-21915ae55fa6.jpg?type=f287', 'https://shopping-phinf.pstatic.net/20200517_13/8ee32982-ea5d-4280-bf7c-a21b1b8e4750.jpg?type=f287']"
5,막 쓸 용으로 하나 장만했습니다. 배송도 빠르고 말해뭐해 가성비 끝판왕 키보드죠. 아쉬운 점은 키감이 경쾌한 맛이 없어 시원찮지만 오히려 쫀득한 걸 좋아하는 분들은 더 맘에 들어하실 듯. 고민할 시간에 그냥 빨리 사고 오늘 저녁 뭐 먹을까 고민하는 게 현명한 선택입니다.,['https://phinf.pstatic.net/checkout/20201024_12/1603501566348t8fmb_JPEG/review-attachment-1b7796ae-950d-4ed3-926b-26086022b7b1.jpeg?type=f287']
5,배송 빠르고 우체국 택배라 더할나위 없습니다. 근데 제품 퀄리티가.. 플런저축 좋아하는데 그닥 권하고픈 타건감은 아니네요^^;; 확실히 싼티가 나고 여러모로 아쉽습니다. 그런데 구성품이 푸짐하고 led가 이쁘게 들어옵니다. 가격대비 구성품 푸짐함은 괜찮습니다.,[]
1,"일단 처음에 포장이 뭔가 다시 뜯었다가 넣은 것 같아서 기분이 좀 그랬는데요, 쓰다보니 책상에 검은 줄이 계속 생기길래 뭔가 했더니 키보드에 달려있는 고무에서 계속 검은 줄이 생기는 거였습니다.원래 이런 리뷰 잘 안쓰는데 좀 화가 나고요. 뭐 고무를 뺄 수도 없고.. 상자는 이미 버려서 반품도 못하고요.내가 도장을 산건지 키보드를 산건지.검은 줄 잘 지워지지도 않아서 큰일입니다.그리고 예전에 이거같은 플런저 키보드 이 회사 제품으로 샀었는데 거기에는 키보드 청소 솔이 들어있더니 이건 없네요?근데 있었어도 그 솔로 이 검은 줄 청소는 못했겠네요.이만원 그냥 버렸다 치려고 해도 책상에까지 지저분한 줄이 생기니 매우 기분이 좋지 않습니다.","['https://phinf.pstatic.net/checkout/20190313_211/1552453883500OKswc_JPEG/KakaoTalk_20190313_141026614.jpg?type=f287', 'https://phinf.pstatic.net/checkout/20190313_284/1552454128728PVSXq_JPEG/KakaoTalk_20190313_141501973.jpg?type=f287']"
5,"색상도 타자칠때 느낌도 너무 좋네요
가격이 저렴해서 기대를 많이 안 했는데 ...
완전 가성비 좋아요.
개인적으로 키보드는 타자 칠때 느낌이 가장 중요한데
정말 괜찮아요 ~
가격이 싸서 좀 걱정했는데 ..
빛도 많이 파세요 ~^^",[]
4,버튼이 한개 불량인듯 한번 입력하면 키가 어중간하게 반쯤 들어갔다가 꽂혀서 잘 안나옵니다만 잘 안쓰는 키인데다 키보드는 이런 불량을 간혹 본 일이 있어서 그냥 쓰기로 했습니다. 그 외에 LED는 상당히 마음에 듭니다. 가성비 괜찮아요.,[]
4,"가성비 최고! 전에 쓰던 로지텍 무선 멤브레인 키보드 보다 소리가 저음으로 나서 오히려 조용하게 느껴져요. 기대했던 것 보다 조용하고, 타자감이 괜찮네요. 청축의 찰칵거리는 아주 가벼운 느낌이 아니라 적당히 무거운 느낌의 사용감입니다. 키보드 자체도 무거운편이라 제자리에 고정되는 느낌이 좋아요. 그런데 키보드 아래 고무에서 까만게 묻어나와서 책상을 더럽힙니다... 키보드 양쪽 아래 부분이 다 사진처럼 묻어나요. 알콜스왑으로 닦아주면 없어지지만, 무의식적으로 키보드를 밀면 바로 묻어나와서 굊장히 불편해요. 이부분을 제외하면 가성비 최고인것같습니다!","['https://phinf.pstatic.net/checkout/20190324_69/15534303570358omgC_JPEG/KakaoTalk_20190324_212454509.jpg?type=f287', 'https://phinf.pstatic.net/checkout/20190324_98/15534303571804kYuY_JPEG/KakaoTalk_20190324_212152787.jpg?type=f287']"
3,". 사이즈 - 사이트 설명과 동일
2. 디자인 - 사이트 설명과 동일
3. 배   송 - 구매일 기준 익일후 도착
4. 퀄리티 - 한 달 사용후 리뷰 가능
5. 성 능 - 한 달 사용후 리뷰 가능
6. 설 치 - 관련없음
가성비 - ●●●○○
가심비 - ●●●○○
* 총 평
한가지 확실히 얘기할 수 있는 것은 정말 무겁다는 사실~","['https://phinf.pstatic.net/checkout/20200820_275/1597926108017ejChQ_JPEG/review-attachment-f7c5ee8f-834c-4a2e-a67a-29319a1dfff4.jpeg?type=f287', 'https://phinf.pstatic.net/checkout/20200820_33/1597926108203qSYz2_JPEG/review-attachment-27a62846-2b7e-44f9-95e4-cd9318e035d6.jpeg?type=f287']"
4,"일단 튕기는 소리 안나서 좋아요
본체의 무게나 재질이 가성비 굿입니다
비싸보여요 ㅋㅋㅋ
싸구려 틱틱탁탁 소리안나요(묵직)
키감은 개인차겠지만 나름 맘에 들어요 숵걱숵걱 소리같달까 기계식찾는분에겐 비추
나름쫀독하고 타자느린분들께 추천 손목 좀 무리갈수도",['https://phinf.pstatic.net/checkout/20200110_192/1578619276500bdCa5_JPEG/image.jpg?type=f287']
5,"처음 1회 제품에 이물질이 묻어 있어서 교체를 했는데, 인터파크 대응이 정말이지 고객을 무참하게 바보를 만들었어요. 로그인 할 때 아이디 저장도 안 되고,,.. 이런데 이용하는 사람이 아직도 있나 싶을 정도로.. 바보 인증하는 인터파크.. 판매자가 훨씬 똑똑한 듯.., 아니면 기업 시스템 전체-자체가 멍청이 이거나.., 아무튼..., 제품 디자인은 약간 좀 다른 키보드 제품들 보다 뭐, 그렇게 아주 엄청 멋진 키보드는 아니지만, 단 하나. 키감은 꽤, 매우 괜찮습니다.. 전혀 나쁘지 않고, 부드럽게 눌리고, 제가 계속 쓰던 15년 전부터 쓰다가 보관 하고 있던 로지텍 울룩불룩한 키보드를 썼는데, 오타가 많이 났는데,, 이 키보드는 키감부터 제품 사이즈 등 다 마음에 듭니다.. 딱 하나. 프린트 된 자판이 15년 넘은 로지텍 키보드 보다도 약간. 아주 약간 흐립니다. 아주 약간이기는 하나, 그냥 딱 보면 좀 탁하구나 하는 느낌은 그대로 묻어납니다.. 하지만, 키감 하나는 좋습니다. 근데, 이제 보니 키 하나 하나 사이즈가 좀 작네요.. 그래서 올려 놓은 손가락이 부담스러워서 두들기는 지금도 약간의 불안감이 몰려옵니다.",[]
5,어제 처음 사용 해 봤는데 너무 불빛도 이쁘고 키보드 버튼도 잘 눌러지고 해서 마음에 쏙 드네요. 그리고 센스 있게 게임에 자주 사용하는 버튼하고 높낮이 조절하는 것까지 여분으로 챙겨줘서 더 마음에 드네요. 게임이 할 때 사용해 보니 너무 편안하네요. 강추합니다^^,[]
4,솔직히 가성비는 괜찮으나 멤브레인의 한계인지 키보드의 문제인지 키를 지속적으로 눌러야할 시에 가끔 0.1초정도 혼자 안눌렸다 눌리는 등의 증상이 나타나긴했습니다. 그런것에 별로 불편하지 않으시다면 사시는것을 추천드립니다.,[]
1,별한개도 아까워요 접촉불량인지 선 조금만 건드리면 연결이 끊어지고 안에서 뭐가 부서진건지 키보드를 움직이면 안에서 플라스틱 굴러다니는 소리가 나네요. 뭐 화나는 일 있어서 한번 던지고 보내주셨나요? 큰 금액이 아니라 그냥 좀 쓰다가 다른거사고 버리던가 할건데 다시는 여기서 아무것도 구매하지 않으려고요 키보드 하나도 제대로된게 안오는데 다른건 뭐..,[]
5,아드님 옵치용으로 키보드 K300 + 마우스 A610 구매했습니다.네이버 검색 통해서 이거저거 비교하다가 구매했는데갓성비라는 수식어가 괜히 붙은건 아닌거 같네요.키보드 마우스 모두 만족합니다.배송도 매우 빠르고 제품도 이상없이 잘 동작합니다.비쥬얼 적으로도 그렇고 사용해보니 키감이나 마우스 클릭감도괜찮고 RGB LED도 멋짐 폭발합니다.이 가격으로 이정도 제품이 만들어 진다는게 놀랍네요 ㅎㅎ,"['https://phinf.pstatic.net/checkout/20190220_77/155062405741751SAI_JPEG/KakaoTalk_20190220_092521913.jpg?type=f287', 'https://phinf.pstatic.net/checkout/20190220_12/1550624057670MjtpO_JPEG/KakaoTalk_20190220_092522337.jpg?type=f287']"
4,"일반적으로 키보드만 배달오는것과는 달리 여분의 자판키와 키보드 세우는 다리 등 여분의 보조물품(?)들도 주시고선도 겉은 천비스무리한 재질이고, 선을 감는 찍찍이도 달려있네요. 굳굳게임방에서 사용하던 기계식 키보드에 비하면 타격감은 확실히 약하고 빠르게 타자를 치다보면약간 가벼운 느낌이 납니다. 하지만 가격을 고려하면 가성비는 정말 갑인듯.나는 절대 게임방을 안간다. 무조건 집에서만 한다. 게임을 많이하고 장비들도 너무너무 중요하다. 싶은분들은 비 추천이지만.나는 장비 나쁘지만 않으면 크게 신경안쓴다. 친구들과 종종 게임방도 간다. 이런분들이면 생각보다 만족하실듯 하네요.꼭 게임이 아니더라도 일반 작업하시는분들도 추천 드립니다. 키보드 정말 괜찮아요 ㅋㅋ집에서 게임하는 분들도 이정도면 훌륭할듯 합니다. 추천추천",['https://shopping-phinf.pstatic.net/20190627_20/41609762-c519-4929-bec9-4ddf235865f2.jpg?type=f287']
5,너무 잘쓰고이썽요 ㅎㅎ 회사에서 쓰기도 딱 좋은것같아요.. 진짜 열심히 일하는 느낌나요 ㅋㅋㅋ 프로패셔널해지는 기분~ 글고 피시방 키보드같아서 재밌기도 해요..흰색 정말 사고싶었는데 이론고 흰색이 나오면 좋을 것 같아요 . ㅠ,['https://phinf.pstatic.net/checkout/20190909_20/1567994639377A8iE8_JPEG/KakaoTalk_20190909_110320973.jpg?type=f287']
5,솔직히 이 가격에 이정도 키감 상상하지 못했는데 정말 좋네요약간 무접점과 멤브레인 키보드 느낌을 섞어놓은 듯한 키감이니까 참고하시고 구입하세요 진짜 가성비 정말 좋은거 같습니다. 전 정말 만족합니다. 약간의 그 도각거림이 저는 좋네요 기계식 키보드류 원하시는 분들은 다른 키를 알아보시고 도각거리는 느낌 좋아하시는분들이 사시면 만족하실거같아요!!,[]
5,"전에 사용하던 키보드와 모양이 약간 달라서 오타가 나곤했는데, 적응하니까 확실히 안나네요. 게임할땐 불편한거 하나도 없구요! 타자를 칠 용도라면 다른 키보드 고려해보는것도 좋으실 것 같아요. 제 경우엔 타자를 오래치면 새끼손가락이 좀 아파요.(엄지~새끼 F1~F10) 적당히 타건감이 있으면서 시끄럽지않아 좋았어요.",[]
4,키보드 쓰던거 동생이 가져가버려서 새로 샀는데 고민끝에 구매했습니다 배송도 빠르고 LED도 이쁘고 좋네요 밝기는 조금 약해보이긴 하는데 전등 아래서 쓸거라 저는 딱히 밝기 세기는 감안하고 보면 너무 이쁘고 좋네요완전 기계식인지는 잘 모르겠지만 제 기준으로 키판 소음도 신경쓰일정도로 크게 나지 않아서 좋습니다,['https://shopping-phinf.pstatic.net/20190603_19/669d2a0c-cfb5-4abc-bcd8-8462d8f9eb3b.jpg?type=f287']
4,"제품은 좋아요.
다만 결제하고 거의 한달만에 사용하는건데, 배송은 엄청 늦고 불량 있어서 해결해달라고 했더니 직접 해준다거나 알아본다는 말은 안하고 본사에 요청하라는 얘기해서 대응은 겁나 맘에 안듦. 본사 얘기하니 어차피 대응은 교품이었음. 판매자분 잘좀하세요.",[]
5,저는 기계식이랑 무슨 축? 그런 거 잘 몰라가지구 그냥 예쁘고 싼거샀는데요 굉장히 맘에듭니다. 넘어렸을때 컴퓨터를 써봤어서 이렇게 부드러운 키보드를 첨써봐여 회사에 로지텍보다도 더 좋은것같은 느낌적인느낌? 하여튼 잘쓰겠습니다^^,['https://phinf.pstatic.net/checkout/20190115_131/1547510611902LteN2_JPEG/KakaoTalk_20190115_085917964.jpg?type=f287']
5,"좀 넓은 보급형 키보드에요 (기계식아니에요) 만원짜리 키보드는 쓰다가 너무가벼워서 고정이 안되고, 기계식은 키캡이없어 오염에 너무 취약하고 불편하고... 이제품은 키캡도 있고 크기도 적당하고 무게감도 있어서 요골로 비꿨어요. 단점은 : 고정은 잘되지만 게임하다가 빡쳐서 키보드에 샷건치시면 (사진상, 빨간색으로 표시한부분이) 내구성이 매우약해서 바로 부서집니다. 그리고 이부분이 부숴지면 고정판이 소멸되는거라서 (세워야고정되는 형식이에요) 고정이안되요. 구매참고하세요 ㅠㅠ 당시2개구매해서 1개는 버렷어요.",[]
5,조용히 키보드를 치는 사람은 서걱서걱 하는 느낌의 키보드이구요. 약간 세게 두드리는 사람은 딸깍딸깍하는 느낌의 키보드 입니다. 로지텍은 둥그런 느낌? 마이크로 소프트는 물렁한 느낌? 이건 약간 기계식의 사각형 같은 느낌입니다. 그리 나쁘지 않아요. 일단 키 하나 하나 봤는데 불량은 없어요. 흔들거리는 것도 없구요.,[]
3,유선 게이밍 키보드 키감도 좋고 백라이트도 있어서 다 좋습니다.하지만 한가지불만족 스러운 것이 있습니다. 저는 MS Excel를 사용하는 사람으로서엑셀에서는 배열수식을 입력할때 Ctrl + Shift + Enter 키를 눌러서 배열수식을 완성합니다.그런데 이놈의 엔터키가 키보드의 왼쪽 Enter 키를 누르면안먹히네요. 숫자 키패드 쪽에 있는 우측 Enter 키를 눌러야 그제서야 Ctrl + Shift + Enter 키가 적용된다는 것...아픔이 있네요.할 수 없이 게임하는 큰 딸에게 보너스로 지급하고다시 로지텍 유선키보드 K100 NEW 를 이 판매처에서구입해서 지금은 잘 사용하구 있습니다. ㅎㅎ 엑셀 사용하시는 분들은 비추천합니다.,[]
5,"문서작성할 일이 많아서 구매하게 되었는데
기계식은 사무실에서 사용하기에 부담스럽고 일반 키보드보다는 플런져?플렌저? 뭐 이런것도 한번
써보고 싶어서 시험삼아 주문했는데 괜찮은듯합니다.
집에서는 기계식 키보드 사용중인데 기계식 키보드(갈축)에 비해서 소음도 적고, 부드럽게 타이핑 되고 있어서 마음에 듭니다.
혹시나~해서 하나만 샀는데 곧 추가구매할 거 같네요.",[]
4,수령후 사용감 좋네요. 자판이 소프트하게 잘 눌리네요. 동시입력키 테스트도 해봤는데 다른분들 처럼shift+s+4는 동시입력이 안되네요. 이 키보드만의 문제인가해서 다른 말짱한 키보드 엡코 k310으로도테스트 해봤는데 마찬가지로 입력은 안되더군요. 엡코만의 문제일수도 있다는 생각에 그냥 사용하려고 합니다. 크게 사용할일도 없을거같구요. 소리도 그렇게 큰게 아니라 사무실 용으로도 나쁘지않은듯합니다.다만 기존에 쓰던게 기계식보급에 가깝다보니 터치감이 확실히 달라서 적응하기까지가 조금 필요할거같아요.,[]
5,해커 이번 시리즈에 이 모델의 상위호환 제품이 주력제품이라 저가형인 k300은 언뜻보면 일반키보드와 비교해 불들어오는 정도의 차이밖에 없습니다. (키감도 스탠다드한 일반키보드와 별차이없음) 다만 게이머의 편의를 위한 자잘한 기능들이 많고(특히 펑션키를 이용한 다양한 기능들) LED ON시에 중급가격의 LED키보드들과 거의 차이없는 수준의 화려함을 보여주네요. 완벽한 게이밍 키보드와는 다소 거리가 있지만 FPS 초고수의 길을 가고자 하는게 아니라면 게이밍 키보드 입문용으로는 적절해 보입니다.,['https://shopping-phinf.pstatic.net/20190603_9/1019f712-a0fd-4785-84bc-86a9c1d917cb.jpg?type=f287']
4,"가격대기 좋아요. 키보드 괜찮아요 ㅎㅎ LED도 이쁘게 나오고 하나 아쉬운게 있다면 스페이스바가 너무 길어서 익숙하지가 않고,처음에 불량제품 받아서, 환불하고 다시 구매햇는데 이번에는 키보드가 빠져서 굴러다닌점,,다시 받기까지 시간이 오래 걸린점, 그리고 둘 다 박스가 한번 개봉했던 것 같은데..그리고 왼쪽 Ctrl + Shift + Esc(작업관리자 창) 기능이 안되는게 너무 아쉽네요..게임 후 창 잘 안꺼져서 애용하던 키인데ㅎ 그래도 지금은 기능도 다 되고, 사용하는데 크게 불편한 점은 없이 다 만족합니다.",[]
5,"좋습니다. 만족합니다. 저는 pc방에 있는 아이x직??(타사 키보드 언급해서 죄송하지만) 플런저 키보드의 키감에 반해 같은 키감일줄 알고 앱코 플런저 키보드를 구매하게 되었습니다. 구매자들 리뷰도 다른 회사의 키보드보다 확연히 눈에 뛰었고 평들도 다 좋아서 구매한 이유가 컸던것 같습니다 실제 배송을 받아서 타건을 해본결과 만원대라는 키보드 치고 led와 나쁘지 않은 키감 등 가성비 면으로는 정말로 정말로 만족합니다. 게다가 그전에 바로 청축을 쓰고 있어서 소음면에서는 전에 쓰던 청축소리에 비하면 이 키보드는 거의 무소음에 가깝습니다. 과장 조금 보태서지만 말이죠 하지만 키감만으로 평가했을때는 제가 PC방에서 타건해 본 그 고유의 키감은 아니네요. 아이x직 키보드 홍보하는건 전혀 아니지만 저한테는 PC방에 있는 아이X직 키보드가 맞는듯 합니다.그땐 멤브레인과 차이가 좀 느껴졌던걸로 기억을 하는데 이 키보드는 약간 멤브레인 방식과 비슷하게 느껴지네요 일단 앱코K300키보드는 가성비는 둘째치고 순수히 키감만 보자면 제가 과거에 사용했던 dt35 멤브레인식 키보드와 유사한 키감으로 느껴집니다. 마지막으로 LED인데..물론 1만원대 후반이라는 가격치고 이만한 LED가 들어가 있는것도 정말 메리트라고 합니다. 비록 몇년전이지만 그때는 DT35 LED 들어가 있는 제품을 3만원대에 구매했으니 정말 가성비는 좋다고 봅니다. LED에서 한가지 아쉬운건 키캡에 글씨에는 LED가 투과가 안된다는 점? 장점 : 기계식에 비하면 소음이 없고 키감도 무난하다. 기계식보다 멤브레인 좋아하시는 분이라면 만족하실만한 제품, 게다가 LED 색상별로 탑재되어있어서 만원대 후반이라는 가성비가 깡패.",[]
5,led키보드 처음구매합니다 pc방 키보드로 led키보드사용했을때 타자치는 소리가 너무컷었는데이건 소리도 크지않고 뭐랄까 폭신한키감에 소리도크지않고 맘에쏙드네요led도 3단계 밝기조절되고 칼라도 여러가지로 조절도되고 좋아요같이구매한 방수 장패드도 청소할때 물티슈로 슥 닦기만하면끝이니 너무좋네요,[]
5,좋아요 프리미엄 구매평을 작성하면 100원을 준다고 해서 작성합니다 당일배송 + 앱코 공식판매점 앱코 레인보우 엘이디 게이밍키보드 가성비 강력추천을 샀는데 제목 그대로 가성비가 좋더군요 일단 키감이 생각보다 괜찮습니다 청축처럼 탁탁소리나는것도 아닌데 그렇다고 노트북마냥 조용하게 눌리는것도 아니여서 딱 제가 좋아하는 키감이였구요 눌리는 느낌도 괜찮았습니다.,[]
5,이가격대 이런 키보드 구하기 힘듭니다. 깔끔합니다.이쁩니다가격좋습니다타건도 좋습니다. 이가격대에 이정도면 정말 만족합니다. 아쉬운점이 나중에 A/S받을때 용산으로 오라고 하던데 그건좀 아쉽네요..ㅠㅠ. 키보드 정리하는 벨크로타이도 있어서 선까지 깔끔하게 마무리가 됩니다/,[]
5,"괜찮은 것 같아요. 마감도 좋고 백라이트 기능도 이가격에 이런 제품이 가능하다니 놀랍습니다. 하지만 가장 큰 적은 내 안에 있다고 했던가요외관이 주는 기계식 키보드 느낌에 스스로 설득당한 다음, 눌러봤을때 키감은 멤브레인에 더 가까워 조금의 실망감을 느끼네요. 뭐랄까 1과 0이 좀더 분명한 멤브레인 느낌??사실 플렌저가 멤브레인 개량형쯤 되니까 당연한건데 혼자 욕심내서 기대했다가 혼자 실망했네요 ㅎㅎ아무튼 가성비를 생각했을때 총평은 매우 만족스럽습니다. 개인적으로 10점 만점에 9점?엄청 튼튼해 보이구요 여분 키캡과 도구까지 있는 디테일도 있네요. led도 기대 이상. 다만 단색 스타일은 없구 레인보우 스타일만 있는 건 아쉽네요. 혹시나 저처럼 주문할 때는 기대하지 않았다가 외관에 놀라서 기계식 청축 키감을 기대하는 실수는 범치않기를 바랍니다 ㅎ아 wasd랑 방향키 입력을 바꾸는 펑션기능 너무 좋은거 같습니다. 그리고 동시키는 시험해봤는데 일반키보드랑 비교불가네요. 20개 넘게 동시에 눌러지길레 막 도구를 사용해서 더 눌러보려다가.. 귀찮네요..아무튼 피파같은거 하다가 동시키 안눌러졌다 할 일은 절대 없겠네요. 그럼 이만잘 쓸게요 빠른배송 감사합니다",[]
5,키감-기존에 아이락스 펜타그래프 키보드보다는 약간 높이가 있어서 타격감(?)이 좋습니다. 소음-비슷한 플린저식 키보드(방수) NKEY-P1을 먼저 구입했는데 소음이 꽤 커서 사무실에서는 사용하기가 어려워서 대체제로 사게 되었습니다. 소음은 펜타<플린저<멤브레인<기계식 일것 같습니다. 펜타가 소음은 확실히 적네요 LED조명-색을 조정할 수는 없어서 좀 심심하긴 한데 사무용으로도 없는 것보단 있는게 기분전환도 되고 훨씬 좋네요,[]
5,2번째 구매! 가격도 착하고키보드도 사용하기 편해요~전 이거 2번째 구매예영갑자기 멈춰서 바로 구매했는뎅또 갑자기 사용이 가능해져서 ㅋㅋㅋㅋ아무튼 오래써요~이거 2년?쓴거 같아요 ㅋㅋ 그래도 한번 멈췄던거 말고는 아직 쌩쌩합니당,[]
5,가격대비 좋아요 가성비짱 부드럽게 눌리고 조용해서 좋아요 근데 일반적인 청축적축 이런거 기대하고 사시면 실망하실듯 합니다. 키보드에서 빛나오는 것도 안 예뻐서 기대하시면 실망할것같아요... 전 꺼놓고 살아서 저한텐 잘맞네요,[]
4,키감이 부드러움 기존에 맥스틸 새턴이라는 키보드를 사용했는데 키 몇개가 인식이 됐다가 안됐다가 해서 바꿨습니다.플런저축이라 안써봐서 써봤는데 생각보다 통통 튀거나 그런 맛은 없네요.키감은 전체적으로 부드럽게 눌리는 편 인것 같습니다. 전에 쓰던게 비키스타일에 키 높이가 전체적으로 낮았는데 이건 조금 높은 느낌이네요.키가 투명사출이 아니라서 불빛은 외각으로만 나옵니다.전체적인 부분이 다운그레이드되서 조금 아쉽긴하지만 그럭저럭 익숙해지면 괜찮아질듯합니다.,[]
5,제가 타자칠때소음이많은편인데 키감도 부드럽고 무엇보다 LED조명때문에 어두운데서 할땐 키보드칠맛납니다. 게임하시는 분들이 쓰면좋을것같구요 다만 전용커버가없어서 따로 구매자체가안된다는게 아쉬울분 가격이랑 성능면에서 쵝오에요,"['https://shopping-phinf.pstatic.net/20190628_8/0960bc29-9395-4bf5-9756-ff9c96f90c4e.jpg?type=f287', 'https://shopping-phinf.pstatic.net/20190628_2/f3ce7f1a-52ca-4925-aec1-c4ce9e3b55bf.jpg?type=f287']"
