star_point,comment,photo
5,일단 배송은 영업일 기준으로 이틀정도 걸린 것 같구요 무엇보다 포장이 깔끔해서 박스 개봉하는데 기분이 좋았네요 ㅎㅎ 제품 자체는 가성비 이정도면 훌륭하고요.. 글자 자판이랑 엔터 키 자판등 각 자판마다 키감이 다른 것도 타자 칠 맛 납니다 게임하시는 분들은 이 키보드로 하시면 더 재밌게 즐기실 수 있을 것 같아요!!! 커버도 금속재질이라 너무 가볍지도 않고 미끄러짐도 전혀 없습니다 이 제품 강력 추천합니다!!,"['https://phinf.pstatic.net/image.nmv/shopnbuyer_2020_04_25_0/7a184930-8657-11ea-a1fd-505dac8c38f5_03.jpg?type=f287', 'https://phinf.pstatic.net/checkout/20200425_12/1587752065157D1Cjm_JPEG/CF6D6A87-0B62-482D-8F61-AFFE7D4D1C57.jpeg?type=f287']"
5,청축 갈축 둘중에 갈축으로 했지만 청명함이 넘 죽지 않을까 싶었는데 의외로 청명함 경쾌함에 만족합니다.키보드도 무게감이 있어서 밀리거나 텅빈 울림소리없네요큰자판의 저가 저급의 스프링소리도 없어서 더 만족합니다^^더우기 자판 청소덮개랑 청소도구가 있는 제품은 흔치 않죠~~앞으로 개선하거나 좀 아쉬운 부분이 한영이랑 한자 자판의 한글폰트가 좀 희미하네요 전체적으로 좀더 선명했음 좋지 않았을까 싶네요led 동작모드도 좀 더 다양하면 좋겠고 볼륨조절도 조그셔틀로 만들어져서 나왔음 좋겠네요방수기능도 있음 좋겠죠.이리하면 금액이 더 오르겠죠? 그래서 이 가격에 이만한 정도로 충분히 만족합니다^^,[]
5,"좋습니다. 가성비, 마감에 이 가격 절대 안나옵니다. 최고네요.
굳이 단점을 하나 뽑자면 제가 기계식 키보드 매니아인데 큰버튼 백키보드 엔터 쉬프드 등 누르는 감이 좀 먹먹합니다.
그래서 엔터키 칠때마다 흐름이 끊기는 느낌이랄까.
열어봤는데 다른 기계식 키보드는 그 부분이 다르네요 ㅎ
다른거는 긴버튼은 쇠 지지대로 중앙을 누르겠금 되어 있는데 k640은 그런게 없어서 그런 것 같습니다.
이건 개선되면 좋을 것 같습니다.
작업용키보드인데 단모음자음 누르는 감이랑 달라요 ㅋ
아무래도 fps 위주고 10~20만원 고가에 비하면 욕심이겠죠?",['https://phinf.pstatic.net/checkout/20200703_290/1593753059632x3w6z_JPEG/9f4690804dab4bbd01c64c6af6d3a571.jpeg?type=f287']
5,"엔터키는 오래전 그 추억의 큼지막한 엔터키가 아니지만 그건 요새 거의 나오질 않으니 어쩔수 없고..청축 고유의 그 경쾌한 타격감과, 테이블위에 자석처럼 붙어있게 만드는 키보드의 무게감이 기대 이상입니다.정말 만족합니다. 알록달록한 엘티이의 색감도 너무 좋구요. 청축키보드를 첨 접했을때 6만원에 구입한 기억이 있는데, 그때의 그 6만원짜리 키보드보다 훨 괜찮네요.그때 이후론 청축만 썼는데 이번건 가격도 품질도 정말 맘에 듭니다.",[]
5,키보드를 뭘 살지 고민하다가 친구의 추천으로 사봤는데 좋은거 같네요. 색깔나오는것도 예쁘고 키보드 치는소리도 좋아 매우 만족스러운거 같아요. 색도 다양한 패턴으로 바꿀 수 있고 좋네요 소리도 너무 크지도 않아서 매우 만족스럽네요. 혹시 키보드 2개 샀는데 이벤트중인 마우스패드도 2개오나요?,"['https://phinf.pstatic.net/checkout/20200814_230/1597402900044NxseG_JPEG/review-attachment-ffe11695-05a0-488d-a156-1894a0926f1f.jpeg?type=f287', 'https://phinf.pstatic.net/checkout/20200814_227/15974029144663lIXl_JPEG/review-attachment-a65f7bdd-b733-4838-9528-cad3c8a944c2.jpeg?type=f287']"
4,"딸깍딸깍 좋네요 키보드 만지는 맛이 다르네요
한가지 아쉬운건 몇몇키가 서걱서걱 거리는 느낌입니다(백스페이스 엔터 시프트 스페이스 정도네요) 타건감이 다른 부분과 확연히 차이가나요 불량인지 뭔지 모르겠지만 그것만 빼면 좋습니다. 반품할수도 있지만 업무용으로 구매한거라 그냥 쓰려구요",['https://phinf.pstatic.net/checkout/20201110_59/16050044304448EbRK_JPEG/review-attachment-fc60965b-cd58-43ef-984b-2fae62e2f3d9.jpeg?type=f287']
5,배송도 빠르고 적축키보드라 타건은 조금 안좋을수 잇긴하지만 소음이 별루 없구요 (조금의소음은충분히 감안해서 고른거라) 제일 좋은것은 역시 가성비안일까 생각해요 너무잘산듯 고장은 거의 안난다고 보면 댈거같아요 집에서 쓰는거다보니.. 손이 저렴한키보드에 맞쳐잇다보니 저렴하면서도 좋은키보드 찾기가 힘들기도 하고 이제품pc방 키보드 대표적인 제품이잔아요(아님 말구요) 어쩌든 잘쓰겟슴닷!,['https://phinf.pstatic.net/checkout/20200820_151/1597892485400c1WrT_JPEG/review-attachment-a1b46fc9-1806-4f32-b9e3-7e2072c333ef.jpeg?type=f287']
5,"주문 하루만에 도착했습니다. 배송 정말 빠르네요. 박스가 약간 눌려서 오긴했는데 설치해보니 문제없습니다.
예전 키보드보다 약간 작은 느낌이라 왼손이 적응 되면 편할거 같습니다. 소리도 듣기좋네구 LED도 이뻐서 와이프도 만족해합니다. 번창하세요~~^ㅡ^","['https://phinf.pstatic.net/checkout/20200619_124/1592557309305EiWzF_JPEG/20200619_170441.jpg?type=f287', 'https://phinf.pstatic.net/checkout/20200619_195/1592557309383c014G_JPEG/20200619_170538.jpg?type=f287', 'https://phinf.pstatic.net/checkout/20200619_299/1592557309852OImWA_JPEG/20200619_175834.jpg?type=f287']"
5,3년전에 청축을 샀었는데 정말 100% 모든면에서 만족하고 쓰고있었거든요. 하지만 이사를 왔는데 조용히 해야하는 환경에서 이 키보드를 놓을수가 없어서 똑같은 제품이지만 적축으로 구매를 했어요^^ 역시나 후회없는 제품입니다.,"['https://phinf.pstatic.net/checkout/20200728_182/1595923683272spdPH_JPEG/review-attachment-8023823b-25e1-4425-8cd0-e0a4a7de7e76.jpeg?type=f287', 'https://phinf.pstatic.net/checkout/20200728_107/15959236832517VNil_JPEG/review-attachment-28b7b0c1-e6f7-4611-9dd7-1ee23938b7b4.jpeg?type=f287']"
5,"와!
그냥 와소리밖에 안나옵니다!
여태 컴퓨터하면서 키보드란걸 대충 쓰고 했는데
이 키보드를 잠시 사용해봄에도 불과하고
진짜 키보드 기술도 장난아니게 발전을 했다는걸 느끼게 해주네요!
키보드 하얀색상부터해서 !
이 키보드 쓰면 다른 키보드 쳐다도 보기 싫겠네요
아주 좋습니다! 진짜 강추입니다^^
근데 한가지 단점을 굳히 뽑자면 진짜 키보드치면서 내가 타자기를 치는 기분이 들어서 밤에 정숙할때 쓰면 옆에사람한테 맞을수도 있을거 같네요 ㅋㅋ
소리가 쬐끔 요란합니다 ㅋㅋ
그밖에 장점은 그냥 써보면 압니다!
가격대비 가성비도 좋은거 같고 아주 다 좋아요!
사장님 잘쓰겠습니다! 감사합니다^^",[]
5,"배송 - 상품 주문하고서 생각보다 빠르게 왔습니다. 곧 연휴라서 늦게 올줄 알았는데 빨리 와서 감동했습니다. 포장상태- 완충제 없이 박스채로 비닐에 넣어서 보내주었습니다. 조금 아쉬운 부분입니다. 키감 - 다양한 키보드를 써보지 않아서 잘 모르겠지만 저는 만족합니다. 소음 - 피시방처럼 시끄러운 소리가 싫어서 갈축을 시켰습니다. ""사각사각"" 소리가 조용하게 들립니다. 만족합니다. 부가기능 - Fn 키를 이용해서 여러가지 기능을 쓸 수 있습니다. 아직 적응이 안돼서 잘 쓰지는 않지만 도움이 될 것 같습니다. *키보드 덮개가 있어서 보관에 용이할 것 같습니다.",[]
4,일단 주문한지 하루만에 총알배송 좋구요전에도 앱코제품 사용하다가 키가안눌려서 새롭게구매했는데 괜찮긴한데 손목쪽에 받침대가없으니 허전은하네요 일단 더써봐야 알것같긴한데 청축을쓰다가 갈축으로바꾸니 확실히 타격감은 떨어지긴하는데 조용해서 좋네요,"['https://phinf.pstatic.net/checkout/20190730_225/15644924348364CQrW_JPEG/20190730_220812.jpg?type=f287', 'https://phinf.pstatic.net/checkout/20190730_210/1564492435899TkKYN_JPEG/20190730_220157.jpg?type=f287', 'https://phinf.pstatic.net/checkout/20190730_42/1564492435827q7eXe_JPEG/20190730_215758.jpg?type=f287', 'https://phinf.pstatic.net/checkout/20190730_285/156449243584812qC1_JPEG/20190730_215729.jpg?type=f287', 'https://phinf.pstatic.net/checkout/20190730_88/156449243586130Oew_JPEG/20190730_215719.jpg?type=f287']"
5,가성비는 이키보드 따라갈키보드가 없습니다.피방에서 써본분들은 아실꺼에요.. 청축 갈축 적축 고민하시는분들 많으신데 집에서 게임용으로쓰기에는 무조껀 청축입니다 키감이 기가막힙니다.갈축은 뭐랄까 이도저도 아닌거같은 박쥐같은 느낌이랄까.. 취향차이겠지만 청축과적축의 장점만을 모아놨을꺼같은 예상은 안하시는게 좋습니다.. 회사나 공공장소는 적축써야되구요..뭐 더좋은키보드 솔직히 널리고널렸지만 가격이 키보드에투자하기에는 너무 큰가격이라.. 이가격에 기계식키보드를 쓴다는거자체가 엄청난메리트입니다. 강력추천합니다.,[]
5,"배송은 완전 퀵배송이었습니다 ㅎㅎ
큰아들이 학원에서 100점 받으면 사주겠다고 하는데 100점 시험지를 들이밀며 키보드 사달라고 해서 사줬습니다.
저는 회사에서 싼거 쓰는데 아들이 비싼거 사달래서 처음엔 망설였는데
받아보고 직접 키보드 쳐보니.. 타격감이 장난 아니네요~
소리도 경쾌하고...
저도 사무실에 하나 사놔야겠습니다 ㅎㅎ
많이 파세요~","['https://phinf.pstatic.net/checkout/20200821_101/1597971596804DItgl_JPEG/review-attachment-fc48ad58-7e51-4d2f-8c16-54e9111ef357.jpeg?type=f287', 'https://phinf.pstatic.net/checkout/20200821_27/1597971596798yRDM4_JPEG/review-attachment-73cddca2-97d8-47ca-8a78-1eb591d2b2d6.jpeg?type=f287', 'https://phinf.pstatic.net/checkout/20200821_225/1597971596807IOrKg_JPEG/review-attachment-a4ab485d-8cbc-491c-a562-56ee76d6acad.jpeg?type=f287']"
5,"배송도 이틀만에 도착했고, 회사에서 사용하려고 소음이 적은 적축으로 구매를 했는데 키보드 입력시 소리도 작아 옳은 선택을 했습니다. 가격대비 상당히 만족하며 엘이디 밝기 조절기능도 있어서 기호에 맞게 조절하면 됩니다. 구매시 참고하세요","['https://phinf.pstatic.net/checkout/20200617_157/1592342429923hac8t_JPEG/20200616_072107.jpg?type=f287', 'https://phinf.pstatic.net/checkout/20200617_150/1592342437298RbsWL_JPEG/20200616_072041.jpg?type=f287']"
5,확실히 키감이 부드럽습니다 키압은 가벼워서 오탈자가 잘 나긴 하는데요 게임용이다보니까 키감 가벼운게 좋아요 이전에 쓰던모델은 앱코 청축제품이었는데 키감이 상대적으로 무겁지만 타격감이있었거든요 이건 타격감이 적은대신 소음이 적어서 좋습니다 잘쓸게요,"['https://phinf.pstatic.net/checkout/20200725_207/1595687747981I7W6U_JPEG/review-attachment-676ffbde-292a-411b-9e74-4bb586b31c69.jpeg?type=f287', 'https://phinf.pstatic.net/checkout/20200725_94/1595687756361GajiH_JPEG/review-attachment-ec334f53-a406-4a15-928a-2ce95ba3e3b1.jpeg?type=f287']"
4,기존에 사용하던 키보드는 8만원정도 하는데 청축을 사용했는데요. 키 버튼 하나를 누르면 그 라인에 있는 키들이 전부 눌러져서 사용을 못해서 일반 키보드로 억지로 사용하고 있었는데 게임할 때도 타자감도 너무 불편함이 많았습니다. 그래서 키보드 사기엔 컴퓨터도 많이 하지 않는데 사는건 돈이 아깝고 해서 저렴한거 알아보다 앱코 k640이 3만원정도에 살 수 있더라구요. 가격대비 평도 나쁘지 않고 청축만 쓰다 갈축을 선택해서 써봤는데 처음엔 청축처럼 만큼은 아니지만 그래도 처음써보는 거라 그런지 약간 어색했는데 역시 쓰다보니 적응이 되더라구요. 갈축이 청축과 적축의 장점을 모아둔게 갈축이라고 검색해서 알게 되었는데 적당한거 같아서 나름 쏘쏘합니다. ㅋㅋㅋ 가격대비 만족해요. 키보드 커버도 주는 줄 알았는데 알고보니 덮개를 주는거더군요. 이 부분은 살짝 아쉬웠어요 ㅠ 손에 땀이 좀 많은 편이라 또 상황에 따라 좋을 것 같은데 물론 제가 잘못봐서 그런거지만요. 그래도 덮개 있으면 사용안할 때 먼지유입 방지는 또 좋은 것 같아요,[]
5,피시방에서 많이 써 봤던 제품이라 그런가 익숙하고 좋네요! 다만 좀 싸서 그런가 피시방에선 시끄러워서 안들리던게 집에선 타자 칠때 통울림 같은게 들리긴 하는데 노래 조금 틀고 하면 전혀 안들려서 뭐 괜찮아요ㅋㅋㅋ 장패드도 앱코꺼 쓰는데 굿입니당,"['https://phinf.pstatic.net/checkout/20200913_293/1599927521391s2mk9_JPEG/review-attachment-c94f8bcc-a9af-4d69-ade6-ae82d1c3ca6c.jpeg?type=f287', 'https://phinf.pstatic.net/checkout/20200913_180/1599927522506Gf1iE_JPEG/review-attachment-ae26d790-86b0-4f2d-ad03-97b2d8e99b70.jpeg?type=f287']"
3,딱 가격 그대로 가성비 입니다 허허 저는 다 마음에 들었는데 스페이스바가 문제네요 버튼 누를 때마다 한번씩 다안올라오고 중간에 걸려서 입력이 계속 되네요 스페이스바를 쎄게 탁탁 누르면 저런반응은 없어요 (테스트 한번 해봤는데 쎄게 눌렀을때는 약30번? 에 한번씩 반응오고 평상시 입력하듯 누르면 틈만 나면 저런 반응입니다) 저는 반품하는거 귀찮아서 그냥 쎄게 누르며 쓸려구요..,['https://phinf.pstatic.net/image.nmv/shopnbuyer_2020_10_20_0/feb62398-12d7-11eb-b6f4-505dac8c3721_03.jpg?type=f287']
3,예전에 구매한게 있는데 이번건 왠지 마감이 부실하네요. 프린팅 된것도 흐리고. 소리는 넘 경쾌하네요. 시끄럽단 얘기죠. 그래도 누르는 맛이있죠. 글구 혹시 키보드 연결잘못하면 컴 바이오스 초기화되는지 궁금함. 키보드 연결하고 컴 켰다가 윈도우 부팅에러 생겨서 윈도우 새로깔았음. 짜증나 죽는줄알았음. 덕분에 부팅은 빨라졌음. 조용한거 원하시는분은 다른 스위치 방식으로 사시길...,[]
5,"마침 로지텍 무선키보드 방향키가 고장나서 키보드 구매하려고 알아보던 중 이런 좋은 기회를 만나게 되었네요.평소 써보고싶던 키보드를 이렇게 구입해서 사용해 보게 되니 너무 만족스럽습니다. 기계식 키보드 특히 청축은 처음이라 재미있고특히 키보드 타이핑하는 느낌이 쫀득하니 살아 있어서 뭔가를 자꾸 치고 싶게 만드는 마력이 있네요.다만, 기존의 얇은 포지션 키에 익숙한 저에게는 이 키보드의 키가 좀 높아서 손가락으로 타이핑하는 동안 손바닥이 자꾸 아래쪽 키를 누르게 되네요. 한참 타이핑하다 보면 다른 창이 열려있거나 다른 기능이 실행되고 있는 경험을 자주 합니다.손목 보호대가 필수인 것 같네요. 아랫쪽에 결합할 수 있는 손 받침대가 있으면 더할 나위 없겠습니다.그리고 숫자 패드의 '0' 키 하나만 느낌이 다른데, 이건 기분 탓인지 조금 더 사용해 보고 다시 이야기하겠습니다.'0' 키만 적축이나 갈축을 치는 느낌이라서 뭔가 이질감이 상당합니다.아무튼 일단 저렴한 가격에 잘 사용해보고 다른 키보드로 넘어갈지 고려해 보려 합니다.",[]
5,"월요일 오후에 주문했는데, 비도 오고 그래서 늦게 받을줄 알았는데 오늘 도착해서 완전 좋았습니다.
기계식 키보드 처음 써보는데 완전 느낌 좋고 진짜 잘산거 같아요. 디자인도 진짜 이쁩니다.
저처럼 기계식 키보드 사실분 꼭 구매하세요!!","['https://phinf.pstatic.net/checkout/20200909_191/1599648686875nfCOl_JPEG/review-attachment-568f1c2f-ad53-40cd-b944-518874594e1e.jpeg?type=f287', 'https://phinf.pstatic.net/checkout/20200909_286/1599648687510bY93L_JPEG/review-attachment-79528038-1b73-4ff2-981e-9ca4243fa0f8.jpeg?type=f287']"
5,"3만원이 안되는 가격대에 기계식 키보드의 키감을 맛볼 수 있다는 것만으로도 대만족. 무게감이 있어 타이핑시 밀리지 않아 좋고, 무지기색으로 백라이트가 제공돼서 이쁩니다. 여러 단축키를 제공하고 여러가지 모드의 백라이트 기능이 타이핑을 즐겁게 함. 물론 매니아들이 선호하는 다 뛰어난 기계식 키보드도 많이 있겠지만 부담없는 가격대에 충분히 즐길 수 있는 최상의 선택. 본인 취향에 맞게 키를 사서 커스텀도 가능합니다. 배송 역시 빠르고 좋습니다.","['https://phinf.pstatic.net/checkout/20200316_285/1584347331559rkwxu_JPEG/89D1094F-F6A2-4E9A-8A1A-26A2685035B8.jpeg?type=f287', 'https://phinf.pstatic.net/checkout/20200316_170/1584347331343SXELH_JPEG/665E31E3-3FE1-4C32-B5D6-98733BEEF2A1.jpeg?type=f287']"
5,"가격 대비 퀄리티가 매우 높습니다.
배송도 느리지 않았고 불량,상자 파손 전혀 없었습니다
역시 앱코 키보드네요
갈축이라 청축은 너무 소리가 크고 흑축은 소리가 너무 작다 하시는 분에게 좋겠네요
키감도 매우 좋고 너무 시끄럽지도 않아서 좋네요","['https://phinf.pstatic.net/image.nmv/shopnbuyer_2020_08_06_0/8712800f-d7f4-11ea-a472-48df379cc9e4_03.jpg?type=f287', 'https://phinf.pstatic.net/checkout/20200806_143/15967255411080R18z_JPEG/review-attachment-35d39f4f-9be7-4d43-8d31-b6590d135b98.jpeg?type=f287']"
5,처음에 컴퓨터에 인식이 안되서 깜짝놀랐는데 usb포트를 바꿔끼우니 잘 되네요~ 기계식 키보드에 지식이 없는데 적축이 부드럽다하여 적축으로 했어요. 아들이 너무 마음에 들어하고 가성비 훌륭합니다. 마우스까지 세트로 좋네요!!,['https://phinf.pstatic.net/checkout/20201113_256/1605268226564lQ4sl_JPEG/review-attachment-3a25b3a8-e46b-4d5a-a69c-bc02506cbc0d.jpeg?type=f287']
5,1년전 구입해서 잘 사용하는데 누나도 키보드가 필요하다고 해서 고민없이 추천했습니다. 가격도 엄청 싸졌네요. =ㅁ=!! 제가 구입할 당시(3~4만원대)만 해도 나름 가성비 좋았는데 지금은 완전 가성비 괴물이네요;ㅁ;... 너무 좋습니다~!!,"['https://phinf.pstatic.net/checkout/20201119_105/1605753000157vY6xa_JPEG/review-attachment-a7530ffc-ba60-4854-b6b0-365a4d273740.jpeg?type=f287', 'https://phinf.pstatic.net/checkout/20201119_264/1605753000605Ln9M8_JPEG/review-attachment-f88af216-51fe-4d0b-85f7-b3631854d2f0.jpeg?type=f287']"
5,"배송도 빠르고 키보드와 마우스, 장패드를 구매했는데 아주좋은 피시방에 와있는듯한 느낌이 들면서 게임이든 워드작업이든 뭐든 컴퓨터가 바뀐게 아니라 기본도구들만 바뀌었는데도 새로운환경 새로운컴퓨터로 하는기분마저 들도록 엄청잘되네요! 진작 구매할껄너무후회되요! 키보드와 마우스에서 나는 불빛도 이쁘고 타격감도좋고 매우만족스럽습니다!","['https://phinf.pstatic.net/checkout/20200104_263/1578116635516OQXc4_JPEG/20200104_142948.jpg?type=f287', 'https://phinf.pstatic.net/checkout/20200104_59/1578116644768cIg22_JPEG/20200104_143545.jpg?type=f287', 'https://phinf.pstatic.net/checkout/20200104_246/1578116651931LBRaq_JPEG/20200104_143551.jpg?type=f287']"
3,"타감의 부드러움이 갈축보단 적축에 가깝습니다.
블루투스 키보드나 적축처럼 아예 부드러운 키감을 좋아하시는 분이라면 적극 추천드리지만 청축과 적축 사이의 타감을 좋아하는 분에게는 개인적으로 비추천해요. 저는 후자에 가까워서 그렇게 만족스럽진 않았습니다.
스페이스바 키감이 조금 독특합니다. 이부분은 호불호가 갈릴것 같네요.
LED는 레인보우라 나름 화려합니다.
나쁘지도 않습니다. 그냥 딱 무난한 정도네요.",[]
4,"청축을 샀는데 박스에 적축이라 써있고 저번주에 산것과 키감이 달라서 고객센터에 문의했어요. 상담원이 키 하나 빼보라고 해서 빼봤는데 청축이 맞네요. 저번주에 청축박스에 왔던게 적축이었더라구요. 결론은 청축인줄로 알았던 적축이 마음에 들어서 재구입한건데 교환은 안되고 반품된다고 해서 그냥 쓰기로 했네요. 판매자분이 잘 확인하고 박스에 넣었다면 이런일이 없었을텐데...
그 부분은 아쉬워요. 키감이나 디자인이나 제품의 품질은 좋아요. 구성품에 청소솔과 부속품도 넣어줘서 유용하게 쓸꺼 같아요. 다만 오배송으로 인해 별하나 뺐습니다.",[]
5,90년대 IBM장비에서 쓰던 기계식 키보드가 생각나는 타감입니다. 기계식은 처음이라 축에대한 느낌을 자세히 적을수는 없지만 경쾌한 느낌이 너무 좋습니다. 가격대비 만족도는 아주 좋습니다. LED도 다양한 모드라 소소한 재미가 있네요.,['https://phinf.pstatic.net/checkout/20201125_105/1606282812039vz4rF_JPEG/review-attachment-4ee38c25-4343-4907-8194-c7de77de89c9.jpeg?type=f287']
5,졸업 선물과 개인 키보드를 바꾸고 싶은 마음에 검색하다가 기계식 키보드가 저렴하게 나와뭐 싸게 입문용하나 써보것구나하고 구매 다음에 정확하게 딱 와주고 요즈음은 당연히 빠르게 오니 나름 괜찬았고화이트는 청축을 사고 블랙은 갈축을 사서 전 화이트 쓰고 청축 갈축을 비교하면 청축은 워낙 유명하니 다들 그 키보드의 딸깔거리는 느낌 아실거 같고 굳이 비교하면 갈축은 소리가 적고 좀 흐믈거리는 느낌임 약간 펜타그래프 키보드 느낌임인식잘되고 한영키 작동이 안되어서 앱코 고객지원 자료실 레지스트리 등록해주니 너무 잘됨같이 동봉되어 있는 브러시 청소솔이 너무 마음에 듬현재 가성비 추천 제품이라 판단이 됨 추천 합니다. 가격따지면 충분한듯함전 개인적으로 10점 만점에 9점 주고 싶어요주의:키보도 엣지(키패드와 판사이가 떠있는데)가 조금 날카롭더군요 아이가 손이 베이더군요 이건 한번 개선해야 할듯함,[]
5,기계식 입문용이라기에 사봄. 실외에서 듣던것보다 소리가 크다. 소음이 있는 외부에서 와 조용한 실내에서 소리의 차이를 미처 생각 못했다.포장은 부실하다 하나마나한 에어백?은 왜 넣은건지. 공간이 너무 커서 굴러다님.이중?키캡이라 어두운 곳에서도 키가 잘보여 좋다.ㅏ 키누르는 감각도 만족함.전에 쓰던 키보드보다 작아서 적응에 시간이 걸릴듯하다. 아직은 약간 불편함.대체적으로 제품에 만족,[]
5,말로만 듣던 K640 직접 받아서 써보니... 신세계가... 왜 이제품을 쓰는지 알겠더라구요. 제품외관도 이쁘고 타자감도 정말 좋습니다. 그리고 안정적이며 절대 키보드가 흔들리거나 움직이질않네요. 또한 은은하게 뿜어져나오는 불빛이 너무 고급스럽습니다. 이가격에 이제품은 정말이지 완벽합니다. 감사히 잘쓰겠습니다,['https://phinf.pstatic.net/checkout/20200828_22/1598596463368P7K7b_JPEG/review-attachment-4395a4bb-dc04-48a4-bf6b-bd9b6d4edf67.jpeg?type=f287']
5,처음 키보드를 받았을 때 포장이 너무 이뻐서 포장을 뜯었을 때도 키보드가 이쁘길 바랬는데 속포장도 너무 튼튼 하게 해주시고 키보드도 너무 이쁘고 튼튼해보여서 기분이가 좋았습니다 지금 쓰는 멜브레인 키보드는 가벼워서 자꾸 밀리는데 이키보드는 그럴 걱정도 없고 너무 마음에 듭니다~,"['https://phinf.pstatic.net/checkout/20200908_104/1599530967160I6Uaw_JPEG/review-attachment-b7aca5f1-8e83-4f07-ba0b-4bb266e20583.jpeg?type=f287', 'https://phinf.pstatic.net/checkout/20200908_55/1599530967899mJ9Nf_JPEG/review-attachment-5b222484-e27a-4a14-b31c-2da8324acc70.jpeg?type=f287']"
5,"[피시방에서 써보자마자 구매했습니다]
요즘 피시방들은 장비들이 참 많이 좋아졌네요 ㅎㅎ피시방에서 회원가입할 때부터 감탄했구 바로 지르게되었어요ㅋㅋ
저는 15만원대 L사 저소음 적축키보드를 메인으로 쓰고있긴한데, 저소음만 쓰다보니 뭔가 답답할 때가 있어 시원시원한 맛의 청축을 서브로 지르게 되었어요
가성비도 참 좋은 것같고!! 레인보우 led도 이쁩니다 ㅎㅎ 일할 때는 저소음적축 쓰고 집에서 작업할 때는 청축 씁니다~ 키보드 케이블선도 맘에 들고, 배송도 하루만에 도착했네요 ㅎㅎ앞으로 집에서 일할 맛 날 것 같아서 신나네요 :) 감사히 잘 쓸게요~~!","['https://phinf.pstatic.net/checkout/20191113_152/1573655997282qdReM_JPEG/20191113_231225.jpg?type=f287', 'https://phinf.pstatic.net/checkout/20191113_69/1573655997451crHid_JPEG/20191113_231303.jpg?type=f287', 'https://phinf.pstatic.net/checkout/20191113_1/1573655997829tNOTR_JPEG/20191113_232742.jpg?type=f287', 'https://phinf.pstatic.net/checkout/20191113_33/1573655998186D7vai_JPEG/20191113_232911.jpg?type=f287']"
