star_point,comment,photo
5,"포장부터 깔끔하고 배송까지 빠르게 왔습니다.
장점으로는 키보드는 말할 것도 없이 좋습니다. 소음이 크지 않은 적축으로 했는데 너무 소리가 안날까봐 걱정했지만 크지도 않고 작지도 않은 소음이여서 정말 만족했습니다. 그리고 외부충격으로부터 보호하기 위해 꼼꼼히 뽁뽁이도 싸주셔서 너무 마음에 들었고 내부 구성 또한 키패드는 물론 청소 브러쉬, 키 커버, 키캡 리무버, 스위치 리무버 그리고 PC방 전용 경고 스티커까지 알차게 들어있었습니다. 그리고 케이블이 페브릭으로 되어있고 길이도 넉넉해서 정말 만족감을 크게 느껴주는 제품이었네요.

단점으로는 LED밝기가 약한 느낌이 없지 않아 있네요. 최대로 올려도 더 밝았으면 하는 아쉬움이 남아 있습니다.

전반적으로는 이가격에 나올 수 없는 물건이라 생각하고 가성비 값인 제품이라고 생각합니다. 저는 무조건 추천입니다.","['https://phinf.pstatic.net/image.nmv/shopnbuyer_2019_09_29_0/4a6ea5fd-e2c9-11e9-ba3a-48df37269ee2_01.jpg?type=f287', 'https://phinf.pstatic.net/image.nmv/shopnbuyer_2019_09_29_0/5bf7a16c-e2c9-11e9-af78-48df3726a06a_05.jpg?type=f287', 'https://phinf.pstatic.net/checkout/20190929_187/1569768961701R0fK5_JPEG/KakaoTalk_20190929_233805056.jpg?type=f287', 'https://phinf.pstatic.net/checkout/20190929_48/15697689617982CWVU_JPEG/KakaoTalk_20190929_233805056_03.jpg?type=f287', 'https://phinf.pstatic.net/checkout/20190929_192/1569768961867wWlpl_JPEG/KakaoTalk_20190929_233805056_05.jpg?type=f287', 'https://phinf.pstatic.net/checkout/20190929_89/1569768961857d0t7S_JPEG/KakaoTalk_20190929_233805056_08.jpg?type=f287', 'https://phinf.pstatic.net/checkout/20190929_83/15697689620045KMFn_JPEG/KakaoTalk_20190929_233805056_12.jpg?type=f287']"
5,"배송 엄청 빠르네요! 친구덕에 게이밍 키보드 알게되어 구매하게 되었습니다. 구매평이 가장 많은 제품 골랐는데 역시 이유가 있네요!
청축은 사용했었는데 눌리는게 너무 무거운 느낌이고 소리가 커서 적축으로 구매했습니다. 눌리는 느낌이 확실히 부드러운 느낌이 좋고 소리는 청축에비해 다이나믹하진않지만 리듬감이 있습니다. 외형적인 부분에서도 매트블랙으로 깔끔하고 세련된 느낌을 주고 깔끔합니다.
가격대비 성능 디자인 하나 빠지는게 없습니다. 다음 키보드는 좀 더 가격이있는 제품도 구매해보고싶네요^^키보드 잘 사용하겠습니다. 번창하세요! 플레가즈아~!","['https://phinf.pstatic.net/checkout/20200924_227/1600925301930327jA_JPEG/review-attachment-2b5b4a91-2dcb-4100-bc77-f3d543380081.jpeg?type=f287', 'https://phinf.pstatic.net/checkout/20200924_173/1600925302190BOKm8_JPEG/review-attachment-3bba6344-9b01-42a9-b012-97f1cf15d511.jpeg?type=f287', 'https://phinf.pstatic.net/checkout/20200924_226/1600925302949yz8wv_JPEG/review-attachment-8603707a-bd0b-46d7-8378-09f4d8b47b2d.jpeg?type=f287', 'https://phinf.pstatic.net/checkout/20200924_86/16009253032183F7Ni_JPEG/review-attachment-92400a46-90b5-427b-84a7-2a4bcfeea0f6.jpeg?type=f287', 'https://phinf.pstatic.net/checkout/20200924_253/1600925303122yyA0M_JPEG/review-attachment-bbf68334-1e2b-4c6a-8111-340bd8a4e96a.jpeg?type=f287']"
5,"기계식 키보드 첨사봤는데 타격감 굉장히 좋습니다ㅎㅎ 학생친구들은 밤에 몰컴하면 바로 걸릴 그런 느낌이구요 새벽에 잔잔바리하게 게임하...려다가 키보드 두둘기자마자 뭔가 타닥타닥 호롤롤로 쾅쾅쾅 웅장해지는 소리에요
불빛도 모드가 여러개고 심지어 게임별로 모드가 적용이 가능해서 신기하네요 커스텀도 있지만 일단 복잡해서 기본모드중에서 제일 잔잔한 거로 설정해 두었는데 색감 너무 곱고요~ 밝기 속도 조절도 간편하게 Fn키로다가 설정이 가능하네요
이번에 앱코 키보드 헤드셋 마우스 같이 맞추었는데 키보드와 마우스는 연결선에 찍찍이 가 원래 있어서 선정리하기 간편하고 참 좋아용
그전에는 택배오면 붙어있는거로 해서 뭔가 덕지덕지지저분해보였는데 역시 전문 브랜드는 사소한거부터 다르네요
새 장비 잘 적응해서 게임 승률도 좀 올랐으면 하네요 한달후 후기에서 뵙죠~
그리고 이번달 패드 이벤트에 신청합니다
컴퓨터 전용 패드 없어서 강아지 미끄럼 방지패드를 책상에다가 깔고 그러고 살고있네요.....","['https://phinf.pstatic.net/checkout/20201021_283/1603227869573RWeoq_JPEG/review-attachment-99c929a6-a780-4792-8447-61354dce2d2d.jpeg?type=f287', 'https://phinf.pstatic.net/checkout/20201021_169/1603227869520OH0kG_JPEG/review-attachment-6224527d-caa5-40a1-a156-53f9370140c0.jpeg?type=f287', 'https://phinf.pstatic.net/checkout/20201021_287/1603227868855W9IF9_JPEG/review-attachment-11b3431a-e293-467e-a4df-ce2322d356c5.jpeg?type=f287']"
5,"원래 소리나는 키보드를 절대 안 썼는데 주변에서 이거 사서 쓰는 사람꺼를 빌려서 써보게 됐습니다.
소리도 시끄러운 느낌이 아니라 말발굽 소리같아서 거부감이 덜했습니다.
타격감도 좋고 손가락 라인에 맞게끔 굴곡도 좋아 손에 착 감기는 느낌입니다. 오타율도 확연히 적어졌습니다.
그래서 바로 저도 구매했습니다.
배송도 빠르고 일의 능률도 높아졌고 아주 좋습니다.
백스페이스키 까보면 세 개의 플러스가 있는데 각 양쪽 플러스가 안 눌립니다ㅠ 그 전에 먼저 쓰던 사람꺼는 안 그런데.. 그래도 작동을 아예 안하거나 큰 문제가 되지는 않아서 그냥 쓰긴 쓰렵니다.
어쨌든 안 쓰는 기능이긴 하지만 불빛효과도 예쁘고 전체적으로 .","['https://phinf.pstatic.net/checkout/20201012_289/1602509504071KlVB8_JPEG/review-attachment-90e6c015-d531-487b-a7c2-7aca245c769a.jpeg?type=f287', 'https://phinf.pstatic.net/checkout/20201012_277/1602509509655iSWgf_JPEG/review-attachment-dd0fccb9-cfdd-494b-b7ee-762c509b61cc.jpeg?type=f287', 'https://phinf.pstatic.net/checkout/20201012_16/1602509514790mgMQO_JPEG/review-attachment-4ed432fa-b255-4b42-8dc9-f8e55be1e9e6.jpeg?type=f287']"
4,"제가 구입한 생애 첫번째 기계식 키보드가 k640 입니다. 일단 저는 타자를 치는 듯한 경쾌한 소리를 좋아해서 타건 소리가 가장 크다는 청축을 구입했습니다. 그리고 깨끗한 색깔의 화이트를 골랐구요. 구매의 가장 큰 포인트는 타건 소리였는데 일단 제가 기존에 사용하던 멤브레인식 키보드 보다는 짤깍 거리는 소리가 커서 좋았지만 제가 기계식 키보드를 처음 구매해서 사용했기 때문에 다른 기계식 청축 키보드를 사용해 본 적이 없어서 소리가 얼마만큼 큰 지는 잘 모르겠습니다. 개인적인 기준으로는 지금 치고 있는 소리보다 조금 더 컸으면 좋겠다는 생각을 합니다. 타건 소리가 조금 작다(?)는 것만 빼면 디자인도 괜찮고 특히나 사용하지 않는 동안에는 투명한 플라스틱 덮개로 덮어놓을수 있어서 먼지가 잘 들어가지 않게끔 배려해 주신게 생각보다 더 마음에 듭니다. 아직 비교 대상이 없어서 다른 청축 키보드를 사용해 봐야 겠지만 현 시점에서는 가격대비 성능에서는 무척 마음에 드는 제품입니다. 부디 잔 고장 없이 오래동안 사용할 수 있었으면 좋겠습니다.
감사합니다.","['https://phinf.pstatic.net/checkout/20201008_106/16020840138896dSBR_JPEG/review-attachment-9e057c49-28a3-4f82-9be7-68add20669c0.jpeg?type=f287', 'https://phinf.pstatic.net/checkout/20201008_279/1602084020522hTVmH_JPEG/review-attachment-7fec73e4-7950-4dca-a401-1e40df21d425.jpeg?type=f287']"
5,피시방에서 보던 그 보드 그대로라서 너무 좋아요ㅠ 키보드도 무거워서 쓸 때 안움직여서 너무 좋구요 제가 손목이 많이 안좋아서 적축으로 구매했는데 처음에 눌러봤을때는 이렇게 힘없이 들어간다고? 제대로 눌리는거 맞나..? 했는데 게임 사용 해보자 바로 손목 하나도 안아프고 부드럽고 정확하게 사용이 되길래 너무 행복해서 소리질렀습니다... 오래오래 잘 사용했으면 좋겠어요!!,"['https://phinf.pstatic.net/checkout/20201118_190/1605692185288gcNoA_JPEG/review-attachment-87b8bd34-0e70-4b05-bb75-793780e4b15c.jpeg?type=f287', 'https://phinf.pstatic.net/checkout/20201118_244/1605692184908kU3Gx_JPEG/review-attachment-9fa8b9cb-615c-4d2c-bae3-09c3b3c1ddfa.jpeg?type=f287', 'https://phinf.pstatic.net/checkout/20201118_268/16056921848683lfI2_JPEG/review-attachment-54517925-30e5-49da-ae57-22fe0ddb454e.jpeg?type=f287', 'https://phinf.pstatic.net/checkout/20201118_198/1605692185887yHEPE_JPEG/review-attachment-2daa2b14-5731-4d1f-aae7-e6e1d150a3e4.jpeg?type=f287']"
5,기존 해커 키보드 만족하고 사용중이어서 구매했습니다. 기존에 사용하던 녀석이 3년쯤 되니 키가 안먹거나 반응이 느린것 같아 구매했고요. 새제품이라서 그런가 확실히 키반응이 좋더군요. 기존 키보드 대비 키보드가 좀 높아서 불편할줄 알았으나 실 사용시 전혀 문제가 없더군요.,"['https://phinf.pstatic.net/checkout/20201028_44/1603843023825PsOgO_JPEG/review-attachment-cb0d0d06-200e-49d4-9a3d-ccbab4c138b7.jpeg?type=f287', 'https://phinf.pstatic.net/checkout/20201028_38/1603843024003uPS1x_JPEG/review-attachment-c629a749-184a-418f-baea-a83c13028612.jpeg?type=f287', 'https://phinf.pstatic.net/checkout/20201028_189/1603843024117NBfzy_JPEG/review-attachment-85d24378-f89e-4bee-9f6e-d3ca08456a51.jpeg?type=f287', 'https://phinf.pstatic.net/checkout/20201028_109/1603843024183k3dSL_JPEG/review-attachment-a7cfb692-f945-4f61-8ff9-1974e165bfb8.jpeg?type=f287', 'https://phinf.pstatic.net/checkout/20201028_49/1603843024225vzLox_JPEG/review-attachment-43974d6f-03d9-4bdf-857a-9ca31cf39318.jpeg?type=f287']"
5,금요일에 주문했는데 토요일에 도착한거보니 택배 엄청 빨리와서 만족합니다! 그리고 키보드 화이트 청축으로 사니깐 LED 불빛도 화려하고 딸깍딸깍소리도 너무 좋아요~ 그리고 마우스도 추가로 주문했는데 마우스 속도도 조절가능하고 바닥에 LED가 들어오니 만족합니다! 잘 사용할께요^^,"['https://phinf.pstatic.net/checkout/20201108_216/1604838798789wkyt7_JPEG/review-attachment-d406905f-e623-4789-8ba1-bbb1bd0cf05d.jpeg?type=f287', 'https://phinf.pstatic.net/checkout/20201108_134/1604838799544pyciM_JPEG/review-attachment-bc38c774-e773-4ce5-a12d-33b6d5acc196.jpeg?type=f287', 'https://phinf.pstatic.net/checkout/20201108_45/1604838798884nARv3_JPEG/review-attachment-10937193-d435-4a7d-9069-0392fea5ff70.jpeg?type=f287', 'https://phinf.pstatic.net/checkout/20201108_67/1604838800169M0ylE_JPEG/review-attachment-53893b1c-1d78-4085-ad73-41cae322131b.jpeg?type=f287', 'https://phinf.pstatic.net/checkout/20201108_282/1604838794968alXU7_JPEG/review-attachment-1fad6ffc-f5c2-47b1-aa5f-876c74b239a1.jpeg?type=f287']"
5,"키보드에 누르는 타격감도 좋고,
소리도 듣기 거슬리지 않을 정도로 좋네요.
무엇보다 키보드 자체에 무게감이 있어서 좋습니다.
다만 키보드 숫자패드 윗쪽에 살짝 찍힘이 있는 채로 도착했는데,
반품하기도 귀찮고 해서 네임팬으로 살짝 색을 칠해서 사용하려구요.ㅠㅠ

그것만 빼면 완전 만족입니다.

추후 제품 출하시 해당 부분 꼼꼼히 살펴서 보내주셨음 하는 바램입니다.","['https://phinf.pstatic.net/checkout/20200819_198/1597830106011A9U6j_JPEG/review-attachment-897cc293-dd6b-4b08-9d13-ad52a6aa96aa.jpeg?type=f287', 'https://phinf.pstatic.net/checkout/20200819_251/1597830105985KWqag_JPEG/review-attachment-4a44b382-0583-4ed7-b1b5-257710fd06fc.jpeg?type=f287', 'https://phinf.pstatic.net/checkout/20200819_220/1597830105942Kry3q_JPEG/review-attachment-928a69e1-b3cc-4465-9e22-42a73112b5b2.jpeg?type=f287', 'https://phinf.pstatic.net/checkout/20200819_275/1597830106200O3h0T_JPEG/review-attachment-dc8d6581-1ad3-46aa-a560-365afd69cc58.jpeg?type=f287']"
5,"뽁뽁이 할까말까 고민하다가 따로 안 해도 멀쩡히 왔다는 리뷰보고 그냥 구매했어요.
물건은 튼튼한 자체 상자에 담겨 손상된 곳 없이 왔습니다.
발송부터 배송까지 엄청 빠르게 왔고요.

사용해 보니 정말 소리가 좋네요.
다만 조용한 걸 원하시는 분들은 구매하지 않는 게 좋겠어요.
저는 키보드 탁탁 치는 소리를 좋아해서 굉장히 만족합니다.

키보드 덮개는 처음 써 보는 평평한 모양인데 의외로 무난합니다.
덮개 없이 사용하면 쉽게 오염되니 웬만하면 씌워 놓으려 생각 중입니다.

.

오래 쓸 수 있으면 좋겠어요.
많이 파세요.","['https://phinf.pstatic.net/checkout/20201122_65/1606010380205szYb5_JPEG/review-attachment-431dcecb-cd76-418b-a884-d312dbf1b8e9.jpeg?type=f287', 'https://phinf.pstatic.net/checkout/20201122_50/1606010383752V6GCF_JPEG/review-attachment-58739859-2359-41e9-bdcf-2cfba3827dd6.jpeg?type=f287']"
5,"기계식 키보드 입문용으로 강력 추천합니다!
배송은 우체국 택배로 와서 오전에 물건을 받을수있다는점 ! 불필요한 키 구성도 없으며 포장도 꽤나 신경써준느낌이 많이 듭니다. 키압도 적당하며 무엇보다 다양한 led모드로 인하여 질리지않고 사용할수 있습니다. 왜 전국의 pc방에서 k640을 채용하는지 알수있는 부분입니다. 이가격에 절대 이런키보드 못삽니다 강추!!","['https://phinf.pstatic.net/checkout/20201027_35/1603759633477wSFPU_JPEG/review-attachment-56d87c81-de53-475a-a910-6dd41ed7edf0.jpeg?type=f287', 'https://phinf.pstatic.net/checkout/20201027_144/1603759634052XGlri_JPEG/review-attachment-82975cb1-6bf7-4ec4-8675-f2905911c67f.jpeg?type=f287', 'https://phinf.pstatic.net/checkout/20201027_59/16037596336510Q1ox_JPEG/review-attachment-7e0845a0-a39e-44a9-8607-5485a5205bc6.jpeg?type=f287', 'https://phinf.pstatic.net/checkout/20201027_172/1603759635024YxPr4_JPEG/review-attachment-618724af-a109-4adc-9792-ad8aea31bbf9.jpeg?type=f287']"
5,"키보드 색상이 화려해서 키보드를 봤을때 너무 예쁘고, 타자를 쳐봤는데 타자감이 너무 좋아요^^
그 전 키보드가 타자감도 별로고 잘 망가져서 그랬는지 몰라도 이번에 시킨 것은 오래오래 쓸 것 같네요.
그리고 심플하고 키보드가 슬림해서 그런지 보기 너무 좋네요.타자를 칠 때 느낌이 좋아서 컴퓨터를 쓰다보면 기분이 좋아져요 ㅎㅎ그래서 배송되자마자 타자치다가 너무 오래쳐서 눈이 아픈적도 있어요ㅎㅎㅎ사진보다는 실물로 봤을 때가 더 예쁘답니다!!집에 있는 마우스도 무지개색상이라 깔맞춤한것 같아서 넘넘 예뻐용
진짜 다들 이 키보드 사세요~!!전 사고 나서 너무 만족해요
가격때문에 조금 고민을 했지만 사고 나니
확실히 제값을 하는 것 같아요 진짜 계속 말하긴 했지만
타자 칠 때 느낌 최고👍👍👍쉽게 망가질 것 같지도 않고
오래오래 쓸 것 같아서 싼 키보드 사서 쓸빠엔 한 번에 사서
쭉 쓰는게 더 좋다고 생각합니다:)","['https://shopping-phinf.pstatic.net/20191218_19/603fcb75-5c55-4e55-b6ec-f6e7ef8ad174.jpg?type=f287', 'https://shopping-phinf.pstatic.net/20191218_12/1c17e3f5-5b4f-4ed4-940a-b216f5f0309d.jpg?type=f287', 'https://shopping-phinf.pstatic.net/20191218_1/c88df97f-0880-4926-a105-70c7c2695dc3.jpg?type=f287', 'https://shopping-phinf.pstatic.net/20191218_3/94744141-3c9b-4f05-8273-66b7d9184e68.jpg?type=f287', 'https://shopping-phinf.pstatic.net/20191218_13/484f1ab3-2c82-4c62-829c-a8815c7fcc63.jpg?type=f287']"
5,"원래 사용하던 키보드도 그렇고 제가 앱코 제품만 사용하고든요!
잔고장없이 오래오래 사용중이였지만,
앱코 해커의 디자인에 눈이 많이가는 것 같아요.
아무리 성능이 좋아도 디자인이 안이쁘면 사용하고싶지않거든요.
흰색 키보드에 적축 사용하려고 했는데 흰색은 적축이 없더라구요,
이것저것 비교해보다가 가성비도 좋을거같아서 K640 블랙질렀는데
세상에나 기존에 있던 몇~년~된 제품보다 ,
LED도 여러가지로 바뀌는게 넘 증말 이뻐요,
LED 밝기나 속도를 제가 보기좋게 설정해놓을 수 있는게 짱 좋네요
밤에 컴퓨터를 안하고 출근때문에 받고 연결 후 바로
형광등을 키고 찍어서 티는 잘 안나지만,
누르면 누른키를 기본으로 LED가 퍼지는게 넘 이뻐서 설정했어요.
그 외에
타이핑감은 생각보다 부드럽고 잘쳐집니다,
제가 사무직이라 게임할때만큼은 편하게 게임하고싶은데 굳이에요.
필요한것만 외워서 사용할듯요.
제가 이것저것 제품 많이 써봤는데 디자인, 그리고
구매 후 AS보증도 앱코 제품이 가장 좋은것 같아요.

새벽러의 최고겜성을 느끼고 싶다면 고민하지말고 지르세요
밤에 겜성겜성 퐈이아","['https://phinf.pstatic.net/checkout/20191128_131/1574918041787V7gXF_JPEG/KakaoTalk_20191128_141257985.jpg?type=f287', 'https://phinf.pstatic.net/checkout/20191128_286/1574918038362HeNSS_JPEG/KakaoTalk_20191128_141257297.jpg?type=f287', 'https://phinf.pstatic.net/checkout/20191128_176/1574918045756kC3oc_JPEG/KakaoTalk_20191128_141258608.jpg?type=f287']"
5,이전에 앱코 해커 K640 갈축을 상요하고 있었는데 밤에 컴퓨터를 하고있으면 와이프가 계속 시끄럽다고 해서 적축으로 똑같은 제품을 구매해봤어요~ 소리는 갈축보다 적어서 만족하고 키보드감도 너무 좋네요~ 갈축보다 좀더 살짝 눌러도 타이핑이 되는거 같아요~ 소음은 아예 없는건 아니고 조금은 소리가 나요~ 기계식 키보드를 사용하게 되면 소리가 안날수는 없을듯해요~ 제가 지금 회사에서 사용하고 있는 제품도 적축이라 일하면서 사용해도 옆사람에게 방해되는 정도는 아니에요~ 완전 만족합니다.,"['https://phinf.pstatic.net/image.nmv/shopnbuyer_2019_08_28_0/9c41b534-c996-11e9-9f26-48df37269ee2_05.jpg?type=f287', 'https://phinf.pstatic.net/checkout/20190828_201/15669984073480hack_JPEG/DSC01567.JPG?type=f287', 'https://phinf.pstatic.net/checkout/20190828_55/1566998407393lq5X9_JPEG/DSC01563.JPG?type=f287', 'https://phinf.pstatic.net/checkout/20190828_212/1566998407425i6dQI_JPEG/DSC01570.JPG?type=f287', 'https://phinf.pstatic.net/checkout/20190828_137/15669984074203FKNW_JPEG/DSC01566.JPG?type=f287', 'https://phinf.pstatic.net/checkout/20190828_203/1566998407407ATUib_JPEG/DSC01565.JPG?type=f287']"
4,"청축쓰다가 키감은 괜찮은데 소리가 너무 커서 밤에 키보드 쓰기 부다된다거나 하시는 분들은 갈축 쓸만합니다.

키보드 크기는 조금 작아보이긴 하는데 키보드 키 자체가 작거나 키 사이 간격이 좁지는 않습니다. 위 아래가 필요없는 부분이 줄어든 것 같이 보이네요.","['https://phinf.pstatic.net/image.nmv/shopnbuyer_2020_06_23_0/184c3289-b4f7-11ea-837a-505dac8c3639_03.jpg?type=f287', 'https://phinf.pstatic.net/checkout/20200623_4/1592878361265jtyMC_JPEG/1.jpg?type=f287', 'https://phinf.pstatic.net/checkout/20200623_141/1592878361306cCtYW_JPEG/2.jpg?type=f287', 'https://phinf.pstatic.net/checkout/20200623_142/1592878361576r8Amm_JPEG/3.jpg?type=f287', 'https://phinf.pstatic.net/checkout/20200623_141/1592878386221LExJl_JPEG/4.jpg?type=f287']"
5,디제이맥스 리스펙트 V하려고 샀는데요 기존 멤브레인보다 좀더 치는맛이나 연타할때 무게감때문에 좋습니다. 약간 아케이드 리듬게임하듯이 하는 맛이 나서 좋아요. 키보드가 작다는느낌은 없지만 쓸데없는공간을 삭제해버린건 예쁘고 LED모드설정도 간편하고 커스텀도 가능하니 너무 좋아요.,"['https://phinf.pstatic.net/checkout/20200718_243/1595064526681JcImS_JPEG/review-attachment-e3039793-2547-477d-8303-2cb9ad9488b8.jpeg?type=f287', 'https://phinf.pstatic.net/checkout/20200718_231/1595064543891KB3pi_JPEG/review-attachment-f4cc32f0-f678-4c07-9155-ece3de34041f.jpeg?type=f287', 'https://phinf.pstatic.net/checkout/20200718_76/1595064550712p9KJj_JPEG/review-attachment-25b8e03b-3232-4c38-b7ce-4e3649e37d78.jpeg?type=f287', 'https://phinf.pstatic.net/checkout/20200718_1/15950645580045qqgL_JPEG/review-attachment-9b39bd49-1dbf-42f3-8ab4-1b0aad9c0083.jpeg?type=f287']"
5,"일단 배송 빠릅니다. 우체국 택배로 신뢰도 UP.
기존 사용중인 키보드는 일반 멤브레인(?) 게이밍키보드를 사용했었는데 안에 스페이스바 철심같은게 빠지는 경우도 잦고, 시프트키가 눌렀다가 안튀어나와서 새제품 구매고민끝에 기계식에 입문하게 되었습니다.

최근 구매한 PC 주요부품 중 가장 만족도가 큰 제품이 아닐까 싶습니다. K640외에 COX사 맥스틸사 경쟁사품과 고민하다가 결국 이 제품을 선택헀는데 받자마자 생각외로 묵직한 무게감과 작은 크기에 놀랐습니다.
배그할때 동료 청축소리에 방해받은적이 많아 적축으로 했는데 거~의 소리가 안날 정도 입니다. 기본적인 키압이 낮아서 그런건지 살짝만 눌러도 민감하게 반응하는데 전 이게 적응전이라 그렇고 쓰다보면 익숙해질 거라 생각됩니다. 민감한 만큼 손가락 피로도는 덜한것 같아서 너무 좋습니다.
레인보우LED는 덤이구요. 어떨까 싶었는데 전 체감을 못하겠습니다. 조용히 사무용으로 쓰시는분들이 아마 그런걸 느끼지 않을까 싶습니다.
주로 게임과 영상 시청을 하다보니 키보드의 모든 키를 눌러보진 않아서 초기불량같은건 찾지 못했습니다. 내구성이 문제일텐데 아무쪼록 별탈없었음 좋겠네요. 갓성비 인정합니다.","['https://phinf.pstatic.net/checkout/20200520_86/1589930289399JG6co_JPEG/KakaoTalk_20200520_080724134.jpg?type=f287', 'https://phinf.pstatic.net/checkout/20200520_228/1589930289397lyyO4_JPEG/KakaoTalk_20200520_080724002.jpg?type=f287']"
5,"예전에 pc방에서 청축 키보드를 써보고 타격감이 시원시원해서 먼저 구입했었는데 집이나 카페같은 공공장소에서 쓰기엔 생각보다 소리가 커서 이번에 적축을 구입했습니다.
소리가 조용한 대신 반대급부로 타격감이 너무 없으면 어쩌나 걱정했는데 생각보다 느낌도 좋네요. 키보드 자체도 묵직하고 무게감이 있어서 좋은 것 같습니다.","['https://phinf.pstatic.net/checkout/20200909_41/15995794122342tS9h_JPEG/review-attachment-23a6f1c4-33a7-4947-be2f-8af439b0555a.jpeg?type=f287', 'https://phinf.pstatic.net/checkout/20200909_107/1599579413334ojNqP_JPEG/review-attachment-1576864d-0cf8-4d6b-83e5-b012db2795f9.jpeg?type=f287', 'https://phinf.pstatic.net/checkout/20200909_76/1599579421496teB5X_JPEG/review-attachment-3020dbb6-c1c0-4584-b55c-c02a5bf87e59.jpeg?type=f287', 'https://phinf.pstatic.net/checkout/20200909_66/1599579423145Ezh2e_JPEG/review-attachment-ff97d909-1a18-4301-badb-9b1159faa4a8.jpeg?type=f287']"
4,"K660 리니어를 2년정도 쓰다가 청축이 고파서 인기많은 K640을 삿습니다.
먼저 키감은 기대했던것 보다는 아쉽습니다.청축 특유의 쵹쵹 거리는 소리와 탄력감은 있으나 보다 높은 탄력성을 원했던지라 가볍게 느껴집니다.
디자인은 마음에 듭니다. 축이 개방형인 것과 밀집도가 높아 더욱 심플한 느낌이 좋습니다.
처음 구매하시는 분들이 피시방 키보드처럼 쵹쵹 거리는걸 원하신다면 좋은 선택이라고 생각합니다. 가격도 부담없고 만족도도 높습니다.
다만 2년전엔 K660이 5만원이 넘었었는데 지금은 4만원 대로 싸진것을 보면 욕심부려서 K660 클릭을 사는게 개인적으론 더 끌립니다.","['https://phinf.pstatic.net/checkout/20200507_141/1588859792173W8Ma3_JPEG/20200507_224432.jpg?type=f287', 'https://phinf.pstatic.net/checkout/20200507_27/1588859819337ua1Bz_JPEG/20200507_224515.jpg?type=f287', 'https://phinf.pstatic.net/checkout/20200507_234/1588859833721QUel0_JPEG/20200507_224530.jpg?type=f287']"
5,"노트북 사용자로서 게임할때면 입력을 강하고 빠르게 칠 때가 많아 본체의 키보드 X자 구조가 점점 곧잘 빠져 다루기 조심스러운 문제가 있었는데 이번 구입으로 그런 걱정은 하지 않아도 되어 좋습니다. 만약 하나가 망가져도 키보드 전체를 바꾸는게 아니라 키 하나씩 바꿀 수 있다는게 정말 좋은 것 같아요.
포장상태도 양 옆에 스티로폼이 든든히 끼고 위에 덮을 플라스틱 키덮개가 있어 문제없이 상품을 받을 수 있었습니다. 마음 놓고 빠르게 동시에 입력해도 좋다는게 무척 좋네요.","['https://phinf.pstatic.net/checkout/20201106_258/1604612846378WmhUV_JPEG/review-attachment-f7c15928-d947-4f27-87d9-fe0ebfa37ae7.jpeg?type=f287', 'https://phinf.pstatic.net/checkout/20201106_136/160461285433256B02_JPEG/review-attachment-503f19a9-bbd2-4b1a-9245-0c1f865c38f3.jpeg?type=f287']"
