star_point,comment,photo
5,"앱코 키보드로 결정하고, 어떤 시리즈 살지 정말 많이 고민했는데 최종적으로 660이랑 고민하다 이 상품 구매했는데 후회없습니다!!! 일단 가성비가 최고네요...
키보드에 민감한 편이 아니라서 특별히 거슬리는 부분은 없었고, LED도 생각보다 많이 화려하네요!
무엇보다 키보드보호캡 줘서 좋아요!
크기도 적당하고, 아주 만족합니다.",['https://phinf.pstatic.net/checkout/20201126_231/16063755436361Rlsd_JPEG/review-attachment-e2fc01a9-4b9a-4c28-a190-8bf27c3892c1.jpeg?type=f287']
5,원래 키보드소리 시끄러운걸 싫어하는 1인이어서 콕스 게이트론 황축과 커세어 적축 키보드 사용하고 있었는데키보드 타건 영상들 보다가 청축이 급 끌려서 스스로 축교환도 가능한 저렴한 키보드 찾다가 구매했는데 결론적으론 가격대비 만족하는 제품입니다ㅋㅋ 약간 차분한 청축이었으면 더 좋았을거 같긴한데 오랜만에 청축사용하니 기분전환되고 좋아요.펑션 숫자키로 게임종류별 키보드 불들어오는거 설정도되네욧타건감은 나쁘지않습니다! 처음 사용할때도 오타 별로안나고 잘 적응했어요ㅎㅎ흰색에 레인보우도 검은색보다 잘어울려서 예뻐요!근데 청축은 역시 나혼자 있을때.. 시끄러워도 될때... 타자소리 신경안써도 될때 그럴때 쓰세요^0^찰칵쩔꺾？q？？ 소리가 아주 찰집니다,[]
1,"이렇게 가성비 떨어지는 키보드는 처음임 마감품질 안좋을 뿐더러
초기불량 제품 받아서 약 2주만에 교환 받았는데도 불구하고 키 하나가 칼로 여러번 찍찍 그은듯한 부분이 있음 매우 불쾌함
그냥 동네 복지관에 기증할랍니다
교환상품 불량 재발생시 재교환 불가라고 안내하는것도 마음에 안듦..
ㅉㅉ..","['https://phinf.pstatic.net/checkout/20201014_158/1602630264737qPUQh_JPEG/review-attachment-34ada2d2-5b7f-44a0-92f0-fa50089085c2.jpeg?type=f287', 'https://phinf.pstatic.net/checkout/20201014_62/1602630265394sqRgc_JPEG/review-attachment-ab8ca7d7-341c-47c7-9b30-3f623f36b277.jpeg?type=f287']"
5,소리는 감수하고 샀어요. 일반 타이핑용으로 구매한건데 부드럽지만 노트북을 쓰다 오랫만에 일반키보드 만진거라 높게 느껴집니다. 화이트는 적축이 안나와서 어쩔수없이 검정 적축 샀어요. 갈축이 더 조용하단분도 있고 적축이 더 조용하단 분도 있어 스무스한 적축으로 선택했어요. 네온이 이쁘고 네온선택옵션 많아 게임하시는분은 개.취에 따라 선택하기 좋으실듯 합니다.케이블이 패브릭?이라 좋애요. 처음엔 왜 키보드 가운데에 케이블선이 있을까 했는데 usb 방향이 어느쪽이냐에 따라 호불호가 있어 아예 가운데에 놓은듯 합니다. 케이블타이 가정용보급이 시급하네요. 별거 아닌데 이거 요물이네요^^화이트도 적축 만들어주심 참 좋을텐데요^^택배는 케이스 가장자리에 보호스티로폼이 있어 안전하게 왔습니다. 배송도 빠른편. 어제 낮에 주문해서 오늘 받음요.,"['https://shopping-phinf.pstatic.net/20200410_12/631bd17d-8aab-4ec6-8be1-a6011e4afa28.jpg?type=f287', 'https://shopping-phinf.pstatic.net/20200410_16/e619c94f-a4d7-4b14-89a7-f103d05367ba.jpg?type=f287', 'https://shopping-phinf.pstatic.net/20200410_22/bec7f489-47d6-45dd-9b62-46c77b38ca01.jpg?type=f287', 'https://shopping-phinf.pstatic.net/20200410_13/b77e4109-9bd2-4ced-aab8-768a0471d72f.jpg?type=f287']"
5,"배송도 빨랐고 잘 받았습니다~
역시 갈축이라 부드러우면서도 타탁소리가 맘에 들어요!!
다만 시프트키가 조오금 안눌리는 느낌..? 이 들기는 하는데
아직 많이 쓴건 아니기때문에 조금 더 써보면 확실히 알 수 있을것같습니다 ^^
그래도 전체적으로는 만족이고, 감사합니다 번창하세요~","['https://phinf.pstatic.net/image.nmv/shopnbuyer_2020_06_12_0/b4dd3cd4-ac45-11ea-bad7-a0369ff952f4_03.jpg?type=f287', 'https://phinf.pstatic.net/checkout/20200612_209/1591922590306QDj4m_JPEG/%C5%B0%BA%B8%B5%E52.jpg?type=f287', 'https://phinf.pstatic.net/checkout/20200612_14/15919225920985yUCa_JPEG/%C5%B0%BA%B8%B5%E51.jpg?type=f287']"
5,그제 주문하고 오늘 받았습니다. 배송이 무척 빠릅니다.청축과 갈축 두 개를 주문했는데 확실히 청축이 갈축에 비해 더 찰칵거리는 느낌이 듭니다.어떤 키였는지 기억은 나지 않지만 a였는지 s였는지는 칠 때 팅 팅 하는 스프링소리도 났습니다.경쾌하고 키 입력도 빠르게 반응하여 타이핑하는 맛이 있습니다.기계식 키보드다보니 키 배열이 달라 한영키를 따로 설정해주긴 했지만 그거는 당연한 거니까요.다만 제 컴퓨터만 그런지 모르겠는데 쉬프트와 스페이스바를 같이 누르면 한글프로그램이 오류를 먹고 꺼지더라구요.현재 문의를 남겨놓은 상태라 답변 확인해보려고 합니다.전반적으로 가성비 넘치는 제품인 것 같습니다.,[]
5,우선 배송이 빨랐고 제품이 좋습니다! 가성비 갑입니다. 이때까지 무선 키보드.마우스만을 써와서 약간 기대반 검정반이었는데 정말 좋은 제품으로 잘 고른 것 같습니다. 타격감이 좋고 소음도 청축 키보드보다 조용한 것 같습니다. 물론 기존에 쓰던 저소음 보다는 크지만 타격감이 있기에 어느정도 받아들일 수 있는 소음입니다. LED효과도 보는 맛이 쏠쏠합니다~추천합니다.,"['https://phinf.pstatic.net/checkout/20200829_217/15986747335142OtcT_JPEG/review-attachment-8e296871-cf60-4684-9fa8-2695db99c10c.jpeg?type=f287', 'https://phinf.pstatic.net/checkout/20200829_212/1598674746597YGkMM_JPEG/review-attachment-cb64a287-f98b-4797-82af-263025d38c62.jpeg?type=f287']"
5,기계식키보드 사고 싶어서 여기저기 알아봤는데 앱코 추천이 많더라구요. 갈축이 소리가 적당하고 키감도 괜찮을 것 같아서 골랐는데 딱 제가 찾던 느낌인 것 같아요. 신랑 게임용으로 산건데 내심 좋아하는 듯!! 저도 만족스러워요ㅎ 레인보우 색상도 마음에 들구요^^ 디자인이 깔끔하고 블랙컬러가 다른 기기들이랑 잘 어울려서 좋습니다,['https://phinf.pstatic.net/checkout/20200930_105/1601473826773rlTzl_JPEG/review-attachment-ca00ebe9-379a-46b6-b140-2ebc24f74fc6.jpeg?type=f287']
5,"앱코의 키보드를 이제서야 알게 되었다니..
어떻게 이가격에 이런 고급 퀄러티가 나오는지 신기합니다.
청축 타격감 너무 경쾌하고요
엘이디 멋스럽고 여러기능들이 참 좋네요
묵직한것이 더더욱 만족감도 주네요
감사합니다. 잘쓸게요","['https://phinf.pstatic.net/checkout/20200906_202/1599372238318QoeLw_JPEG/review-attachment-8f227a71-5315-4293-a6eb-07ff8f46449b.jpeg?type=f287', 'https://phinf.pstatic.net/checkout/20200906_86/1599372242542vjqPB_JPEG/review-attachment-67c47d9f-ccf1-405f-9fe1-926609d25638.jpeg?type=f287']"
5,"게임보다는 문서 작업으로 타이핑할 일이 자주 있는데 타이핑 감이 괜찮네요~ 전에 사용하던 키보드보다 오타가 덜 나서 좋고, 기계식 키보드는 시끄러울 거라고 알고 있었는데 그리 시끄럽지는 않은 것 같아요. 가성비 좋네요!!","['https://phinf.pstatic.net/image.nmv/shopnbuyer_2020_11_18_0/e3f94e43-2949-11eb-80d0-246e963a464c_03.jpg?type=f287', 'https://phinf.pstatic.net/checkout/20201118_169/1605668342061OPNBm_JPEG/review-attachment-a0fde85c-239d-4a15-8378-6f683d543859.jpeg?type=f287']"
5,"일반 키보드만 줄곳 써오다가 사무용으로 게이밍 키보드를 구입하기를 몇번 망설이다가 드디어 구입을 하게 되었습니다.
그야말로 신세계네요 ...
왜 이제야 바꾸었을까 생각을 몇번이나 했는지 모르겠네요 ㅎㅎ
택배는 제가 제일 좋아하는 우체국 택배라 만족에 만족 점수를 드리고 싶습니다.
이 금액에 이런 제품의 품질 이라면 저는 이 이상의 제품을 구매할 이유가 없습니다. 진심 200% 만족 합니다.
선정리를 위한 정리선도 고급스럽고 키보드 청소를 위한 솔도 있으며 키캡을 분리할수 있는 도구도 있네요. 누군가 제게 키보드 추천을 원한다면 무조건 추천할거에요.
최고에요!!!","['https://phinf.pstatic.net/checkout/20200715_81/1594776549912ggoRx_JPEG/review-attachment-f850a363-4dd4-4c40-843c-0a0a6fdfdb36.jpeg?type=f287', 'https://phinf.pstatic.net/checkout/20200715_131/1594776549797JHO2G_JPEG/review-attachment-c797e549-b53c-4575-a18c-fed25c745082.jpeg?type=f287']"
5,"생각보다 배송이 빨라서 정말 깜!짝! 놀랐어요 ㅇ0ㅇ
그동안 무선 키보드를 사용하느라 게임할 때 키감을 느끼지 못해서
너무 불편하고 아쉬웠는데, 이번에 알바를 통해 번 돈으로
새로운 게이밍 키보드를 겟-또! 할 수 있어서 너무 기쁩니다.
색감 또한 여러가지라 화려함은 덤으로 !

키감도 그렇고 스프링 느낌도 그렇고 저는 다 만족스러워요!
아침에 택배 오자마자 도키도키한 마음을 간신히 억누르며
바로 상자를 호다닥 뜯어서 컴퓨터에 연결하자마자
롤 한판 쌔렸습니다 ㅋ0ㅋ크크루삥빵뿡
앞으로 더욱 더 즐거운 겜창인생을 살 수 있을 것 같아요 !

리뷰 이벤트로 장패드도 100% 지급한다고 들었는데
세상에나 세상에나.. 뭐야뭐야~ 아낌없이 주는 나무잖어.
안그래도 장패드 너무나도 절실했는데
미리 감사합니다 (_ _* 잘 쓰겠습니다.","['https://phinf.pstatic.net/checkout/20200526_191/1590491294402UDIfg_JPEG/KakaoTalk_20200526_200116499_01.jpg?type=f287', 'https://phinf.pstatic.net/checkout/20200526_130/1590491298200S6Us4_JPEG/KakaoTalk_20200526_200116499.jpg?type=f287']"
5,박스에 상처 없이 깔끔하게 잘 받았어요 적축이라길래 키감이 너무 없으면 어떡하나 했는데 딱 적당할 정도의 타격음과 반발력으로 타이밍 시 청축보다 소리로 받는 스트레스와 부담감이 적어 집에서 밤 늦게까지 쓰기에 딱 좋을 정도네요.깔끔한 디자인과 기계식이라는 장점이 가격비 제일인듯 싶네요.,"['https://phinf.pstatic.net/checkout/20190808_171/15652578181146IqxU_JPEG/%C5%B0%BA%B8%B5%E54.jpg?type=f287', 'https://phinf.pstatic.net/checkout/20190808_181/1565257821349p5tTD_JPEG/%C5%B0%BA%B8%B5%E55.jpg?type=f287', 'https://phinf.pstatic.net/checkout/20190808_160/15652578254219gPTG_JPEG/%C5%B0%BA%B8%B5%E53.jpg?type=f287', 'https://phinf.pstatic.net/checkout/20190808_240/1565257836242F8ACP_JPEG/%C5%B0%BA%B8%B5%E51.jpg?type=f287', 'https://phinf.pstatic.net/checkout/20190808_163/1565257840045o3qw2_JPEG/%C5%B0%BA%B8%B5%E52.jpg?type=f287']"
5,가격이 저렴하여 정말 만일의 사태를 위한 서브 제품입니다. 오테뮤 축이라고 하여 축이 다른 축에 비하여 생각보다 무거울줄 알았는데 그렇지만도 않네요. 기존에 쓰던 축(무접점30g)보다는 확실히 손가락에 부담이 가는게 느껴지긴 합니다만(사실 30g축이랑 비교하는게 말이 안 되기는 합니다) 우려하던 것 보다는 괜찮네요. 사실 축의 압력을 생각하면 정말로 괜찮습니다. 요 근래 키보드가 상향평준화 되었다고는 하지만 이 정도 가격에 이 만한 품질의 제품은 그리 많지 않을 거로 생각합니다. 고민하고 있다면 질러도 후회는 없으리라고 생각합니다.,[]
5,"led굉장히 멋집니다. 확실히 갈축이라 딸깍딸깍하는 찰진 소리는 없지만 그래도 기계식 키보드의 느낌은 있네요. 근데 소음이 꽤 있습니다. (물론 청축보다는 덜 하겠지만요) 그래도 개인적으로 만족합니다.
마우스도 같이 샀는데 마우스도 멋지네요","['https://phinf.pstatic.net/image.nmv/shopnbuyer_2020_07_03_0/cc30f4cb-bc74-11ea-8754-a0369ff94ed0_03.jpg?type=f287', 'https://phinf.pstatic.net/checkout/20200703_171/1593702120816KroX0_JPEG/4bf5e37dffaae396d03939412f1514ae.jpeg?type=f287', 'https://phinf.pstatic.net/checkout/20200703_93/1593702126893E4zec_JPEG/3a876babcc6e30a803608e0a79c3dafd.jpeg?type=f287']"
5,"ABKO 해커 K640 키보드 2개째 사용중인데 아주 좋습니다.
한2년전에 구입한것 보다 요번에 구입한것이 통울림 소리가 조금 조용하고 고급스러워진듯 합니다.
저에게는 키는 역시 갈색축이 제일 좋은듯 합니다.
키 누르는 느낌도 나고 일단은 적당히 소리가 나서 좋습니다. 물론 키 감도 부드러워 손가락에 무리도 가지 않고 아주 좋습니다.
적당한 가격에 기계식 키보드 사용하실분에게는 아주 좋은 선택일듯 합니다.","['https://shopping-phinf.pstatic.net/20191201_29/613776a3-7790-472b-8c24-7651bbfdc5ee.jpg?type=f287', 'https://shopping-phinf.pstatic.net/20191201_9/92aff3f5-d7bc-405e-bcc4-bb200980332a.jpg?type=f287', 'https://shopping-phinf.pstatic.net/20191201_8/0593ce5e-70e9-4c0b-b6e1-c86d0b44e55c.jpg?type=f287', 'https://shopping-phinf.pstatic.net/20191201_26/d43377bc-0118-46d9-bbc1-72fcc392052f.jpg?type=f287']"
4,"3만원 정도의 가성비에 이 정도 퀄리티면 굉장히 괜찮습니다.
다만 저는 멤브레인 쓰다가 기계식 갈축 쓰니 소리는 많이 나네요. 게임할 때, 타이핑 할 때 느낌은 좋습니다.
다만 기계식을 처음 쓰다보니, 키보드가 약간 높다는 느낌이 있어요. 그래서 손목 받침대는 있어야겠네요. 그리고 스페이스바가 약간 뻑뻑하네요. 쓰다 보면 부드러워지겠죠. 키보드 무게가 어느 정도 있는 편이라 밀리지 않고 좋습니다. 그리고 불도 들어오고 이 정도면 만족입니다. 기타 구성품도 알차서 좋네요.",['https://phinf.pstatic.net/checkout/20200808_143/1596892397600VGFs4_JPEG/review-attachment-825d1bef-2a4d-4ef0-8502-ec5c3f24f630.jpeg?type=f287']
5,"선물 했는데 아아주 만족스러워해요
원래 제가 쓰던건 과한 게이밍 보드라서 그런지 타격감이 좀 덜한느낌을 받네요^^;마치 눌리다만듯한 느낌으로.. 제꺼 다시 해보니까 느낌은 같은데 소리만커서그런가 암튼 뭔가 그래요 ㅎㅎ그리고 보드가 살짝 안으로 파이는 느낌? 그니까 쉬프트 바가 ㄹㅎㅗ키보다 올라온느낌? 이에요 ㅎㅎㅎ암튼 가격대비 훌륭함다","['https://phinf.pstatic.net/checkout/20201103_259/1604374224330I7P55_JPEG/review-attachment-bb420f3c-4508-4b62-8832-605e9c3628e0.jpeg?type=f287', 'https://phinf.pstatic.net/checkout/20201103_272/1604374224500tbfAd_JPEG/review-attachment-86fc8a4c-7cc1-46fe-8571-ad71dc6fb457.jpeg?type=f287']"
5,"기계식 키보드는 처음 써보는데, 다나와에서 순위가 높은 제품 중 가성비 Line인 K640 모델을 선택하게 되었습니다. 청축을 선택했기 때문에 타이핑하는 재미가 있네요. 하지만 집사람은 타이핑 소리가 일반 키보드보다 커서 뭐라고 하는군요. 문 닫고 잘 사용하고 있습니다ㅋㅋㅋ 다음 키보드는 갈축이나 적축을 써봐야겠네요. 걱정했던 불량도 없고 입문용으로 추천합니다!","['https://phinf.pstatic.net/checkout/20200629_276/1593438328679khORP_JPEG/20200629_224331.jpg?type=f287', 'https://phinf.pstatic.net/checkout/20200629_4/1593438424117ywFuv_JPEG/20200629_224648.jpg?type=f287']"
5,"키감과 묵직한 느낌이 신뢰감을 줍니다. 케이블도 싸구려 PVC선이 아니고 쉴드처리되어 만족스럽습구요. 다만, 한글자판의 인쇄상태는 좀 불만입니다. 분명 새제품임에도 아래쪽이 약간 흐릿하군요. 아직 자판이 미숙한 초보분들은 당황하시겠어요. 그럼에도 튼튼한 포장상태와 친절한 구성물들이 어울어져 만족감은 충분합니다.","['https://phinf.pstatic.net/checkout/20200222_110/1582361862147lFFbG_JPEG/20200222_151239.jpg?type=f287', 'https://phinf.pstatic.net/checkout/20200222_7/1582361871658t6LT5_JPEG/20200222_151415.jpg?type=f287', 'https://phinf.pstatic.net/checkout/20200222_74/1582361884783C9DoA_JPEG/20200222_152117.jpg?type=f287', 'https://phinf.pstatic.net/checkout/20200222_46/1582361900084L7iMn_JPEG/20200222_160854.jpg?type=f287']"
5,모니터를 새로 장만한 김에 새로운 키보드를 물색하다 K640 기계식 청축 키보드를 구입했다. 큰 기대를 안했는데 막상 받고 보니 가성비 굿! 일단 하얀 키보드 배경에 화려한 조명이 간지나고 소리도 크지 않고 적당했으며 터치감도 부드러우면서 입력이 정확해 손의 피로도가 감소되는 느낌. 무엇보다 키 하나하나를 빼서 청소 또는 교체할 수 있다는 것도 장점. 이 가격에 이만한 기능의 키보드는 찾아보기 힘들 듯하다.,[]
5,"커세어 k70키보드 사용중이고 추가로 앱코 k640은 단순히 저렴해서 구매했습니다. 보통 앱코키보드는 피씨방에서 주로 사용해봐서 별 기대감은 없었는데 집에서 이번 제품 사용해보니 제 커세어 키보드보다 훨씬 싼제품이라고 느껴지지 않을정도로 좋았습니다. 키감은 약간 단단하게 잡아주는 견고한 느낌이 있어서 저가형제품답지 않게 고급스러웠고 디자인도 꽤나 멋있습니다. 청축답게 소음은 조금 있느나 소음걱정되시면 다른축 구매하시면 될 것 같습니다. 3만원도 안되는 가격에 다양한 rgb효과나 usb포트, 이어폰잭이 불필요하다면 최고의 선택인 것 같습니다.",[]
5,"와... 이거 요물요물!!! PC방에서 쓰는것보다 훨씬 괜춘한데요..
소리 좋고 타이핑 잘되고 색깔 커스터 마이징 해서 엄청 이쁘고 기존에 로지택 무선키보드써서 그런지 반응성도 좋고 쓰는 맛도 나고 게임하는데 잘 눌러지고 좋네요.
스페이스가 긴거만 빼면 저한테는 베스트입니다. 한영키 누르려고 하면 아직까진 적응이 안되서 스페이스를 눌러요. 짱 좋습니다! 감사해요",['https://phinf.pstatic.net/checkout/20200910_138/1599732062919WtVm3_JPEG/review-attachment-2107d565-b7e9-45ef-8e64-8780da90b770.jpeg?type=f287']
5,"기존에도 앱코 다른 제품을 사용하고 있었는데, 새로운 제품이 예쁘게 출시되었기에 새로 구매를 하게 되었습니다. 경쾌한 타격감에서 만족스럽고, 사진에서 보시듯 흰색에 색색으로 나오는 조명도 돋보여서 키보드를 자주 사용하게 됩니다. 가격까지 저렴한 편이니 기계식 키보드의 타격감을 느껴보지 못하신 분은 일단 이 제품으로 시작해보시는 것도 좋을거라 생각됩니다. 가격이 비싸다고 무조건 좋은 것은 아니니 이 제품으로 시작을 했는데 그대로 정착을 하실수도 있지 않을까 생각도 듭니다. 일단 사용해보세요. 가성비도 좋고, 딱히 단점을 잡기도 애매한 좋은 제품입니다.",[]
5,게이밍 키보드 처음 써보는데 생각보다 많이 묵직해서 더 안정감이 있고 안흔들려서 좋아요! 소리도 적당하고 많이 시끄러울까 걱정했는데 진짜 보통정도라 안심이에요! 그리고 누르는것도 좋은게 살짝만눌러도 되니까 게임하기 편해용! 맘에 든다든다 너무 저렴하게 이쁜거 사버려찌모양,"['https://phinf.pstatic.net/checkout/20200306_187/15834595960164JCDN_JPEG/20200306_102633.jpg?type=f287', 'https://phinf.pstatic.net/checkout/20200306_160/15834598824359jo5Q_JPEG/20200306_095747.jpg?type=f287', 'https://phinf.pstatic.net/checkout/20200306_238/1583459896709Gmj3Q_JPEG/20200306_095659.jpg?type=f287']"
5,앱코는 가성비가 진짜 좋은 것 같아요 키보드 색도 원래 흰색 청축을 쓰다가 앱코 이 제품을 보고 한 번 사봤는데 타자감도 좋고 누르는 느낌도 전에 쓰던 제품과 비슷해서 좋은것 같아요! 다만 무지개 색이 한정인게 아쉽습니다 ㅠㅠ 제가 전에 쓰던 제품은 흰색 청축이고 검정색이 앱코 제품입니다!!,"['https://phinf.pstatic.net/image.nmv/shopnbuyer_2020_09_21_0/9d9c7d72-fb9c-11ea-b618-246e963a4708_03.jpg?type=f287', 'https://phinf.pstatic.net/checkout/20200921_77/1600646111551qekkv_JPEG/review-attachment-97bc4767-248f-43a5-bea7-e42f23631218.jpeg?type=f287']"
5,리뷰 많은 순으로 삿는데 역시 헤드폰이나 키보드 둘다 가성비좋구 게이민 감성 지대로네요~~ 너무시끄러운건 싫어서 갈축으로 시켜봤는데 키감은 살아있고 소음도 괜찮아서 만족스럽네요 ㅎㅎ 다음에 고장나면 또 시킬거에요~~,['https://phinf.pstatic.net/checkout/20201116_121/1605516023560qEC4V_JPEG/review-attachment-05803d04-bbb2-4876-a710-90d93dfb1bf0.jpeg?type=f287']
5,"먼저 빠른 배송에 만족 그리고 제일 기대했던 기능은 무한대 동시 키 입력이었는데 사용해보니 키 동시 입력이 생각 이상으로 만족스럽고 가정에서 사용해야하는데 늦은 시간 사용시 소음에 대한 걱정이 없지않았는데 생각보다 (일반 키보드 대비) 소음이 그리 크지 않아서 심야시간에 사용해도 다른 식구들에게 크게 방해가 되지 않는데다 백라이트 색상이 무지개 색이어서 사용시 시각적 만족감이 상당히 높다 그리고 상품에 기본제공되는 키커버는 물론 관리시에 필요한 키캡리무버, 스위치 리무버, 청소 브러쉬까지 기본제공 되고 있어 전체적으로 만족스럽다",[]
1,"배송 받았습니다. 받은 당일날 리뷰를 적기에 내구도나 고장여부같은것은 리뷰가 불가능하고 배송과 첫인상만 리뷰합니다
배송 빠르게 잘 왔고 포장도 잘돼서 왔습니다.
인터넷에서 앱코 키보드에 대한 안좋은 리뷰가 많아서 불안했는데 첫인상은 만족합니다.
간단하게 LED 테스트하고 펑션키 테스트 해봤습니다.
Fn+F1키를 누르면 내컴퓨터가 켜져야하는데 이 키가 말을 듣지 않네요
또 Fn+F8을 누르면 정지가 돼야하는데 이전으로 이동하기가 되고 F9는 뮤트버튼인데 뮤트가 아니라 다음곡으로 이동하기가 되네요;;
펑션 키는 LED 조정하는것과 몇몇개 외에는 오작동 합니다.
설명서 보니까 드라이버를 다운받을 수 있다고 되있어서 홈페이지 방문해봤는데
홈페이지에 어디서 드라이버를 다운받아야하는지 잘 모르겠습니다.
드라이버는 없고 키보드 테스트프로그램만 있네요.
한달 사용후에 사용후기 또 올리겠습니다.",['https://phinf.pstatic.net/image.nmv/shopnbuyer_2020_07_21_0/30909f63-cb39-11ea-ad39-48df379ccacc_03.jpg?type=f287']
5,"처음으로 사게 되었던 키보드입니다. 나름 철저하게 찾아보고 조사한끝에 이 제품의 갈축으로 고르게되었는데 몹시 만족합니다 .
게임용 , 사무용 등등으로 폭넓게 사용하기에 적합한 타격감이였고, 무게또한 묵직하기에 밀려나지 않으며 디자인또한 깔끔하게 마감되어있어서 몹시 만족스럽습니다 .
구성품 또한 청소도구와 키보드를 교체할 수 있는 부품까지 받게되어 오래오래 사용할 수 있을거같네요 잘쓸게요!",['https://phinf.pstatic.net/checkout/20200908_66/1599553337571JGK2O_JPEG/review-attachment-5c0dd961-291c-4a18-ab49-302b56c4b0b8.jpeg?type=f287']
5,게이밍 노트북 사용중에 노트북키보드 매우 불편하여 키보드 구매를 하였습니다. 평소 키보드 칠때 사운드를 좀 중요시하는 편인데 사운드 너무 좋네요.그리고 led도 여러가지가있고 게임용led 직접 설정 가능해서 더욱더 좋네요. 가격대비 너무 좋습니다 키보드 무난한가격제품 찾으시는분들 K640 사십시요! 개인적으로 오랫동안 사용할수있을것 같은 키보드입니다. 좋은 제품 감사합니다.,"['https://phinf.pstatic.net/image.nmv/shopnbuyer_2019_07_27_0/142d494a-b038-11e9-a391-505dacfbaa5c_03.jpg?type=f287', 'https://phinf.pstatic.net/checkout/20190727_112/1564208912391X3awC_JPEG/1564208897452.jpg?type=f287', 'https://phinf.pstatic.net/checkout/20190727_160/1564208992808GzvVO_JPEG/1564208978326.jpg?type=f287', 'https://phinf.pstatic.net/checkout/20190727_75/15642090229727Tnla_JPEG/1564208994922.jpg?type=f287', 'https://phinf.pstatic.net/checkout/20190727_297/15642090379369GQ9h_JPEG/1564209026450.jpg?type=f287']"
5,일단 배송이 정말 빨라서 좋았습니다. 청축은 너무 시끄러울까봐 갈축으로 샀는데 키감도 너무 만족스럽습니다. 다만 살짝 통울림이 있는데 정말 민감하신분들 아니시면 크게 신경쓰이는 정도는 아닙니다!! 다음에 또 구매를 할 의향이 있습니다~~~,"['https://phinf.pstatic.net/checkout/20200917_255/1600272016452TT9gK_JPEG/review-attachment-cd7751eb-67c0-4356-a1ed-d1b599f355d7.jpeg?type=f287', 'https://phinf.pstatic.net/checkout/20200917_77/1600272016424eYyyl_JPEG/review-attachment-e922220a-2e6f-4b39-9cc4-4b1849bb4374.jpeg?type=f287']"
5,가성비 괜찮은 상품입니다. 피씨방에서 많이 써본제품이라 키감은 알고있었지만 집에서 쓰려고 보니 특히 펑션기능이 잘되어있는거같네요. 단점이라면 아무래도 금액대의 한계로 키캡 사출이 아쉽지만 이 가격에 고급키보드 사출까지 바라는건 욕심인것같아요. 만족합니다!!,['https://phinf.pstatic.net/checkout/20201114_36/1605356687721fdyW9_JPEG/review-attachment-061dc970-cafc-4273-bacf-b55196e7d470.jpeg?type=f287']
