star_point,comment,photo
4,무거운감이있는가했더니 쓰다보니 익숙해지네요 예뻐욥,['https://phinf.pstatic.net/checkout/20200907_8/1599460948897jon59_JPEG/review-attachment-7b1ece96-9868-41e5-86dd-42f9d7c62b47.jpeg?type=f287']
5,묵직하고 소음도 적고 타자 잘 쳐지네요 나중에 게임하면 할 맛 나겠습니당ㅋㅋㅋ 잘쓸게요!,['https://phinf.pstatic.net/checkout/20200820_33/1597922578513mMwt3_JPEG/review-attachment-1eac86ec-d38e-451f-b719-c75a919c2287.jpeg?type=f287']
5,"무게감 적당해서 게임할때 좋네요
키캡 흰색인데 led도 흰색이라서 잘 안보이기도 하는데 어떻게 보면 별로 안튀는 색이라서 나름 괜찮은듯",['https://phinf.pstatic.net/checkout/20200823_42/1598148667877SQqRE_JPEG/review-attachment-bcfd9bbe-c6e2-42fe-97be-4a46ae852f19.jpeg?type=f287']
5,기계식키보드 처음 구입했는데 잘눌리고 좋아요!,['https://phinf.pstatic.net/checkout/20200901_143/1598927127810dE6QU_JPEG/review-attachment-29a182c5-61bf-4899-b215-9c4b1c11c491.jpeg?type=f287']
5,이쁘고 저렴하고 아주좋아요 가성비 최고에요,['https://shopping-phinf.pstatic.net/20200813_20/a1b5dbfb-89d1-4662-9e3b-3503e6045f72.jpg?type=f287']
5,빠른배송. 이쁘고 소음이적어서 구매했습니다,['https://phinf.pstatic.net/checkout/20200901_243/1598941529031bl6SO_JPEG/review-attachment-c0cca503-6903-4a15-9c3c-255438c0aa5e.jpeg?type=f287']
5,배송도 빨랐고 키보드도 만족스러웠습니다.,['https://phinf.pstatic.net/checkout/20200909_54/1599633764638k54Xq_JPEG/review-attachment-d885176a-2f3a-4f21-895a-40928e892db5.jpeg?type=f287']
5,레알쌎기엽네요미쳐요저죽어요초카와이✨,['https://phinf.pstatic.net/checkout/20200902_148/1599042108935tFI8s_JPEG/review-attachment-4dbeb421-2e32-4f9a-8655-0d3cdcc73871.jpeg?type=f287']
5,"완전 이뻐뇽..
소리도 찹찹찹",['https://phinf.pstatic.net/checkout/20200921_230/1600653734025wKS88_JPEG/review-attachment-06fabc17-04c4-4385-80df-7f17c270619b.jpeg?type=f287']
5,광축 키보드 첨 써 보는데 정말 좋네요. 타격감 진짜 좋구요 압력도 적당한 것 같아요. 클릭으로 샀는데 소리도 좋고 게임할 맛나는 키보드네용ㅠㅠ LED 효과도 단일색이라 은근히 괜찮네요ㅋㅋ,['https://phinf.pstatic.net/checkout/20200824_217/1598273650584R2Wgp_JPEG/review-attachment-2594d6b4-820f-4b03-ad79-6f40874921b5.jpeg?type=f287']
5,배송 빠르고 제품도 괜찮네요,['https://phinf.pstatic.net/checkout/20200824_184/1598242345420WMRuV_JPEG/review-attachment-6078ec52-a947-40ec-a58b-4efcdaea668a.jpeg?type=f287']
5,클릭은 너무 방정 맞은 느낌이라 싫은데 딱 적당하네요 잘눌리고 예뻐요...원래 검은 제품만 쓰다가 지인이 산거보고 이뻐서 구매했는데 검은색 중에 딸기우유 같은애 하나 잇으니 화사하니 좋네요,['https://phinf.pstatic.net/checkout/20200822_271/1598086619087lvyLv_JPEG/review-attachment-f3865f8d-fcf8-499c-8373-a59729fefd67.jpeg?type=f287']
4,어반그레이 회사에서 쓰다가 맘에들어서 텐키있는 걸로 사려고했는데 비쌌던 핑크 가격 많이 떨어져서 그냥 핑크 텐키리스 샀네요. 확실히 없으면 불편하긴 하지만 없는게 훨씬 이쁘긴합니다.,['https://phinf.pstatic.net/image.nmv/shopnbuyer_2020_08_26_0/7c9cc4f3-e79a-11ea-9766-48df37ae3fca_03.jpg?type=f287']
5,아들이 좋아합니다~^^,['https://phinf.pstatic.net/checkout/20200904_107/1599199254632PDzFv_JPEG/review-attachment-f949aff9-1a54-4857-9214-b56c510b3de2.jpeg?type=f287']
5,"마우스랑 헤드셋, 그리고 키보드 까지 핑크로 맞추고 나니까 뭔가 기분이 되게 좋아오 ㅎ.ㅎ
찰진게 조아서 클릭으로 샀는데 대 만족입니다용",['https://phinf.pstatic.net/checkout/20200822_176/1598063301971uYs7L_JPEG/review-attachment-a9bf246a-898d-43c4-a1c9-b7f18a361505.jpeg?type=f287']
5,"가격대비 좋습니다.
키보드 led 빛이 좀 약한듯.. 낮에는 led 들어오는지도 모름..",['https://phinf.pstatic.net/checkout/20200824_252/1598272649256skQQR_JPEG/review-attachment-3ff9ed03-d60a-4a8c-a1b2-00286ccf75c9.jpeg?type=f287']
5,"이상없이 잘 쓰고있습니다
좋아요 ㅋㅋㅋ",['https://phinf.pstatic.net/checkout/20200907_143/1599451396376m4E0R_JPEG/review-attachment-1ca46ca0-aac3-4546-880d-450bbbf84080.jpeg?type=f287']
5,k511쓰다 갈아타는데 장난감 블록같고 아주 아주 맘에드네요. k511보다 더 예뻐요😤👍,['https://phinf.pstatic.net/checkout/20200904_299/1599229304339KlKVN_JPEG/review-attachment-014b91d3-47db-498a-a9b6-c773bc621ac6.jpeg?type=f287']
5,기존에 클릭을 쓰고 있었는데 리니어의 느낌을 처음 알게 되었습니다. 물렁한 젤리 느낌. 키도 서로 바꿀 수 있어서 이렇게 해 보았네요.,['https://phinf.pstatic.net/checkout/20200826_145/1598422242527Ue2u4_JPEG/review-attachment-80747818-eb56-47d4-acc5-c009d7324b56.jpeg?type=f287']
5,와 소리b 비주얼b 뭐 하나 빠지지 않네요 ㅜㅜㅜ 너무 좋아요bbb,['https://phinf.pstatic.net/checkout/20200908_52/159953149248112sM9_JPEG/review-attachment-202a9a31-1a28-4ff7-89a0-6f9c731a7f7b.jpeg?type=f287']
4,"입문용으로 가격 괜찮고 디자인도 무난해보여 구입했습니다.
우체국 배송이라 빨랐구요.",['https://phinf.pstatic.net/checkout/20200828_31/1598593443184293NL_JPEG/review-attachment-b3b559d5-2360-433b-8b0e-e4152680f090.jpeg?type=f287']
5,키감 색상 너무 좋아요 기존에 쓰던거랑 비교샷! 키캡은 올흰으로 다 바깠어요,['https://phinf.pstatic.net/checkout/20200818_62/1597711062588jm3Aa_JPEG/review-attachment-b2a6c1fe-79ed-46b5-a7df-1086148b8696.jpeg?type=f287']
