star_point,comment,photo
5,"갈축과 적축 두개를 구매했습니다.갈축은 불량이 걸려서 현재 교환요청 중이구요,적축은 타자를 조금 많이 치는 저에게 적합하다고 생각되어 적축을 했는데..터치감이 부드러운것 같아요 PC방 키보드보다..소음을 중요시 하는 소비자라면, 글쎄요, 아직 갈축을 교환 보내서 비교를 상세히 해보지는 못했지만,적축이 소음이 없는건 아니예요! 무거운 느낌보다는 살짝 가벼운 느낌의 타자기 치는 소리가 납니다.전 뭐 사무실에서 사용하는 거여서 그닥 상관은 없어요~키보드 LED 들어오는부분의 종류도 많은것 같은데, 유저의 사용법에 따라 선택할수 있는것 같습니다.아직 저는 기본으로 두고 사용중이라 ^^;스페이스바가 기존 키보드보다 넓어서 적응이 안된 상태라..자꾸 한영키 누를때 버벅 거리네요전체적으로 활용만 잘하면 만족도가 높을것 같은 느낌이예요 ^^아 그리고 옥션에서 쿠폰할인 받고, 현재 앱코에서 이벤트 중인 리뷰작성시 장패드 주는거..넘나 좋으네요 ^^ 다들 좋은 혜택 있을때 득템하세요~^^","['https://shopping-phinf.pstatic.net/20190627_4/d1b8771d-7b1d-4ace-80b1-93b6234b7685.jpg?type=f287', 'https://shopping-phinf.pstatic.net/20190627_19/0e1269a5-ff93-4cc8-a343-cf1c806ddc22.jpg?type=f287', 'https://shopping-phinf.pstatic.net/20190627_26/d7b660e4-41a8-4745-8b77-3b52893ce5bd.jpg?type=f287', 'https://shopping-phinf.pstatic.net/20190627_29/7acb9d8b-d777-491f-b191-c0606f776797.jpg?type=f287']"
5,"작년에 이곳에서 구매한 텐키리스 K511을 사용중인데 요즘 숫자키 입력할 일이 많아져서 고민 끝에 화이트 감성으로 K640 화이트를 선택했어요.
제 K511은 카일 리니어라서 그냥 누르는 소리만 나는지라 이번에는 다른 느낌으로 가고싶어서 청축으로 선택했어요. 오테뮤 스위치는 내구성 얘기가 좀 있어서 잠시 고민을 했었지만 초기불량 아니면 거의 문제 없고 게다가 축교체형이니 고장난 키만 바꾸거나 다른축으로 교체해도 되니 괜찮겠다 싶었어요.
리뷰쓰면서도 찰칵거리는 느낌이 경쾌하고 초기불량도 없는것 같아서 만족스럽습니다.
청축은 회사같은 공동으로 사용하는 공간에서는 무리일것 같고 집에서만 쓰고 경쾌한 타건감을 느끼고 싶은 분들께는 너무 비싼 체리말고 가성비로 좋은 대안일것 같아요.
앱코브랜드가 호불호가 좀 있는데 저는 K511도 아주 만족스럽게 사용했었고 K640도 마음에 듭니다. 한달 뒤에도 고장이 없길 바라며...
K660도 행사중이라서 끝까지 고민을 했는데 화이트에 홀렸네요 ^^ 너무 이쁩니다.",['https://phinf.pstatic.net/checkout/20200331_48/1585633614689WmvI5_JPEG/20200331_142135.jpg?type=f287']
4,"가성비 좋습니다!!
LED도 은은해서 눈이 크게 신경쓰이지 않고
여러가지 타입으로 변경가능합니다

-단점(그냥 아주 개인적인 단점)
기계식 적축은 처음 써보는데 밤에는 소리가 거슬리네요ㅋㅋ
104키도 처음 써보는데 타자치는게 익숙치 않아서 오타가 많이 나요...
스페이스바도 길어서 한영키 누르기도 힘들고","['https://phinf.pstatic.net/checkout/20200222_55/1582372183822vTpoR_JPEG/20200221_204317.jpg?type=f287', 'https://phinf.pstatic.net/checkout/20200222_218/1582372193172xNAMt_JPEG/20200221_204350.jpg?type=f287', 'https://phinf.pstatic.net/checkout/20200222_146/15823722022420St2A_JPEG/20200221_204503.jpg?type=f287', 'https://phinf.pstatic.net/checkout/20200222_70/1582372210251MlHai_JPEG/20200222_162519.jpg?type=f287']"
4,친구 생일 선물로 사줬는데 친구가 생각보다 좋아하네요! 근데 손이 좀 큰편이라 키가 작은 감이 있다고는 하더라구요~ 그 외에는 다 만족하는 것 같습니다! 함께 온 키스킨도 나름 괜찮은거 같아요~ 친구가 본체 옆면에 붙는다고 보관하기 편하겠다고 하더라구요ㅋㅋㅋ 아무튼 가격대비 만족스럽습니다~,"['https://phinf.pstatic.net/checkout/20200824_299/1598247843922pJt59_JPEG/review-attachment-276d4923-d73a-469e-94eb-32cdf85b2cbc.jpeg?type=f287', 'https://phinf.pstatic.net/checkout/20200824_86/1598247834521udg2T_JPEG/review-attachment-07efe8bb-e0fe-4702-8f4c-dbe02c077c53.jpeg?type=f287', 'https://phinf.pstatic.net/checkout/20200824_294/1598247839566EJyOy_JPEG/review-attachment-83d2e832-30d2-40e2-9cff-030703d1ba98.jpeg?type=f287']"
5,배송은 이틀 정도 걸렸습니다. 기계식 키보드에 처음 입문하는 거라 가성비 좋은 걸로 알아보는 중 앱코 해커를 알게 되었습니다. 가성비가 좋아서 PC방에서도 많이 쓰이는 제품이더군요. 외관 디자인은 굉장히 깔끔하고 비키스타일이라 청소하기도 편합니다. 적축이라서 소음이 적은 것도 좋구요. 입문용으로 아주 제격이라는 생각이 드네요. 매우 만족합니다.,"['https://phinf.pstatic.net/checkout/20200805_86/1596632897881v7z0a_JPEG/review-attachment-af6089b3-ddba-4237-aca7-3373303729ff.jpeg?type=f287', 'https://phinf.pstatic.net/checkout/20200805_41/1596632898281i5BDr_JPEG/review-attachment-55038f8b-fc6b-46c4-a85c-1a44bb026e71.jpeg?type=f287']"
4,소리 덜 나고 손에 무리가 덜 난다고 해서 사봤습니다. 어느정도 소음 있는 밖에서만 기계식 키보드 사용해봐서 몰랐는데.. 조용한 방에서 키보드를 쳐보니 통울림 소리가.. 은근 신경쓰이네요.. 통통... 인터넷에 쳐보니 원래 이런거라고.. 여러 해법을 찾다가.. 귀찮아서 배경음악 깔고 작업하기로 했습니다. 계속 써보고 나중에 더 좋운걸로 갈라타야겠어요.. 통통 울리는 소리빼고는 괜찮은 것 같아요..,"['https://phinf.pstatic.net/image.nmv/shopnbuyer_2020_08_25_0/4348f262-e6b3-11ea-9620-246e963a464c_03.jpg?type=f287', 'https://phinf.pstatic.net/checkout/20200825_121/1598346812219aW45P_JPEG/review-attachment-080f5eca-2765-4b8d-9bb1-88e40f5fa019.jpeg?type=f287']"
5,기존은 청축 키보드 를 사용했엇는데 타 드렌드의 조금 고가의 제품이였는데 타격감은 좋았지만 너무 시끄러워서 게임을 하다보면 마이크에 소리가 들어가서 다른사람이 어무 시끄럽다고 할정도여서 갈축으로 갈아탔는데 역시 가성비 대비 졸 좋은 제품 입니다 훌륭 합니다.,"['https://phinf.pstatic.net/checkout/20201118_97/1605662722221DFKSF_JPEG/review-attachment-57af0dc7-8053-41f2-a998-b72d07668b79.jpeg?type=f287', 'https://phinf.pstatic.net/checkout/20201118_216/1605662722364ATETE_JPEG/review-attachment-b94c9dc9-ecc0-4109-86bf-4c1f44fbd145.jpeg?type=f287']"
5,우선 배송이 정말 빠른게 마음에 들었습니다! 예상도 못했는데 다음날 바로 도착했네요 ㅎㅎ 포장 상태도 상자 끝이 살짝 구겨진거 빼고는 양호했습니다. 그리고 대망의 실물! 너무 이쁘게 생겼네요. 3만원대 치고 참 고급스럽게 생겼습니다. 저는 블랙 적축으로 샀는데 부드럽게 들어가는게 좋아요. 오래쓰기에는 청축보다 적축이 좋은 것 같아요. 적축 키감 어떤지 영상으로 첨부합니다. 다들 가격에 비해 엄청 만족하실거 같아요!,"['https://phinf.pstatic.net/image.nmv/shopnbuyer_2020_04_07_0/81aca60c-789f-11ea-b859-000000004708_03.jpg?type=f287', 'https://phinf.pstatic.net/checkout/20200407_69/1586243570993o1Hz6_JPEG/%C5%B0_1.jpg?type=f287', 'https://phinf.pstatic.net/checkout/20200407_101/1586243698047cM8Qw_JPEG/%C5%B0_2.jpg?type=f287', 'https://phinf.pstatic.net/checkout/20200407_158/1586243700856ysF7m_JPEG/%C5%B0_3.jpg?type=f287']"
5,아무런 생각없이 구매했다가 제품을 받고 솔직히 말해 걱정스러운 마음이 있었습니다.앱코 회사측에서도 인식하고 있는지 모르겠지만 앱코에서 만든 저가형중 특히 마우스나 키보드는 믿고 거르라는것이 우리들의 친구 꺼무위키(나무위키)나 각종 커뮤니티에서 돌아다니고 있었으니까요.그리고 실제로 저가형 앱코 컴퓨터 케이스중 실제로 받자마자 쇠구슬이 2개 떨어진이후로 '아 이래서 믿거앱이라는 단어가 있구나' 라고 생각했었습니다.그런데 개인적으로는 앱코에서 만든 제품의 디자인을 선호하고 앱코라는 회사를 빼고 봤을때 '이거 괜찮네' 하고 구매를한것이기에 선입견을 버리고 사용하기로 했습니다.(어짜피 환불도 못하니까....)나머지는 다 괜찮았습니다.제품의 디자인(앱코인줄 모르고 그냥 단순 디자인을 보고 구입한거니까 당연한것일지도)이며 다양한 기능 그리고 제품의 구성과 그에따른 가격(가성비라고 해야할까요? 예전에 4만원정도에 구입한 기계식키보드는 축을 교체도 목하고 자체적인 기능도 적으며 구성품도 키리무버 하나밖에 없었으니까요.)도 다 괜찮았습니다. 그리고 만족을했고요. 다만 이것만큼은 조금 집고 넘어가고 수정좀 해줬으면 한게 있습니다.이 제품에는 LED가 측면과 자판 아래에 존제하는데 측면의 LED는 괜찮았습니다. 하지만 자판 아래에있는 LED의 경우 햇빛이나 형광등아래에서 보면 조금 어둡다라는 느낌이 들었습니다. 물론 Fn키로 밝기를 조절가능하다고 하지만 최대로 올린기준으로 어둡다라는 느낌이 들었습니다.(기계식키보드는 이번이 두번째이고 오히려 이것이 평균이고 이전것이 너무 밝은것일지도 모르겠네요.)그것말고는 솔직히 뭐 불편하다거나 그런것은 없었고 만족스러웠습니다.,"['https://shopping-phinf.pstatic.net/20190627_27/81a0917a-0a39-47b3-8ff3-79019b4d2e73.jpg?type=f287', 'https://shopping-phinf.pstatic.net/20190627_7/b4bbe8e3-471d-4988-a2df-f0d5024c3e5f.jpg?type=f287', 'https://shopping-phinf.pstatic.net/20190627_4/4a73e65b-9b03-4d79-8c93-bf4ad919a2e2.jpg?type=f287', 'https://shopping-phinf.pstatic.net/20190627_16/0b5c6c21-490b-4498-b43f-804e914b4fe1.jpg?type=f287']"
5,"깔끔한 무광블랙에 거슬리지않는 키보드소리까지 너무 이쁩니다..!
고양이들 때문에 일부러 플라스틱덮개가 있고 소리가 거슬리지않게 적축인 제품을 찾고있었었어요.. 그런데 이런가격이라니 외계인고문이라도 한건가요...ㅠㅠ 배송은 주말껴서 조금더 걸렸지만 출발하고 다음날 바로 받았구요! 손이 갈때마다 촉감도 좋고 마음에 드는 제품이네요!","['https://phinf.pstatic.net/checkout/20201021_3/1603259897721B4aMQ_JPEG/review-attachment-51c48a1c-f0f3-4675-a7eb-a90ad17f3aec.jpeg?type=f287', 'https://phinf.pstatic.net/checkout/20201021_298/1603259969413hFP8m_JPEG/review-attachment-5bfc9a7d-e01e-4846-a5af-45613ad44c37.jpeg?type=f287']"
5,"기계식 키보드는 처음 써보는데 타건감이 진짜 좋고, 저는 청축으로 샀는데 소리가 제가 딱 원하던 소리에요ㅜㅜ 피방에서 키보드 치면 나는 딱 그소리!! led도 균일하게 잘 나오고 화이트가 진짜 너무예쁘네요.. 저는 프로그래밍할때 쓰려고 샀는데 어차피 집에서만 쓸거라서 소음은 상관없을것같아용! 잘쓰겠습니당 ㅎㅎ","['https://phinf.pstatic.net/checkout/20200909_171/1599633929314SJGSe_JPEG/review-attachment-8b69663f-a687-4c89-8f46-6da58980ff61.jpeg?type=f287', 'https://phinf.pstatic.net/checkout/20200909_71/1599633929777EVLvt_JPEG/review-attachment-35749733-7978-40fd-a11f-6cf4696cc8c4.jpeg?type=f287', 'https://phinf.pstatic.net/checkout/20200909_240/1599633929855xoNpd_JPEG/review-attachment-6dee92f0-0c38-4368-8be3-454a0cbfb382.jpeg?type=f287']"
4,"갈축이 느낌이 어떨까해서 싼맛으로 한번 사봤어요!
엄청 아담하고 키보드 커버도 있어서 정말 마음에 드네여! 갈축이 어떤 느낌인지 한번 알아서 괜찮은 느낌이에요
그런데 리뷰보다가도 한번씩 스프링 소리가 난다고 하길래 뭔지 겪어볼려구 산거긴 하지만 확실히 스프링 소리가 많이 거슬리긴하네요
그래도 싼맛에 갈축느낌이 어떤지 알려고 한다면 괜찮은거 같아요","['https://phinf.pstatic.net/image.nmv/shopnbuyer_2020_03_07_0/159388af-6028-11ea-9418-505dac8c385b_03.jpg?type=f287', 'https://phinf.pstatic.net/checkout/20200307_2/1583553581253P1Ytf_JPEG/KakaoTalk_20200307_125438920_01.jpg?type=f287', 'https://phinf.pstatic.net/checkout/20200307_257/1583553581277ee63r_JPEG/KakaoTalk_20200307_125438920_02.jpg?type=f287', 'https://phinf.pstatic.net/checkout/20200307_67/1583553581339wE5Ba_JPEG/KakaoTalk_20200307_125438920_03.jpg?type=f287']"
5,처음 구입해본 기계식에 간지나게 들어오는 불빛과 게임모드에 따라 자판이 알맞게 변하는지 모드등 참 가격대비 성능 가성비가 죽여줍니다 타이핑도 좋구요 처음에는 적응좀하느라 약간 익숙해질때까지 손가락 연습좀 했네요,"['https://phinf.pstatic.net/checkout/20201030_219/1604050913904o6CCP_JPEG/review-attachment-69c48cd6-aefa-429c-bec6-9929adf5fa34.jpeg?type=f287', 'https://phinf.pstatic.net/checkout/20201030_99/160405091648175tJN_JPEG/review-attachment-d344b07d-bc67-434e-a914-28722170ca2c.jpeg?type=f287']"
5,"기계식 키보드는 처음 써보는 거고, 게임보다는 사무용으로 쓰기 위해 구입했습니다.구름타법이 가능한 키보드 말고, 기계식 중에서는 소음이 적다고해서 적축으로 구입했습니다.키감도 얻고 싶어서 갈축이 청축과 적축의 중간느낌이라서 갈축을 사려고 했으나, 여러 동영상 리뷰를 보고 적축으로 결정했습니다.결론적으로 완전 마음에 듭니다. 키압은 그렇게 크지 않아서 타자를 입력시킬 때 편해서 좋고요.다만, 기존에 적축을 쓰셨던 분들은 어느정도로 기대했을 수 있겠지만, 처음 구매하는 저로선 그래도 소음이 크다고 느껴집니다.저는 가정용으로 쓰기 위해 구입했으나, 사무용으로는 그래도 쓰기 어려울 것으로 생각되네요.(영상 첨부-> 소리 참조)그래도 가격적인 측면에서 가성비가 갑오브 갑이고, 충분히 만족스러워서 적극추천 드려요 ㅎㅎ+ 배송도 하루만에 왔습니다!!그런데 한/영 키보드가 다소 오른쪽에 있다는 생각이 들어 적응하는데에는 시간이 필요할 것 같네요.",[]
5,"앱코 유명하죠. 일단 빠른 배송과 포장 상태 만족스러웠습니다. 사용하기 너무 편하고 키보드 쳤을 때 소리며 손가락에 느껴지는 느낌이며 너무 좋고 만족스럽습니다. led 불빛 완전 제 스타일입니다ㅋㅋ좋은 제품 저렴하게 구입, 만족스럽게 사용하고 있습니다.","['https://phinf.pstatic.net/checkout/20201127_5/1606445752745HLTTx_JPEG/review-attachment-08c2a325-db72-402b-931d-ccc8d846a2a3.jpeg?type=f287', 'https://phinf.pstatic.net/checkout/20201127_146/1606445758221NdUnb_JPEG/review-attachment-eb7bce97-76fa-4718-86ff-feb1f0e60079.jpeg?type=f287', 'https://phinf.pstatic.net/checkout/20201127_180/1606445764595Xv7QL_JPEG/review-attachment-516ee739-c215-4fec-83ee-170edc7b3c13.jpeg?type=f287']"
5,"키보드를..오만년만에 바꿨어요~~~진짜오래된 키보드 쓰다가..이제 바꿀때가 온 거같아키보드를 검색하던중..이 앱코키보드가 눈이부시게제 마음에 들어왔어용~~처음엔 청축.갈축.적축?이게 뭔가 해서 알아보고리뷰도 보고 공부좀했어용ㅋ그래서 결론적으로..선택한것이 갈축블랙이예용블랙키보드로 쭉써와서 블랙으로 선택했구요ㅡ일단 청축과 갈축 중 고민하다가ㅡ은은한 중저음의 적당한 소음, 타건감을 고려해서갈축으로 선택했는데..ㅡ주문한지 하루만에 오는 빠른배송! 에 놀랐어용같이구매한 웹캠도 잘묶어서 와주었구요ㅡ이렇게 레인보우LED 키보드를 좋은가격에쓸 수 있다는 점 좋네용 9가지빛이 난다니 신세계입니다,ㅡ타건감..또한 너무좋아서 마냥글쓰고 싶게 만들어줍니다ㅡ단축키도 넘 좋네요 오래쓰던 키보드쓰면서..왜 진작바꾸지않았나싶을정도로 구시대ㅡ현시대를 점프해서 뛴거같아 보기만해도 좋네용ㅡㅡ게임은 안하는데 기계식넘좋네요~~~♡ㅡ청축도경험해보고싶어용",[]
5,"항상 싸구려 5천원짜리 키보드만 사용하다가 처음으로 기계식키보드라는걸 구매해보았어요
일단 적축이라 무척조용합니다 키압도 좋아요
전 시끄러운건 싫은데 안성맞춤입니다
디자인도 심플하고 다만 키스킨이 없어서 먼지 쌓이는건 감수해야할듯
처음살때 주는 투명캡으로 키보드 사용후에 덮는건가봐요
아무튼 대만족이네요","['https://phinf.pstatic.net/checkout/20200807_150/1596759865012oiipW_JPEG/review-attachment-2775a779-8f60-4ce8-bf5a-0aca3a39f8e5.jpeg?type=f287', 'https://phinf.pstatic.net/checkout/20200807_238/1596759844739EsGlP_JPEG/review-attachment-34783774-97a1-4004-8110-7e8f40dd060d.jpeg?type=f287']"
5,재택근무용으로 갈축 구입했습니다. 연결하자마자 키보드에 램프가 쫘르륵 들어오는데 정말 멋있어요.갈축도 소음은 시끄러운 편이라 재택 근무에 적합한것 같아요. 적축이어도 조용한 사무실은 기계식 키보드 소리가 좀 시끄러울수 있어서... 60cm 테이블에도 크기가 딱 맞아요. 최고,"['https://phinf.pstatic.net/checkout/20201020_143/1603162090854C8nzt_JPEG/review-attachment-2f0fae66-ace0-41c1-9fe5-80b4c78593cb.jpeg?type=f287', 'https://phinf.pstatic.net/checkout/20201020_272/1603163526036kHV4q_JPEG/review-attachment-4696d6fc-fc6d-4e66-b9e1-4d6d590f9469.jpeg?type=f287']"
5,"빠른 배송이 좋았습니다.(주문날 다음날에 바로옴)
포장도 깔끔하게 왔고 키보드가 하자없이 잘 작동해서 만족했습니다. 적축으로 샀는데 타건소리도 만족스러워서 잘 쓸것같습니다. 기계식 처음 쓰는거라 추천받아서 사봤는데 입문으로 잘 산 것같아 좋네요.","['https://phinf.pstatic.net/checkout/20200723_133/1595497469960XLKYg_JPEG/review-attachment-e17cd6d4-d449-424f-9367-87ac352743c3.jpeg?type=f287', 'https://phinf.pstatic.net/checkout/20200723_226/1595497470451jRofL_JPEG/review-attachment-32bdf73b-0e52-4505-87f4-ed93341b3b7b.jpeg?type=f287', 'https://phinf.pstatic.net/checkout/20200723_168/1595497470828oNU6d_JPEG/review-attachment-f5d182e1-4eb7-4e46-82e3-1f167f3cf16b.jpeg?type=f287']"
5,"소리 적은게 좋을 거 같아 적식으로 사려고 했는데 화이트가 전체적으로 더 예쁠거같아 이걸루 샀어요.
넘 이쁘네요. 소리에 좀 예민한데 소리도 그렇게 크진 않고요 작다는 건 아니지만 ㅋㅋ
맥북에 연결해서 쓰려고 했는데 인식도 굉장히 잘되고 매우 좋습니다 번창하세용","['https://phinf.pstatic.net/checkout/20200221_218/1582282831324frPwz_JPEG/D85669E9-673C-4B8B-8DD0-A4CF3C4C605A.jpeg?type=f287', 'https://phinf.pstatic.net/checkout/20200221_22/1582282831487vnYEF_JPEG/40C42ADC-4D6F-4C0A-A302-321520649606.jpeg?type=f287', 'https://phinf.pstatic.net/checkout/20200221_153/15822828314384XE1t_JPEG/55B8BF5A-03EC-4E97-815E-262A4E9CEA7C.jpeg?type=f287', 'https://phinf.pstatic.net/checkout/20200221_159/15822828314871QvqT_JPEG/9F7D5392-7D7A-4C02-AD37-0A818731C462.jpeg?type=f287']"
5,키감이 확실히 좋습니다. 가성비 좋은 축 키보드 디자인도 맘에 들고 다른 값싼 일반 키보드보다 무게감이 있어서 타이핑할 때 흔들리지 않습니다. 라인도 전선이아니라 실로 압축되어 있어서 쨍쨍합니다. 불빛도 이쁘네요 ㅎ 재구매 의사 있습니다.,"['https://phinf.pstatic.net/checkout/20200506_17/1588767615925o2MBj_JPEG/20200506_202316.jpg?type=f287', 'https://phinf.pstatic.net/checkout/20200506_90/1588767616194lzcLJ_JPEG/20200506_202625.jpg?type=f287', 'https://phinf.pstatic.net/checkout/20200506_164/1588767615827V0AOz_JPEG/20200506_210144.jpg?type=f287', 'https://phinf.pstatic.net/checkout/20200506_163/1588767616281rrKtF_JPEG/20200506_202525.jpg?type=f287']"
5,"빠르게 배송왓네요 키보드에 음료수 쏟는바람에 급하게 주문한건데 다행이에요..누르는느낌은 부드럽고 약간 쿠션감느껴져요 이게 거북한분들도 계시겟지만 저는 괜찮아요 무엇보다 시끄럽지않아서 좋네요
가성비가 워낙 좋아서 선택햇습니다 기왕이면 오래쓰고싶어요","['https://phinf.pstatic.net/checkout/20200826_124/1598403671983ijv4E_JPEG/review-attachment-01dcc973-c4b7-4887-aed3-efcff0e43957.jpeg?type=f287', 'https://phinf.pstatic.net/checkout/20200826_280/15984036721783fqgn_JPEG/review-attachment-8274ff08-d6e4-4c04-8487-b36677a49a0b.jpeg?type=f287']"
5,"신입사원 입사 선물로 2개 구매하게 되었습니다.
개발 직군에 있는 친구들이라 사용감을 물어보니,
만족도가 높고 타건감이 좋아 오타율과 개발속도가 많이 향상된다 합니다.
선도 튼튼하고 현재까지 고장이슈가 없어 좋습니다.
감사합니다.","['https://phinf.pstatic.net/checkout/20201126_116/1606365939334Wgj04_JPEG/review-attachment-7409f540-cc00-4539-89d3-8b63c46497e2.jpeg?type=f287', 'https://phinf.pstatic.net/checkout/20201126_178/1606365951285EKLnS_JPEG/review-attachment-1dc912b1-495c-42f1-8980-f95c910268e8.jpeg?type=f287']"
4,"위사진은 몇년전? 구매했던 k640 청축이고

아래는 이번에 구매한 k640 갈축입니다.

달라진점을 보니 이중사출에 의한 글자모양이 달라졌더라구요.

최근 hacker가 타사등과 동일한 폰트를 사용하는 것 같습니다.

사출하는 곳이 동일할지도 모르겠네요 ^^

조금 타건해보니 역시나 갈축은 통울림? 스프링소리가 많이나네요.


청축에서는 그런 느낌이 거의 없어서 동일한 느낌이 될까 생각해서 구매했는데


타사 유사 가격대 상품보다는 조금더 좋은 것 같은 느낌( 느낌만일수도 있습니다. ) 이네요.


보니 통울림이 먹혀(?)서 잘 안들리는 것일지도 ..


아무튼 갈축으로 타건시에는 통울림/스프링 소리가 신경 쓰이기는 하네요.

최근에 청축이외에 다른것들에 꽂혀서 저렴이들 여러가지 구매해보고 있네요..

기존 청축구매후 잘쓰다가 갑자기 소음과 손가락 힘이에 부담이 생겨서

최근 광축(리니어-적축느낌 - 텐키리스), 갈축(타사저렴이), 이번에

앱코 k450 갈축 까지 사보게 되네요...


산것들 모두 합치면.. 13만원정도는 되겠네요..

키보드에 이렇게 많이 투자할거라고는 생각안했는데... ^^


아무튼 참고하세요...",['https://phinf.pstatic.net/checkout/20200117_127/1579252597280z1GEr_JPEG/20200117_1636171.jpg?type=f287']
5,타사 기계식 키보드를 사용하다가 고장나 이번에 k640 제품으로 넘어왔습니다. 전에 키보드도 갈축을 사용했었는데 같은 갈축키보드지만 좀더 k640이 부드럽게 눌리는 느낌을 받고 있고 소음도 덜 한 것 같아요. 이벤트가격이라 가격도 저렴하고 축 교체를 할 수 있다는 게 가장 큰 장점인거 같아요. 지난번 키보드는 축과 보드가 일체형이라 5~7개의 축이 고장나서 고칠려면 수리를 맡기거나 버려야 해서 아까웠는데 축 교환 된다는 부분이 큰 메리트 인것 같습니다. 지금 3일 정도 쓰고 있는데 굉장히 만족합니다.,['https://phinf.pstatic.net/checkout/20200913_88/1599978778598P93h7_JPEG/review-attachment-3e2bcc5d-27c4-4e4a-b040-20ab27ecf48d.jpeg?type=f287']
4,"게임용으로 남편이 쓰고 전 노트북 연결해서 사용하고있어요 묵직한게 색도 이쁘게 나오고 좋아요 타자가 익숙한게 아니라 오타가 좀 나긴하는데 게이밍용이니 적응하려합니다
뚜껑이있어서 좋은데 제껀 살짝 깨져서 보수했어요~","['https://phinf.pstatic.net/checkout/20200923_93/1600820097504TzzRy_JPEG/review-attachment-0641ed3d-4673-4b2e-bb4c-3526f57f85e8.jpeg?type=f287', 'https://phinf.pstatic.net/checkout/20200923_224/16008201041837H4Ex_JPEG/review-attachment-275d8236-cb9a-47c5-9f77-05d93ed76875.jpeg?type=f287']"
4,"1. 디자인
장패드에 마우스와같이 쓰기 부담없는
부담없는 사이즈에 손이 큰 나조차도
아무 부담없이 사용할수있는 키크기.
각종 변경할수있는 색상들도 매우 예쁨.
2. 성능
체리키보드 청축, 리니지 청축,
기타 10만원언저리 청축등을 사용해온
나로서 싼값에 게임용이 아닌 업무용으로
청축을 구매했으나, 당연히 키압이나 소리등은
10만원대이상의 청축에 비해
좀 저렴한 키압과 소리가 남.
허나 업무용으로 쓰기에는 전혀지장없고
조금 익숙해지면 아무문제 및 불편함 없이 사용가능.
.

3. 총평
이가격으로 10만원이상 키보드성능을
바라는건 당연히 무리.
그러나 충분히 가격이상의성능은 보여주고있음.
굿.",['https://phinf.pstatic.net/image.nmv/shopnbuyer_2020_07_08_0/28a46710-c0c3-11ea-8f92-48df379cc9e4_03.jpg?type=f287']
