star_point,comment,photo
5,"근 8년 가까이 쓰던 체리 청축 키보드가 수명을 다했는지 입력 오류가 슬슬 내기 시작하길래 새 키보드를 살 때가 됐다 싶어서 구매했습니다. 원래는 PC방에서 자주 보던 K660을 구매하려고 했다가 이게 훨씬 세련되보여서 샀는데, 사진보다 훨씬 예쁩니다. LED효과도 꽤 많고요.
외관은 진짜 100점 만점입니다.

타건감은 저는 체리 청축이 타건감이 경쾌한 축에 든다고 생각했었는데 제가 쓰던 키보드가 오래되서 그런진 몰라도 카일 광축이 훨씬 경쾌하네요. 클릭감도 더 확실한 것 같고요. 비교해보니 오히려 체리축이 더 쫀득한 키감인 것 같습니다.
개인적으로는 카일 광축이 클릭감이 더 확실해서 좋네요.

그 반동으로 통울림이 약간...있나 싶긴 한데 혼자 쓸 때는 신경쓰일 정도는 아닙니다. 저가형 오테뮤축 키보드에서 극악의(?) 통울림을 맛본적이 있어서 그런지 듣기 싫은 통울림은 아니네요. 다만 다들 아시다시피 클릭축은 사무실이나 조용한 곳에서 쓰셔야 한다면 피하시는게 좋겠습니다 ㅎㅎ

전체적으로 키보드 자체가 예쁘고 특출나게 단점도 없는 키보드고, PC방에서도 많이 사용되는 키보드 베이스라 입문용으로도 무난하고, 저처럼 다른 기계식 키보드 쓰시다가 저렴하게 바꾸시거나 서브 키보드 찾으시는 분들한테도 좋은 키보드인 것 같습니다.","['https://phinf.pstatic.net/checkout/20200718_20/1595065464427oSbCN_JPEG/review-attachment-23395835-02c6-4009-ab43-096932e79696.jpeg?type=f287', 'https://phinf.pstatic.net/checkout/20200718_14/1595065464797v2qFF_JPEG/review-attachment-382906e5-01e2-4b2d-8fc8-790f53e9bcd0.jpeg?type=f287', 'https://phinf.pstatic.net/checkout/20200718_189/1595065464682gzm1k_JPEG/review-attachment-af65e8fa-de63-4573-a922-575b45b6eb3f.jpeg?type=f287', 'https://phinf.pstatic.net/checkout/20200718_216/1595065464855VehX5_JPEG/review-attachment-495ebb4d-6bc4-4230-88be-24cd00bdeeb5.jpeg?type=f287']"
5,"앱코가 박스 훼손 이슈가 있다 보니 걱정이 조금 되었는데, 미개봉 스티커는 전혀 훼손되어있지 않고 제조일자가 오래 되지 않아서 좀 더 안심이 되었습니다 :)

리니어 제품이라 적축느낌의 작은 타건음을 가졌고, 키압이 낮으면서도 반발력이 좋아서 쫀쫀한 타격감이 느껴지네요ㅎㅎ

그리고 같이 딸려온 키버튼을 장착하니 더 이쁘네요 LED도 너무 밝지도 약하지도 않게 적당하고 전체적으로 너무 마음에 듭니다 마감도 좋은데 이정도 품질에 이 가격이면 가성비 끝판왕이라고 보면 될거같습니다","['https://phinf.pstatic.net/checkout/20200711_296/159443909274155TWU_JPEG/review-attachment-cc720f2d-1b04-47f4-a3a5-1e1cfe889dc8.jpeg?type=f287', 'https://phinf.pstatic.net/checkout/20200711_41/15944390926752smIr_JPEG/review-attachment-15519444-261c-44f5-95a3-a42259aa4e6f.jpeg?type=f287', 'https://phinf.pstatic.net/checkout/20200711_266/1594439094169FsRYW_JPEG/review-attachment-8957351d-1f93-4ab3-95f6-0ab7c4eb587e.jpeg?type=f287', 'https://phinf.pstatic.net/checkout/20200711_172/1594439094564Nai7q_JPEG/review-attachment-28975f1f-5cb8-4329-a2bf-e524d108644a.jpeg?type=f287']"
5,"배송은 하루걸렸네요 역시나 하루걸릴줄알았는데 빨라서 너무좋아요
원래는 멤브레인사용하다가 -> 기계식청축을 사용했었고요, 광축 클릭(청축)을 써봤는데 너무좋더라구요 근데 집에서 사용하기에는 가족다있는데 너무 시끄러운거같아서 리니어(적축)으로 구매했어요. 확실히 다르네요 그리고 저는 적축이 저한테 더 맞는거같아요 훨씬가볍고, 타건느낌도 더 좋네요. 리니어 강추입니다. 그리고 중복눌림도 없어서 너무좋아요. 광축만 쓰게될거같아요.. 휴.
10번 20번 강추입니다. ㅎㅎ디자인은 말할것도 없이 예쁘구요 ㅎㅎ
10번사세요 20번사세요!","['https://phinf.pstatic.net/checkout/20200819_96/1597833969558SrGfg_JPEG/review-attachment-0d9a8b2a-c4c5-4e25-a5b9-5d18f5c9419b.jpeg?type=f287', 'https://phinf.pstatic.net/checkout/20200819_275/1597833969485scc5B_JPEG/review-attachment-8a380e5c-ab2a-45ec-a489-b6aefa6e0484.jpeg?type=f287', 'https://phinf.pstatic.net/checkout/20200819_215/1597833969443EbojP_JPEG/review-attachment-2af56b1d-1e37-4021-adaf-71285b96700a.jpeg?type=f287', 'https://phinf.pstatic.net/checkout/20200819_42/1597833969377xuzt7_JPEG/review-attachment-c4728c55-4bfa-47ed-85d6-fbfd78e8ba8a.jpeg?type=f287', 'https://phinf.pstatic.net/checkout/20200819_88/1597833969357y0Rsx_JPEG/review-attachment-1d304eda-8f5b-4ad7-84d5-118271ee9174.jpeg?type=f287']"
5,"마우스랑 같이 구매했습니다. 마우스 상태 좋은데 약간 꺼끌한? 그런 재질이라 오래 사용하시다보면 그 부분만 맨들거려지는 그런 마우스? 오래 써야 그렇게 되니 큰 걱정은 안하셔도 될듯합니다. 키보드는 .. 받고 눌러보자마자 반품신청 했었습니다ㅎ 스프링 튕기는 통울림 소리? 그게 너무 심해서요.. 근데 계속 눌러보다 보니 소리가 줄어들다 못해 이젠 거의 안나네요. 새제품이라 소리가 났었나봐요! 키감은 쫀쫀하다기 보단 찰칵거리는 느낌이고 기존에 쓰던 기계식 청축 키보드 보다 소음이 좀 큽니다ㅎ.. 청축 특유의 소리가 아닌 키캡의 소리가 크다 해야하나? 그래도 키감 나쁘지 않습니다. 그냥 음 기계식 키보드 보다 좀 무거운 느낌?
스프링 소리 땜에 반품하고 싶었는데 키보드 자체가 너무 이뻐서 흔들리다가 그냥 사용하기로 했습니다. 그정도로 키보드 자체는 너무 이쁘네요.. 잘 만들었어요.. 굿..","['https://phinf.pstatic.net/image.nmv/shopnbuyer_2020_06_10_0/b269bd4c-aae8-11ea-a4a6-48df379cc9e4_03.jpg?type=f287', 'https://phinf.pstatic.net/checkout/20200610_161/1591772644211ai4SU_JPEG/20200610_141757.jpg?type=f287', 'https://phinf.pstatic.net/checkout/20200610_155/1591772644561890dr_JPEG/20200610_141716.jpg?type=f287']"
5,"포장 깔끔하고 너무 예쁨.(참고로 남자임)
그 전에는 청축 키보드 썼는데 타건감 전혀 부족하지 않음.
오히려 더 마음에 듬. 적축은 안 써봤는데 아마 이 느낌이지 않을까 싶을 정도로 부드럽고 사각함.
내구성 하나 보고 샀는데 막상 받아보니 디자인이 제일 마음에 듬.
제발 오래 쓰고 싶음.
글쓰는 직업이라 키보드를 많이 누르는데 3개월만 버텨도 다음에 다시 살듯. 레알.","['https://phinf.pstatic.net/checkout/20200706_13/1594009631129t3dqH_JPEG/review-attachment-94b09d60-0786-41a3-b629-59193a1e04be.jpeg?type=f287', 'https://phinf.pstatic.net/checkout/20200706_90/1594009678233DCuNw_JPEG/review-attachment-97b5a9eb-2cca-464a-853f-7eb80ab8c1a3.jpeg?type=f287', 'https://phinf.pstatic.net/checkout/20200706_221/1594009716797pthIL_JPEG/review-attachment-fe650f94-3aa8-46fc-a186-a5e43cd31b18.jpeg?type=f287', 'https://phinf.pstatic.net/checkout/20200706_241/15940097586374Hz2u_JPEG/review-attachment-7760f64d-78c1-42f6-8c37-5514f7acf845.jpeg?type=f287']"
4,"나름 값이 나가는 기계식 키보드를 사용했었습니다.
그런데 음료를 한 번 쏟아버리고 고가의 키보드가 먹통이 되자 회의감이 강하게 들더군요.
그래서 방수가 되는 광축 키보드를 구입하게 되었습니다.

앱코 해커 K662를 클릭, 리니어 모두 구입했습니다.
두 개를 사도 전혀 부담이 되지 않는 가격입니다.
.

통울림이니 스프링소리니 이야기가 있지만 저는 예민하지 않은 편인지 괜찮게 느껴지네요.
어떠한 단점이 있더라도 가격과 방수가 모든 것을 용서해줍니다.
혹여 나중에 무슨 문제가 발생하더라도 가격이 워낙 저렴하니 그냥 하나 더 사면 될 것 같다는 생각입니다.
물론 무탈하게 사용하게 된다면 최고겠지만요.

상품에 대하여 전반적으로 만족합니다.
배송 속도도 만족합니다만 완충재 포장을 해주지 않으셨다는 점은 아쉽네요.",['https://phinf.pstatic.net/checkout/20200821_268/1598005377353TIMOO_JPEG/review-attachment-1d3ec49a-4520-4d2c-aa1c-e7ea1524286c.jpeg?type=f287']
5,"입력속도도 빠르고 타건감도 좋습니다.
앱코 LED 도 멋지구요
키보드 색상도 맘에 들어요.
게임하는 재미가 더해진다고 할까요.
집에서 게임하는 재미가 솔솔합니다.
그리고 집에서 게임하다 음료 흘릴일들이 간혹 있는대 방수가 된다고 해서 완전 굿입니다. 키커버 최고. 먼지 들어갈일 없을거예요 ㅎㅎ","['https://phinf.pstatic.net/checkout/20201010_23/1602336720802LFrKC_JPEG/review-attachment-b9e6b2e7-2205-47dc-be68-ec19d3fe727b.jpeg?type=f287', 'https://phinf.pstatic.net/checkout/20201010_253/1602336746034wXFrb_JPEG/review-attachment-e2373da8-0768-4e04-bb02-3b26814c2656.jpeg?type=f287', 'https://phinf.pstatic.net/checkout/20201010_128/1602336764338tx2dj_JPEG/review-attachment-4c1f5ae0-f026-4c47-8f54-2ceff9b0f854.jpeg?type=f287']"
4,멤브레인 플런저 기계식 광축 시대대로 다써봤습니다바로 전에쓰던 앱코의 아들인 콕스 광축키보드쓰다가 다 맘에드는데 소리때문에 바꿨습니다솔직히 예전이라면 앱코..거르는데 다른건몰라도광축키보드는 잘만든거같습니다 클릭축 처음 눌렀을때 쫀득한 그맛을 잊을수없네요 청축이 둔탁한 찰칵이라면 광축은 짤깍짤깍느낌 클릭축이 가정에서 사용하기 시끄러운 감이있어서이번엔 리니어축으로 주문했습니다#디자인실물이 더낫습니다 상판은 깔끔하면서도 키캡이 삼색이라 매력적이네요 회색이나 검은색이여도 좋았겠지만 이렇게 나온제품이없어서 특이합니다..#키감1년넘게 클릭축에 익숙해져있었는데 리니어축이 확다르네요그냥 쑥들어가듯이 눌려서 당황했습니다;; 어느정도 걸리는느낌이 있을줄알았는데 반발력만 살짝있어서 조용하고 키압이적어서 맘에듭니다. 사무용추천.한가지 아쉬운점은 led가 단색이라 뽕이 덜채워짐 끝.,[]
5,"노트북를 주로 사용하면서 키보드에 대한 아쉬움이 많아 기계식 키보드를 알아보다가 광축키보드를 알게 되고 나에게 맞는 광축키보드를 찾다가 해커 K662를 알게 되어 고민 끝에 구입했는데
경쾌한 키감과 무리없이 눌러지는 타건감이 너무 좋아요...잘 구매했다는 생각이 듭니다...^^","['https://phinf.pstatic.net/checkout/20201010_194/1602326247969BHFjS_JPEG/review-attachment-52a2f897-aa53-4fa5-8996-c9a641ce2651.jpeg?type=f287', 'https://phinf.pstatic.net/checkout/20201010_11/1602326248531NxGg1_JPEG/review-attachment-d313bb59-3b3f-4ef2-8feb-0a25672e484c.jpeg?type=f287', 'https://phinf.pstatic.net/checkout/20201010_58/1602326248383XTcwn_JPEG/review-attachment-31fe1cc5-19fc-45b8-b670-d6c7d4359c03.jpeg?type=f287']"
5,잘 받았습니다~ 제가 산건 리니어구요 카일광축 리니어제품을 원래 만족하면 서 쓰고 있었어서 서브로 k662 모델로 하나 더 샀습니다 이벤트라 저렴하게 구매하였고 이벤트증정품인 키캡도 잘 받았습니다 키캡은 원래 누락되었었는데 문의드리니깐 그날 바로 출고해주셔서 빠르게 잘 받았습니다 디자인은 보다시피 깔끔하고 키감이 상당히 좋습니다 클릭의 소음이 신경쓰이시는 분들은 리니어로 구매하시면 아주 만족하실겁니다,"['https://phinf.pstatic.net/checkout/20200528_59/1590669191334IMyw8_JPEG/KakaoTalk_20200528_212612462.jpg?type=f287', 'https://phinf.pstatic.net/checkout/20200528_217/1590669191327CRWQq_JPEG/KakaoTalk_20200528_212612578.jpg?type=f287', 'https://phinf.pstatic.net/checkout/20200528_244/1590669191328eYVRr_JPEG/KakaoTalk_20200528_212612696.jpg?type=f287', 'https://phinf.pstatic.net/checkout/20200528_281/15906691913288J36B_JPEG/KakaoTalk_20200528_212612829.jpg?type=f287']"
5,와 일단 넘 이쁘고요 ㅋㅋ상자가 무거워서 놀랐어요. 후기에서 보이던 컬러키캡은 없는것같았지만! 연결해보니 잘되고있어용 가벼운키감 찾는중이었는데 타각타각소리도 완전크진않고 맘에듭니다! 그래도 확실히 크긴큰편이라~ 아예무소음생각하시면안될것같아요 잘쓰겠습니다!,"['https://phinf.pstatic.net/checkout/20200819_129/15978374001858R5nf_JPEG/review-attachment-57b695e4-fa66-40a2-a7fb-a48d5801469b.jpeg?type=f287', 'https://phinf.pstatic.net/checkout/20200819_284/1597837416576lmGme_JPEG/review-attachment-c58d8726-71bd-43e6-9528-f992cc44fbd2.jpeg?type=f287']"
5,"대만족입니다.
이런 기계식키보드류 (축)는 처음 사용해봅니다.
일반기계식키보드를 선택할까 고민도 했지만
방수기능의 중요성을 알기떄문에 광축인 k622제품을 골랐습니다.
배송도 이틀만에 오고,좋습니다.
이런류의 키보드 사용이 처음인지라 축에 대해 잘 알지는 못하지만
ㅎㅎ","['https://phinf.pstatic.net/checkout/20200923_269/1600792664327N0xtp_JPEG/review-attachment-4fcd83ed-9c13-421c-b75e-968ee3cd9816.jpeg?type=f287', 'https://phinf.pstatic.net/checkout/20200923_11/16007926643786wPB3_JPEG/review-attachment-96ab6d72-9aa6-4400-bf3a-37f9e4d89949.jpeg?type=f287', 'https://phinf.pstatic.net/checkout/20200923_235/1600792664342pzfym_JPEG/review-attachment-3e397d7f-edb1-42a7-8501-d8de1442f72c.jpeg?type=f287']"
5,"키크론 사용하려다가 디자인이 비슷해서 넘어왔는데 키감정말 좋습니다. 디자인이 일단 최고고요.
로지텍 mx keys 사용했었는데 기계식키보드 가성비 윗급제품인것같습니다. 키크론이랑 고민하시는분은 100% 662추천합니다. 가격도 반값이하고 키배열과 키감도 좋습니다. 다만 갈축쓰시던 분들은 고민하세요. 청축에가까운 키감입니다.","['https://phinf.pstatic.net/checkout/20200423_92/1587607404318Ayerq_JPEG/20200423_105710.jpg?type=f287', 'https://phinf.pstatic.net/checkout/20200423_70/1587607411173WHLvv_JPEG/20200423_105642.jpg?type=f287', 'https://phinf.pstatic.net/checkout/20200423_74/1587607416052YOgUt_JPEG/20200423_105648.jpg?type=f287']"
5,"가격 저렴하게, 좋은 키보드를 구매했습니다.
기존 사용하던 키보드는 펜터그래프이었는데 소리는 확실히 크고, 키감은 확실히 좋네요,

손목의 편안함과 내구성은 조금 더 사용해봐야 할거 같습니다.
가장 마음에 드는 부분은 색상의 조합이 정말 마음에 드네요.","['https://phinf.pstatic.net/checkout/20200731_100/1596177893439PxhIF_JPEG/review-attachment-93f277e3-156e-4bc8-891d-857eea8f51e3.jpeg?type=f287', 'https://phinf.pstatic.net/checkout/20200731_120/1596177893885rRgN6_JPEG/review-attachment-8d3ab3ef-2aec-45ec-b28b-c92699483fa3.jpeg?type=f287', 'https://phinf.pstatic.net/checkout/20200731_68/1596177893673RiglU_JPEG/review-attachment-7e309fae-ceaf-438d-bbbe-63168a2e2b67.jpeg?type=f287']"
5,이마트에서 만져보고 키감이 너무 좋아서 샀어요~ 기계식 느낌의 키보드는 처음인데 광축은 고장도 잘 안난다고 해서 바로구매했습니다ㅎㅎ 이전에 쓰던 컴퓨터 살때 따라나온 멤브레인방식 키보드쓰다가 써보니 정말 만족합니다. 키감도 깔끔하고 led도 너무 현란하지않고 깔끔하게 이뻐요^^ 강추합니다.,"['https://phinf.pstatic.net/checkout/20200807_193/1596788302715QTsgH_JPEG/review-attachment-6f3de93f-81ae-4c57-8c90-1f00057e6dc2.jpeg?type=f287', 'https://phinf.pstatic.net/checkout/20200807_46/15967883454701g845_JPEG/review-attachment-1b92b9f4-16ea-432a-a846-e513732c2850.jpeg?type=f287']"
4,"손가락 아픈데 누르는 힘 덜 들어가서 좋아욤. 키보드가 좀 중요한 일 하는데 반응속도 좋음. 아쉬운 점 키보드가 조금 높아요. 글자 빛나는게 ㄱ, ㅅ, ㅐ 나 ㅔ 같이 아래 써 있는거는 빛이 안 나는데 저는 신경 안 쓰이지만 사실 분들을 위해 적어봅니다. 키보드가 조금 헐렁한 느낌도 없지 않아 있지만 적축 키감이 원래 더 그렇게 느껴지더라구요. 가성비는 아주 만족입니다.",['https://phinf.pstatic.net/checkout/20200924_66/1600914854406qWD2v_JPEG/review-attachment-8d77c8ca-4bf4-4b68-9a37-32e9df913793.jpeg?type=f287']
5,"배송 빠르고 제품 역시 만족합니다.
단, 포장이 완충재 하나없이 비닐봉지에 넣어주는건 좀...
택배상,하차때 보면 막 던지던데 충격이 좀 걱정됨.
키보드 키감은 적당히 쫀득하니 좋네요
디자인 역시 요즘 알록달록한 LED로 화려하지않고
단색의 조명이라 제스타일 입니다.","['https://phinf.pstatic.net/checkout/20200819_277/15978004174157aw9a_JPEG/review-attachment-45ece782-0c7f-4a4d-8595-2c0347218ff6.jpeg?type=f287', 'https://phinf.pstatic.net/checkout/20200819_194/1597800417428wswGy_JPEG/review-attachment-c3e0e01e-a48b-421e-8a89-4c2072214d5c.jpeg?type=f287']"
5,"아주 만족스럽습니다. 키보드 클릭감도 부드러우면서도 누른것을 확실히 인지할수 있는 선명한 느낌이고, 디자인도 좋습니다. 본체랑 연결되는 케이블도 꼬임없는 고급재질이고, 세세한 부분까지 신경쓴것이 느껴지는 제품입니다.","['https://phinf.pstatic.net/checkout/20200810_135/15970305737842xuo0_JPEG/review-attachment-afec631c-9cf2-4fef-854e-756871407cfc.jpeg?type=f287', 'https://phinf.pstatic.net/checkout/20200810_94/1597030588586hHwTm_JPEG/review-attachment-f8356519-c3a3-4c8c-8d29-0250d940c7e1.jpeg?type=f287']"
4,"키보드 세일기간에 저렴하게 잘샀어요
일단 조용한걸원해서 리니어로 구매했는데
통울림이 좀있지만 키감과 소음면에선 가격대비
만족합니다 근데 키들이 유격이좀 있어 덜렁거리네요
2년전 출시한 제품이니 요즘나오는거는 개선됬을지 ㅎㅎ
암튼 가성비 좋은 키보드 입니다","['https://phinf.pstatic.net/checkout/20200526_207/1590474069627i0Vkr_JPEG/20200526_134352.jpg?type=f287', 'https://phinf.pstatic.net/checkout/20200526_127/1590474069678QHXyF_JPEG/20200526_134408.jpg?type=f287']"
5,"배송 하루 걸렸고 빠르게 도착했습니다!
한동안 계속 적축만 사용하다 사고싶다고 생각만 하던 광축을 이참에 한 번 써볼까 해서 구입했어요!
클릭이랑 리니어랑 고민하다가 어차피 클릭사용하다
금방 질릴거라는 생각에 한달 정도 뒤에
리니어 하나 더 사자 결정하고 먼저 클릭으로 주문했습니다!
오랜만에 찰칵찰칵한 느낌이 좋습니다:)
청축은 찰칵찰칵하기만 한데 광축 클릭형은 정말 뭔가 클릭하는 것 같은 느낌이랄까 버튼같을걸 클릭클릭 누르는 느낌이라 너무 좋습니다:)
확실히 시끄럽기는 하지만 클릭거리는
백라이트도 너무너무 예쁩니다.
백라이트가 상단부나 하단부만 들어오는게 아니라 키캡 전체적으로 모두 들어와서 LED 색상이 밝거나 화려한 것도 아닌데도 눈에 너무 잘 들어옵니다!
생각보다 LED 모드도 많아서 놀랐어요
생각했던 것보다 통울림이 조금 있는 편인것 같기는 하지만 가격대가 가격대인만큼 너무너무 만족스럽습니다.
광축 검색하면 키캡이 반들반들한 코딩된 키캡이 많았는데
요 아이는 그런 키캡이 아니라 좋아요
거기다 그레이&화이트에 레트 포인트 키캡 너무 예쁩니다ㅠㅠ
리니어는 V2를 구입할 예정이라 클릭은 V1으로 구입을 했는데
이미지로 보는 것보다 실제로 보는게 진짜 훨씬훨씬훨씬훨씬x10000 예쁩니다ㅠㅠㅠ
구입 고민하시고 있다면 구입하시는 걸 추천드립니당:)",['https://phinf.pstatic.net/checkout/20200314_182/1584119732553wKtoB_JPEG/KakaoTalk_20200314_020629858.jpg?type=f287']
5,생애 첫 기계식키보드! 여기저기 추천을 받았을 땐 앱코는 빼라는 얘기를 들었는데 이마트가서 시연을 해본 결과 이것만큼 타격감과 안정성이 있는 키보드는 없더군요. 이거 사진으로 볼때랑 또 달라요. 완전 실물갑! 그리고 타건소리도 조용한 사무실에서 사용해도 적당하고 울림도 거의 없어요.(리니어 기준) 그 또각또각 소리 나는게 낭낭해서 계속 자판을 치고 싶게끔 만드네요. 다만 사무실의 환한 조명 아래에서는 LED자판 조명이 가장 밝게해도 잘 보이지는 않네요. 집이나 pc방이면 또 다르겠죠? 다른 제품군들을 보고 계신다면 k662도 구매0목록에 추가해도 좋을 듯해요.,['https://phinf.pstatic.net/checkout/20200305_96/1583371821527GgA1E_JPEG/KakaoTalk_20200305_100705380.jpg?type=f287']
5,"키보드 색감이나 무게감이 고급지고 너무좋아요♥
멤브레인만 쓰다 이런류는 처음써보는데
조용하게 쓰고싶어서 리니어를 선택했는데 키감이 어색해서 그런가 클릭살걸 쪼끔 후회해요 ㅠㅠ
근데 이것도 맘에들어서 이것도 쓰고 클릭도 또 살까 벌써 고민중이에요!! 2번사세요!!!","['https://phinf.pstatic.net/checkout/20200915_150/1600180504443xhRia_JPEG/review-attachment-9f6b0f8f-8f76-4640-900c-6081d010d11c.jpeg?type=f287', 'https://phinf.pstatic.net/checkout/20200915_264/1600180504601OcGY8_JPEG/review-attachment-4f0b47fc-250f-4a83-b7f9-0d9463d224cf.jpeg?type=f287']"
5,"택배가 왜이리 빨리와요? ㅋ
광축 리니어 사길 잘 한거 같아요. 사무실에서 쓸거라 소리가 많이 나면 일하는지 쉬는지 표날까봐 ㅋ
클릭감은 적축과 갈축 사이 정도 소리도 크지않고 딱 좋습니다.
근데 배송이 안에 뽁뽁이 한개도 없이 덜렁 혹시나 충격 간게 없는지 살핀다고 ㅜ","['https://phinf.pstatic.net/checkout/20200818_225/1597741955499oWAGN_JPEG/review-attachment-b7790cfa-f5f5-4572-87e1-4c8b11357a4a.jpeg?type=f287', 'https://phinf.pstatic.net/checkout/20200818_63/15977419555807FEIy_JPEG/review-attachment-deae4370-d05a-4277-9987-ac194afd5392.jpeg?type=f287']"
5,"ㅋㅋ 같은 시리즈인데 키보드 색깔 다른 걸로 배송와서 굉장히 짜증났어요. 아무런 연락도 없이 색 다른걸로 보내셨더라구요. 저번에 산거 만족스러워서 다른 색으로 하나 더 시킨거였는데... 하지만 제품 자체는 이 가격대에서 살 수 있는 최고라고 생각해요.
그리고 장패드 이벤트 한다더니 후기 길게 썼는데도 감감무소식이더라구요. 지금 2달 넘었는데 처음 샀던거 장패드 아직도 안 오는거보면 그냥 안 보내주는듯...뭐 이건 판매처 책임이 아니라 제조사 문제니까 그러려니 하고 있어요. 암튼 제품은 좋구요 색 다른거 올 수 있으니 주의",[]
5,"약 3년전에 쓰던 기계식 키보드가 고장나서 구매하였습니다.
받아서 써보니 확실히 기존에 쓰던 청축 키보드보다 조용하고 led도 단색 led라 더 깔끔하네요. 디자인도 마음에 들구요. 그리고 구조가 단순해서 물세척도 가능하고 잔고장도 더 잘 안난다고 하니 기대됩니다.
보내주신 추가 키캡은 나중에 지금 디자인이 조금 질려갈 때 쓸 생각입니다. 싼 가격에 좋은 키보드를 잘 구한 것 같습니다.",['https://phinf.pstatic.net/checkout/20200726_197/1595732624433mJYKo_JPEG/review-attachment-5495993b-e515-438a-8e61-1a11bc4fb8c2.jpeg?type=f287']
5,"청축, 갈축, 적축 순으로 써봤는데 광축은 처음 써보네요.기계식이면서 점점 소음이 적은 것을 찾게 되네요.그래서 리니어 광축을 선택했고, 도착하자마자 연결해서 사용해보니 소음은 적축하고 비슷하고. 예상보다 키감이 좋네요. 지금껏 사용한 키보드와 다르며 딱 제가 원하는 정도의 키감이네요.조금 소음이 더 적었으면 하는 바램도 있지만게다가 고장이 안난다는 소리를 들으니 더 든든하고. 오래 오래 써야 겠습니다.",[]
4,"이전에 동 모델의 클릭 스위치를 사용한 경험이 있는데, 사용 환경 상 이번에는 리니어를 사용해 보았습니다. 클릭의 짤깍거리는 소음이 없는 대신 스위치가 내부 강판에 부딪히는 소리가 약간 클 수도 있습니다. 클릭보다 약간 키압이 낮기 때문에 가볍게 치면 소음이 심한 수준은 아닙니다. 광고나 타 사용자의 평대로 체리 적축과 비슷한 키감을 제공하며, 코딩 등 타이핑이 많은 업무에 적당합니다. 키캡 마감은 다소 미흡하나, 쉽게 분리하여 다듬을 수 있으므로 크게 불만스럽지는 않습니다. 앱코 해커 시리즈 로고가 변경되어서인지, 기존에 주어지던 붉은색 해커 로고 키캡이 구성에서 빠진 것은 아쉽습니다.클릭에 이어 리니어까지 동 모델을 사용하게 된 건, 게이밍 기어면서도 요란하지 않고 깔끔한 디자인에, 가격 대비 만족도가 상당히 좋기 때문입니다. 10만 원 미만 보급형 키보드로서는 확실히 제값 하는 성능입니다.",[]
