star_point,comment,photo
5,두번째 구매 ~ 역시 배송은 칼배송 ~ 모니터는 박스로 왔습니다 ~ 후기보니 에어캡 씌어서 보내주신거 같던데.. 테스트 결과 양품으로 온듯합니다 ~키보드같은경우 박스에 씰이 두장이더군요 ~ 불량품 확인을 위해 ~ 뜯었다가 다시 붙인건지 ~ 반품온거 붙인 건지는 모르겠으나 ~ 기능적으로는 양품이라 씁니다 ~ 키보드 상판에 실기스 두줄은 있었습니다..dp 케이블은 후기보고 구매 많은 제품으로 구매 했습니다 ~ 잘 사용할게요 ~,"['https://phinf.pstatic.net/checkout/20190313_30/1552445408662fGV1i_JPEG/IMG_2894.JPG?type=f287', 'https://phinf.pstatic.net/checkout/20190313_274/1552445408900snNjD_JPEG/IMG_2893.JPG?type=f287', 'https://phinf.pstatic.net/checkout/20190313_133/1552445409137IGN5P_JPEG/IMG_2892.JPG?type=f287', 'https://phinf.pstatic.net/checkout/20190313_248/1552445409354OAlW6_JPEG/IMG_2896.JPG?type=f287']"
5,다한증이있어서 광축 완전방수인점이 맘에들어 구매했습니다 키보드 디자인너무예쁘고 소리는 약간의 스프링소리가 귀기울여들으면 나긴하지만 예민하지않으면 신경쓰이지않고 입력또한 잘됩니다 다른컴퓨터를사용할때도 구매할듯,['https://phinf.pstatic.net/checkout/20200308_102/15835971047038PUgO_JPEG/3A599DDB-5AEA-4625-9169-2105AA62A75A.jpeg?type=f287']
5,가성비 최고 키보드 입니다.동일스펙 키보드 중에서 가성비 최고인 것 같습니다.타격감도 좋고 또 완전방수라 세척도 쉬워서 오래오래 새것처럼 사용할 수 있을 것 같습니다.집에서 게이밍키보드로 쓰기 이만한게 없을 것 같습니다.,[]
5,앱코 K662 V1 구매....K640 K660 K662 중에 고심을 하다가K662 광축 리니어로 결정했어용기존께 청축이라...집에서 쓰기가 소음때문에640 갈축을 고심 했었으나 662 리니어로 결정확실히 소음은 적네요...찰칵 키감은 조금 떨어지지만..앱코 포인트 키캡도 서비스로 왔구요만족하며 쓰고 있습니다.추천드립니다.,[]
5,"역시 제가 생각했던 것 만큼 예쁘고 좋습니다! 타자칠 때 소리는 생각했던 것 보다 크지만 사무실 자체가 좀 시끌해서 쓰는데 큰 무리는 없습니다! 빛 들어오는게 색이 잘 눈에 안띄긴 해여! 그리고 무게는 생각보다 무겁습니다! 아무튼 매우 만족스럽고, 일하는데 타자치는게 즐겁내용~~",['https://phinf.pstatic.net/checkout/20200224_212/1582551055452eohLq_JPEG/4AA7FBFD-DE7B-4480-B2C4-C2E14B1BDEC0.jpeg?type=f287']
5,키보드 누를때 클릭 소리는 안나지만 키가 부딪힐때 나는 소리가 생각보다 시끄러워서 세게 치면 결국 청축하고 비슷하게 시끄러워요. 하지만 닿지 않게 살살 누르면 손가락에 부담도 없고 조용하고 나름의 갬승이 있음. 가성비 추천합니다.,['https://phinf.pstatic.net/checkout/20200108_166/1578489935862QdTxO_JPEG/20200108_222249.jpg?type=f287']
5,"배송이 익일 특급느낌으로 빨리오네요 ! 어제 오전 11시 30분에 주문넣었는데, 익일날 오후 2시에 도착했어요. 상당히 빠른 배송 만족합니다.제품 곽 박스가 운송중 데미지 안가게끔 설계되어있어서 좋구요 구성물은 키보드 본체랑 간단한 조작키 설명서 , 먼지 털이 브러쉬 정도 있네요 구성은 간단합니다.피시방에서 해커 비슷한 제품군 써보고 키감이랑 소리가 만족스러워서 구매하게됬는데 잘산거같아요~","['https://phinf.pstatic.net/checkout/20190612_70/1560317663925DMMH1_JPEG/20190612_141855.jpg?type=f287', 'https://phinf.pstatic.net/checkout/20190612_218/1560317663735E0mn1_JPEG/20190612_141315.jpg?type=f287']"
5,"배송빠르고 포장도 튼튼한 박스에 잘 왔습니다.
택배받고 무거워서 키보드 아닌줄 알았는데 열어보니 키보드 맞네요. 많이 묵직해서 밀리거나 하지 않을거같습니다. 랜덤증정 키캡도 포인트 되고 좋습니다.
고장안나고 오래 썼으면 좋겠네요",['https://phinf.pstatic.net/checkout/20200528_227/1590642482459jWseO_JPEG/1590642418877118763841934033056.jpg?type=f287']
5,아들 게임용 키보드를 고민하다가 pc방에서 많이 사용한다는 앱코를 알아봤더니 평이 좋더라구요완전방수되는 걸로 골랐는데 가격도 적당하고 자판소리 너무 크면 시끄러울것 같아서 리니어로 골았습니다다른 키보드처럼 led가 화려하진 않치만 깔끔하고 예뻐요 만족합니다,[]
4,"매번 일반 키보드만 쓰다가 새로운 스타일의 키보드를 사용하니 다른 세계입니다. 우선, 디자인에 압도되어 눈이 현혹되고, 두번째는 타격감이라고 해야하나요? 소리가 신박합니다. 누군가에게는 소음이 될 수도 있지만 연주하듯 각 키들의 음향이 달라서 소위 치는 맛이 좋습니다. 문서작업시 더 작업하고 싶은 욕구가 생기기도 하네요. 또한, 밤에는 불빛으로 인하여 재미까지 더해주니 새로운 경험을 하게 됩니다. 이후에 청축/광축에 대한 공부를 더 하고 더 좋은 후기를 남기겠습니다. 수고하세요.",[]
4,키보드 받아서 설치후 잘사용 하고있습니다 가격대비 가성비 최고에용 다만 저번에는 포장 배달 할때 뾱뾱이 같은 보호재가 있었는데 이번엔 아무것도 없이 그냥 상자만 배달되어 혹시 파손이 있었을까 살짝 염려 되었네요 계속 써봐야 알겠지만 잘 사용하겠습니다~,['https://phinf.pstatic.net/checkout/20191018_1/1571388384343WFnuo_JPEG/1571388367130777079742481528232.jpg?type=f287']
4,항상 저가키보드만 써보다가 처음으로 중저가(?)키보드를 구매해봤습니다 배송도 빠르게 하루만에 왔고 배송 오자마자 사용해봤는데 리니어라 그런지 소음이 적어 사무용으로 쓰기에도 무난한 것 같습니다 키감도 가볍고 괜찮은 것 같습니다 다만 한가지 아쉬운 점은 LED가 키캡 위쪽에 위치해서 그런지 키캡의 아래쪽은 비춰주지 못해서 키보드 구매하실때 LED에 민감하신 분은 신경이 쓰이실 것 같습니다,"['https://phinf.pstatic.net/checkout/20190723_288/1563864521525s9Yle_JPEG/IMG_2556.jpg?type=f287', 'https://phinf.pstatic.net/checkout/20190723_82/1563864522138YtaCo_JPEG/IMG_2557.jpg?type=f287']"
4,"조용하게 사각사각한 게 느낌이 좋네요. 그냥 일단 멤브레인 형식의 키보드와 소음 차이가 엄청 크진 않는 정도의 타자음인것 같아요. 타자느낌도 부드러운 편이구요. 색깔도 실물이 훨 낫네요. 전 하얀색이 더 끌리긴 했는데, 실물 보니까 잘 산 것 같아요. 첫 기계식 키보드인데 마음에 쏙 듭니다. 한달 후기 때 더 자세하게 써볼게요.",['https://phinf.pstatic.net/checkout/20190928_272/1569630748072jb67T_JPEG/KakaoTalk_20190928_092248481.jpg?type=f287']
5,너무 이뻐요.... 딱 제가 찾던 디자인입니다. 가성비도 좋고요. 근데 타자칠때 스프링 소리가 엄청 크게 나는데 괜찮아지겠죠..?ㅠㅠ 하나뿐인 esc키도 오염이 조금있어서 너무 슬퍼요 ㅠㅠ 근데 다음날 바로 배송온건 진짜 엄청나내요 ㅋㅋ 지인한테도 추천했답니다,['https://phinf.pstatic.net/checkout/20200327_60/1585283016859J7GuF_JPEG/20200326_124059.jpg?type=f287']
5,주문해놓고 기다리는데 빨리 받을 수 잇어 좋았습니다. 색 배열도 마음에 들고 RGB보다는 하얀LED가 심플하고 좋네요. 광축 클릭으로 구매해서 쓰는데 생각보다 딸깍딸깍 소리가 나네요. 키감은 마음에 드는데 리니어로 할걸 그랬나 싶기도 합니다. 다른 분들 리뷰에 봉인라벨이 떨어져있다고 하는데 저는 이상없이 받았습니다.,"['https://phinf.pstatic.net/checkout/20190301_87/1551430390692y5aYD_JPEG/657775EF-C176-4EBA-8657-348500C3C856.jpeg?type=f287', 'https://phinf.pstatic.net/checkout/20190301_80/1551430391266hbRVU_JPEG/92E80B32-4C35-4182-9FB9-A90FC580B783.jpeg?type=f287', 'https://phinf.pstatic.net/checkout/20190301_214/1551430391302zRCFk_JPEG/9B7597AC-BC13-47F7-878D-E61BD146626E.jpeg?type=f287']"
4,"물건 배송은 많이 빠릅니다. 이전에 기본 키보드만 사용해와서 기계식 입문으로 구매를 했는데요. 생각한 것보다 키감과 소리가 좋아 마음에 듭니다.디자인적으로도 꽤 훌륭하지만, 다른분들의 사용기에도 언급되는 개봉 실링 스티커가 떼어져 있고 키보드 외부에 약간의 기스도 보이는 것이 새로 주문한 새상품인지 의심스럽긴합니다. 키보드 덮개로인해 생긴 기스 같기도 한데 키보드에 비닐을 하나 더 씌우고 투명덮개를 놓으면 이런 불만은 줄어들듯하네요.약간의 불만족스런 부분은 있지만 키보드가 주는 타격감이나 디자인(LED등)은 만족스럽네요. 문서작성이 많은데 적절한 키보드라 생각되어집니다.",['https://phinf.pstatic.net/checkout/20190209_158/1549715190934EgI4w_JPEG/KakaoTalk_20190209_144912030.jpg?type=f287']
5,콕스 엔데버 쓰다가 부담스러워서 넘어왔는데 가성비는 진짜 좋네요 키압도 생각보다 은근히 있어서 쫄깃하구요 저도 저 태그 떼어져있었는데 별 문제는 없었어요 다만 LED광량이 콕스 엔데버 보다 약해서 밝지 않고 스페이스바 스테빌 소리 조금 나네요 그래도 이가격대에 이만한건 없는듯 하네요 첫 리니어인데 되게 만족스럽네요,"['https://phinf.pstatic.net/checkout/20190413_31/1555161427402Dgqto_JPEG/20190409_164830.jpg?type=f287', 'https://phinf.pstatic.net/checkout/20190413_91/1555161441276lsO9p_JPEG/20190409_163110.jpg?type=f287']"
5,원래 다른곳에서 v2리니어를 찾다가 재고있다는 거짓말에 입금하고 구매취소 두번이나 하다가 포기하고 v1리니어를 주문했는데 배송도 하루만에 오고 다른곳은 봉인씰 띄어져있다고 하는데 여기는 조금도 안찢어지고 완전히 붙어있어서 기분좋았어요ㅎㅎ 배송과정중에 상자가 조금 찌그러지긴했지만 봉인씰 붙어있는것만으로 만족ㅎㅎ 불키고봐도 이쁘고 끄고봐도 이뻐요!! 처음 사보는 게이밍키보드인데 키감도 좋고 소리도 엄청크지않고 적당하네요!! 좋은제품 감사합니다ㅎㅎ,"['https://phinf.pstatic.net/checkout/20190313_265/1552472120803GDWrL_JPEG/F1326A37-E694-411F-AAAA-4EEAB567B2B8.jpeg?type=f287', 'https://phinf.pstatic.net/checkout/20190313_54/1552472121791sLvLh_JPEG/D7969E7D-6AA9-40C8-B0EC-4AEF96B8A903.jpeg?type=f287', 'https://phinf.pstatic.net/checkout/20190313_69/1552472121484ah4Hk_JPEG/F0070423-4B35-460C-8278-B0DDD9AB79F6.jpeg?type=f287']"
5,차분한 스타일의 기계식 키보드 다른 분이 앱코 K662를 추천해주셔서 구매했습니다. 저가형 청축 키보드를 쓰고 있었는데 키감이나 소리도 적당히 묵직해서 만족스럽네요. 심플하면서 클래식한 느낌도 들면서 LED 색깔도 현란하지 않게 화이트 톤이라 게임용뿐만아니라 평소에 사용하기에도 괜찮은거 같습니다. 다른분이 구매하신다면 추천해드리고 싶네요.,"['https://phinf.pstatic.net/checkout/20180724_176/1532439731304vdLsD_JPEG/KakaoTalk_20180724_223712835.jpg?type=f287', 'https://phinf.pstatic.net/checkout/20180724_15/1532439731526QSlbM_JPEG/KakaoTalk_20180724_223713756.jpg?type=f287', 'https://phinf.pstatic.net/checkout/20180724_21/1532439731761GWDvR_JPEG/KakaoTalk_20180724_223714125.jpg?type=f287', 'https://phinf.pstatic.net/checkout/20180724_132/1532439731977mB3Oo_JPEG/KakaoTalk_20180724_223714495.jpg?type=f287']"
4,"키보드만 7개째인데 적축-백축-광축-청축-광축-백축-저적으로 가는중입니다. 그나마 이중에서 게임할때 후리하게 막쓰는게 앱코 해커 K662네. 긍디 요즘 저적과 무접점에 빠져서 이 두가지를 더 수집할려고 사들이고 있습니다. 여튼 결론은 지금 자주 사용하는 키보드 중에 하나가 되었습니다. 키감도 좋고, 문제도 없었습니다. 광축을 선택하고자 하시는분들은 K662, This is gonna be awesome for you.",['https://phinf.pstatic.net/checkout/20190715_223/1563146182822aONqh_JPEG/20190604_205215.jpg?type=f287']
5,"타닥타닥거리는 기계식 키보느는 피시방 말고는 처음사용해봣는데 너무 사용감이 좋아요ㅎㅎ
항상 저렴한거 쓰다가 조금 값이 나가서 그런지는 몰라도 확실히 다르네요 앞으로 계속 업그레이드 해나갈 생각인데 항상 애용하겠습니다.
감사함니다.",['https://phinf.pstatic.net/checkout/20190907_133/1567786332411o9DiF_JPEG/20190829_215129.jpg?type=f287']
4,"기계식 청축 쓰다가이번에 광축 리니어로 바꿨는데아직 적응이 안되네요.청축 그 특유의 키감과 반발력이리니어광축은 그런게 없는데 확실히 청축보단 조용하네요.약간 멤브레인 느낌은 아니지만 옛날 갬성 돋는 키감이구요.소리는 기계식 청축보단 훨씬 조용한데, 그렇게 줄어든편은 아닙니다.약간의 통울림은 있어요.금요일날 오전인가 오후에 주문했는데 토요일 오전에 받아봤어요.역시 킹체국 택배라 배송은 빠릅니다.","['https://phinf.pstatic.net/checkout/20190507_35/15572394995305LOlp_JPEG/20190507_231702.jpg?type=f287', 'https://phinf.pstatic.net/checkout/20190507_226/15572394996527JYKy_JPEG/20190507_231644.jpg?type=f287']"
5,나무와 인간은 서로 돕고 살아갑니다. 재미있는 것은 나무와 인간(동물)의 삶의 방식이 정반대라는 사실입니다. 동물은 땅 위에 자신의 배설물을 뿌리고 나무는 대소변을 공중을 향해 날립니다. 동물의 배설물은 땅 속에서 분해되어 나무의 영양분이 되고 나무의 대변(?)인 산소를 포함한 피톤치트는 인간을 포함한 모든 동물들의 호흡을 이롭게 합니다.,"['https://shopping-phinf.pstatic.net/20190627_19/d3e1fdce-606e-4320-80fb-2015a380a306.jpg?type=f287', 'https://shopping-phinf.pstatic.net/20190627_7/a89924e2-bff0-477c-bf0a-669ff071d0b6.jpg?type=f287']"
5,24일에 주문했는데 하루만에 받았습니다~타건감은 넘 맘에들어요~ 쓰고 있던 키보드가 세게 눌러야 되는게 있어서타자칠때 피곤함이 빨리 왔는데 확실히 그런게 줄어들었습니다.타자치는감을 좋아하시면 다른모델이 좋을것 같습니다.리니어가 사무실에서 사용하기 좋다는 추천이 있어서주문했구요저는 정말 조용한걸 원했는데타자쳐보니까 소리가 나긴하더라고요그래도 거슬리는 정도는 아니라서 만족합니다.,['https://shopping-phinf.pstatic.net/20190428_2/e8a57007-a90a-4a8f-97a7-3cc7cbee1691.jpg?type=f287']
5,수요일 새벽에 구입했는데 다음날 목요일에 도착해서 K662로 리뷰를 씁니다. 배송 빠르구요. 꼼꼼하게 살펴봤는데 전체적으로 마감좋고 작동 잘 됩니다.너무 맘에 드네요.광축은 첨이라 기대가 됩니다.전체적인 완성도와 내구도는 한달사용리뷰에 쓸께요.봉인씰은 예상대로 잘려있네요.,"['https://phinf.pstatic.net/checkout/20190307_163/1551934316453OGTUl_JPEG/KakaoTalk_20190307_123634865.jpg?type=f287', 'https://phinf.pstatic.net/checkout/20190307_50/1551934316662tMoqf_JPEG/KakaoTalk_20190307_123659306.jpg?type=f287']"
3,내것도 설마~ 했는데 역시나 뜯겨있는 반품씰 ㅋㅋ;;...이전키보드랑 비교샷입니다. 키보드는 막쓰는 타입이라 교체주기가 긴 소모품정도로 생각하고 쓰고 버리고 하는데 다음 키보드는 글쎄.. 두번 낚이고 앱코 고르기 힘들겠네요. 제품자체는 좋아요. 제품은 좋습니다.,"['https://phinf.pstatic.net/checkout/20190308_102/1552036972980jE0xs_JPEG/DSC_0106.JPG?type=f287', 'https://phinf.pstatic.net/checkout/20190308_96/1552036973186nh05F_JPEG/DSC_0107.JPG?type=f287']"
5,"소리가 안나는 키보드를 찾고 있었는데... 그것 때문에 리니어를 구입했지만 생각보다 소리는 커요.. ㅎㅎ 그래도 보기에 참 이쁘고, 타자를 계속 치고 싶어지는 키보드예요 ㅋㅋㅋ 지나가는 사무실 사람들도 한번씩 물어본답니다. 색 조합이 깔끔하고 이쁘네요. 여자는 역시 이쁜것에 다 넘어가는 것 같습니다. 모든게 용서되요. 그리고 눌림이 굉장히 부드러워서 쉽게 타자가 쳐지고, 그래서그런지 아직까지는 오타율이 높은 편이예요. 적응하면 괜찮아지겠죠? 아무튼 만족하며 사용하고 있습니다! ^^",['https://phinf.pstatic.net/checkout/20190202_203/1549085057023uso11_JPEG/KakaoTalk_20190202_141941329.jpg?type=f287']
2,이 업체도 노답이고 키보드도 노답임 USB단자에 녹 발생된 제품와서 반품했음반품되어 온 새제품도 녹발생 되어옴이 업체 상담 대응 개노답이라 앱코 본사에 전화했더니 바로 씰 개봉부분에 대해 설명 친절하게 해주고 미개봉씰로 보내준다고함(구 제품은 칼집을 내서 작은 충격에도 개봉되어 새로 나오는 제품은 보안되어 미개봉으로 온다고함)이 업체는 유통업체라 그런지 상담 개떡같이 했음이 유통업체가 두번째 보낸제품은 녹발생+키보드에 이물질 묻어있음원래 앱코가 그렇다며 업체 직원이 상담함본인 회사가 유통하면 소비자보다 자세히 알고 설명을 잘 해주셔야지 않나요?결론 앱코 본사 최고 유통업체가 안좋음패드 안주셔도 돼요 신청도 안할거임,"['https://phinf.pstatic.net/checkout/20180923_204/15376979455265tq4I_JPEG/PRREW_6629198011823943442.jpeg?type=f287', 'https://phinf.pstatic.net/checkout/20180923_161/1537697984909bufJg_JPEG/PRREW_92775224247677244.jpeg?type=f287', 'https://phinf.pstatic.net/checkout/20180923_10/1537697996060wANLc_JPEG/PRREW_8124575598751348796.jpeg?type=f287', 'https://phinf.pstatic.net/checkout/20180923_35/15376980109832JgwR_JPEG/PRREW_9140031571500949412.jpeg?type=f287']"
5,LED를 별로 안좋아해서 컬러가 이쁜 키보드를 샀는데 색감이 마음에 들었습니다.적절한 소음과 키압이라 더 마음에 든거같아요. 스프링 소리가 심하게 나는 키도 없습니다. 가끔 다른 후기에서 구성품이 빠져있거나 하는 경우가 있다고 해서 걱정했는데 빠짐없이 왔습니다. 단지 흰색부분키가 오래사용하면 때가 탈거같은데 관리만 잘해준다면 괜찮을거 같습니다. 적극추천 합니다.,['https://shopping-phinf.pstatic.net/20190311_24/97e3607c-5725-4653-bafd-dbfced444169.jpg?type=f287']
5,"가격/디자인/기능/타건감/소리 면에서 모두 우수함 추천합니다. 사실 저는 키보드는 아무거나 쓰면 된다는 주의였는데, 이번에 컴퓨터를 바꾸면서 키보드도 검색해봤고구매평이 매우 좋은편이라 그리고 가격이나 디자인도 적당하다 생각하여 구매를 하였습니다.배송은 수욜 저녁에 주문해서, 금요일에 왔습니다. 배송도 빨랐고, 또 직접받아보니키보드 무게가 묵직합니다. 그리고 설명한대로 키보드 타건감이 매우 좋습니다. 특히 저는 스페이스바를 누를때 나는 소리가 너무 좋습니다~ ㅋ 저는 리니어를 선택했는데, 사실 리니어와 클릭의 차이를 크게 알수없어, 많은 분들이 구매하시는 리니어를 따라 구매했는데 매우 좋은 선택이네요 ㅎㅎ그리고 소음이 크시다하셨는데, 이부분은 제 생각은 큰거 같습니다. 만약 사무실에서 사용하시게 되면 조금 큰편이 아닌가 생각이 드네요. 그치만 이 타건감과 소리를 포기할 수 없을 거 같습니다 ㅎㅎ아무튼 적극 추천드리는 바입니다. 감사합니다.~","['https://phinf.pstatic.net/checkout/20181019_7/1539951313547ngrV1_JPEG/KakaoTalk_20181019_210907517.jpg?type=f287', 'https://phinf.pstatic.net/checkout/20181019_125/1539951313706pWGoU_JPEG/KakaoTalk_20181019_210907064.jpg?type=f287']"
1,리뷰를 보고 살걸그랬네요..일단 씰 떨어져있고요 웃긴거는 두겹 붙여져 있는데 두겹이 다 떨어져있습니다. 이걸 도대체 뭐라고 생각해야 하는건가요?황당해서 리뷰좀 보니까 배송중에 뜯어졌다고 이상한 개소리를 하시나 본데요 그러면 안떨어지게 해서 보내는게 당연한거죠 뭐 택배회사에 따지라는 소립니까? 누구는 돈이 집에 굴러다니는줄아나.. 아까운도 쓰고 기분 개잡치네요 그리고 usb도금 상태 개판입니다.얼룩덜룩 무슨 도금을 크래파스로 칠해서 하셨나..가격 싼거에 이런게 다 포함된거라고 생각하고 그냥 쓰겠는데요남 아까운도 받아다 물건 팔꺼면 제대로 파세요 돈쓰고 욕나오게 하지 말고요 아시겠어요?,[]
3,1. 구매이유: 지금 백축을 쓰고 있는데 쫀득한 키감이 아주 일품인 제품이라 수명연장을 위해 다소 저렴한 광축을 알아보던 중에 앱코해커 K662를 구매(막쓸거임 -0-)2. 구매평: 키를 전체 다 눌러서 디테일하게 체크하지는 못했지만 대부분 괜찮았지만 이 제품의 단점은 혹시나 했는데 역시나 스페이스바 통울림...심하다.3. 마지막으로 심플한 디자인은 맘에 든다,[]
5,일단 배송도 빠르고 디자인도 너무 예뻐서 좋네요광축은 어떤 느낌일까 궁금했는데 확실히 사전에 조사한것처럼 클릭은 청축이랑 비슷하네요저렴한 가격에 괜찮은 제품 구한것 같아서 만족합니다생활방수도 되고 먼지솔도 같이 동봉되어 청소하기 쉬울것같습니다여분 키캡이 없는것은 아쉽지만 충분히 만족합니다ㅎㅎ감사합니다~~,['https://shopping-phinf.pstatic.net/20190531_9/944abb10-e725-434c-9165-d2d54adfadb4.jpg?type=f287']
5,사진보다 실물이 훨씬 예뻐요 사무실 모니터 및 본체가 블랙이라 색상을 아주 고민하다가 K662 v1 으로 구매하였습니다검은 프레임이 모니터의 검정과 일치하여 일체감이 있고 안정적입니다키감은 뭐 워낙 유명하니 말할 필요도 없구요 사진으로 보는것보다 실물이 훨씬깔끔하고 좋습니다사진으로 망설이시는 분들은 일단 구입하고 보시는 것을 추천드립니다,"['https://phinf.pstatic.net/checkout/20181103_187/1541253715230lrH0q_JPEG/%EB%8B%A4%EC%9A%B4%EB%A1%9C%EB%93%9C_(1).jpg?type=f287', 'https://phinf.pstatic.net/checkout/20181103_276/1541253715353FzvE9_JPEG/%EB%8B%A4%EC%9A%B4%EB%A1%9C%EB%93%9C.jpg?type=f287']"
5,"이번에 컴퓨터를 새로 조립하게 되면서 키보드도 새로 살 겸 앱코 명기라고 추천받았던 K660라인업 중 하나를 구매하였습니다. V1이 V2보다 마음에 들어서 V1을 구매했고요. 색이 사진 그대로이고 확 튀지않아서 마음에 듭니다. 평범한 키보드같이 생겼으면서 포인트가 있어서 좋네요. 제가 구매한 제품은 광축리니어인데 키보드 입력시에 타격감이 꽤나 특이합니다. 청축처럼 통통튀는게 아니라 부드럽고 탄력있게 느껴지네요. 그리고 방수 기능이 있다는게 마음에 듭니다. 더러워지면 쉽게 청소할 수 있을 것 같네요. 키보드 밑에 배수홀이 있어서 물도 잘 빠질 것 같네요. 키보드에 있는 여러 기능설정은 타 기계식 키보드도 보유할만한 것이지만 합리적인 가격과 좋은 타격감, 은은한 디자인이 이 키보드의 포인트 아닌가 싶습니더.",['https://shopping-phinf.pstatic.net/20180705_29/e6196609-c374-4036-95a2-f43f95f6e43d.jpg?type=f287']
5,앱코 K662 모델 구입했습니다.v2 리니어로 했는데 저는 타건감 마음에 드네요.LED 불 들어오는것도 정말 예쁩니다 :)무엇보다 디자인이 정말 예쁘네요. 올블랙 기계식 키보드 쓰다가 이거 쓰니깐 밝아서 좋아요!!이 가격에 이런 기계식 키보드 둘도 없을겁니다.,"['https://shopping-phinf.pstatic.net/20190624_22/102404a6-d009-4515-8ee1-512e45e0bb6b.jpg?type=f287', 'https://shopping-phinf.pstatic.net/20190624_15/6d318878-4d0a-480a-92e6-28d27212ed07.jpg?type=f287', 'https://shopping-phinf.pstatic.net/20190624_9/a1e58504-589e-48ac-8c0e-88b80da10e71.jpg?type=f287']"
5,다른분들은 봉인씰이 뜯어져 온게 많다고 하여 걱정했는데 다행이 제꺼는 봉인이 제대로 되어있네요일단 처음열었을때 회색이 적절히 섞여있어서 고급스러운 느낌이 들고 무게도 묵직하여 좋네요 키감은 제가 이런키보드 처음 써봐서 다른 제품이랑 비교할수는 없지만 고급스러운 소리가 나네요,['https://phinf.pstatic.net/checkout/20190312_5/1552393712361BwMQd_JPEG/AE814341-D172-4A7B-8D07-F3570B8C7297.jpeg?type=f287']
5,"제품 품질과 사용감은 만족합니다. 무게는 듣던대로 생각보다 많이 나갑니다.집에서는 갈축을 사용하는데 그것보다는 확실히 소음이 적네요. 다만 사무실이라 조용해서 그런지 주위사람들은 좀 크게 느끼는 것 같아요.키보드 조명의 경우 최대로 해 놓으면 밝은 사무실에서는 흰색 키에 적혀있는 글자가 잘 안보여요. 키도 다른 키보드에 비해서 민감한 것 같습니다.사용에는 크게 불편함은 없고, 좋은 제품입니다.",['https://shopping-phinf.pstatic.net/20190627_16/f025fb85-58fc-451b-bd3e-cb9987cb9567.jpg?type=f287']
