star_point,comment,photo
5,"한달이 아니라 1년을 사용해도 험하게 쓰지 않는다면
별반 차이가 없을듯 싶네요..",[]
5,"사용감이 좋아요
재구매의사있음",[]
5,너무조아연가나다닐가걻,[]
5,"넘 좋아요.
짱입니다.~~^^",[]
5,"좋아요 좋아요 좋아요
저희아들이 너무 만족하면서 쓰고있어용^^",[]
5,디자인 예쁘고 방수기능 있어서 좋습니다. 사용감도 좋고 만족만족합니다~~,[]
3,"pc방에 갔다가 키보드가 너무 이뻐서 구매했습니다
외관은 만족
내구성은 글쎄요 스페이스바가 씹히는 경우가 가끔 있네요",['https://phinf.pstatic.net/checkout/20191018_193/1571405484696LPtTo_JPEG/KakaoTalk_20191018_223054355.jpg?type=f287']
5,아들이 가지고싶어해서 주문시켰는데 배송도 빠르고 키보드 느낌도 좋아서 아들이 만족하더라고요 잘 사용하겠습니다 ^^,[]
5,피c방에서 보고 반해서 바로주문한 넘나조쿤 ㅎ예뻐요ㅎ,['https://phinf.pstatic.net/checkout/20191108_143/1573149359541OSoAI_JPEG/20191108_025541.jpg?type=f287']
5,진심으로 이쁘고 타격감 지리고 후회안합니다,[]
4,타격감이 너무 좋아요 !! 색도 이쁘고,['https://phinf.pstatic.net/checkout/20191105_92/1572934133601gp2Oy_JPEG/EAD4A872-D71E-4229-82D5-6DA09F877A73.jpeg?type=f287']
5,상품 배송도 빠르고 무엇보다 아이가 너무 좋아해서 좋고 색상이 실제가 더 이쁘네요^^ 아이 친구에게 추천했다고 합니다.,[]
5,아주 맘에 속들어요 노란색이라 좀 구릴것같지 않을까했는데 생각보다세련미가 물씬...ㅎㅎ,[]
4,넘 예쁘고 키감이랑 소리도 좋은데 흠집이 있어욤 ㅠㅠ 귀찮아서 그냥 쓰려구요 아쉽지만..,"['https://phinf.pstatic.net/checkout/20190706_169/15623827631603VojN_JPEG/8EB02DD4-C3E5-47E7-A149-EF95F4D8AE47.jpeg?type=f287', 'https://phinf.pstatic.net/checkout/20190706_95/1562382774083zKzvQ_JPEG/8EC01F2C-308D-4340-BE45-F08758C62A9D.jpeg?type=f287']"
5,led가 넘 이쁘고 코로나때문에 많이 늦어질줄알았는데 생각보다 일찍 도착했어요,[]
5,사진그대로 예뻐요 배송이 잘못와서 다시 받았지만 빠르게 해결해주셨어요,[]
5,배송 빨라요 터치감 좋아요 색감 좋아요 하지만 소음이 있어요기계음이 있어서 시끄럽지만 괜찮아요~~ 좋아요~~ 좋아요~ 좋아요~ 좋아요~,[]
5,너무 예뻐요ㅎㅎ 잘쓸게요,['https://phinf.pstatic.net/checkout/20191101_60/15725770087769nNIN_JPEG/1572577001474.jpg?type=f287']
5,배송도 빠르고 디자인도 짱 예뻐요!!너무너무 만족스럽습니다 잘쓰겟습니당,[]
5,피씨방에서 사용하던거라 제품에 대해선 너무 신뢰가는 상품입니다ㆍ디자인도 맘에 들고 소리도 짱입니다ㆍ배송도 빠릅니다,[]
5,"깔끔한 포장과 빠른배송~ 빠른배송으로 같이 주문한 마우스, 이어폰, 마이크까지 셋팅할 수 있었어요. 게임하려고 주문했는데 불빛이 들어와서 더 예뻐보이네요",[]
5,광축 특유의 짤깍거리는 소리가 재미있습니다. 사진이 좀 흔들렸는데 개인적으로는 LED 불빛을 끈 게 더 이쁘네요!! 꽤 만족합니다!!!,['https://shopping-phinf.pstatic.net/20191022_3/5e82cc7e-6bda-4b05-b093-b7e36146f46b.jpg?type=f287']
5,"쫀득하니 좋네요. ㅎㅎㅎ
추천함다",[]
5,친구가 추천해줘서 구매했는데 우선 색이 너무 맘에 들고요 소리도 생각보다 별로 안커서 더 좋아요ㅠㅠ 진짜 너무 예뻐용 추천합니당,['https://phinf.pstatic.net/checkout/20191008_86/1570530322044cuoDq_JPEG/%C5%B0%BA%B8%B5%E5.jpeg?type=f287']
5,빠른배송 꼼꼼한 포장 감사합니다,[]
5,디자인 끝내주네요 ㅋㅋ 불키고 키보드 보면 자판이 잘 안보이지만 그래도 이뻐요,[]
5,소리부터 느낌까지 완전 제 스타일 이라서 산거 후회안해요 ㅠㅠ!,[]
4,원하던 디자인과 타건감이 좋네요~,[]
5,타격감 디자인 다맘에드네요,[]
5,빠른배송과 친절한답변 감사합니다.,[]
5,좋아요 좋아요 좋아요,[]
5,배송도 빨라서 좋구요 품질도 좋아요 추가구매도 하곺을정도이네요,[]
5,자판기 불빛 제어 가능하고 묵직하니 좋네요.,['https://shopping-phinf.pstatic.net/20191013_9/43a3d75e-21fa-44eb-801c-2134527456ec.jpg?type=f287']
4,한 두달가까이 쓴 거 같은데 ㅠㅠ 타격감은 여전히 좋지만 스페이스바가 약간 삐그덕거려요ㅠ 이것만 빼면 만족해요~~,['https://phinf.pstatic.net/checkout/20190928_12/15696817570043E5iK_JPEG/0AF62A6E-83A6-4136-A5F5-99A24079D5D4.jpeg?type=f287']
5,찰칵찰칵 소리 너무좋고 색깔이 너무맘에들어요. 크리스탈이라 벗겨질 염려도 없고 너무좋네요 ^^,['https://phinf.pstatic.net/checkout/20190924_285/1569314385657lcOVq_JPEG/20190907_220510.jpg?type=f287']
5,만족합니다!좋은 제품입니다!,[]
5,Pc방에서 사용해보구 구입했어요좋네요,[]
1,"내참 장패드 자존심 상해서ㅋㅋㅋ 달라고 달라고 고객센터 전화해도 당담자없다고 전화 준다고 책임만 떠 넘기다가 결국 전화안옴 전화받은 여자 직이삐고싶다
짱나서 한달째 뜯지도않음",['https://phinf.pstatic.net/checkout/20191003_173/1570043929612HPryI_JPEG/20191003_041836.jpg?type=f287']
5,일단 배송은 무지 빠르네요 아들애 고르고 골라서 살달라서 사？Z는데 제가 보기에도 좋은 재품인거 같아요,[]
5,게임방에서 처음 봣는데 아주 만족합니다. 키감 디자인 모두 좋아요,[]
5,키보드 써본것중 완벽하다고 말할 수 있습니다.,['https://phinf.pstatic.net/checkout/20190908_110/15678700851267ut1q_JPEG/A2446F93-1DA7-49A3-AE8F-AF400F2294FF.jpeg?type=f287']
5,"피시방에서 보고 좋아서 삿는데 만족하빈다 ㅎㅎ
상당히좋아요 계속쓸듯~",[]
5,모양이랑 키감도 좋고 여러가지 옵션등 너무좋고기본적으로 키감이 너무 좋습니다.,['https://shopping-phinf.pstatic.net/20190809_3/d854152d-fcd7-4cc6-8357-1cc311f3d5e3.jpg?type=f287']
