star_point,comment,photo
4,디자인 좋은데 왜게이밍키보드라하는지 잘모르겠습니다키가 너무잘눌러주는데 살짝만 손을 올려나도제가 참고로 이키보드로 더킹오브파이터을 즐겨봤습니다전에 키보드는 왼쪽 밑으로 막연타하면 기술이 나가는데 이키보드는 안나가네요PC용 게임에 마쳐서 나온지모르겠지만 저는 기쁨 나쁨 반반이네욤/더써바야될거같습니다근데 장패드는 왜안온건지,['https://shopping-phinf.pstatic.net/20180712_0/5f58062b-ac99-4837-89ca-675111c29301.jpg?type=f287']
3,잘쓰긴 합니다만 찝찝합니다 처음에 받았을떄 포장을 열어보니 전자 제품 포장에 있는 개봉시 반품불가가 이미 뜯기 전부터 잘려져 있더군요 이미 열린거 열어보니 제품 상태는 문제가 업어 보였지만 이런식으로 보낸건 어차피 환불 해줄 마음이 없다는 건지 어쨋든 사용 했을때의 느낌 자체는 좋은 편이긴 해요 눌렀을 떄 소음도 큰편이 아니고 하지만 좀 찜찜 하네요,[]
5,딱 제가원하던 제품이었습니다. 청축보다 조용하고 쫀득한 느낌! 클릭감이 청축보다는 없지만 이건 적응만하면 인생 키보드가 될듯하네요~ 디자인도 너무 이뻐요! 논란있는 씰개봉상태는 보안해야 할듯하네요. 그래도 깨끗하고 새제품인건 맞네요^^,[]
5,새로운 타건감을 원하시면 추천합니다. 전에 M사 청축 키보드를 2년 정도 쓰다가 갑작스럽게 뽐뿌가 와서 질렀습니다 후기나 타건영상도 참고해서 구매했는데 받아서 타건해보니 좋습니다 소리도 그렇게 크지 않고 통울림도 거의 느껴지지 않습니다. 이걸로 또 얼마간은 즐겁게 타이핑 할 수 있겠네요 ㅎㅎ,[]
1,절대 사지마세요.⭐️⭐️⭐️본사 놈들도 똑같다불량 교체 해준다면서 결국엔 내가 보낸 제품 그대로 뜯어보지도 않고 보내줬더라내가 지치고 힘들고 피곤해서 다시 전화 안함여러분 그냥 애초에 돈들여서 비싼거 사세요이 회사꺼는 사면 안됩니다.,[]
5,기계식 키보드는 처음인데 확실히 일반 러버돔식보다 키감 느낌이 더 좋은것 같습니다.리니어방식을 선택해서 클릭식보다는 소리가 작네요.키캡도 투톤이고 키보드 라이트는 색상을 지정할 수 있는 RGB방식은 아니지만 이가격에고사양 제품의 성능이 필요치 않다면 처음 사용하는 기계식 키보드로서 굉장히 만족합니다.,['https://shopping-phinf.pstatic.net/20180623_11/daef6696-c97e-4fbf-a9c2-481de1795c41.jpg?type=f287']
5,"배송 상태: 빠르고 (휴일빼고 1일), 파손, 빠진 물건 없이 잘 왔습니다.키감: 적당한 저항감, 경쾌한 클릭. 바닥에 닿는 느낌 좋습니다.LED: LED에는 별 신경 안써서 모르겠네요. 밝기, 효과 테스트해봤는데 다 잘됩니다.키감이 매우 좋아 추천합니다.",['https://shopping-phinf.pstatic.net/20180819_2/16f41228-bda0-4bf0-b600-4c7dc20f49fd.jpg?type=f287']
5,"좋아요 일단 키보드에 브러시를 따로 주어 먼지를 자주자주 털어낼 수 있다는게 좋았습니다.키보드를 항상 쓰면 더러워지고 청소하기 힘들어서 오래 못쓰는게 단점이었는데, 이게 보완되는 것 같아요.그리고 무엇보다 광축이라그런가 소리가 청축에 비해 훨~신 안들립니다.밤에 작업하실 때 특히 이 장점이 돋보이는 것 같네요.그리고 가장 중요한 성능.이건 자세히 모르지만 그냥 좋은거같아요 ㅋㅋㅋ",[]
5,"저의 생활중 가장 많이 저의 손과 미팅을 하는 k662 v1 모델 사용기 입니다.저의 자리에서도 가장 많은 비중을 차지하고 제가 사용하는 제품중 가장 소리나 비쥬얼적인 면모에서도 존재감을 발현하고 있는 제품입니다. 학생들을가르치다 보니 학생들이 신기해서 만져보기도 하고 궁금해하기도 하면서, 어떨때는너는 일하는 티가 나는 건가 생각하게도 한답니다.^^",['https://shopping-phinf.pstatic.net/20180622_28/771062fd-62d1-4dca-818e-b9c1bad96474.jpg?type=f287']
5,"앱코 k662 정말 좋네요 쓰던 키보드가 고장나서 급하게 구매하려고 알아보다가 앱코 k662 키보드를 구입하게 되었는데 직접 상품을 받아보니 디자인, 사용감, 기능 뭐 하나 부족한게 없는것 같습니다. 배송도 너무 빨리와서 만족합니다. 다음에 기회가 된다면 또 구매할 의향이 있습니다.",['https://phinf.pstatic.net/checkout/20180722_181/1532249795405r4AEL_JPEG/PRREW_4199582054352446727.jpg?type=f287']
5,"기계식 키보드를 이렇게 저렴한 가격에 쓰게 되네요! 사무실에서 사용할 거라 리니어 버전으로 구매했는데 딱 적당한 소음에 적당한 키감이라 잘 선택한것 같습니다! 이 가격에 악세사리도 여러개 주는것도 좋은데, 완전 방수가 가장 마음에 드네요! 사무실이라 먼지가 많은편인데, 금요일 퇴근전에 물로 살짝 행궈 놓으면 될듯합니다! LED는 단백색이라 깔끔합니다.",[]
4,카일축은 처음 사용하는거라서 고민좀 했는데요. 사용해보니 충분히 만족합니다. 전에는 체리 적축 사용했는데 그보단 좀더 타이핑하는 맛이 있네요.단지 포장스티커인가 그거 이미 칼로 열려있었는데 반품할생각은 없어서 크게 문제는 없지만 이유를 모르겠네요.,['https://shopping-phinf.pstatic.net/20190301_0/cc5fe2b9-8894-4e7c-9dca-5ecb271b3660.jpg?type=f287']
5,배송 정말 빠르구요 제품 만족도도 최고입니다.디자인 깔끔하고 타건감도 좋고서걱서걱 하는 것이 계속 키보드를 누르고 싶어지는 충동을 갖게하네요리니어 적축 키보드라 소리도 조용하면서특유의 그 느낌을 갖게하기 때문에 상당히 매력적인 상품이라고 봅니다 조용한 사무실에서도 무리가 없을 것 같습니다,[]
1,지금껏 물건 사본중에 제일 최악입니다 봉인스티커는 잘려져있고 박스를 들어보면 달그락 소리가 나서 열어보니 키보드교체툴이랑 먼지털이 내용물이 비닐에 싸여져 있지도 않고 뒹글고 있습니다 이 부분은 원래 그런건지 모르겠으나 암튼 봉인 스티커 뜯긴 제품 받아보긴 처음입니다 판매자 너님 최악입니다 구매자는 새제품을 산것입니다 한번이라도 뜯었다면 그게 중고지 새겁니까 이건 뭐 이중씰도 아니고 보란듯이 뜯겨져있으니... 11번가에서 물건사면 내가 남자가 아니고 여잡니다 이제~,[]
5,"배송도 매우 빨랐고 제품은 지금 사용함에 있어서 품질에 매우 만족합니다. 제가 원했던 키감과 소리, 다 좋은데 제품의 봉인이 뜯겨진 상태로 배송이 되는 건 문제가 있네요. (새제품이 아니라 중고제품인지 의심이 되니까요) 판매자께서 이점만 신경을 써주신다면 좋겠습니다.",[]
4,기계식 키보드는 처음 사용해보는데 타격감이 경쾌하고 좋습니다.멤브레인 키보드와 비교 샷입니다~그리고 키보드가 생각보다 무게감이 있습니다.책상에 척하고 붙어서 안움직여서 좋습니다.키보드 Lock 버튼 해놓으면 아이들이 장난치며 눌러도 하던일에 지장이 없어서 좋습니다.13가지 LED 액션도 이쁩니다.멤브레인 키보드만 쓰다가 기계식 키보드를 쓰니 집에서 쓰기에는키보드 타격음이 생각보다 크게 느껴지기는 합니다.암튼 좋네요~!,['https://shopping-phinf.pstatic.net/20180710_1/b1687110-b762-4662-9537-339f59807fe6.jpg?type=f287']
5,이가격에 이정도면 아주 훌룡합니다 디자인도 클래식한게 딱이도 클릭감도 쫄깃한게 맘에 듭니다 다만 .. 다른분들이 불만이였던 봉인실 훼손상태는 개선을 해야할듯합니다 그래도 나름 5만원이 넘어가는 가격인데요 신경 써주시기 바랍니다 그외에는 이가격에 완벽할만큼 맘에 듭니다,[]
5,어제밤에 도착해서 게임 몇번 해보니 사용감이 좋습니다. 가격도 저렴하고 무엇보다 예쁘네요 ㅎㅎ 투명커버에 피씨방 문구 스티커도 따로 있어 붙여서 사용후에 덮어놓으니 좋네요. 키보드 자체 무게감도 있고 하단 고무로 안움직이고 좋습니다.,['https://shopping-phinf.pstatic.net/20180729_14/8d15194f-55e5-4296-a640-04480425ea15.jpg?type=f287']
4,기존 카일 청축을 사용했습니다. 카일 청축보다는 확실히 무게감이 느껴지고 그만큼 소음도 적습니다. 제품 성능은 전반적으로 기대했던 만큼 나왔는데 제품씰이 뜯겨서온게 아쉽네요. 물론 사용한흔적은 없어보이지만 그래도 리퍼제품인지 새제품인지 알 방법이 없다는게 아쉽습니다. 또한 판매자분이 당일발송하시는건 좋은데 이용하시는 택배사(로젠택배)가 물량대비 인력이 적은지.. 배송은 몇일걸렸네요.,[]
5,주말에 주문해서 오늘 받았네요.배송은 빠르고 좋습니다~기계식키보드를 처음 써보는데 뭐를 살까 고민을 많이 하다가마우스랑 뭔가 세트로 맞추고 싶어서 앱코 해커 제품을선택하게 됐습니다. 물론 타건음과 키감은 상당히만족스럽습니다. ESC 키는 추가로 해커로고 레드컬러 키가추가구성되어있어서 오자마자 바로 갈아꼈습니다 ㅋㅋ좀 더 써봐야 정확한 성능을 체감하겠지만기계식키보드의 기대를 결코 져버리지 않는 제품이네요.,[]
4,처음으로 기계식 키보드 검색 해보고 구입 했습니다. 성능은 뭐 무난 합니다. 그러나 봉인스티커가 잘려져 배송이 되었습니다. 이게 중고 인지.. 아니면 새 제품인... 걱정입니다. 이부분에서는 개선을 해야 할것 같습니다. 제품 사진과 박스 사진 올려보아요,[]
3,물건은 괜찮은거 같은데... 물건은 깔끔하니 괜찮은거 같은데.... 개봉씰이라고 해야하나요???스티커 같은건 이미 뜯겨져 있고... 게다가 다리도 들어있을줄알았는데... 안들어가 있고.... 쪼매 거시지 혀요.... 그래도 돈주고 새제품 사는건데.... 왠지 헌물건 받은 느낌???,[]
5,게임용보다는 사무용으로 구입했는데 타이핑이 아주 부드러워서 좋구 저처럼 독수리타법인 사람들에게 더욱 권해드리고 싶네요. 누르는 재미도 있고 기계식이라 타이핑 소리가 있긴하지만 자판에 빛이 발산되니까 눈에 쉽게 띄여서 누르기 좋네요. 근데 장패드는 이벤트에 참여해야만 주나요? 배송은 빨라서 만족합니다.,[]
5,좋아요~ 가성비 갑갑 청축은 너무 시끄러울것 같다고 생각을 많이 한편인데..그래도 소리가 아예 없지는 않기를 바라고 리니어를 구매했습니다. 배그할때 팀원들한테 큰 불편감없이 제가 타자치는 재미는 있고 적당한것 같습니다.디자인도 매우 마음에 듭니다. 감사합니다~,[]
5,"음량 조절이 Fn키 말고 전용으로 있었으면 더 좋았겠지만..
키보드 묵직하고 괜찮네요
다만..다른키보드 한영 누르던거 생각하고 누르면 스페이스바가 있는..
밝기도 조금더 어둡게 할수있으면 좋을꺼같긴한데
눈부신정도는 아니니",[]
5,구매한지 하루만에 7천원 할인 특가가 떠서 슬픕니다. 하지만 키보드 정말 이쁩니다. 다른 키보드 사려다 led불빛에 홀려서 구매해버렸습니다. 누를 때 마다 점멸되는 거 진짜 이뻐요. 근데 갈축정도의 소음을 원했는데 그냥 청축소음이네요. 소음에 민감하신 분이면 나중에 리니어로 구매 고려해보세요. 키캡하고 led로 비주얼 짱짱입니다. 레인보우 엘이디 안한거 최고.,[]
5,"정말 이렇게 좋을줄 상상도 못했어요.
몇개 더사고 싶어요~~

자꾸 컴퓨터만 켜게 되네요~~~^^ 넘 좋습니다.","['https://phinf.pstatic.net/image.nmv/shopnbuyer_2020_09_09_0/d9edf47d-f274-11ea-a986-48df379cca40_03.jpg?type=f287', 'https://phinf.pstatic.net/checkout/20200909_105/1599639364348OoYlO_JPEG/review-attachment-8bdd8c83-c171-4e54-9eec-35e9cd52308c.jpeg?type=f287', 'https://phinf.pstatic.net/checkout/20200909_127/1599639364904Y7hmO_JPEG/review-attachment-fee97e0a-8a5f-4089-a5cd-88c02bc3d78c.jpeg?type=f287', 'https://phinf.pstatic.net/checkout/20200909_258/1599639364895jCb0I_JPEG/review-attachment-79f33404-0e32-47b1-adbe-ce1dfb1c5bcc.jpeg?type=f287', 'https://phinf.pstatic.net/checkout/20200909_66/1599639364995JKam5_JPEG/review-attachment-77bd8f85-4b4a-4238-aadf-7c7674e00ed4.jpeg?type=f287', 'https://phinf.pstatic.net/checkout/20200909_34/1599639365351VeLhH_JPEG/review-attachment-98ae2172-7d7b-4e3b-95e1-fa65fd724f71.jpeg?type=f287']"
5,k660이 유명해서 찾아보다가 우연히 k662를 발견했는데 너무 예뻐서 구매했어요 k660이 유명해서 찾아보다가 우연히 k662를 발견했는데 디자인이 너무 예뻐서 이거로 구매했어요!타건감도 너무 좋고 저처럼 키보드 잘모르는분들은 이거 사시면 대만족 하실겁니다.,['https://phinf.pstatic.net/checkout/20180821_289/1534835505845hHtGV_JPEG/KakaoTalk_20180821_154938794.jpg?type=f287']
5,"적극 추천합니다 처남 생일선물로 사줬습니다.처남이 선물을 받고 기분좋아하니 저도 덩달아 기분이 좋습니다. 가성비가 좋다라는 말은 굳이 처남에게는 하지 않았지만,이 제품을 살까말까 고민하시는 분들에게는 적극적으로 말씀 드리고 싶습니다. 가성비가 훌륭합니다.",[]
4,따다다닥따다다닥 아주 좋네요. 쫄깃쫄깃한게 오타도 많이 안나고 좋아요.색상또한 지겹지도 않고 화이트 불빛으로 나오는게 다른 다양한 색 나오는거 보다 더 좋은거 같아요.기계식이라고해서 많이 씨끄러울줄 알았는데 그렇지도 않고 적당하네요,[]
5,배송 솔직히 하루도 안걸림.. 어제 오후3시쯤에 주문했는데 온거는 오늘 오후 1시 되기전에 문자와있네요 당황했음...무슨 택배가 이렇게 빨리오지 ㅋㅋㅋㅋ정말 배송 빠르고 키보드는 좀따 확인해야하디만!구매평 엄청 좋은걸로봐서는 헿 믿고 잘쓸게여!,[]
5,"사무실에 하나 더 샀어요.
세게치면 통울림이 있어서 좀 살살쳐야 해서 신경쓰이지만
키보드를 많이 치는 건 아니라서..ㅎㅎ

게임용 키보드같이 않보이고
너무 센스있어 보이고 이쁘네요.","['https://phinf.pstatic.net/checkout/20200925_227/16009903931782XAMv_JPEG/review-attachment-21a873b2-42dc-4f0f-bc5d-3bc6f77794a9.jpeg?type=f287', 'https://phinf.pstatic.net/checkout/20200925_81/1600990393952CmiWc_JPEG/review-attachment-018580f7-3859-4817-a46a-6bc02335db7b.jpeg?type=f287', 'https://phinf.pstatic.net/checkout/20200925_163/16009903945452jBY9_JPEG/review-attachment-30565f43-50d5-445d-b87c-91a8d01f5206.jpeg?type=f287', 'https://phinf.pstatic.net/checkout/20200925_128/1600990394637Bw1jy_JPEG/review-attachment-cde952b6-ec76-48a8-baba-f3e8f6dbf652.jpeg?type=f287']"
5,키감 좋고 배송도 안전하게 왔어요 ~ 사람들이 많이쓰는이유를 알겠네요~~,"['https://phinf.pstatic.net/checkout/20200830_100/1598715270574BAaAE_JPEG/review-attachment-caae4d85-b3a3-4959-add0-c7e44cb7dd0b.jpeg?type=f287', 'https://phinf.pstatic.net/checkout/20200830_1/1598715286456jjFgU_JPEG/review-attachment-90c923e0-53d4-453b-9a96-f9a4c73c6198.jpeg?type=f287', 'https://phinf.pstatic.net/checkout/20200830_294/1598715292293tpx66_JPEG/review-attachment-4e942368-5a30-400c-b6c4-c9eeb4db522d.jpeg?type=f287', 'https://phinf.pstatic.net/checkout/20200830_53/1598715299332MFFdj_JPEG/review-attachment-428782c2-20b6-4914-9817-28a5467043bc.jpeg?type=f287']"
5,소음도크지않고 사각거리면서 부드러운키감이 오타를줄여주누느낌이에요,"['https://phinf.pstatic.net/checkout/20200922_8/16007614912116asXr_JPEG/review-attachment-46a90c78-cbe6-4dcb-b402-be4c2948bffd.jpeg?type=f287', 'https://phinf.pstatic.net/checkout/20200922_121/1600761491288UIFeQ_JPEG/review-attachment-c485b42e-7c58-4b31-b3bf-a6dbccd948ea.jpeg?type=f287', 'https://phinf.pstatic.net/checkout/20200922_210/1600761491279o7PHh_JPEG/review-attachment-4a4184c5-da11-4e41-900c-93d89e18af95.jpeg?type=f287']"
4,이제 뜯어서 쓰는데 키감도 좋고 아직은 좋은 것 같아요,"['https://phinf.pstatic.net/checkout/20200908_240/15995235255057FuJz_JPEG/review-attachment-497d5b67-39d9-409e-bf4e-93049c2b65b7.jpeg?type=f287', 'https://phinf.pstatic.net/checkout/20200908_224/1599523525977GBuqE_JPEG/review-attachment-61244146-e12e-45fa-97d1-3ea3955c5110.jpeg?type=f287', 'https://phinf.pstatic.net/checkout/20200908_19/1599523526092jgseH_JPEG/review-attachment-47d7d6eb-1819-4565-a5f9-7db127b4c5f7.jpeg?type=f287']"
5,"너어무 만족해요!!!!
키감도 좋고 무게도 묵직하니 좋고
키보드를 너무 사고싶었는데
이가격에 이키보드라니 !!!구웃!!!입니다","['https://phinf.pstatic.net/checkout/20201126_289/1606357517604O7ETf_JPEG/review-attachment-ddca73c8-5de7-43aa-a491-73604edb27fd.jpeg?type=f287', 'https://phinf.pstatic.net/checkout/20201126_107/1606357523673bayJT_JPEG/review-attachment-414b449c-814d-47ec-bd78-1f24240e0a86.jpeg?type=f287']"
5,"키보드감도 소리도 아주 좋습니다.
색감도 차분하면서 포인트도 나름 있고 모두 만족하네요. ^^
강추합니다.","['https://phinf.pstatic.net/checkout/20201128_213/1606535580714fgXJr_JPEG/review-attachment-188be5d7-d677-4c57-9fb6-9c70c5aa4107.jpeg?type=f287', 'https://phinf.pstatic.net/checkout/20201128_127/1606535580724bLedI_JPEG/review-attachment-eb596e0d-29b3-47d4-9f5d-e4bfb6e02226.jpeg?type=f287']"
5,"가성비 좋습니다.
솔직히 키보드 바뀐다해서 게임 잘해지는거 아니잖아요?
클래식 감성으로 한번 써보세여","['https://phinf.pstatic.net/checkout/20201104_85/1604489835870piaKo_JPEG/review-attachment-65b867d5-cb80-448b-9451-6f53a3728524.jpeg?type=f287', 'https://phinf.pstatic.net/checkout/20201104_297/1604489836703Rq7dq_JPEG/review-attachment-f7878509-168e-4ee3-9259-2fbf045c20f8.jpeg?type=f287']"
5,배송 빠르고 포장 튼튼히 잘 되어 왔어요,"['https://phinf.pstatic.net/checkout/20201111_129/1605067185160NKbJQ_JPEG/review-attachment-fc22e39e-9e31-4758-bd43-1a40cdf64a38.jpeg?type=f287', 'https://phinf.pstatic.net/checkout/20201111_217/1605067252249lxAsA_JPEG/review-attachment-7950d3b4-eb46-4d21-9794-37dc86a2935a.jpeg?type=f287']"
5,너무 마음에 들어요 소리도 마음에 들고 누르는 감각도 좋고 제 인생 최고의 키보드입니다,"['https://phinf.pstatic.net/checkout/20201105_162/1604505930738WK1EK_JPEG/review-attachment-eaa680c4-dea7-44c9-b987-3991a42447cd.jpeg?type=f287', 'https://phinf.pstatic.net/checkout/20201105_154/1604505937370r3NSy_JPEG/review-attachment-d624e966-cae5-4f8b-8284-3eaba97f76f3.jpeg?type=f287']"
5,배송이 아주 빠르고 물건도 좋내요,"['https://phinf.pstatic.net/checkout/20201019_226/1603060922681yXwW6_JPEG/review-attachment-dc24e554-bbde-4e6c-b655-ddfc550bf896.jpeg?type=f287', 'https://phinf.pstatic.net/checkout/20201019_162/1603060925517SBrRX_JPEG/review-attachment-8b7bec01-005b-46a3-a2b4-d733dd2ed3b8.jpeg?type=f287']"
5,색상 단순하고 그렇게 화려하지 않아서 좋음 v1 리니어 타자 키 소리 안나서 좋음,"['https://phinf.pstatic.net/checkout/20201026_246/1603691799268Foq2R_JPEG/review-attachment-0cc70397-1c90-4a40-98f4-d28fe9a93d03.jpeg?type=f287', 'https://phinf.pstatic.net/checkout/20201026_46/1603691816023tmtoO_JPEG/review-attachment-94d52f01-9ca1-4b53-95fa-69c0c7ddc90a.jpeg?type=f287']"
5,오자마자 냥이한테 박스뺏겼네욬ㅋㅋ 우선 키감도좋고 너무무겁지도않고 너무가볍지도않아서 좋아요! 아래는 고정이잘되어있고 안움직여서 안정적이여서 좋네여 오래쓸수있으면 좋겠어요!,"['https://phinf.pstatic.net/checkout/20200204_298/1580793670805R1O5D_JPEG/20200204_131819.jpg?type=f287', 'https://phinf.pstatic.net/checkout/20200204_97/1580793670005TH3GR_JPEG/20200204_131834.jpg?type=f287', 'https://phinf.pstatic.net/checkout/20200204_206/1580793754924JJHB6_JPEG/20200204_142227.jpg?type=f287', 'https://phinf.pstatic.net/checkout/20200204_297/1580793669845WnDpE_JPEG/20200204_132117.jpg?type=f287']"
4,"2틀만에 받았습니다..
포장상태는 비닐에만 넣어서 와서 좀 아쉬웠고(박스찌그러짐)

일단 제품은 만족합니다.
생각보다 색상과 디자인 만족스럽네요.
고가의 기계식보단 별로지만 LED가 참 이쁘네요 ㅎㅎ
잘산거같아요!!","['https://phinf.pstatic.net/checkout/20200822_58/1598070215985rJ8SS_JPEG/review-attachment-70f8d14f-fcd3-4762-84fd-e9872059ab7e.jpeg?type=f287', 'https://phinf.pstatic.net/checkout/20200822_40/1598070215997tWYpO_JPEG/review-attachment-1978bd61-8306-490d-b479-6d73f5cd117e.jpeg?type=f287']"
5,"제품이 알록달록하니 이쁘네요. 보내주신 추가 키캡도 포인트로 잘쓰도록 하겠습니다. 제품자체도 기본에 충실해서 좋구요, 덮개도 구성품에 있어서 먼지유입 걱정도 덜었습니다.","['https://phinf.pstatic.net/checkout/20200529_145/1590746995462tfocm_JPEG/20200529_190248.jpg?type=f287', 'https://phinf.pstatic.net/checkout/20200529_16/1590746997035Qhjsh_JPEG/20200529_190253.jpg?type=f287', 'https://phinf.pstatic.net/checkout/20200529_131/1590746998875HUSsP_JPEG/20200529_190311.jpg?type=f287']"
5,"원래 같은 제품(색만다름) 제가 쓰다가 동생도 이번에 컴 맞춰서 같은걸로 샀습니다
가격대비 매우만족
저는 지금 4개월째인데 고장도 안나고 잘쓰는중이요~","['https://phinf.pstatic.net/checkout/20200919_99/1600448651379sU8GS_JPEG/review-attachment-aa897e5b-a395-4a28-95f4-0d9f1bd8080c.jpeg?type=f287', 'https://phinf.pstatic.net/checkout/20200919_145/1600448634776EG4Wg_JPEG/review-attachment-9b5e3f02-9420-4ef0-b49a-fbc976108da4.jpeg?type=f287']"
5,"기계식 키보드는 처음 접해봅니다.
지인 추천받아 광축키보드중에 앱코제품 구매하게됐는데 키감 만족스럽습니다.
FPS게임을 즐겨하는데 반응속도도 빠르고 적극 추천하고싶은 제품이네요~
좋은 상품 주셔서 감사합니다!","['https://phinf.pstatic.net/checkout/20200820_208/1597851269439BBCSy_JPEG/review-attachment-1b8997cd-282a-4370-a4a1-2c9e9de45fb1.jpeg?type=f287', 'https://phinf.pstatic.net/checkout/20200820_12/1597851288559erfVE_JPEG/review-attachment-bfe06f1b-2c3c-4b52-916a-382adfaa6879.jpeg?type=f287']"
5,"배송이 진짜 빠릅니다.
그리고 리니어 제품 처음써보는데 좋습니다!
제일 맘에드는 건 디자인입니다. 디자인 너무너무 귀여워요옹 흰색 회색의 조합과 ESC키의 빨간 키캡이 정말 포인트네요! 너무 만족하고 잘쓰려구요~~","['https://phinf.pstatic.net/checkout/20200909_92/1599618628699cSmD5_JPEG/review-attachment-3c209c58-2634-4607-8b4d-c5ab5a1f45a8.jpeg?type=f287', 'https://phinf.pstatic.net/checkout/20200909_15/15996186292400WpaE_JPEG/review-attachment-5450db3d-0c3e-4f39-8694-3c9c43901007.jpeg?type=f287']"
5,제품 너무 맘에 듭니다. 디자인도 그렇고 키감도 쫀득한게 기대보다 더 좋았습니다. 가성비가 너무 좋은 키보드인 것 같습니다. 그리고 배송도 빨라서 좋습니다.,"['https://phinf.pstatic.net/checkout/20200821_7/1597988924216lCEth_JPEG/review-attachment-a64f4224-f217-424f-a856-868693264f33.jpeg?type=f287', 'https://phinf.pstatic.net/checkout/20200821_44/1597988927138cF62p_JPEG/review-attachment-5beaaece-c4b3-4e58-9fab-c04837763fcc.jpeg?type=f287']"
5,"상당히 배송이 빠름 주문한지 2일?만에 온거같음
스크레치도 없고 제품상태 만족","['https://phinf.pstatic.net/image.nmv/shopnbuyer_2020_08_08_0/7743b2e1-d95e-11ea-8718-505dac8c3639_03.jpg?type=f287', 'https://phinf.pstatic.net/checkout/20200808_8/1596881047582275tA_JPEG/review-attachment-fda957f3-f232-4a2c-8733-65b71e422db1.jpeg?type=f287']"
5,쓰고 만족스러워서 선물용으로 하나 더 샀습니다. 새로 산것도 맘에 드네요,"['https://phinf.pstatic.net/checkout/20200901_28/1598948823993Ym5yz_JPEG/review-attachment-ea1223e3-10da-46ef-8b52-68e646223dd3.jpeg?type=f287', 'https://phinf.pstatic.net/checkout/20200901_249/1598948830148UOG70_JPEG/review-attachment-962ea588-0377-462b-b2fe-197d4b7d9a69.jpeg?type=f287']"
5,"깔끔하고 키감이 좋네요
추천합니다!","['https://phinf.pstatic.net/checkout/20200821_254/1597982792897GscbW_JPEG/review-attachment-366cefd1-efb4-4d28-860d-742c7fa87934.jpeg?type=f287', 'https://phinf.pstatic.net/checkout/20200821_278/1597982793913vXlXz_JPEG/review-attachment-ae129835-8f24-477c-8138-a38f4b6c18a7.jpeg?type=f287']"
5,소리도 너무 좋고 깔깜하네요^^,"['https://phinf.pstatic.net/image.nmv/shopnbuyer_2020_08_19_0/81a704b4-e20d-11ea-8718-505dac8c3639_03.jpg?type=f287', 'https://phinf.pstatic.net/checkout/20200819_247/1597835815685GqR6C_JPEG/review-attachment-be83a994-d46a-403a-bd37-338975c7c102.jpeg?type=f287']"
5,"매우 좋습니다. 치는 느낌이나 디자인 전부 마음에 들어요.
다른 앱코 해커 K시리즈 중에서 가성비 대비 좋은거 같습니다.
그리고 빠른 배송과 적당한 포장까지 만족합니다.","['https://phinf.pstatic.net/checkout/20200805_223/1596603174191ni8s3_JPEG/review-attachment-e53efcdd-09f0-428e-8bff-ac639011d4d2.jpeg?type=f287', 'https://phinf.pstatic.net/checkout/20200805_253/1596603280075QmWps_JPEG/review-attachment-9798792d-21ba-4016-9ca3-cce8d232d533.jpeg?type=f287']"
