star_point,comment,photo
5,"적당한 가격의 합리적인 키보드!!입니다.
고민하는 시간에 배송만 늦어질뿐~
배송: 정말 빨랐어요
제품: 생각보다 부드러운 키감,파스텔의 색상으로 인테리어효과있고 동그란 키판이 익숙해지면 오타없이 빨리 칠 수 있을 것 같아요. 저는 개인적으로 블루투스 연결보다 리시버연결이 편해서 이 제품 선택했는데 노트북 연결도 바로 잘 되고 편해여~
고객응대:🌟🌟🌟🌟🌟처음 받았을때 불량이었는데 바로 빠르게 새제품 교환해주셔서 감동했습니다. 빠른 고객 서비스에 믿음이 갑니다. 주변 친구들에게도 홍보하러 갑니다!! 키보드 글자만 안 벗겨지고 오래쓰길 바랍니다~ 앞으로 엑토에서 다른 제품도 구매해보고 싶습니다.
지금 새제품 교환 받자마자 리뷰 다시 쓰는데 지금은 리시버 전류도 신경쓰이지 않고 불빛도 제대로 들어옵니다. 추천!!!","['https://phinf.pstatic.net/checkout/20201117_152/1605614397885bI2RI_JPEG/review-attachment-a5653d26-7172-4ffc-902d-dbed61d10589.jpeg?type=f287', 'https://phinf.pstatic.net/checkout/20201119_222/1605785578043Sa2Ka_JPEG/review-attachment-97efd8ee-ae42-4f11-a443-878b027f2724.jpeg?type=f287']"
3,"스위치 용으로 구매했는데 리시버가 있는 제품에 너무 귀여운 디자인에 핑크라 구매했습니다! 디자인도 가격도 너무너무 마음에 드는데 처음에는 배송할 때 잘못와서 박스가 많이 구겨졌다고 생각했는데 열어보니 원래 그랬던 제품인것 같다는 생각이 들더라구요! 리뷰 영상 촬영하다가 리시버가 안들어가서 이상하다 싶었는데 가운데가 어디 찍힌 것 처럼 휘어져있어서 펴주었고, 그렇게 하니 인식은 잘 되는데 키보드에 전체적으로 어디 쓸린 것 같은 상처가 많았습니다ㅠㅠ
그래서 전체적으로 새제품 보다는 중고 제품같다는 인상을 받았어요!
사진상에서는 필터어플로 찍은 사진이라 잘 안보이지만 30cm정도 거리에서 봐도 크게 느껴지는 상처입니당..ㅠㅠ
교환할까 고민했지만 요즘 시기에 택배받는게 불안하기도 하고 게임할때 하루라도 빨리 써보고 싶어서 교환하지 않고 스티커를 붙여서 사용하기로 했어요:-)
혹시 이런게 민감하신 분들은 꼭 감안하시고 구입하시길 바래요!","['https://phinf.pstatic.net/checkout/20200611_239/1591858340468z3qbW_JPEG/IMG_2806.JPG?type=f287', 'https://phinf.pstatic.net/checkout/20200611_101/1591858340555IMTAp_JPEG/IMG_2804.JPG?type=f287', 'https://phinf.pstatic.net/checkout/20200611_277/1591858340571BX29C_JPEG/IMG_2805.JPG?type=f287']"
5,무선 키보드 두개샀는데 하나는 컴퓨터 하나는 스위치 게임기에 연결하려고 샀어요 스위치는 블루투스지원은 안하지만 이렇게 리시버 있는 제품은 별도 없이 바로 연결해서 빠르게 타자치기 가능합니다 동숲할때 특히 아이템같은거 검색할때 엄청편합니다 스위치 있으신분은 꼭 구매하세요!,"['https://phinf.pstatic.net/image.nmv/shopnbuyer_2020_06_02_0/80d998a6-a47e-11ea-b3f4-48df379ccacc_03.jpg?type=f287', 'https://phinf.pstatic.net/checkout/20200602_187/1591067368495g1MfG_JPEG/F6048208-9299-4383-97A7-38D6E95B36F9.jpeg?type=f287']"
4,"usb방식의 무선제품이 따로 있는점이 좋았고, 75배열인 점도 마음에 듭니다. 소리도 완전 조용하지는 않지만 딱 적당합니다.
스테빌도 정상적이라 스페이스바 같은 키도 가장자리 눌러도 잘 되네요. good~!

전원 on/off 키가 따로없는건 아쉽네요...",['https://phinf.pstatic.net/checkout/20200907_145/1599408709925ye3gv_JPEG/review-attachment-684a63ba-f4a2-4e08-b0a8-58ceece667d4.jpeg?type=f287']
5,"이뻐요 연결도 플러그꼽으면 1분기다렸다가 바로돼요 편함 소음도 별로없고 키감도 적당히 ㄱㅊ 무겁지도 않음 휴대하기도좋을듯. 근데,, 살짝 높아서 오래 사용하면 손목살짝아플듯 근데 2만원에 이정도스펙이면 불평없이 잘쓸듯요 ㅎㅎ",['https://phinf.pstatic.net/checkout/20201009_122/1602211185654spJGy_JPEG/review-attachment-0af14a94-0676-46b4-be85-75ebb838756d.jpeg?type=f287']
4,딸아이가 구매요청 해서 구매 했어요. 색상 디자인 다 맘에 든다고 합니다. 자판 칠때 탁탁 소리나는게 느낌도 좋다네요. PC방 자판에 나는 소리랑 같다고 그자판 좋아하시는 분들은 만족하실꺼라고 합니다. 가격도 저렴하고 배송도 빠르고 만족합니다. 추천해요.,"['https://phinf.pstatic.net/checkout/20200501_130/1588291456001Jz8tl_JPEG/20200428_212407.jpg?type=f287', 'https://phinf.pstatic.net/checkout/20200501_182/1588291461287rId8q_JPEG/20200428_212405.jpg?type=f287']"
5,동물의숲할때 타자치는게 너무 불편해서 키보드를 구입하게되었어요 일단 색감이 너무 예쁜 파스텔 보라색이고 동글동글해서 너무 귀여워요ㅠㅠ 연결도 되게 쉽고 잘 되서 만족합니당 키보드때문에 편지 잘 안썼었는데 이제 편지쓸때 편하게 쓸 수 있어서 넘 좋아요!,['https://phinf.pstatic.net/checkout/20200715_71/1594801053353b6e3R_JPEG/review-attachment-b20c4a7d-448b-47d9-b146-f33f3316a029.jpeg?type=f287']
5,처음에는 어색했는데 몇번 사용하니 금방 익숙해져서 저는 좋았어요^^* 타다닥 타자감이 저는 개인적으로 좋고 크기가 생각보다 크기는 한데 집에서 사용할거라 오히려 크기는 괜찮은 거 같아요 색도 제가 좋아하는 거라 기분좋게 잘 사용할 것 같아요~,['https://phinf.pstatic.net/checkout/20200825_287/1598357811587HsD7G_JPEG/review-attachment-fff149b4-4913-41e7-b167-8c640d3f4fca.jpeg?type=f287']
4,보기는 좋아요 책상에 올려놓으면 예쁘고 레트로 타자기 갬성.. 하지만 키보드는 입력장치잖아요? 키가 전체적으로 너무 높아서 오래 치기 힘들고 손가락이 키에 걸려 오타나기가 쉽습니다. sns 글정도 치는 용도면 괜찮지만 타자를 많이 쳐야되는 상황이라면 그리 적합하진 않습니다. 입력음은 크거나 작지 않은 보통입니다.,['https://phinf.pstatic.net/checkout/20200410_240/1586501513850PjhoO_JPEG/20200410_153459.jpg?type=f287']
5,"처음에는 배송이 느린것같아서 좀 짜증이 났엇지만
물건 받으니까 그런 짜증같은건 잊어버렸어요,
라벤더 색상 구입햇는데...기분이 너무 좋아지네요..색깔효과^^
젤 중요한 키보드는 넘 부드럽고 좋습니다
뭔가 일을 많이 하는 생각 ??ㅋㅋㅋ
좋은 물건 주셔서 감사합니다",[]
5,배송은 그냥저냥이었고 제품은 마음에 드네요. 미니키보드라 숫자키패드가 없어서 살짝 불편하지만...알고 산 거라 상관은 없고 전체적인 키감은 멤브레인방식에서 느끼는 딱 그 키감이에요. 기대값에서 더하지도 덜하지도 않아서 5점입니다.,[]
5,디자인 깔끔하고 맘에 듭니다. 키감도 독특한게 괜찮아요 소음도 크지 않은 편이구요. 다만 오른쪽이 일반적인 키배열이랑 좀 달라서 적응 기간이 필요할 듯 하고 생각보다 크기에 비해 무게감이 있습니다. 블루투스 버전도 사려고 했는데 좀 생각해봐야겠어요 ㅎㅎ,[]
5,"일단 상품 자체가 너무 예뻐요. 색도 잘 뽑았고, 사이즈도 적당해서 좋아요. 상품 자체에 오염, 흠집 전혀 없고, 당연 하자도 없습니다. 받자 마자 바로 사용했는데 느린 거 없이 바로바로 글씨가 나옵니다. 고민하지 마시고 사세요.",['https://shopping-phinf.pstatic.net/20200208_22/b1b5f874-6bc3-4aa4-81c5-9e59c1fe4097.jpg?type=f287']
2,"디자인은 정말 너무나 예쁩니다. 정말요...하지만 개인적으로는...키보드 자체 높이가 너무 높아서 손목 받침대 필수이고, 키캡높이가 높아 오타율도 높습니다. 이거 작성하면서도...몇번이나 오타가 ㅠㅠ 원형의 디자인은 너무나 좋으나 왜 거의 모든 키캡이 사각인지 알겠네요 ㅠㅠ 디자인은 별 10개도 아깝지가 않지만...좀더 적응해 볼게요~",[]
4,"귀여워요 타자치는 느낌도 좋아요
근데 색이 사진과는 좀 차이가 있어요
분홍에 가까운 연보라네요!","['https://phinf.pstatic.net/checkout/20200903_164/1599120450493y6oV7_JPEG/review-attachment-1d3bab39-03d3-48b1-b5ee-aa5c6ffc6322.jpeg?type=f287', 'https://phinf.pstatic.net/checkout/20200903_88/1599120450623b6htd_JPEG/review-attachment-af99dfac-847b-4055-9a2d-50ccd68fe9d7.jpeg?type=f287']"
4,배송 빨랐고 제품 잘 작동해요~ 색감도 예쁘고 괜찮네요 ㅎㅎ 불이 들어오면 더 좋았을뻔!,['https://phinf.pstatic.net/checkout/20201128_226/1606553800987dnQHx_JPEG/review-attachment-cd0acc64-613b-4d63-8b52-df168e0702c2.jpeg?type=f287']
5,블루투스인줄 알고 잘못 시켜서 반품할까 하다가 너무 이뻐서 그냥 사용하려구요~~근데 자판에 먼지가 쌓이면 어떻게 청소해야하나 고민이네요~~ㅋㅋ,['https://phinf.pstatic.net/checkout/20201116_239/1605507864388rD2dv_JPEG/review-attachment-4b30b34e-14d5-4d43-951f-c56bc95b614a.jpeg?type=f287']
5,"항시 대기중~
노트북 키보드로 사용하고 있어요
터치감도 좋고 아이가 만족해 합니다^^",['https://phinf.pstatic.net/checkout/20201119_38/1605788915318gTVdB_JPEG/review-attachment-1877e651-af7c-4412-8075-b5250e4942d4.jpeg?type=f287']
5,색깔도 넘 맘에들고 작고 귀여워요!! 장난감같아서 맘에 듭니다 저렴한 맛에 구매했는데 잘 쓸 것 같아요 별도의 설치도 없고 센스있게 건전지까지 챙겨주신 것 까지 맘에 듭니다ㅎㅎ,['https://phinf.pstatic.net/checkout/20201109_283/160493076964977nHb_JPEG/review-attachment-a7a4dec3-ca0a-4ed8-af23-555865bd13ed.jpeg?type=f287']
5,굿이에요 쓸만합니다 최고,['https://phinf.pstatic.net/checkout/20201111_7/1605027073859aiGRC_JPEG/review-attachment-ca81e2e5-769d-47e0-87ad-76c8a3cef903.jpeg?type=f287']
5,너무너무 좋아요 일본에 살아서 한국키보드가 필요해서 구입했어요,['https://phinf.pstatic.net/checkout/20201111_242/1605056551319ijhkd_JPEG/review-attachment-b95ee8d6-d87b-439e-983e-1f178782f84b.jpeg?type=f287']
5,이쁘고 좋아요 하지만 블루투스를 샀어야했는데 무선을 사버렸어요.아이패드용 블루투스 다시 주문하고 이건 맥북용으로 사용해야겠어요,['https://phinf.pstatic.net/checkout/20201007_126/1602055970208T1CvI_JPEG/review-attachment-64e7323c-85e3-4b27-b36e-40e3f78199e4.jpeg?type=f287']
5,"노트북 키보드가 불편하다고해서 샀는데
색상도 그렇고 터치감도 넘 좋네요~

금방 고장만 안난다면 100점! ㅎ",['https://phinf.pstatic.net/checkout/20201009_135/1602200346411TVlzh_JPEG/review-attachment-8ce0b838-3080-4eca-93fe-abedbff04d9e.jpeg?type=f287']
5,처음에는 타자하는 것이 익숙하지 않았는데 적응이 되서 편하게 사용하고 있어요,['https://phinf.pstatic.net/checkout/20201003_74/1601720755199tqCFJ_JPEG/review-attachment-d3fb78dc-206b-4028-96d4-4112cc5c61e8.jpeg?type=f287']
5,"친구 생일선물로 줬는데 괜찮다고 하더라고요.
색상은 퍼플로 했는데 실제 색감은 사진하고 비슷한 것 같아요
미니라고 해서 엄청 작을 줄 알았는데 그렇지는 않고 대충 15인치 노트북 정도 크기라고 생각하면 될 것 같아요",['https://phinf.pstatic.net/checkout/20200822_290/1598104372236E934n_JPEG/review-attachment-f175ae73-b6e7-46ae-a43d-0d8953a0cb6d.jpeg?type=f287']
4,배송도 빨랐구요 색상도 이뻐요 ㅎ 만족합니다!,['https://phinf.pstatic.net/checkout/20200820_109/1597893984648iLT1h_JPEG/review-attachment-873d2cd2-bdbe-4b09-92f3-b1f548f4cfaf.jpeg?type=f287']
5,보라색좋아해서 주문했는데 다음날 바로받았어요 ~ 너무예뻐요~ 핸드폰무선 키보드 시켰는데 이건 컴터용이네요~ 잘못시켰는데 너무 예뻐서 그냥 쓰려구요~,['https://phinf.pstatic.net/checkout/20200828_133/15985904492555E8YP_JPEG/review-attachment-84bbb9b6-f5f1-41d3-9a3e-5baf4a40501f.jpeg?type=f287']
5,디자인도 이쁘고 키보드 소리가 너무 좋아요! 이쁘게 잘쓰겠습니다~!,[]
5,실물 색이 너무 예뻐요! 타자감도 굿👍,['https://phinf.pstatic.net/checkout/20200810_213/1596988672034yonTT_JPEG/review-attachment-24354911-4743-495c-9349-627c03dcf966.jpeg?type=f287']
5,결과는 잘못샀어요ㅜ 탭엔 연결이 안되요 색상 다맘에 드는데ㅜ,[]
5,저렴히 잘 구매 했네요 잘 사용 하겠습니다 수고 하세요!,[]
5,색상도 이쁘고 잘 쓰고 있습니다,['https://phinf.pstatic.net/checkout/20200727_164/1595855450056ko4mg_JPEG/review-attachment-87e5e3dc-0222-46e2-a0d1-df4d0390bb53.jpeg?type=f287']
5,제품이 마음에 들구요 다음에 또 주문할께요,[]
5,이제품이 큰제퓸보더 품질이 더 좋습니다,['https://phinf.pstatic.net/checkout/20200706_180/1594043728289fVOGC_JPEG/review-attachment-60d13442-85b8-40d1-aec5-72cd3829968c.jpeg?type=f287']
5,색깔이 예쁘네요ㅋㅋ 깔끔하게 화이트로 구매하려다가 서브 키보드로 쓰는 거라 맘에 드는 색 구매하자고 샀는데 대만족입니당! 키감도 좋고 오타도 안 나네요!!,['https://phinf.pstatic.net/checkout/20200711_129/159446845659194g2b_JPEG/review-attachment-0dceb01a-0ad6-41d3-8d41-bde986bc3704.jpeg?type=f287']
5,완전 이뻐요~~근데 조금 누르는 느낌이 너무 깊어서~,[]
5,"예쁘고, 타자감 좋고 소음도 거의 없어요!","['https://phinf.pstatic.net/image.nmv/shopnbuyer_2020_02_25_0/b30a2a07-5796-11ea-beb4-00000000464c_03.jpg?type=f287', 'https://phinf.pstatic.net/checkout/20200225_208/1582611479597TrtFd_JPEG/5CAC2C05-3835-4230-967E-2C6E4572CC82.jpeg?type=f287']"
5,"아이패드에 연결하려고 샀는데 블루투스 기능 없는거네요
저처럼 호구되지 마시구 잘 보고 구매하시길 ㅠㅠㅠ 키감은 정말 좋아요ㅠㅠㅠ",['https://phinf.pstatic.net/checkout/20200707_263/1594115570877gAdRc_JPEG/review-attachment-6a5766e1-f227-4e32-b4cf-1080dd206870.jpeg?type=f287']
3,만족합니다 !! 아직까지 고장이 없어요,[]
4,아이가 잘쓰고 있습니다.,['https://phinf.pstatic.net/checkout/20200611_288/1591877090878r3a6T_JPEG/1591877072289.jpg?type=f287']
5,아주 맘에 듭니다.,[]
4,"버튼이 너무 깊숙이 눌리다보니 다른것도 함께 눌리는 경우가 종종 있네요
그래도 너뮤 좋아요 원하던 디자인에 눌리는 느낌고 좋습니다",[]
3,키보드 높이가 거의 부담스러울 정도 그냥 이가격에... 하며 사용중. 성능이 외모를 못따라오는 정도. 구매목적에 따라 다르겠지만 외모만 보시는분은 구매하세용,['https://phinf.pstatic.net/checkout/20200608_36/1591618022012nYtSP_JPEG/15916179869891075374218980116067.jpg?type=f287']
5,동물의숲 채팅하려고 샀오용.... 타자 칠때 느낌 너무 좋고요 인식도 빨라요. 저세상 색감♡♡♡,['https://phinf.pstatic.net/checkout/20200615_118/1592217195604N1vLc_JPEG/1592217164936.jpg?type=f287']
5,통통해서 놀래긴 했지만 이쁘네용 약간 실리콘 제질티었다면 더 귀염귀염 했을텐데 약간은 투박해서 아쉬워용 닌텐도 스위치에서 쓰려고 구입했구요 잘되네요. usb를 독에 꼽거나 젠더를 이용해 스위치에 꼽아서 쓰면 됩니다,['https://phinf.pstatic.net/checkout/20200528_68/1590657347515RPSJY_JPEG/20200528_181456.jpg?type=f287']
5,소리가 별로 크지않고 좋아요! 어댑터와 건전지는 따로 동봉되니 상자 안에 내용물 다 찾아보세요:3,['https://phinf.pstatic.net/checkout/20200529_281/1590737865652Fsw5D_JPEG/F2DD90E2-F012-4600-AE12-69F18623A657.jpeg?type=f287']
4,일단 비주얼이 좋아요. 키감은 그다지.. 키가 높아서 자꾸 손가락에 걸려요.,['https://phinf.pstatic.net/checkout/20200528_205/1590627068206zsJ5L_JPEG/20200528_095018.jpg?type=f287']
5,"엑토 키보드 항상 잘 사용하고있습니다
이번이 5개째 구매입니다
예뻐서 깔별로 사요",['https://phinf.pstatic.net/checkout/20200519_119/1589867485195Payqt_JPEG/485A93AC-911C-4B39-888D-FE21D46ACD6F.jpeg?type=f287']
5,이야. 이거 너무 이쁘네요...,[]
5,"안끊기고 좋습니다
잘쓰고 있습니다",['https://phinf.pstatic.net/checkout/20200601_42/1591005389932c7wim_JPEG/1591005370603.jpg?type=f287']
3,배송 빠릅니다. 굿,[]
5,이뻐여,[]
5,태블릿에 쓰려고 미니라고 해서 샀는뎅 ㅋㅋ 생각보다 커서 당황했어여.. ㅠㅠ 그래도 예쁘네용,['https://phinf.pstatic.net/checkout/20200529_54/1590764113121tMgnR_JPEG/36A05A5C-C3A6-49B3-B4A2-5CBFCCEA10CE.jpeg?type=f287']
4,빠른배송 예쁘고 가성비 좋습니다. 포장회손 부분이나.. 손탄 흔적이 있어서 좀.. 기분이 안좋아서 별은 하나 뺐어요. ㅠ ㅠ,[]
5,소음은 있지만 독서실에서 쓸거아니면 쓸만하고 타이핑 하는 느낌은 찰지고 좋아요!! 강추!,[]
5,아진짜 겁내 귀여워요ㅠㅠㅠ 미쳤음 ㅠㅠㅠ,[]
5,"배송 빠르고 포장도 깔끔합니다.
민트색 색상 너무 예뻐요 ㅠㅠ",['https://phinf.pstatic.net/checkout/20200512_36/1589279224973Cyaow_JPEG/image.jpg?type=f287']
5,"사이가 좁아서 방향키랑 가끔 헷갈리고 소리도 좀 큰데 그래서 귀여워서 만족합니다. 키가 높아서 손목이
좀 아프긴 해요",[]
3,높이가 있어서 손목에 무리가 많이 가네요..ㅜ 손목받침대 사야겠어요. 디자인은 생각 그대로 예쁨.,['https://phinf.pstatic.net/checkout/20200505_289/1588670413450AmluL_JPEG/20200505_173714.jpg?type=f287']
5,고양이가 키보드를 못쓰게 깔고누워서 그때 쓰려고 샀어요 배송빠르고 딱 생각하던 사이즈네요 디자인도 예쁩니다,['https://phinf.pstatic.net/checkout/20200409_300/1586416447221tO69Y_JPEG/20200409_161320.jpg?type=f287']
4,배송이 하루 늦게 왔네요. 문자는 오늘 도착한다고 했는데 도착안해서 쬐끔 당황!! 요즘 날씨도 워낙 안좋고 택배도 많을거란 생각에 하루 정도는 패쓰~ 키보드는 생각보다 높이가 높아요. 디자인 색상 다 좋았는데 ㅡㅜ,[]
5,이쁘네요. 딸 본아이 골랐고 만족해합니다.,[]
5,"넘 이뻐요.
근데 타자 잘치는 사람은 계속 오타가 난다고 불편하다네요",['https://phinf.pstatic.net/checkout/20200408_210/1586276569834xhtEo_JPEG/5DDBF2DE-B20C-4FA2-A8F4-99CEBCEC5E1C.jpeg?type=f287']
4,처음 받은 택배에 문제가 있어서 글 남겼는데 대처도 빠르고 배송도 매우 빨랐습니다. 상품 자체는 생각보다 높았어요. 하지만 타자감이 좋고 소리가 매우 작아서 만족합니다.,['https://phinf.pstatic.net/checkout/20200402_140/1585808548720QilVk_JPEG/1585808511748.jpg?type=f287']
5,타자할때 소리도 좋고 동글동글한 키보드가 너무 귀여웠어요! 한달동안 별 문제 없이 썻어요!,['https://phinf.pstatic.net/checkout/20200324_280/1585015378091hNqeT_JPEG/1585015311610.jpg?type=f287']
5,잘 받았습니다 :),[]
5,이쁩니다 이쁘면 그만입니다!,['https://phinf.pstatic.net/checkout/20200405_217/1586088058368aesFr_JPEG/E0659189-D1F3-4690-82AB-A6F01176F2A7.jpeg?type=f287']
3,리시버를 모르고 버려서 다시 샀지만 아무튼 키감 괜찮고 이뻐요,['https://phinf.pstatic.net/checkout/20200331_51/1585651750522rqrBw_JPEG/B3A271CB-2851-4638-A960-ADCB92A754F2.jpeg?type=f287']
4,키가 조금 높고 키 사이가 좁아서 쓰기는 조금 불편한데 소리도 작고 디자인이 이뻐서 만족합니다!,[]
3,무소음 이래서 샀는데 많이 시끄립네요.,['https://phinf.pstatic.net/checkout/20200326_128/1585195906461BhqLK_JPEG/1585195834664.jpg?type=f287']
5,작고 예쁘네요 강추 합니다,['https://phinf.pstatic.net/checkout/20200401_22/1585718201070F4OBt_JPEG/1585718169778.jpg?type=f287']
5,넘 귀엽고 좋아요 ㅎ,['https://phinf.pstatic.net/checkout/20200314_35/1584140906601PyyGJ_JPEG/1584140891764.jpg?type=f287']
5,예뻐요 마우스랑 키보드랑 같이 맞추니 넘너무 예쁘네염,['https://phinf.pstatic.net/checkout/20200321_187/1584794647757qkeBG_JPEG/C3187C9F-57DF-4794-9419-27A5E0E12C55.jpeg?type=f287']
5,기대한 만큼 짱 좋아요 배송도 엄청 빠르구여,['https://phinf.pstatic.net/checkout/20200311_65/158391026283607JYc_JPEG/1C762257-6B84-43A4-8114-352D33F11B65.jpeg?type=f287']
5,"작동도 잘 되고, 정말 예쁘기도 합니다.",[]
5,"제품은 예쁘고 좋은데 울집 컴터가 말썽이라
아직 제대로 사용 못하고 있으나
제품은 아주 좋아요",['https://phinf.pstatic.net/checkout/20200318_166/1584508932126W2rKF_JPEG/1584508880157.jpg?type=f287']
5,좋아요 감사합니다|,['https://phinf.pstatic.net/checkout/20200320_162/1584705990508hvoYB_JPEG/image.jpg?type=f287']
5,만족,[]
4,리뷰 봤던대로 터치감이 별로 안좋고 보라보단 분홍에 가깝긴 한데 귀엽고 예뻐서 익숙해질때 까지 쓸려고요,['https://phinf.pstatic.net/checkout/20200217_282/15818669727305m7u2_JPEG/20200214_164059.jpg?type=f287']
5,잘 쓰고 있어요. 너무 이쁨,[]
5,제품이 어무 좋아용~^^,[]
5,"키보드 예쁘고 타감도좋아요
흰색 너무 깨끗하고 귀여워요",['https://phinf.pstatic.net/checkout/20200215_108/1581744461751TMLrW_JPEG/1581744435848.jpg?type=f287']
5,무선이라 공부할 때 필기랑 병행하기 편함,[]
5,핑크색 샀는데 너무 귀엽고 가볍고 쓰기 편해서 좋아요 배송도 빨리 잘 왔어요,[]
4,"매장 인테리어나 장식용으로 좋습니다
실제 사용하기는 좀 ㅡㅡ+",[]
5,배송 빠르고 예뻐요~~~,['https://phinf.pstatic.net/checkout/20200211_49/1581392894043ubcJM_JPEG/1581392865149.jpg?type=f287']
5,조아요 또살게용 ㅋㅋ,['https://phinf.pstatic.net/checkout/20200215_205/1581718230997BVUFd_JPEG/20200215_071004.jpg?type=f287']
5,예쁘네여,[]
5,동숲할때 쓰려고 샀어요 동그란 키보드키가 익숙하지않아서 제가 컴퓨터로 쓰고있는 키보드보다는 오타가 자주 나고 키감이 좋지는 않지만 예쁘니까요 좋습니다,[]
5,배송이 엄청빠르네여,[]
3,블루투스인지 usb인지 잘 확인하세요ㅠㅠ,['https://phinf.pstatic.net/checkout/20200130_212/1580380633699kGITt_JPEG/29719D35-2A30-470D-B2B7-D92D3EB6AF6E.jpeg?type=f287']
5,가볍고 예쁘고 크기도 적당하고 만족입니다,[]
5,작고 귀여워요 노트북연결용으로 딱입니다,[]
5,"색깔도 굉장히 예쁘고, 크기도 적당했어요!",['https://phinf.pstatic.net/checkout/20200110_222/1578647254895j10qD_JPEG/1578647218203.jpg?type=f287']
5,"너무 귀엽고 예뻐요
소리도 예술 ㅋㅋ",['https://phinf.pstatic.net/checkout/20200110_28/1578608715653W2xTH_JPEG/59AD8617-A650-4587-A47B-F8DCAE852B69.jpeg?type=f287']
4,맘에듭니다. 추천!,['https://phinf.pstatic.net/checkout/20200113_119/1578888427009G7PQW_JPEG/55D6F2B6-8FF6-4FDF-BDF3-D44820B128C1.jpeg?type=f287']
4,매우 예뻐요 여자분들이 좋아하시겠어요제가 사이즈를 제대로 안보고 샀네요ㅜ좀 작긴 해요타자감은 좋은데 소리는 좀 나는편이에요,[]
5,헉너무 귀여워요 모양도 너무 깜-찍그자체.....,[]
5,블루투스가 아니라서 아쉽지만 너무 귀엽습니다 잘쓸게요~~,[]
5,장난감같고 재밌습니다 ㅋㅋㅋ 예쁘기도 하구요 배송도 빠르고 (다만 제가 싫어하는 택배회사....배송상태 구림 박스 구겨져서옴) 타감도 재미용이라면 추천합니다 ㅎㅎ,['https://phinf.pstatic.net/checkout/20200116_279/1579115160340Jq7EI_JPEG/KakaoTalk_20200116_040110809_06.jpg?type=f287']
5,색이 너무 예뻐요 타감도 좋고 잘쓸께요,[]
4,만족하고 잘 사용합니다.,[]
5,좋아요,[]
5,"디자인 깔끔하고 색상이 예쁘고
타감 괜찮아요",['https://phinf.pstatic.net/checkout/20191212_210/1576117622770fFIQg_JPEG/1576117571860.jpg?type=f287']
5,귀엽고 소리가 안나서 좋아요,['https://phinf.pstatic.net/checkout/20191218_62/1576665705020YuHYP_JPEG/08C588C7-0835-4E8A-B8D5-6E91EFD4E74F.jpeg?type=f287']
5,가격대비 괜찮은 제품입니다,['https://phinf.pstatic.net/checkout/20191210_205/1575980311836vsj6Y_JPEG/1575980298888.jpg?type=f287']
5,실제품 매우만족합니당,[]
5,"디자인과 기능 가성비 다 잡은 거 같아요!
처음 엑토제품 사용해보는데
키보드 치는 감도 좋고 사이즈도 딱입니다",[]
5,너무너무예뻐요ㅎㅎ잘됩니다,[]
5,키감좋고 동글동글하지만 미스터치없어요ᆢ아주 예프고 고급스럽구요ᆢ멤브레인방식 좋아하시는 분들 고민하지 마시고 구입하세요!,[]
3,아직 안뜯어봤어요!!! 망가지지않길바래요,[]
5,배송최고빨라요. 누르는감도 넘 좋아요,['https://phinf.pstatic.net/checkout/20191214_77/1576309514100H1lSX_JPEG/1576309495296.jpg?type=f287']
5,무게감도있고옛날타자같이예쁘네요,[]
5,"잘쓰고 있음 잼남 타닥타닥 치는재미. 재미용으로 생각하신다면 후회하지않음 추천.
실생활로 자주쓰이는 용이라면 물론 비추임. 턱이 높아서 치는게 편하지는 않음",[]
5,색감 너무 예쁘고 사용감 좋아요!!,[]
5,너무 귀엽고 색상도 예뻐요^*^!!!,[]
5,잘받앗습니다.빨리왓어여,['https://phinf.pstatic.net/checkout/20191204_297/15754237722826XM0s_JPEG/102713_1-1.jpg?type=f287']
5,친구 선물로 구매했어요! 보라색도 너무 예쁜데 무난하게 흰검 구매했습니다:) 디자인 너무 귀여워요,[]
