star_point,comment,photo
2,너무너무 만족한 키보드와 달리 커버는 호불호가 갈릴것 같네요 개인적으로는 불편했습니다 아직 익숙치않은 배열이라 키보드를 봐야하는데 생각보다 불투명해서 키각인이 잘 안보이네요 그리고 다수의 키보드 겸용이라 길이가 딱 떨어지지 않아서 해당가격의 키보드를 구입하는 고객의 니즈와는 동떨어지네요 (길이가 최소한 맞을줄 알았는데 테두리가 너덜거려요 ㅠ) 회사에서 사용중이라 퇴근후 먼지 쌓이지 않게 덮어두는 용도로 쓰고있습니다 키배열 딱맞는 커팅이나 박스형태로 뚜껑처럼 덮게하면 좋을것 같습니다!,['https://phinf.pstatic.net/checkout/20201119_69/1605751664034Ccq1P_JPEG/review-attachment-76f0e09a-31ed-4431-b5b7-28b00eac81f7.jpeg?type=f287']
5,"재구매했습니다. 집에서 사용할 목적으로 구매했습니다. 앞서 말했듯이 만족도가 너무 좋습니다. 연구실 인원들도 자기도 구매하고 싶다고 그러는데 제가 2개 있으니 하나 넘기라고 장난스럽게도 말하네요 -_-

키감이 매우 훌륭하나 소음이 살짝 있는 편이라 이번엔 키스킨까지 구매했습니다. 처음에 키스킨 구매할때는 퇴근할 때나 사용하지 않을 때 덮어둘려고 구매한건데 덮어놓고 타이핑해도 별다른 느낌 없고 소음이 적어져서 매우 만족스럽네요. 항상 키보드 근처에 마실걸 두다보니 불안했는데 덮어두니 괜찮은거 같습니다.

마우스패드는 게임용이라 아니라... 사무실에서 쓸 넓적한거 찾고 있었는데 마침.. 한번에 구매할 기회가 있어서 구매했습니다. 전체적인 질감은 부드럽고 무난히 사용할 수 있을 정도입니다.","['https://phinf.pstatic.net/checkout/20191105_258/1572932413194YdOiJ_JPEG/KakaoTalk_20191105_142405650.jpg?type=f287', 'https://phinf.pstatic.net/checkout/20191105_113/1572932413276vvSCc_JPEG/KakaoTalk_20191105_142406283.jpg?type=f287', 'https://phinf.pstatic.net/checkout/20191105_133/15729324132375DB4X_JPEG/KakaoTalk_20191105_142405957.jpg?type=f287']"
5,"사무실에서 사용중이며 윈도우 10 환경입니다.
적당히 시끄럽습니다. 근데 뭐랄까 요란한 소리가 아니라 고급진 딸깍이랄까요?? 타이핑으로 뭘 쓸때 정말 감성은 좋습니다. 왠지 글이 잘 써지는 기분??

외관은 되게 고급집니다. 누구든지 보면 와... 이럴정도로 되게 정갈하고 느낌있습니다.
. 다른 기계식 키보드도 많이 사용해봤지만 .

게임환경에서는 사용하지 않아서 모르겠습니다.
사무실 컴퓨터에 연결할 목적으로 구매한거라...","['https://phinf.pstatic.net/checkout/20191016_61/1571198587178SeCsI_JPEG/KakaoTalk_20191016_125633796.jpg?type=f287', 'https://phinf.pstatic.net/checkout/20191016_275/1571198587200N8zzh_JPEG/KakaoTalk_20191016_125634177.jpg?type=f287', 'https://phinf.pstatic.net/checkout/20191016_188/1571198587242Mg1Cy_JPEG/KakaoTalk_20191016_125634536.jpg?type=f287']"
5,"마우스는 어디서 굴러다니는거 사용하는데 자꾸 페어링이 끊기는데
구매한 키보드는 페어링도 진짜 빠르고 ,, 타격감 짱입니다 ,,
그래서 복붙해도 상관없는 내용 타자치는 재미에 살고 있슴다 ,,

정품 등록도 완료했고 사장님 많이 파세용 ,,",['https://phinf.pstatic.net/checkout/20201120_258/16058621340527xf6r_JPEG/review-attachment-605099cf-94f4-4d22-927b-f12bd57784be.jpeg?type=f287']
5,"사무실에서 사용할꺼라 적축에 풀스킨으로 주문했습니다.
손가락 관절이 아파서 기계식이 손가락에 무리가 안간다고 해서 한참 찾아보고 고민하다가 구입했습니다.
일단 키보드 높이가 낮아서 어색하고...
핸드폰으로 블루투스 연결하는게 제가 잘 못하는건지 어렵네요 ㅠㅠ

확실히 지금까지 사용해봤던 다른 키보드에 비해 비싼값을 하는 것 같아요. .
손가락에 무리가 안가는지 여부는 좀 더 써봐야 알 것 같아요.",['https://phinf.pstatic.net/checkout/20200608_83/1591596851001c9SaH_JPEG/F34D1499-69A7-4621-BE3D-051867C3B028.jpeg?type=f287']
5,"여러분 여기가 제일 가격도 저렴하구요.
배송도 토요일에 주문했는데 일요일에 벌써 배송준비를 해주셨더라구요. 그래서 좋았구요.
RGB LED 진심 너무 이쁩니다. 감탄밖에 안나와요 저는 불끄고 쓸일은 없지만 불켜고 써도 이쁩니다.",['https://phinf.pstatic.net/checkout/20201028_47/1603855706133aknOD_JPEG/review-attachment-fea27a76-e6f7-430b-a1ef-ae268f144620.jpeg?type=f287']
5,윈도우 PC에 쓰려고 샀는데 로우프로파일 기계식 키보드의 끝판왕인 것 같습니다.,"['https://phinf.pstatic.net/checkout/20200909_163/1599624704101lEVfP_JPEG/review-attachment-9cfa1677-55d3-46fb-93f4-6ed8a42fe2e8.jpeg?type=f287', 'https://phinf.pstatic.net/checkout/20200909_13/1599624710622GkVaN_JPEG/review-attachment-d848d410-cf24-4a89-a839-b0fb0c6da98d.jpeg?type=f287']"
5,청축 주문했는데 초고속 배송으로 적축이 왔어요. 교환역시 초고속으로 진행되었습니다. 상품도 좋아요. 많이 파세요!!,['https://phinf.pstatic.net/checkout/20201119_264/1605764720792nG2UR_JPEG/review-attachment-12cacfec-5bf7-4243-832c-329e3cde635c.jpeg?type=f287']
5,"실물깡패네요 첫인상 너무 멋지네요
회사에서 쓸거라 갈축했는데 오히려 기존 일반 유선키보드보다 조용하네요 키보드 높이 걱정했는데 저는 불편함 없었습니다 잘쓸게요!",['https://phinf.pstatic.net/checkout/20201119_58/160575144067950e6B_JPEG/review-attachment-2d89dca8-befd-4837-a258-e4e1615f6b22.jpeg?type=f287']
5,갈축 서걱거리는 느낌이 좋아요 소리도 꽤 크고 마음에 듭니다,['https://phinf.pstatic.net/checkout/20201104_291/16044205620456LQr7_JPEG/review-attachment-3420c7ed-63a5-4c85-bce0-4f93547fe2a3.jpeg?type=f287']
5,"가격대가 있는만큼 퀄러티를 논하는건 무의미하겠죠. 소음, 디자인 모두 흡족하나 바닥에 다리가 없는게 아쉽네요.",['https://phinf.pstatic.net/checkout/20201006_276/1601970405676lvI9z_JPEG/review-attachment-6fa7c4d5-831c-44b2-8334-c0761139c29e.jpeg?type=f287']
5,좋아요 키캡 불량이었는데 제품자체를 보내주셨네요,['https://phinf.pstatic.net/checkout/20200915_147/1600173966869HUanM_JPEG/review-attachment-03662763-ec50-47c1-90a3-eb1c5e91c978.jpeg?type=f287']
5,배송도 빠르고 제품도 양품이고 마음에 드네요~,[]
3,키보드는 마음에 드는데... 15만원짜리 키보드 사는데 비닐포장으로 택배가 올줄은 몰랐네요. 겉박스 찢어지고 찌그러짐.,[]
4,욱선 써보고 후기 남기겠습니다,[]
5,"빠름 배송과 크게 군더더기 없는 포장이 마음에 들었습니다.
제품도 생각보다 마음에 듭니다.",[]
5,여러 가지 효과가 재미나고 키감 및 소리가 좋아요 키보드 경사조절과 usb동글연결시 안정성이 아쉽네요 전체적으로 만족스럽네요,[]
5,빠른 배송 감사합니다,[]
5,"적축인데 소리가 업청 작아요.
사무실에서 사용하기 좋을듯합니다.",[]
5,키감과 소리가 재미지네요 다만 블루투스 연결이 데스크탑에서 usb동글을 이용하니 좀 불안해요 그리고 키보드 상단 높이 조절 장치가 있었으면 좋겠어요,[]
4,제품은 만족합니다. 키캡이 조금 문제가 있어서 조금 아쉽습니다,[]
5,"로우프로파일 첨 써보는데 좋네요
본체도 맘에 들고요
키캡 키리무버 등등 만족스러운 요소가 많습니다",[]
5,역시 이쁩니다 맥에 딱 입니다.,[]
5,"배송 하루지나서 왔구요~ 저소음에 LED, 키감까지 제가 원하는 조건을 다 갖춘 키보드입니다. 뽐뿌와서 바꾼 보람이 있네요 ㅎㅎ",[]
5,휴대해서 개인 위생용으로 써도 좋을 것 같아요~~=,[]
5,번쩍이는 led가 재미있고 타격감이 좋아요~~,[]
5,"처음에 페어링문제 때문에 고생했는데,
한번 제대로 페어링
작동하니 이후 잘 되네요",[]
4,공식 판매처인 만큼 상품 퀄리티 매우 좋고 상품자체도 정말 괜찮네요. 배송이 매우 빨랐는데 택배측 실수만 없었다면 5점인데...판매자측에서 일찍 준비해주셨는데 택배에서 싣는걸 까먹으셨다고 했네요...,[]
5,깔끔하고 여러대 전환할때 너무 편하네요,['https://phinf.pstatic.net/checkout/20200426_236/15878973505272EmgH_JPEG/C2EA01CF-B2C3-4893-8DE9-B848C6E829A4.jpeg?type=f287']
5,일단 배송이 빨랐고 제품도 너무 맘에 들어요,['https://phinf.pstatic.net/checkout/20200405_237/1586019221329KLL8C_JPEG/01E3E80B-158F-495D-B168-BE2F798A3448.jpeg?type=f287']
5,덕분에 먼지도 안쌓이고 좋습니다~,['https://phinf.pstatic.net/checkout/20200414_287/15868145214139Hsij_JPEG/BB683FF3-314C-4C03-BB7D-052FADE4A323.jpeg?type=f287']
5,제품과 배송 모두 만족합니다.,[]
5,아주 좋아요~! 재구매의사 200%입니다!,['https://phinf.pstatic.net/checkout/20200211_74/15813902933914ERMs_JPEG/IMG_4191.jpeg?type=f287']
5,키보드 불빛들 너무 이쁘고 키감도 좋고 잘 사용중입니다,[]
5,"완벽합니다. 좋은 제품. 빠른 배송 감사드립니다.

많이 판매하세요~~!",[]
5,덕분에 사용중이 아닐 때 먼지 안쌓이게 잘 보관중입니다~,[]
5,"타건감 진짜 좋구요
슬림해서 더욱 가성비 넘치는.
멀티페어링 잘됩니다",['https://phinf.pstatic.net/checkout/20191210_166/1575981773174ITuwD_JPEG/1575981686122.jpg?type=f287']
4,친구꺼 보고 타격감이 좋아서 샀는데 키가 눌렸다가 안나오는 현상이 있네요ㅜ 그래도좋네요^^,['https://phinf.pstatic.net/checkout/20191217_259/1576585901013S2OQp_JPEG/F226186C-3126-42CD-9AC8-4825510777B4.jpeg?type=f287']
5,"빠른배송.
슬림사이즈.
타건감은 듣던데로 베스트!!",['https://phinf.pstatic.net/checkout/20191210_144/1575981707329tc0Hk_JPEG/1575981686122.jpg?type=f287']
5,오타가 좀 많이 나긴하는데 굉장히 만족스러워요,[]
5,104키보다 키 스킨이 너무 크네요...,['https://phinf.pstatic.net/checkout/20191212_277/157607783827099FNS_JPEG/D05BB15B-00DF-4A5E-BD33-98906DE6912F.jpeg?type=f287']
5,비싸지만 아주 만족스럽습니다,['https://phinf.pstatic.net/checkout/20191212_161/1576077799161vDvR4_JPEG/5F78FAFE-5B01-4D17-BBC6-331386EE930B.jpeg?type=f287']
4,적축 키보드샀는데...생각보다 키감이 저랑 너무 안맞아서 너무 아쉬웠습니다....디자인은 진짜 이쁜데~,[]
5,"사고나서 한달되니, 바로 쎄일 들어가네.
제길슨",[]
5,부드럽고 좋습니다~~!!,[]
2,숫자 자판 8이 눌려 들어가 있었고 다시 뺐다 끼워서 쓰고 있지만 자꾸 들어가네요. 교환신청하기에 시간도 없어서 그냥 씁니다,[]
5,키감도 좋고 맥과 윈도우 스위치가 있어서 편리하네요~ 맥 모드는 맥 키보드 배열과 같아서 좋네요~,[]
