star_point,comment,photo
3,"무사히 수령하였습니다.
아쉬운 점을 나열해보자면 아래와 같습니다.


* 기왕이면 [윈도우 로고] 키캡과 [Ctrl 한자] 키캡도 동봉 되었으면 하는 소소한 아쉬움이 있습니다.
(적어도 [Ctrl 한자] 키캡은 K2 키캡에 구성되어있는 사항입니다.)

* .
[만능 키보드 키스킨]이라는 제품이 판매되고 있지만, 키에 맞춰 성형된 것이 아니고 키 위에 얹혀서 사용하는 것이라 이용시 매우 잘 미끌어집니다. 텐키리스 키스킨이 몇 개인가 유통이 되고는 있지만(체리 텐키리스 키스킨, 레오폴드 FC750R PD 키스킨) K8과의 호환 여부가 불투명한 것이 현실입니다.

* 개인적으로는 상태 표시 LED(충전상황/블루투스/Caps Lock)의 밝기가 강하다고 느껴집니다.
상태 표시 LED에 관련된 밝기 레벨 조절 스위치가 있었으면 하는 아쉬움을 느꼈습니다.

* 제조사 차원에서의 리맵핑 프로그램이 지원되지 않는 것이 다소 아쉬울 따름입니다.
한글 윈도우 10 에서는 코타나 이용이 불가합니다. 그렇기에 원터치 코타나 키는 적어도 한국의 윈도우 사용자에게는 사용할 일이 없습니다. (지역설정을 바꾸면 되긴 합니다만 이래저래 번거롭습니다. 마이크가 없는 데스크톱 환경이기도 하고요.)
[스크린 캡쳐] 키와 [원터치 시리&코타나] 키는 SharpKeys 3.92 버전 기준으로 리맵핑이 불가합니다. (인식 불가 및 다른 키값과 혼용되기에 설정이 불가.)

* K8 제품의 특징상 팜레스트는 선택이 아닌 필수입니다.
바닥서부터 맨 앞쪽 키캡 끝까지의 높이가 35mm 가량 됩니다. (키캡 아래 까지만이면 23mm 정도 됩니다.)
문제는 키크론 K8 호두나무 팜레스트의 높이가 15mm 라는 것입니다.
(물론 개인차는 있겠지만) 적어도 높이가 25mm 는 되어야 할 것이며, 세로 길이 또한 80mm 가 아닌 100mm 는 되어야 쓸만할 것이라 여겨집니다. 마감 또한 오일 마감인지, 유리막 방수 코팅이 어느 정도 농도로 되었는지에 대한 정보가 공개되었으면 하는 바람입니다. (무슨 이유인지는 모르겠지만 2020년 10월 9일 20시 48분 기준으로 키크론 홈페이지에는 K8 팜레스트가 등록되어 있지 않습니다. K8 전용 및 공식 팜레스트라고 설명하며 판매하는 곳도 적지 않은 상황임에도 말입니다.)

* 단점이라기보다는 주의해야 하는 사항이 하나 있습니다.
키크론 K8은 Male 부분이 꺾인 USB C 타입 케이블이 제공됩니다만 길이가 길지는 않습니다.
따라서 길이가 긴 USB C 케이블과 연장젠더를 조합하는 환경을 구성하는 경우도 있겠습니다만, K8 본체의 Male 커넥터 부분이 좁게 되어 있어서 케이블 및 연장 젠더의 커넥터 성형 상태에 따라 이용을 못하는 경우가 생길 수 있습니다. 일단 저가형 연장 젠더는 대부분 사용이 불가 할 것으로 사료 됩니다.


위의 단점을 제외하면 크게 문제되는 것을 느끼지 못하였습니다.
이전부터 사용해온 팬터그래프 키보드보다는 확실히 타건 시 소리가 크게 들리긴 합니다.","['https://phinf.pstatic.net/checkout/20201009_286/1602227209855NrF0z_JPEG/review-attachment-faceb097-3f35-43b2-b5ba-a4d236891c43.jpeg?type=f287', 'https://phinf.pstatic.net/checkout/20201009_120/1602227214510kKX2M_JPEG/review-attachment-fe420e70-08cd-4f92-bcc7-c6f29c14f59e.jpeg?type=f287', 'https://phinf.pstatic.net/checkout/20201009_259/1602227220431y60RD_JPEG/review-attachment-b54bb38d-c4d4-4ae7-bcd0-fe4c84cfcdaa.jpeg?type=f287', 'https://phinf.pstatic.net/checkout/20201009_48/1602227226655Hzc4b_JPEG/review-attachment-a2fc744a-f996-4287-8254-117e2afd0f07.jpeg?type=f287', 'https://phinf.pstatic.net/checkout/20201009_257/1602227234259gGduK_JPEG/review-attachment-260932a8-2851-4857-85ce-501dbb85163a.jpeg?type=f287']"
5,"빠른 배송과 제품의 성능 디테일한 부분까지 아주 만족스럽습니다.
간단하게 아이폰과 페어링 해서 폴라리스 오피스에서 한글작성하면서 타이핑했는데 아주 편하고 신속하게 연결되고 끊김이 없이 입력되더군요!
백라이트기능은 무선밧데리를 생각해볼때 작동을 많이 안할것 같지만 야간작업시에 왠지 운치있을듯 하고 지금 필코적축과 타사 청축을 쓰고 있는데 소음때문에 갈축을 구입했습니다. 갠적으로 이정도 소리면 무난할것 같고 속기용으로 잘 활용해보아야 겠습니다. 정품등록은 바로 큐알코드로 해버렸네요. 그리고 키캡도 변경해주었습니다.
다른 사이트 갈축이 품절이라 이곳저곳 찾으러 다녔는데 왠지 가격은조금 아쉽군요! ㅎㅎㅎ;; 그래도 금액만큼 활용해주면 될테고 암튼 좋은제품 앞으로도 많이 판매해 주세요.","['https://phinf.pstatic.net/checkout/20201107_80/1604724971486w3qDg_JPEG/review-attachment-dd38450a-be37-4c60-83a8-c7dbf065c729.jpeg?type=f287', 'https://phinf.pstatic.net/checkout/20201107_113/1604724971603UaOOx_JPEG/review-attachment-a0fcc0fd-5d17-4426-9d41-223830c733f3.jpeg?type=f287', 'https://phinf.pstatic.net/checkout/20201107_120/1604724971566Jtxfd_JPEG/review-attachment-de50030f-076e-4420-ad96-456600c55181.jpeg?type=f287', 'https://phinf.pstatic.net/checkout/20201107_187/1604724971611QKjCe_JPEG/review-attachment-e0d6feb6-1e07-43cb-b37d-a9a04702010d.jpeg?type=f287']"
5,"담당자분이 많이 놀래셨나봐요.
주문 잘못한거면 어떡하지 걱정하셨나본데 주문 잘못한거 아니니까 너무 각정하지 마라 전해주세요.

체리축으로 스위치 교환하는데 확실히 품질은 체리쪽이 더 압도적인거 같아요.
게이트론은 스위치 제거할때 스위치가 뽑힌다는 느낌보단 억지로 뽑아버리는 느낌이 강하고 스위치에 상처 납니다. 몇개 뽑고나면 플라스틱 부스러기가 날려요.
불량축도 있던데 이건 검수에서 좀 아쉽네요.

통울림이 좀 심해서 배터리 부위 제외하고 3T정도의 스펀지 흡음재 사용하는 것을 추천드립니다. 배터리 부분은 잘라내고 써야지 안그러면 기판 휩니다.

스태빌 간이윤활 되아있던데 취향에 따라 직접 다시 윤활하셔야 할 수도 있습니다.

유무선 가능한 세컨드 키보드로 led장난(...) 키캡장난 할 텐키리스 rgb 갬성 키보드를 찾고 있었는데 딱 나오네요.

잘 쓰겠습니다.","['https://phinf.pstatic.net/checkout/20201009_230/1602211905893YWAOX_JPEG/review-attachment-cfa174a0-62e3-41a9-99de-cdba1bc9e106.jpeg?type=f287', 'https://phinf.pstatic.net/checkout/20201009_75/1602211927133gqca1_JPEG/review-attachment-993de5bd-c4e5-4bc0-92ba-e175fd113d49.jpeg?type=f287']"
5,"택배박스가 아닌 비닐 포장지에 와서 깜짝 놀랐지만 안에는 뽁뽁이로 엄청 안전하게 잘 포장되어 있어서 안심하며 열어 보았습니다.
알루미늄으로 주문해서 그런지 묵직했고 생각보다 키보드의 높이가 좀더 높았습니다. 같이 주문한 팜레스트보다도 높아서 키보드와 팜레스트의 높이 차이가 조금 생기다보니 아쉽기는 했지만 키감도 나쁘지 않고 이뻐서 매우 만족하고 있습니다~","['https://phinf.pstatic.net/checkout/20200904_166/1599183439045WbbkO_JPEG/review-attachment-681eca3f-88f4-4315-a51b-6a173c2eddd5.jpeg?type=f287', 'https://phinf.pstatic.net/checkout/20200904_42/159918345710953wGU_JPEG/review-attachment-1d370a53-fef5-40db-989c-81fca61984ec.jpeg?type=f287', 'https://phinf.pstatic.net/checkout/20200904_146/1599183473495bC6VY_JPEG/review-attachment-9a073ac2-7318-49b9-96df-939494e35b93.jpeg?type=f287']"
5,"전에 로지텍 K480을 써오다가 이번에 큰맘 먹고 키크론 k8로 갈아탔는데요. 포장이나 구성품들은 마음에 너무 들었고, 마감이나 품질도 정말 만족스럽습니다. 제일 걱정했던건 통울림이랑 높이가 꽤 높아 팜레스트가 필요한지 걱정이었는데 통울림이 그렇게 심하다는 생각이 들진 않았고, 손이 커서 그런지 팜레스트 없이 오래 타이핑해도 손에 큰 무리 없이 사용가능했습니다. LED모드도 정말 정말 다양하고 지금은 옵티컬 갈축으로 구매했는데 나중에 다른 축이든 교체할 수 도 있어서 마음대로 커스텀하고 싶으신 분들이라면 키크론 k8이 가장 나은 키보드가 아닐까 싶네요. 배터리도 생각보다 오래가고 블루투스 5.0이라 끊김도 없고 디자인도 이 정도면 정말 만족스럽습니다. 다만 펑션기능들이 데스크탑에 최적화되어있고 LED 광량이 그렇게 밝진 않은건 단점인 것 같습니다.",[]
5,"기계식 처음 쓰는 건데 아주 좋네요. 터치가 좀 가볍지만(적축) 느낌은 기존 매직키보드보다 훨씬 좋습니다. 야간에 컴퓨터 많이 하는데 RGB LED가 마음을 덜 외롭게 하는 효과가 있네요.

다만 한가지는, 화상회의시에 키보드소리가 마이크 너머로 더 많이 들어가는 것은 있네요. 내가 듣기에는 더 좋지만 회의시에는 참고하셔야 할듯요.

좌측 스위치들이 조절하기에 완벽한 느낌으류제공하고 있지는 않습니다만 어짜피 편함을 추구하기 위해 구매한 것은 아니니 괜찮습니다.

블루투스 등록만 잘 해 놓으면 전환시에도 퍽 불편없이 넘어갑니다.",['https://phinf.pstatic.net/checkout/20201028_24/1603862926772wR5DY_JPEG/review-attachment-d7c78d7a-79b9-427a-a30c-b250ce05a90a.jpeg?type=f287']
5,"그동안 청축을 써서 너무 시끄러웠는데, 갈축은 눌리는 압도 적당하고 좋네요 특히 맥과 윈도우 동시에 운용이 가능하다는것이랑, 기계식이지만 블루투스로 무선으로 사용이 가능하다는 것이 흡족스럽습니다.

다만, 확실히 키보드가 높아서 손이 작으신 분들은 팜레스트가 필수인것같아요. 손이 커서 한번도 불편했다고 느낀. 적 없지만 확실히 얘는 좀 높다는 느낌을 받고 있습니다",['https://phinf.pstatic.net/checkout/20201105_126/16045859619291WawM_JPEG/review-attachment-e73f1274-57d6-401b-b412-793b9c758702.jpeg?type=f287']
5,"키크론 제품 고민하다가 마침 k8 예약이 진행되고 있어서 구매하게 되었습니다.
맥북 사용자로써 사용하기에는 정말 좋았고, 알루미늄의 마감 또한 괜찮았습니다. 적축은 처음 사용해봐서 그런지 청축과 다른 소프트한 느낌이 신기해하면서 사용중입니다ㅎㅎㅎ 짤깍거리는 느낌이 없어서 속시원한(?)게 없지만 조용한 타건감을 원해서 적축을 선택하길 잘한 것 같네요ㅎㅎ (나중에 무접점도 개발하신다면 구매할 의사 있습니다ㅎㅎ)스테빌라이져도 잘 잡혔는데 쉬프트키가 약간 뻑뻑한 느낌이 좀 있네요. 먼지 끼임이 걱정되어서 사용후에는 뚜껑을 닫아놓는데 높이도 딱 알맞아서 좋네요ㅎㅎ 높이가 꽤 있어서 전용이든 아니든 꼭 필요한 제품이라고 생각합니다. 맥북의 스페이스그레이랑 잘어울려서 디자인적으로도 만족입니다. 앞으로도 키보드 개발 기대됩니다 :)",[]
5,"기계식 키보드 큰 맘 먹고 비싼 돈들여 구매했는데, 정말 맘에 듭니다. 키크론 K8 새로 나왔다고 해서 구매했는데, 윈도우 노트북과 맥OS 아이패드겸용으로 같이 쓸 수 있어서 너무 맘에 들어요. 진짜 평생 키보드로 남을 수 있을 것 같습니다.","['https://phinf.pstatic.net/checkout/20201012_123/1602431560857sziye_JPEG/review-attachment-9f55fdf5-826c-4ab1-b295-13c902c8d32f.jpeg?type=f287', 'https://phinf.pstatic.net/checkout/20201012_130/16024315610966c17q_JPEG/review-attachment-b8a55f9a-ae9e-44d1-b568-9fa62c9551f6.jpeg?type=f287']"
5,"배송도 빠르게왔고,
RGB 도 많이 밝지않고 은은하니 좋습니다.
갈축 키감도 상당히 좋고 소음도 크지않아
만족감이 높습니다.

맥과 PC를 같이 쓰는데 앙쪽 블루투스를 번갈아가며 잡을 수 있어 키보드는 한대로 사용할 수 있는 장점이 있네요! .

참. 팜레스트는 필수입니다.",['https://phinf.pstatic.net/checkout/20200905_32/1599282049611W31fm_JPEG/review-attachment-1aff8381-759d-4a43-acaf-e37668ac0223.jpeg?type=f287']
5,"맥 용 키보드 중에 좀 ㅋ튼튼한 거 없나 찾다가 사게 됐네요
일단 유무선을 모두 지원한다는 게 마음에 들고요 배송도 빨라요
키캡 추가 구성이 있길래 기본 구성에 한영각인 안 되는 줄 알고 추가 주문 했는데 기본으로도 한영각인이 오는 걸 보고 그냥 좋은게 좋은 거라고 생각하고 있습니다
나중에 키캡 낡으면 바꾸면 되죠
결론은 좋아요 굿",['https://phinf.pstatic.net/checkout/20201010_33/1602321637045I2zAu_JPEG/review-attachment-3c1c4cb4-9ce3-4809-a646-6b5a0b92c03e.jpeg?type=f287']
4,다 좋은데 키감이 좀 구려요. 적축 기준입니다. 일단 근데 맥 윈도우 호환성 대비 이만한 물건이 없기 때문에 그냥 참고 써요. 근데 진짜 키감 하나는 진짜 구리다 못해 .. 반발력만 심해서 스무스한 타이핑이 조금 힘들 정도네요 .,['https://phinf.pstatic.net/checkout/20201122_73/1605990544197hqzGc_JPEG/review-attachment-12261366-6e80-4150-b07e-005d7025a3db.jpeg?type=f287']
5,"키보드가 깔끔하고 텐키리스라 책상 공간확복에 한 몫을 해줍니다.
K6와도 고민을 했었는데, 방향키 및 기능 버튼들이 따로 나와있어 좀더 익숙하고 좋습니다. 키보드 자체는 만족스러운데, 팜레스트가 자꾸 미끄러져서 아래에 매트를 깔아줘야되는게 아쉽네요.",['https://phinf.pstatic.net/checkout/20201008_38/1602148721766668xb_JPEG/review-attachment-876d3d56-df61-428a-9c0f-1ef515829372.jpeg?type=f287']
5,"배송 빨라서 좋았습니다! 드디어 납작한 매직키보드를 치워버릴 수 있겠네요!
전에도 기계식 키보드를 사본 적이 있었습니다. 그런데 맥만 쓰고 맥 단축키에 익숙한 저에게는 너무 불편하더라구요. 청축으로 샀는데 점점 시끄러운게 싫어지기도 했고요. 키크론 키보드는 맥용으로 호환 잘 되게 나와서 너무 편하고 좋네요!",['https://phinf.pstatic.net/checkout/20201027_236/1603792174702LqvaC_JPEG/review-attachment-46364f4c-db6a-4865-a221-378b3c83a5ec.jpeg?type=f287']
4,"키보드 성능은 만족합니다. 불량이나 오작동 같은건 아직 안나왔네요.

다만 팜레스트...
뒷면의 미끄럼 방지고무 책상에 검은색으로 게속 묻습니다.
잘지워지지도 않구요. 패드를 닦아보니 검은색 계속 묻어나오는 중..
다른분들도 그런지 모르겠지만 밝은 책상에서는 쓰기 힘들거 같아요",['https://phinf.pstatic.net/checkout/20200904_171/15992282353610egUN_JPEG/review-attachment-ff2a4274-0bc3-473e-b110-a1f5e9e306bc.jpeg?type=f287']
5,"키크론 k1 v4도 구매해서 쓰고 있었는데 확실히 로우프로파일이랑 키감 차이가 다르네요 ㅎㅎ 너무 좋고, 되게 키감도 무거울줄 알았는데 생각보다 가벼워서 놀랐습니다 청축이라서 시끄러운건 어쩔 수 없어서 갈축으로 갈아줬는데 핫스왑이라서 실증나면 다른 스위치사서 끼우면 되는게 너무 좋네요 ㅎㅎ",['https://phinf.pstatic.net/checkout/20201126_155/16063731899726hjxU_JPEG/review-attachment-72b1f5b3-4d5a-40fb-a3fd-0e0711de84b8.jpg?type=f287']
4,"디자인은 전체적으로 너무 만족스럽습니다.
하지만 혹시 저 처럼 디자인만 보고 키보드를 구매 하시는분들은 키보드가 생각보다 높다는걸 인지하시고 손목 받침대가 필요 하신지도 같이 고민해보시는게 손목 건강에는 좋을 것 같습니다 저는 살짝 부담되서 손목받침대 팜레스트를 알아보고 있습니다",['https://phinf.pstatic.net/checkout/20201012_98/1602475098936R7Wp7_JPEG/review-attachment-b5bd62ff-5175-44cc-8449-54da12142e16.jpeg?type=f287']
4,포장이 잘되어 배송되었네요.. 생각했던것 만큼 키감도 좋고 아주 만족합니다. 숫자키 패드만 따로 하나 구입해야겠어요.. 숫자키 없는 키보드를 처음 사용해봐서 아직 적응이 안되네요. 페어링도 잘되고 아주 만족하며 사용중입니다. 개인적으로 단점아닌 단점이 지문이 많이 묻는 다는 것이 흠이라면 흠이네요.. ㅠㅠ 그것말고는 없는듯 합니다.,['https://phinf.pstatic.net/checkout/20201021_124/1603271855112CHD8t_JPEG/review-attachment-152d65e2-e788-4aa3-8515-fe52ffc2a7a3.jpeg?type=f287']
5,"처음에 타자치면 그냥 적축인데 오래 써보니 확실히 좋습니다. 풀알루, 풀윤활 상태가 아니고 기계식 스위치라서 울림은 있습니다. 특히 스페이스바(스테빌라이저)의 울림이 크게 느껴지니 참고하세요.

그리고 키보드가 타 키보드에 비해 높은건 사실입니다 팜레스트 필요 하구요. 혹시나 장시간 게임용으로 사는분은 비추천드립니다.

사무용 특히 MAC용에 최적화입니다.(키배열은 맥북이랑 다릅니다. 기능은 같음) 이상입니다.",[]
5,"아이맥용으로 구매해서 맥북에어까지 사용합니다. 신나는 타건감으로 작업합니다.

갈축이라 서걱거리는 소리가 좋아요.
페어링이 3대까지 저장되니 아주 편하네요.
일단 에어랑 아이맥 1.2번 각각 저장해서 잘 사용중입니다. 감사합니다.",['https://phinf.pstatic.net/checkout/20201123_132/1606064970920XKIov_JPEG/review-attachment-36621897-6dff-4a28-98df-deaaf2193c47.jpeg?type=f287']
5,"K2 기계식 갈축 쓰다가 만족도가 좋아서 K8도 구매했습니다.
K8은 적축옵티컬로 구매했는데, 타건감은 확실히 기계식 갈축이 좋네요.
옵티컬의 이질감인건지는 모르겠지만 키압은 K2 기계식보다 조금 뻑뻑한 느낌입니다. 그렇다고 불편한 정도는 아니고, K2 기계식 갈축에 익숙해진 것 일 수도 있습니다.

윈도우와 맥에 왔다갔다 아주 편하게 쓰고 있습니다.",['https://phinf.pstatic.net/checkout/20200907_105/1599464038403MYKmW_JPEG/review-attachment-b9e81721-9dfa-4521-a396-28445a3e4f76.jpeg?type=f287']
4,"키보드 자체의 타건감 등은 좋습니다. 다만, 가만히 있는 경우 대기모드로 들어가는 경우가 있는데(자동 절전모드가 아님), 이 경우 깨어나는데 시간이 조금 걸립니다.(2~3초?) 이 부분이 사용감에 있어서 안좋은 영향을 주긴 합니다.
다만, 지속적으로 사용한다는 가정하에 이정도 가격에 이정도 물건이면 꽤나 괜찮은 물건이 아닌가 싶습니다.",[]
5,사무실에서 사용하기 위해 적축으로 구매했는데 확실히 소음이 적어서 좋네요 ㅎㅎ 집에서 저렴한 적축 키보드를 쓰고 있었는데 그건 리얼 적축(?) 아니었나 봅니다... 키감이 너무 만족스러워서 오래오래 쓰려고 합니다! 아 팜레스트는 필수인듯합니다.. 키보드가 꽤 높네요~,[]
5,"처음 제품이 키 하나가 키감이 달라서 교환신청했는데, 바로 진행해주고 좋네요. 맥북에서 사용하기 위한 용도로 기계식키보드 찾다가 마음에 들어서 바꿨는데 만족스럽습니다.

따로 win, alt 키 안바꿔도 되고 ㅎㅎㅎ 좋은 제품 감사합니다 :)",[]
5,"거의 한 달 기다려서 드디어!! 오늘 받았네요
기다린 만큼 좋습니다 ㅋㅋ
포장도 뽁뽁이 잘 되어있고 무선 키보드 중에 기계식 키보드 찾기가 힘든데 거의 유일한 제품이라 만족스럽네요
키캡은 따로 사서 바꿔 끼웠습니다","['https://phinf.pstatic.net/checkout/20201008_149/1602143409453tYTTF_JPEG/review-attachment-5ee35133-5fcb-4613-8cee-76462744d837.jpeg?type=f287', 'https://phinf.pstatic.net/checkout/20201008_66/1602143409719afY1X_JPEG/review-attachment-ccb99307-3890-4081-a69a-a9d804517cc9.jpeg?type=f287', 'https://phinf.pstatic.net/checkout/20201008_99/16021434099118gRAI_JPEG/review-attachment-4da1f22b-44b9-4b6b-927d-58028d2fa5e4.jpeg?type=f287']"
5,기계식 키보드로서의 성능도 무난하고 멀티페어링과 맥 호환은 정말 끝내줍니다,"['https://phinf.pstatic.net/checkout/20201016_47/1602853097257VsPGz_JPEG/review-attachment-81b6b06d-5f03-42cd-8914-ca613c81fa23.jpeg?type=f287', 'https://phinf.pstatic.net/checkout/20201016_40/1602853128631dOxWi_JPEG/review-attachment-873fe5be-b9ef-473a-833c-a7b5c8a6cdbb.jpeg?type=f287', 'https://phinf.pstatic.net/checkout/20201016_256/1602853133034jdm2z_JPEG/review-attachment-ee11cac7-a5a5-4e3b-b5c6-49f119b5ad37.jpeg?type=f287']"
5,"배송도 빠르고 왜? 이 키보드를 이제야 샀나? 하는 생각이 듭니다. 정말 만족하고, 다른곳 보다 1만원 정도 싸게 산 것 같아서 더 좋네요","['https://phinf.pstatic.net/checkout/20201112_76/1605163936710E6bhY_JPEG/review-attachment-97cac7d4-585b-44a4-a12a-1670d31b456d.jpeg?type=f287', 'https://phinf.pstatic.net/checkout/20201112_296/1605163951879ssmqP_JPEG/review-attachment-d39b560e-23ee-4f18-9a94-863f47926ac6.jpeg?type=f287']"
5,"잘 받았습니다
키감 좋아요
사이즈 컴팩트해거 좋고 예쁘네요","['https://phinf.pstatic.net/checkout/20201009_14/1602249923749ji49Y_JPEG/review-attachment-ea234e88-0d4f-460d-937b-71ef67f26ca8.jpeg?type=f287', 'https://phinf.pstatic.net/checkout/20201009_263/1602249946052N6vWD_JPEG/review-attachment-7a4918b7-c550-48f5-bfeb-6f085eb2975b.jpeg?type=f287']"
5,"빠른 배송에 너무 좋았습니다
키보드는 역시 너무 이쁘고 좋습니다
타이핑이 재밌어요","['https://phinf.pstatic.net/checkout/20201016_238/1602805689528108TC_PNG/review-attachment-8300b8a0-ba08-40f8-9a6e-c05d7f554568.png?type=f287', 'https://phinf.pstatic.net/checkout/20201016_232/1602805690013HeykK_PNG/review-attachment-1b9efc8f-726d-45e9-8eb7-9d4bb8beab22.png?type=f287']"
4,모든게 다 좋은데 약간은 통울림과 이건 취향일 수 도 있는데 led빛이 방에 불을 켜두면 안보여유,"['https://phinf.pstatic.net/checkout/20201018_19/1602958301464qljeu_JPEG/review-attachment-48fe373f-0765-447a-bcf3-c5fdaf33a016.jpeg?type=f287', 'https://phinf.pstatic.net/checkout/20201018_46/1602958301585GUwvH_JPEG/review-attachment-c7e8d1f3-1541-4ce4-ab21-52754fb9e7f9.jpeg?type=f287']"
4,예뻐요. 적축이어서 소음도 괜찮고. 그런데 팜레스트에 스크래치들이 조금 있는 상태로 왔네요. 조금 아쉽습니다.,"['https://phinf.pstatic.net/checkout/20201008_131/1602167092005eC025_JPEG/review-attachment-dc6ff9b2-10ab-4935-9184-94f4d76fb348.jpeg?type=f287', 'https://phinf.pstatic.net/checkout/20201008_26/1602167110446s0vdK_JPEG/review-attachment-ea447150-1670-4ba9-b4c8-e96f45ecc32d.jpeg?type=f287']"
5,키크론 k8 핫스압 키보드 사무실에서 쓸려구 갈축으로 샀는데 청축으로 살걸그랬네요..타건이 아주부드럽고 찹찹거리는소리를 기대했는데..ㅋㅋ듣기좋고 부드러운 타감일품입니다..,"['https://phinf.pstatic.net/checkout/20201011_270/16024106562580LXLq_JPEG/review-attachment-f6255584-4b83-4b3f-9547-c83f69289412.jpeg?type=f287', 'https://phinf.pstatic.net/checkout/20201011_149/1602410656560xaDi0_JPEG/review-attachment-c7d9a197-38db-4676-a0ce-b84b625226ff.jpeg?type=f287']"
5,"아주 좋아요.. 맥과 윈도우 이동때문에 구매하게되었네요..
기존 매직키보드 중고로 방출하고 윈도우랑 통합해서 하나로만
사용하니 너무 편해요","['https://phinf.pstatic.net/checkout/20201010_193/1602335366387WdshC_JPEG/review-attachment-0fe3a096-0281-40cf-ac8b-0ad32c9d0d16.jpeg?type=f287', 'https://phinf.pstatic.net/checkout/20201010_289/1602335396428CzgEi_JPEG/review-attachment-7f423d4a-9a62-4037-a19f-7b4829946a08.jpeg?type=f287']"
5,상상했던 것 이상으로 좋아요! 맥전용이라 정말 강력합니다!,"['https://phinf.pstatic.net/checkout/20201009_102/16022315850422qELY_JPEG/review-attachment-43673bb4-5f19-454c-93e4-22417539431d.jpeg?type=f287', 'https://phinf.pstatic.net/checkout/20201009_210/1602231585145kiXDB_JPEG/review-attachment-1285ef60-d0d2-46f1-ac98-39482adea108.jpeg?type=f287']"
4,시간이 걸렸지만... 잘 받았습니다,"['https://phinf.pstatic.net/checkout/20201014_215/1602675479893wNvXr_JPEG/review-attachment-8639e0b7-88e1-49bd-b0c0-c74cacb9dc98.jpeg?type=f287', 'https://phinf.pstatic.net/checkout/20201014_67/1602675479782hbnUM_JPEG/review-attachment-b9a0f631-6a44-43ef-b95e-427fc2ce3552.jpeg?type=f287']"
5,만족스러운타건감과 깔끔한디자인 모두 좋습니다,"['https://phinf.pstatic.net/checkout/20200907_229/1599458695976WiWd5_JPEG/review-attachment-560b4071-825c-43a2-af95-55624daa4a26.jpeg?type=f287', 'https://phinf.pstatic.net/checkout/20200907_135/1599458696473Wot3h_JPEG/review-attachment-744300e4-43ab-4a89-9c8c-bafb572ba1bc.jpeg?type=f287']"
4,제품은 만족합니다. 내부 led에 실금이 가있는데 기능적으론 문제가 없어서 그냥 사용하려고 합니다.,"['https://phinf.pstatic.net/checkout/20200907_264/1599405817085GyDqj_JPEG/review-attachment-bd9fcda7-f142-4de7-a7c9-f98805220083.jpeg?type=f287', 'https://phinf.pstatic.net/checkout/20200907_223/1599405808525tS0Mv_JPEG/review-attachment-8a4c821d-ab02-4c1f-b7b5-7456affbe5a9.jpeg?type=f287']"
